par_nr	head	sentence
1	 Capaneusi Harta 	 Capaneusi Harta 
2	NA	 Indrek Hargla 
3	NA	 Estrada 41. 
3	NA	 Ardaman ; kell 20.04 
4	NA	 Estrada surus hääletu laserpüstoli aeglaselt kabuuri tagasi . 
4	NA	 Ta käsi värises , silme ees hüplesid endiselt kaks luukollast sarve , mille omaniku oli odoorlaeng eemale peletanud . 
4	NA	 Kaks sarve ... okkaline neljajalgne keha , hirnatuse ja rögisemise vahepealne häälitsus , mille kuularid oli veelgi võikamaks võimendanud . 
4	NA	 Ma jõudsin , ma jõudsin reageerida , mõtles Estrada . 
4	NA	 Tema reaktsioon oli olnud ülikiire , aastatepikkuse treeningu tulemus . 
4	NA	 Kuid siiski oli ta teinud esimese liigutuse valesti . 
4	NA	 Püstolit haarates oli ta pöidlaga lülitanud sisse laserrezhiimi , sõrmed kippusid iseenesest sarvikut surmava kiirega kostitama . 
4	NA	 Hetk enne päästikule vajutamist oli mingi kohusetundlik mõtteimpulss siiski jõudnud püstoli odoorlaengule tagasi seadistada . 
4	NA	 Sarved kadusid ühe hetkega , Capaneusi sarviku haistmiselundid on koletise rünnaku vastu parimaks kaitseks . 
4	NA	 Estrada hingamisfilter ei lasknud Vaatlejal endal laengut sisse hingata . 
4	NA	 Niiviisi ei teadnud ta , mismoodi odoorlaeng õieti haiseb . 
5	NA	 Sarviku ilmumine oli kindlaks märgiks , et Estrada oli liiga kaugele ekselnud . 
5	NA	 Jäljed olid kadunud juba tunni aja eest , ilmselt olid naised juba varem , pöögimetsa servalt ära pööranud , seiretabloo oli tumm . 
5	NA	 Võsane ja soine kõnnumaa ei saanud naiste sihtpaigaks olla , ta teadis seda juba ammu , ometi oli ta valinud just selle tee , sest lihtsalt siia polnud ta varem sattunud . 
5	NA	 Uudishimu ... 
5	NA	 Sarvikute haistmismeel hoiab nad inimeste radadest tavaliselt eemal , Estrada välikostüüm oli aga täiesti lõhnatu ja sestap ta oligi selle elaja otsa komistanud . 
6	NA	 Ta vaatas kella . 
6	NA	 Nüüd oli juba liiga hilja naiste jälgi uuesti üles otsida , tuli pöörduda tagasi T-punkti , süstik peaks varsti saabuma . 
6	NA	 Ainuke , mida Estrada oleks veel jõudnud teha , oli paigaldada kaamera kohale , kus naiste jäljed olid kadunud . 
6	NA	 Homme võibolla jõuab ta neile taas jälile , siis paneb ta üles uued kaamerad , siis saab tema seekordne ülesanne täidetud , ta lendab jälle Pesasse , istub ekraanide taha ja saab mõneks ajaks puhkust sellest vastikust maailmast ... 
7	NA	 Kuhu nad siis ometi läksid , mõtles Estrada . 
7	NA	 Kui nad ei tulnud siia kõnnumaale , pidid nad sumpama mööda metsaserva ja siis kas Mõõkkaljudele ronima või metsa tagasi keerama . 
7	NA	 Igal juhul pidi olema tegu üsnagi kummalise teekonnaga , sest kaljudel ei saanud kindlasti midagi huvitavat olla ja metsa tagasipööramine tähendas mõttetu ringi tegemist mööda soist ja ohtlikku rada . 
7	NA	 Võib-olla olin ma aga ise liiga tähelepanematu — jäin unistama , nagu Zeman ütleb — võibolla reguleerisin seiretabloo liiga tundlikuks ... 
7	NA	 Letussier või Dhaka poleks kindlasti eksinud , nemad juba teaksid , kuhu naised iga päev nii sihikindlalt rühivad , kaameradki oleks neil ammu paigaldatud , nemad on ju kõige paremad ... 
7	NA	 Aga Bent arvas , et see ülesanne on nii kerge , et ässasid pole mõtet saata , piisab minustki . 
7	NA	 Ja Estrada ei osanudki arvata , kas Bent vris Zeman oli tema välja valinud seepärast , et ei uskunud noort Vaatlejat rohkemaks võimeline olevat või tahtis ta teda lihtsale ülesandele saates vaid hoida ja kergemate ülesannetega tema karjääri kiirendada . 
8	NA	 Estrada ohkas ja märkis seiretabloole sarvikuga kohtumise koha . 
8	NA	 Siis edastas ta andmed kiirelt Pesale ja luges vastusrealt , et info on salvestatud , süstik läheneb ning aeg on naasta . 
8	NA	 Pesa soovis talle ka õnne ülesande eduka täitmise puhul ! 
8	NA	 Ilmselt nad ei vaevunudki vaatama , kas marsruut on kaardile kantud , ülesanne oli ju nii lihtne . 
8	NA	 Pesas pidi sidetabloo ees istuma Dhaka , tuli Estradale meelde . 
8	NA	 Siis tema soovib mulle muidugi õnne , või veel ! 
8	NA	 Nii lihtne ülesanne , kuidas siis muidu ... parim pugemismoodus on alati nooremate töötajate oskusi üleolevalt kiita . 
8	NA	 Siis on võimalik esimese apsu juures silmakirjalikult väita , et nii hea Vaatleja , kes oleks temast võinud arvata ... 
8	NA	 Nii lihtne ülesanne ja läbikukkumine . 
8	NA	 Või lihtne ! 
8	NA	 Jälitada kaduvaid varje ... 
9	NA	 Juba mitu kuud olid aeg-ajalt mõned naised VI-B koopast läinud mööda peateed metsaservale ning kadunud . 
9	NA	 Õieti polnud neid keegi jälitanudki , algul ei pööratud sellele mingit tähelepanu . 
9	NA	 Huvi tekkis Pesas siis , kui ilmnes , et kadunud on kakskümmend üks naist . 
9	NA	 Kuna satelliitide paigaldamine endiselt viibis , otsustas Zeman luurajad välja saata . 
9	NA	 Naiste teekonnale tuli seada minikaamerad , samuti neid lähedalt jälgida . 
9	NA	 Zeman tahtis alati inimlikku lähenemist , ta ei kippunud eriti kaameraid usaldama . 
9	NA	 Oma silmaga nägemine , kasvõi hetkeks , ületab kogemusliku poole pealt igati kaamerapildi . 
9	NA	 Zeman oli oma karjääri jooksul alati inimestega tegelnud , ta uskus end märkavat iga emotsiooni ja tundevarjundit , luges kehakeelt , mäletas kõiki näoilmeid . 
9	NA	 Zemanile ei julgenud keegi valetada . 
9	NA	 Kas Zeman oli aru saanud ? mõtles Estrada , kui ta seiretabloo naasmisteekonnale sättis . 
9	NA	 Oli ta mõistnud , tundnud ? 
9	NA	 Kasutanud oma inimese mõttemaailma tundmist ka kolleegide , mitte ainult koopaelanike suhtes ? 
10	NA	 Seiretabloole ilmus punakas punktiirjoon , mis tähistas Estrada naasmisteekonda . 
10	NA	 Tuli hakata liikuma , tagasi sinna , kus ta oli naiste jäljed kaotanud , seada üles kaamera ning jõuda süstikule . 
10	NA	 Ta sumpas läbi videviku , tige enda ja Zemani peale ja katsus mitte mõelda teravatele sarvedele , mis ikka ja jälle mälusopist üles kerkisid . 
10	NA	 Kalk ja igav võsastunud tühermaa . 
10	NA	 Kvaterneer oma täielikus ilus ja uhkuses . 
10	NA	 Mida nii romantilist ja huvitavat ta küll oli lootnud siit leida ? 
10	NA	 Kaks aastat treenigut asustamata maaosas — Zomasel , kaks rutiinset ja julma aastat , koos tehnilise väljaõppega Pesas . 
10	NA	 Romantika ? 
10	NA	 Külmust ja võõristust õhkav planeet oma inimestega , kes on nii vanad ja noored samaaegselt . 
10	NA	 Aga nad oskavad juba üksteist suurepäraselt tappa ... 
10	NA	 Sellega oligi Estradal algul kõige raskem harjuda . 
10	NA	 Kaljuservale riputatud kaamera edastas detailitäpset stereopilti ühest lahingust — see oli olnud vaid aasta tagasi . 
10	NA	 Harjuge , oli Zeman käskinud , vaadake ja harjuge . 
10	NA	 Nuiaga tapmine ... 
10	NA	 See on tegelikult nii raske . 
10	NA	 Kui ei tea või ei tunnegi huvi , kuidas ühe hoobiga tappa . 
10	NA	 Kolm kütti VI-B koopast olid kohtunud viie naaberkoopa uitajaga . 
10	NA	 Arvuline ülekaal sundis kohe võitlusele . 
10	NA	 Kaks tehti kiiresti võitlusvõimetuks ja tõugati järsakult alla , kolmas — juht — oli visama hingega ja tappis kaks ründajat enne , kui ülejäänud ta nuiadega surnuks peksid . 
10	NA	 Mittesekkumine ... 
10	NA	 Iseeneslik areng . 
11	NA	 Estrada astus rutakalt mööda üksluist maastikku , jalge all lirtsus pori , ümbrus oli kõle ja nukker . 
11	NA	 Üle võsatihnikute paistsid taamal mäed , kus asus ka T-punkt ja kuhu varsti pidi jõudma süstik . 
11	NA	 Seiretabloo edastas peilingut kõigest elavast , mis luuraja ümber liikus — midagi ohtlikku ei paistnud olevat . 
11	NA	 Mida enam Estrada mõtles kohtumisele sarvikuga , seda enam hakkas ta soovima , et oleks peletise tapnud . 
11	NA	 See äkiline ehmatus , kui ta kuulis võsast võigast röginat ... 
11	NA	 Algul oli tõesti ainult ehmatus , hiljem hakkas ta tundma ründaja vastu viha ja raevu . 
11	NA	 Tema eneseväärikust oli hirmutatud liiga tugevalt . 
11	NA	 Kättemaks kogetud hirmu eest . 
11	NA	 Miks me ei võiks küll neid elukaid tappa ? 
11	NA	 Miks peaksid need inimesed aru saama , et sarvik pole surnud loomulikku surma . 
11	NA	 Aga Zemani sõna oli kindel — mitte ükski Capaneusi Zaindi mandri eluvorm peale inimese ei suuda tappa sarvikut . 
11	NA	 Läbipuuritud ja veritsev sarviku laip on selle leidjale midagi liiga erakordset , see muudaks nende ettekujutust oma maailmast . 
11	NA	 Ja selleks pole meil õigust . 
11	NA	 Need inimesed peavad küll vahest sarvikule jahti , aga ainult siis , kui mõni isend on juhtunud liiga koopa lähedale . 
11	NA	 Kambapeale tulevad nad sarvikuga toime , aga nad ei võta jahti meelsasti ette . 
11	NA	 Aga meie jaoks kuulub sarvik oma ökosüsteemi ja meie oleme siin ainult vaatlejad . 
11	NA	 Sarvikut ei tohi tappa , rabahunti ei tohi tappa , dinolüüpi , seda rahumeelset rohusööjat , ei tohi tappa , inimest — Homo sapiens capaneaum — ei tohi tappa . 
11	NA	 Enesekaitse ja kontakti vältimine on muidugi erijuhus , ent üle kahe kontakti kellelegi andeks ei anta . 
11	NA	 Tegelikult ei tohi midagi ega kedagi tappa , aga ikka tapetakse . 
11	NA	 Baktereid , putukaid , väikeloomi ( Estrada oli täna juba kolm mutitaolist elukat sodiks astunud , nad olid nii õrnad , luustik peaaegu puudus , terav kiunatus ja siis lige plotsatus ) — kõiki tapetakse , aga see pole nii tähtis , ütles Zeman ja nii seisis ka Capaneusi Hartas , mis oli ette valmistatud tuleviku jaoks . 
11	NA	" "" Tema Majesteedi Mõistliku Elu Otsimise Konservatoorium omab planeet Capaneusi üle kogu võimutäiust , kuid on vastutav , et ükski Capaneusil loomuliku evolutsiooni käigus tekkinud eluvorm ei saa inimtegevuse läbi kahjustatud . "
11	NA	" Samuti pole MEOK-il õigust sekkuda Capaneusi inimese ega ühegi muu eluvormi evolutsiooni ega talle oma olemasolust teada anda . "" "
12	NA	 Kui nad kunagi pärisinimesteks saavad ... ehk siis kirjutatakse Harta alla ? 
12	NA	 Lapsik ? 
12	NA	 Aga Hartat oli vaja inimeste südametunnistuse rahustamiseks . 
12	NA	 Et niiviisi õigustada oma viibimist kogu Ruumis ainulaadse iidse Maa teisikplaneedil , Maa õe kordumatus biolaboris , elusas muuseumis . 
13	NA	 Estrada kahlas edasi ja hakkas esmakordselt päeva jooksul väsimust tundma . 
13	NA	 Ta oli oma toiduvarud ammendanud , juua veel oli , kuid tühjast kõhust hakkas pea valutama ja tekkis tüdimus . 
13	NA	 Tema universaaljaki seljale kinnitatud väljaheidete lahustaja vajas tühjendamist ja siis uuesti elektriga laadimist . 
13	NA	 Midagi ei tohtinud maha jääda . 
13	NA	 Või õigemini — jälgi inimese viibimisest Capaneusil tuli jätta nii vähe kui võimalik ja vältimatult vajalik . 
13	NA	 Nende jaki sisse kinnitatud voolikutega oli nii raske harjuda ... 
13	NA	 Esimesed kuud Zomasel pidid kadetid sööma ja jooma võimalikult palju . 
13	NA	 Siis aeti nad välja ja õpetati kannatama . 
13	NA	 Estrada oskas kannatada , kuid teadis , et ei tohtinud enam juua . 
14	NA	" Ma ei tohi jälle "" unistama "" jääda , sisendas ta endale . "
14	NA	 See polnud päris läbikukkumine , midagi pole veel katki , kõike on võimalik veel parandada . 
14	NA	 Homme ... homme , jõuab ta neile jälile ja lahendab VI-B naiste saladusliku kadumise . 
14	NA	 Muidugi on Zeman tühjast asjast kära teinud , naised on lihtsalt leidnud uue koopa ja osad on sinna elamagi asunud . 
14	NA	 Zeman aga pabistab iga asja pärast , kõik on talle nii tähtis , ta ei suuda ikka unustada oma ningosid ja Suurt Tundmatut . 
14	NA	 Tegelikult ei tohiks ta Zemanist nii mõelda , Zeman on ikkagi See Suur Zeman , tal on Majesteedi kingitud päruslaev , ta on ennast täielikult ja alatiseks tööle pühendanud , ohverdanud eraelu — Yenonagi läks ju Zemani juurest ära , kuigi Yenona oli igavene nõid ja vastik elukas ... 
15	NA	 Estrada peatus ja jõi suurte sõõmudega välipudelist vett . 
15	NA	" Talle tuli meelde , kuidas Zeman oli rääkinud Vaatleja Dovanist , mehest , kelle neli "" hoolealust "" koopaelanikku janusse surid . "
15	NA	 Dovan oli peale sattunud koopale , kust neli viljatut naist olid minema aetud . 
15	NA	 Naised hakkasid mööda kaljuvahet teisele poole mägesid minema , kus oli suur lagendik . 
15	NA	 Loomulikult olid nad nii või teisiti hukule määratud . 
15	NA	 Dovan töötas mingi sotsio-psühholoogilise programmiga , tal oli vaja vaatlusandmeid ja nii edasi . 
15	NA	 Vaatleja järgnes ettevaatlikult naistele , oli mitmeks päevaks kõige vajalikuga varustatud . 
15	NA	 Siis tuli varing ja naised müüriti mõnekümne ruutmeetrisse kivilahangusse . 
15	NA	 Dovan oli nende juures kuni lõpuni ... 
15	NA	 Naised ei teinud üksteisele midagi , kuigi tugevam neist oleks võinud nii oma eluiga pisutki pikendada — see fakt oligi lõpuks kõige tähtsamaks osutunud . 
15	NA	" Keegi kaitses nende vaatlusandmetega oma "" doktori "" — keegi , kuid mitte Dovan . "
15	NA	 Dovan vaatles ja nuttis ... 
15	NA	 Ta ei tohtinud nende kannatusi leevendada . 
15	NA	 Liitrike vett , mida naised nii ihaldasid või neli kiiret mürgilaengut — kõike seda oleks olnud liiga palju . 
15	NA	 Naised kustusid aeglaselt piineldes , hoidsid üksteisel käest kinni ( koopas polnud sellist lähedusvajaduse fenomeni täheldatud ) ja surid , nähes silme ees vaid avarat helesinist Capaneusi taevast . 
15	NA	 Dovan ütles pärast seda oma töö üles ja lendas minema . 
15	NA	 Temast olevat saanud Vikerlase kaardiväe major ning ta uputas kolm aastat hiljem verre mässu Damaskus III-l . 
15	NA	 Aga Estrada mäletas , et Dovani juhtum oli seminaris tekitanud kõva vaidluse . 
15	NA	 Zeman väitis , et Vaatleja käitus õigesti , Vaatlejal polnud teist valikut , ta oli andnud vande . 
15	NA	 Ja vande mitte ainult Konservatooriumile vaid ka Capaneusile . 
15	NA	 Keegi oli aga arvanud , et Vaatleja oleks võinud naistega suhelda , kontakti astuda . 
15	NA	 Õnnetute reaktsioon oleks olnud teadusele väga huvitav , oma kogemust poleks nad niikuinii saanud edasi anda . 
15	NA	 Zeman vastas , et kontakt on keelatud . 
15	NA	 Igasugustes tingimustes keelatud . 
15	NA	 Siis oli Estrada veel kadett ja ei teadnud eridirektiivist ... 
16	NA	 Hakkas hämarduma . 
17	NA	 Estrada taipas , et tema samm on liiga aeglane . 
17	NA	 Zaindi öö on kiire laskuma , õhtuvidevik peaaegu puudub . 
17	NA	 Oli viga sinna tühermaale ronida , teda võidakse veel süüdistada sarviku provotseerimises . 
17	NA	 Zeman vaevalt seda teeb , aga Dhaka võib küll . 
17	NA	 Dhaka on mõnikord liiga norija , ta tahab Zemani ees distsipliiniga hiilata . 
17	NA	 Dhaka on pugeja , kinnitas Estrada endale . 
17	NA	 Pugeja , kes poeks alati iga ülemuse ees ja Zemani ees poeb ta praegu ainult sellepärast , et Zeman on ülemus . 
17	NA	 Muud põhjust siin ei ole . 
17	NA	 Ei tohi olla . 
18	NA	 Siis hakkas Estrada seiretabloo häält tegema . 
18	NA	 Mitte kõvasti piiksuma , ainult kuularites tekkis signaal — andur oli tuvastanud midagi , millest ka inimene kindlasti teadma pidi . 
18	NA	 Estrada peatus . 
18	NA	 Mets oli päris lähedal , sealt pidi ta põhjakaarde pöörama , et T-punkti jõuda . 
18	NA	 Teekond jäi koopaasuika harilikest radadest eemale , see oli valitud nii , et ühkti olulist eluvormi teel ei oleks . 
18	NA	 Ta vaatas seiretablood . 
18	NA	 Neli objekti — kolm väikest ja üks suur . 
18	NA	 Kolm inimest ja üks sarvik . 
19	NA	 Bent vris Zeman 41. 
19	NA	 Ardaman ; kell 22.16 
20	NA	 Ta pani oma vastase nimeks Mathika ning seadistas ta musta vöö tasemele . 
20	NA	 Nimel polnud tegelikult mingit tähtsust ja seepärast ta ristiski vastase mitte midagi tähendava sõnaga . 
20	NA	 Kui ta klaviatuuri näppides Mathikat elustas , sisendas ta endale , et sellel pole mingit pistmist Damaskus III voodoo-kultusega ega sealt omandatud oskustega . 
20	NA	 Vastane sai nimeks Mathika ja Zeman ründas teda kiiresti oma kroonvõtetega — pettelöök kubemesse ja pöördelt jalahaak kuklasse . 
20	NA	 Mathika blokeeris ülikiirelt mõlemad ja kasvatas jalalöögi blokilt osavalt vastuhoobi . 
20	NA	 Löögist saadud valu oli piisavalt tugev , et Zeman rõõmustaks väärilise vastase üle . 
20	NA	 Kukla taha kinnitatud andur reageeris täpselt läbilastud tabamusele ja sisendas meeltesse vastava valuaistingu . 
20	NA	 Mathika osutus nutikaks selliks . 
20	NA	 Zeman polnud talle sugu programmeerinud , kuigi tihti armastas ta luua mulaazhe naiste kehajoontega . 
20	NA	 Nii mõnigi virtuaalseks veriseks tombuks pekstud mulaazh sarnanes äravahetamiseni Yenonaga . 
20	NA	 Kuid Mathika oli sootu . 
20	NA	 Ja Pesa Foogt ja Tema Majesteedi Teaduse ja Tehnika Ameti Mõistliku Elu Otsimise Konservatooriumi endine luureülem parun Bent vris Zeman kohendas pisut niudevööd , mis koos musta peapaelaga moodustas tema ainsamad riietusesemed . 
21	NA	 Seadeldis oli uus ja Mathika Zemani seitsmes tehispartner . 
21	NA	 Esimesed kaks oli ta liiga kiirelt tapnud ning kahtlema löönud rahakulutuse otstarbekuses . 
21	NA	 Hiljem olid treeningpartnerid tugevamaks muutunud . 
21	NA	 Mathika oli aga eriti hästi õnnestunud — mulaazhi agressiivsus oli viidud maksimumini ning ta oskas kung-fu'd Zemanist paremini . 
21	NA	 Pärast esimest ebaõnnestunud rünnakut katsetas Zeman pettelööki pähe , kuid jäi hiljaks . 
21	NA	 Mulaazh kummardus ning tegi osava pöörde vasakule — Zeman kaotas tasakaalu ja rehmas õhku , saades samal ajal piste neerudesse . 
21	NA	 Mathika oli kükakil giboni-asendis ja rebis talle oma teravdatud varvastega veel teisegi löögi . 
21	NA	 Zeman põrkus paar sammu tahapoole ja võttis sisse samuti põlvedest kõverdatud võitlusasendi . 
21	NA	 Talle isegi tundus , et mulaazh irvitas ... 
21	NA	 Veelkord proovis ta pettelööki ja veelkord tabas Mathika jalalaba ta rannet . 
21	NA	 Jalg pühkis oma teelt Zemani käe — blokk oli hirmvalus — ja samas , ilma vähimagi vihjeta uuele tasakaaluasendile ja kombinatsioonile sidus Mathika oma tõrjesse rünnakulöögi . 
21	NA	 Zemanit tabati rinda , andur kuklas edastas löögiimpulsi ajju ja Zemani hing jäi hetkeks kinni . 
21	NA	 Kuid ainult hetkeks — Mathika ei saanud tappa ja tõmbus tagasi , et tema looja saaks hinge tõmmata . 
21	NA	 Nüüd hakkas Zeman juba vihaseks muutuma , kuid see viha oli vaid sisemine innustus , mitte füüsiline raev . 
21	NA	 Treeningmulaazh oli õnnestunud , kui ta võitlusega oma loojat motiveeris . 
21	NA	 Zeman proovis nüüd Zhu-Maoingi küünarlöökide seeriat — parem käsi tegi pettelööke ja keha jäi kergelt ehmatatud vastasest piisavalt kaugele , kui kõverdunud sõrmedega vasak jagas koodina vaheldumisi küünar- ja rusikahoope . 
22	NA	" "" Zeman ! "
22	NA	" Balthus siin , oled sa kodus või ? "" "
22	NA	 Kogu tuba täitus Balthus Azarjani nasaalse häälega . 
22	NA	 Neli silmale nähtamatut valjuhääldit edastasid vaneminseneri nõudlikku , kuid ettevaatlikku küsimust . 
22	NA	 Loomulikult oli Zeman kodus , kus mujal tal siis olla oli ? 
22	NA	 Ilmselt kostus Azarjani telefoni vaid matsatused ja ähkimised , sest üle toa valgus inseneri lootusetu ohe , kui ta küsis : 
23	NA	" "" Tapad jälle neid viirastusi ? "
23	NA	" Vabandust , et segasin . "" "
24	NA	 Foogti kodutelefonil rääkimine oli lubatud ainult äärmisel juhul . 
24	NA	 Pesas oli ametlik puhkeaeg ja Zeman nõudis , et vastavalt tema seisusele on iga päev neli tundi ainult tema päralt . 
24	NA	 Foogt pidi säilitama alluvatest teatava distantsi . 
24	NA	 See polnud Konservatooriumist kaasa toodud poosetamine . 
24	NA	 See oli distsipliin — kõik pidid mõistma , et tühise asja pärast Foogti puhketundidel tema poole pöördumine toob asja pärast kaasa nädalase treeningreisi Zomasele . 
25	NA	 Zeman lajatas Mathikale oma firmahoobi — pöördelt kannahaak kaksteistsõrmiksoolde . 
25	NA	 Mulaazh jäi sedapuhku blokeerimisega hiljaks ning välkkiirelt kukerpallitas Zeman arvuti juurde . 
25	NA	 Veel klaviatuuri poole seljaga olles , tabas ta varvastega pealülitit . 
25	NA	 Mathika kadus hetkega . 
25	NA	 Zeman tõusis ja astus matilt ära . 
25	NA	 Vaikse surinaga , mis pidi ka Azarjani kuularitesse ulatuma , tõusis tatami hoobadelt üles , tõmbus seinani ja kadus laepaneeli alla . 
25	NA	 Suure ümarate nurkadega ruumi põrandale tekkis taas harilik plastplats , mis imes endast välja kunstkarusnahkse vaiba . 
25	NA	 Zemani kabinet-kodu võttis taas oma hariliku ilme ja hiljutisest võitlusest jäi õhku vaid higilõhn . 
26	NA	" "" Kuulan , alluv , "" hõikas Zeman vannitoa poole suundudes . "
26	NA	" "" Plaanid väikest retke Zomasele ? "" "
27	NA	" "" Ainult koos sinuga ! "
27	NA	" Mul on midagi tõeliselt tähtsat . "" "
27	NA	 Azarjani hääl kostus tõepoolest erutatult . 
27	NA	 Umbes sellisena oli pikakasvulise inseneri ninahääl kõlanud kaks aastat tagasi . 
27	NA	 Siis kui ta Zemani palvel oli sooritanud oma viimase retke Vaatlejana ja jäänud lõksu paarituvate sarvikute ning jahiretkele suundunud koopaelanike vahele . 
27	NA	 Sidepidamine Pesaga oli lubatud samuti ainult äärimisel vajadusel . 
28	NA	" "" Kui tähtis ? "
28	NA	" Kas võib Foogt endale enne lubada pisut kümblemist ? "" "
29	NA	" "" Ma arvan , et sa peaksid seda võimalikult ruttu nägema . "
29	NA	" See on midagi erakordset , seda pole iialgi varem juhtunud ... "" "
29	NA	 Azarjan oli tõesti ärevil . 
30	NA	" "" Mis siis on ? "
30	NA	" Sul läks kõvaks või ? "" "
31	NA	" "" Meil läheb siin kõigil varsti kõvaks ! "" "
32	NA	" "" See võiks tõesti huvitav olla , "" pomises Zeman , heitis niudevöö ja peapaela toanurka ning sulges vannitoa ukse . "
32	NA	 Azarjan närvitses alati , kui Estrada all oli . 
32	NA	 Zeman teadis Azarjani kiindumusest noorde Vaatlejasse . 
32	NA	 Intiimsuhted Pesa töötajate vahel polnud just keelatud , kuid mida vähem neid oli , seda parem . 
32	NA	 Siin polnud ju lõppeks Terranoova ega Õukond . 
32	NA	 Nii paistis arvavat Zeman ja järelikult oli see ka Konservatooriumi tahe . 
32	NA	 Kuid tegelikkus ... 
33	NA	" "" Kas Foogtil oleks siis võimalik Tehnikast läbi tulla ? "" "
33	NA	 Inseneri hääl segunes vee pahinaga . 
34	NA	" "" Ma pesen ja tulen . "
34	NA	 Ära vahepeal lõdvaks lase . 
34	NA	" Lõpp . "" "
35	NA	 Kui Zeman oli pesnud ja riietunud , astus ta aeglaselt oma ruumidest välja ja liikus mööda Pesa plastmetallist koridore arvutikeskuse poole . 
35	NA	 Tee peal põikas ta Operatiivkeskusesse . 
36	NA	 Sidepaneelide taga istus valveohvitser Cirnetta Dhaka . 
36	NA	 Pesa üks kolmest Asefoogtist ning Zemanile vastukarva käiva üldise arvamuse kohaselt ka tema suursoosik . 
37	NA	" "" Kuidas all on ? "" küsis Zeman . "
38	NA	 Kaunitar keeras oma lühikeste lumivalgete juustega pea momentaalselt Zemani poole . 
38	NA	 Silmade välkudes kandis ta õõnsal ja enda arvates operatiivsel häälel ette : 
39	NA	" "" Meie sektoris Estrada . "
39	NA	 Jälitab VI-B kadujaid . 
39	NA	 Peaks viienda süstikuga naasma . 
39	NA	 Oliveri grupp on endiselt ookeanil — otsivad labori jaoks asustamata saart . 
39	NA	" Ja siis on veel Abelsson , aga nemad ei raporteeri enne nädalat . "" "
40	NA	 Zeman teadis , kes all on ja mida seal tehakse . 
41	NA	" "" Probleemideta ? "" "
42	NA	" "" Kaks tundi tagasi raporteeris Estrada sarvikust . "
42	NA	" Odoorlaeng , probleem likvideeritud . "" "
43	NA	" "" Ülesanne täidetud ? "" "
43	NA	 Dhakaga rääkides tabas Zeman ennast koonerdamiselt verbidega . 
43	NA	 Ta sai aru küll , et tegu on alateadliku Asefoogti kõnemaneeri mõnitamisega , kuid ilmselt pakkus see talle haiglast rahuldust . 
44	NA	" "" Signaal tuli tühermaalt . "
44	NA	 Kutsungit 7 pole olnud . 
44	NA	 Kuid ilmselt on tal naiste marsruut teada ja kaamerad on üleval . 
44	NA	" Estrada on ju meil noortest üks parimaid . "" "
45	NA	 Kutsung 7 tähendas ülesande täielikku täitmist , kuid selle edastamine polnud enne süstikusse jõudmist kohustuslik . 
45	NA	 Foogti soovil olid kohustuslikud ainult hädasignaalid ning raportid kohtumistest kaardistamata areaaliga sarvikutest , dinolüüpidest ja muudest suurtest loomadest . 
45	NA	 Zemani poliitika oli hoida võimalikult vähe sidet Vaatlejatega — see pidi neid motiveerima iseseisvusele ja adekvaatsele käitumisele . 
45	NA	 Pealegi võisid üleliigsed raadiolained liialt mõjuda Capaneusi mõningatele asukatele . 
45	NA	 Lausside ei meeldinud Zemanile , seepärast polnudki ta vaimustuses satelliitide paigaldamise ideedest ning transformaatorite ülesseadmisest Mõõkkaljudele . 
46	NA	" "" Estrada nägi sarvikut ? "
46	NA	 Veider , miks ta tühermaale ronis ... 
46	NA	" Kui tagasi tuleb , kirjalik raport ja kohe minu juurde ! "" "
47	NA	" "" Edasi antud ! "
47	NA	" Kirjalik raport ja kohe Foogti juurde . "" "
47	NA	 Blondiini sõrmed klõbistasid arvutiklahve . 
48	NA	" "" Muid probleeme pole ? "" "
49	NA	" "" Loomulikult mitte , Foogt . "
49	NA	" Kõik on korras . "" "
50	NA	 Kõik pole kunagi korras , mõtles Zeman , kui suundus edasi , kõik ei saagi kunagi korras olla . 
50	NA	 Oli puhkeaeg ja koridorid tühjad . 
50	NA	 Pesa elanikud olid enamalt jaolt kas oma eraruumides või siis Muuseumis või raamatukogus . 
50	NA	 Pidev enesetäiendus , pühendumus . 
50	NA	 Mittesekkumine nõudis Vaatlejatelt suuremat teadlikkust kui füüsilist valmisolekut . 
50	NA	 Zeman loivas aeglaselt Azarjani impeeriumi poole . 
50	NA	 Peaaegu terve Pesa keldrikorruse võttis enda alla kolme plokki jagunev tehnikakeskus — tuhandete üle planeedi laiali nähtamatute silmade ja andurite aju . 
50	NA	 Kõik elektroonilised ja hologeensed signaalid planeedilt jõudsid siia , kus targad masinad neid süstematiseerisid ja edastasid . 
50	NA	 Kogu krempli juhtimiseks piisas ühest inimesest — peainsenerist Balthus Azarjanist . 
50	NA	 Ligi seitse aastat oli Azarjan Vaatlejana Capaneusil oma leiba teeninud , kuni lõpuks oli Zeman palunud tal omad praktikas kogutud teadmised ühendada erakordse tehnikavaistuga ning keskus üle võtta . 
50	NA	 Azarjani kasutas ta Vaatlejana nüüd ainult erijuhtudel ning neid tuli harva ette . 
51	NA	 Keskuses oli hämar , sest Azarjan ei kannatanud eredat valgust . 
