par_nr	head	sentence
822	NA	 Mees ei olnud mingil alal silmapaistev . 
822	NA	 Tema ainsaks vaieldamatuks trumbiks tuli pidada seda , et Valdek lihtsalt ei suutnud ennast hetkekski alluvana tunda . 
822	NA	 Milliste tutvuste kaudu ta Tallinna esinduse bossiks kerkinud oli , seda Ivo muidugi ei teadnud . 
822	NA	 Aga oma nõrkusi oskas pomo kenasti varjata . 
822	NA	 Ivot vajas ta eelkõige selleks , et klientidega mitte vaidlema sattuda . 
822	NA	 Juhtus õlidest või autohooldusvahenditest , eriarvamusi tekkima , viipas Valdek Ivo juurde . 
822	NA	 Arvatavasti keemiainseneri diplomist piisab ? 
823	NA	 Kontrastiks Cannoni rämedale häälekusele oli Ivo vaikne , leebe , kuid veenev — alati oli just nende müügiartikkel antud juhuks kõige sobivam . 
824	NA	 Ivo hakkas salongist eemale hoidma , eelistas , tunkeded seljas , töökojas masinate sisemuses kaevata . 
824	NA	 Ta armastas perfektset tehnikat ja seda nende müügiartikkel tõepoolest ka oli . 
824	NA	 Pealekauba igatses Ivo ka endale rattaid istumise alla . 
824	NA	" Tema "" Regatta "" oli läinud olmemurede täitmatusse auku . "
825	NA	 Aga Cannon ei lasknud tal deserteerida . 
825	NA	 Ta sai aukõrgendust — nüüdsest peale pidi ta firma esindusautoga linnas liikuma , viibima restoranides , kohtuma sõpradega Milline elu oleks suurepärasem olnud ! 
825	NA	 Ühel nädalal kaks , teisel kolm täiesti enda päralt päeva , tee mida tahad . 
825	NA	 Ta ei pidanud isegi mingeid ametitunnuseid kandma , välja arvatud firmasärk või müts . 
825	NA	 Tuli jätta mulje , et auto kuulub temale ja ta on edukas ning suhteliselt vaba . 
825	NA	 Keegi ei nõudnud mingit aruannet . 
825	NA	 Ja peale paari nädalat leidis ta , et võib need päevad , vähemalt osaliselt , ka kodus raamatu taga veeta . 
825	NA	 Kõik see oli lihtsalt liiga tore , et olla tõsi . 
825	NA	 Ja tõsi see ei olnudki . 
825	NA	 Üks ta saatusekaaslastest sai lõpparve . 
825	NA	 Ei mingit selgitust . 
825	NA	 Raha pihku ja head aega . 
825	NA	 Keegi urises vaikselt — muidugi , kui ikka ei leia poole aasta jooksul ühtegi ostjat ... 
826	NA	 Tallinnas on võib-olla kümmekond potentsiaalset ostjat selle luksusklassi relvadele , mida nemad müüsid , üks iga neljakümne tuhande elaniku kohta . 
826	NA	 Leia vaid üles ja veena , et sama hinna , kuid teise embleemiga autod on kõik kehvemad ... 
827	NA	 Kaks korda oli Ivol võimatu õnnestunud . 
827	NA	 Loomult endassetõmbunud ja pigem uje kui pealetükkiv , oli ta ära õppinud inimeste rahakoti hindamise nende kõnnaku ja kõnemaneeri järgi , oli avastanud viisi , kuidas baarileti taga või kohvikulaua ääres juttu teha , kuidas keelduda napsist , jättes ometi sõbraliku mulje , kuidas pealetükkivust ilmutamata pakkuda lõhnadega autoomanikule küüti . 
828	NA	 Autot ta juhtida oskas . 
828	NA	 See hääletu ja võimas loom jättis mulje , et oled ise saanud tiigri jõu , pehmuse ja kiiruse . 
828	NA	 Seda tuligi demonstreerida , tuli ohver vaimustusse viia ja ta oligi sinu ! 
828	NA	 Lihtne , eks ole Oh , kuidas ta seda elu vihkas ! 
829	NA	 Ta oli lootnud , et tema haridustase , stiilitunne , asjatundlikkus , kõik kokku aitavad ta varsti salongist sinna klaasseina taha , kus istusid suuremad ja väiksemad peajumalad . 
829	NA	 Aga nemad ei arvanud sugugi , et mingi Ivo Lepala võiks teha targemaid otsuseid kui mõni neist , milline pudrusuu ja kammimata keegi ka polnud . 
830	NA	 Üks šanss oli tal kasutamata . 
830	NA	 Firma Euroopa-osakonna müügidirektor oli Simone D'Avignon , neljakümneaastane veetlev pariisitar , kelle pilku Ivo korra kohanud oli ... 
831	NA	" "" Millega keegi kaupleb , "" muigas ta hapult . "
832	NA	" "" Hm , pariisitarid ! "" "
832	NA	 Svenile need jutud istusid , juba kooliajast peale ja ikka veel . 
832	NA	 Nagu poleks ta olnud tüdrukute lemmik , aina parv ümber . 
832	NA	 Kikilipsu kandminegi pärines sellest ajast . 
833	NA	 Ivole kerkis korraga silme ette see kunagine Sven , nukralt naeratav ja kahvatu , alati hästi kammitud , pikk aga kleenuke , nii et ta kael elas nagu omaette elu keset alati laitmatult puhast ja tärgeldatud kraed , mida kroonis igipõline ristlips . 
833	NA	 Nad olid üle klassi poisid , need kaks vasakus reas kolmandas pingis . 
833	NA	 Samavõrra kui Sven oli silmnähtavalt hästikasvatatud , oli Ivo natuke isemeelne ja problemaatiline . 
833	NA	 Lõpuklassis oli ta endale juba autospordiga nime teinud . 
833	NA	 Selle ala arutu ohtlikkus tuli ilmsiks , kui poiss murtud rangluuga kooli ilmus . 
833	NA	 Sestpeale ümbritses teda laitev ja imetlev võõristus . 
834	NA	 Sven oli muidugi paipoiss , alati kõigiga parimates suhetes . 
834	NA	 Eriti muidugi tüdrukutega , nii et teda hakati kutsuma — sõbranna . 
834	NA	 Kui siis see sõbranna ühel klassiõhtul veidi viltu käis ja oma kasvatatuse kontrastiks hirmus ropusti laulis , oli kõigile selge , et sõprus Ivoga on talle väga kahjulik . 
834	NA	 Neid püüti lahutada , kuigi mingit põhjust polnud ette tuua . 
834	NA	 Purjus oli olnud Sven , mitte Ivo . 
835	NA	 Muigama ajas ! 
835	NA	 Millisest kasvuhoonekliimast nad pärit olid ! 
835	NA	 Õpetajatädid ! 
835	NA	 Me olime kõik , kogu klassiga natuke rüübanud ! 
835	NA	 Aga Svenil võttis too sada grammi pidurid maha ja see , mis oli talle nii rangelt keelatud olnud , pääses valla . 
836	NA	 Taas pidi Ivo autoga manööverdama . 
836	NA	 Tunkedes mammi tahtis prügikonteinerisse sületäie klaasitükke tuua . 
836	NA	 Vasakule jäävas majas käis kibekiire ümberehitus . 
836	NA	 Kaugemal hoovis tehti mingit metallitööd . 
836	NA	 Presentrõivais mehed tassisid õlal sinna torusid . 
836	NA	 Plangu pragude vahelt sähvis sinist leeki . 
836	NA	 Ivo käivitas , tagurdas , keeras nina tulekusuunda . 
836	NA	 Tänav võttis neid vastu liiklusummikuga . 
836	NA	 Küll uhiuusi , küll roostelaigulisi sõiduautosid , pikapeid , furgoone ja raskeid veomasinaid läbisegi busside ja trammidega veeres pikaldaselt , mürinal , sinises heitgaasivingus . 
836	NA	 Polnud enam jälgegi hommikuse linna natuke ebareaalsest uduniiskest värskusest . 
836	NA	 Andis oodata , enne kui liiklusvoolu auk tekkis ja sinna auto kiiluda sai . 
837	NA	 Viru parkimisplatsil jäid nad paratamatult päikese kätte . 
837	NA	 Tuli mõlemad külgklaasid alla lasta . 
837	NA	 Liiklusmüra mähkis nad tihedasti endasse . 
838	NA	 Postimaja oli siinsamas . 
838	NA	 Jäänud oli veel pool tundi . 
838	NA	 Paljast mõttest lõi erutus Ivos kihisema nagu gaas korgi alt vabanenud karastusjoogis . 
838	NA	 Ta ei saanud suud peetud . 
838	NA	 Naine , kellega ta mullu suvel Rakveres elas , ei vasta ta kirjadele . 
838	NA	 Neil oli kokkulepe , et loata ta külla ei lähe . 
838	NA	 Nüüd oli ta vallamajja helistanud , palunud Marit Möller täna kella üheteistkümneks kõnele kutsuda ... 
839	NA	 Sven oli aina võrratu kuulaja olnud . 
839	NA	 Nagu muuseas õngitses ta Ivolt välja rohkem , kui too eales rääkida oleks tahtnud . 
840	NA	" "" Nii et sa ei raatsi lihtsalt niisama jätta ? "" "
841	NA	 Varemgi oli Ivo endalt küsinud , miks ta õigupoolest siis ikkagi olukorraga ei lepi ? 
842	NA	" "" Kas sa ei arva , et lillebuketist isaduse ilmseks omaksvõtuks kohtule küllalt on ? "" "
842	NA	 Sveni poolnaeratus , küsiv kulmukergitus ajasid vihale . 
843	NA	" "" Ise näed , "" nähvas Ivo . "
843	NA	" "" Olime kunagi üle-peo-poisid ! "" "
843	NA	 Ja kahetses kohe . 
844	NA	 Sven Sarapile võis nagu vahele väga lihtsalt sügavaid kriime teha , kartmata , et need kuigi kaua säilivad . 
844	NA	" "" T-jah ! "" ütles too ainult . "
844	NA	 Kaks teismelist , kellest Sven ilma oli . 
844	NA	 Kui valus see olla võis ? 
845	NA	 Ivo ei tahtnud mingil juhul enne ühtteist helistada . 
845	NA	 Kui ta lõpuks kõnepunkti kabiinirägastikust töötava automaadiga vaba klaaskuudi leidis , oli aeg juba viis minutit üle läinud ja mees hakkas kiiruga numbrit valima . 
845	NA	 Kinni-toon , tühi vaikus , jälle kinni-toon Lõpuks pikad signaalid . 
845	NA	" "" Siin ei ole vallamaja , siin on korter . "" "
846	NA	 Ivo ei kaotanud naljalt kontrolli oma sõnavara üle , kuid nüüd ta juba vaikselt vandus . 
846	NA	" Siis rahulik meeshääl : "" Kallaus kuuleb . "" "
847	NA	 Enda rahustamiseks polnud aega . 
847	NA	" "" Vabandage , ega "" korraga ei suutnud Ivo naise nime meenutada . "
847	NA	" "" Kas te saite kõnelekutse edasi öelda ? "" "
848	NA	" Veidi muigaval toonil lausus vallavanem : "" Rahu , ainult rahu ! "" "
849	NA	 Torus oli natuke kobinat ja seejärel väljapeetud , puhta diktsiooniga : 
850	NA	" "" Ma kuulen . "" "
851	NA	 Ivo hingas sügavalt sisse . 
851	NA	" "" Marit , oled see sina ? "
851	NA	" Ivo siinpool . "" "
852	NA	 Eile oli ta Madis Kallauselt palunud : ärgu öelgu , kes kutsub , öelgu , et ei tea , oli see mees või naine , sekretärilt unnes küsida . 
852	NA	 Kuidas nad Maritiga küll selle üle naerda võisid ! 
853	NA	" "" Ma teadsin , et see sina oled , "" lausus Marit pilkava üleolekuga . "
854	NA	 Äkki silmas Ivo läbi kabiinide klaasseinte muhelevat Sveni ja ajas enda sirgu . 
854	NA	" "" Marit , ma tahaksin sind õnnitleda , aga sa teed selle võimatuks . "
854	NA	" Kui ma loata sinna ilmuda ei tohi ja sa mu kirjadele isegi ei vasta , ei saa ma käituda nii , nagu ma õigeks olen harjunud pidama . "" "
855	NA	" "" Andesta . "" "
855	NA	" Marit tahtis midagi lisada , kuid Ivo lõikas vahele : "" Ma ei tulnud sind noomima , ma selgitan olukorda . "
855	NA	" Palun räägi , kuidas läheb ? "" "
856	NA	" "" M-ma ei saa ... "" "
857	NA	 Niisiis ei läinud see vallavanema-lontrus isegi toast ära ! 
857	NA	" "" Viska teda templipadjaga ! "" soovitas Ivo ja ajas naise naerma . "
857	NA	" "" Ära looda , et sa minust pääsed , ma saan alati , mida ma tahan . "
857	NA	" Ja seekord ma tahan teada . "" "
858	NA	" "" Ma kirjutan sulle , "" lubas Marit , aga Ivo ei uskunud teda ja seda ta ka ütles . "
859	NA	" "" Kui sa ei räägi , siis istun ma praegu autosse ja olen pooleteise tunni päras seal . "
859	NA	" Kas oleme kokku leppinud ? "" "
860	NA	" "" Leia mulle keegi õpetaja , "" ütles Marit . "
860	NA	" "" Kooli tuleb kaks klassi , mitte üks . "" "
860	NA	 Ta tahtis juttu mujale viia , kuid Ivo hakkas naerma . 
861	NA	" "" Hästi ! "
861	NA	" Toon sulle ühe õpetaja . "" "
862	NA	" "" Ivo ! "" "
862	NA	 Mariti toon oli keelav ja kohkunud . 
863	NA	" "" Oleme kokku leppinud ? "
863	NA	 Tulen pooleteise tunni pärast ja toon ühe õpetaja . 
863	NA	" Sobib ? "" "
863	NA	 Mida see väänkael endast mõtleb ! 
863	NA	 Kui ta kavatseb tõepoolest Ivot täielikult kõrvale jätta , siis tuleb tal selleks mehe nõusolek saada ! 
864	NA	" "" Hästi , "" soostus Marit ootamatult . "
864	NA	 Oli Ivol siis tõesti õigus , kui ta juba mullu arvas Madis Kallause asjast huvitatud olevat ? 
864	NA	 Kas mitte lihtsalt selle pärast , et tolle mehe kuuldeulatusest pääseda , oli naine jutu lõpetanud ? 
865	NA	" "" Nägemiseni ! "" ütles Ivo ja pani toru ära . "
866	NA	 Sven oli selja keeranud ja uuris ajakirjade väljapanekut . 
866	NA	 Igavene jesuiit ! 
866	NA	 Terve kõne luuras läbi kahe kabiinirea Ivo ilmet ! 
867	NA	 On ta töötu ja perekonnata ? 
867	NA	 On ta huvitatud töökohast ? 
867	NA	 Siis tulgu kaasa ! 
868	NA	 Sven kuulas loo ära ja ta naeratus muutus ebalevaks . 
868	NA	" "" Jah , jah ee See oleks ju teatav lahendus . "" "
869	NA	 See polnud mingi lahendus ! 
869	NA	 Sven oli hariduselt ajalooõpetaja , elupõline tallinlane . 
869	NA	 Kui ta seda mereäärset valda näeb , muutub ta kõhklus kindlasti eituseks . 
869	NA	 Ja olekski tore pilt , kui see ennast koledaks ja krimpsu joonud mees hakkaks sealseid mudilasi lugema õpetama ! 
869	NA	 Aga praegu polnud sellel tähtsust . 
869	NA	 Paigale ta sinna mingil juhul ei jää . 
870	NA	 Ivo ostis kimbu lopsakaid valgeid roose , laskis need märja ajalehe sisse pakkida . 
870	NA	 Ta oli hingelt ikka veel poisike . 
870	NA	 Samavõrra kui ta tulevast kohtumist pelgas , nautis ta ette pikka autosõitu . 
870	NA	 See siin linnas oli pigem vaevlemine kui rõõm . 
871	NA	 * * * 
872	NA	" "" Kas sa pole kunagi mõelnud , miks Napoleon ei hakanud piraadiks ? "" küsis Sven , kui punane auto Kiiule lähenes . "
872	NA	 Vaikus oli kestnud nii kaua , et kaassõitja unustanud Ivo võpatas . 
872	NA	 Ta mõte oli liikunud kahe teema ümber . 
872	NA	 Eelkõige nautis ta autot . 
872	NA	 Sellega sõitmine oli parem kui mis tahes puhkus . 
872	NA	 Kliimaseade oli salongi parajalt maha jahutanud . 
872	NA	 Kui klaasid olid suletud , ei kostnud kummide kädin sulaval asfaldil peaaegu üldse sisse . 
872	NA	 Oli väga vaikne , üksnes raadiost tuli mahedalt Ravel . 
872	NA	 Ja selles sumedas naudiskluses jälgis mees endas pikkamisi kerkivat palavat ärevust . 
872	NA	 See oli nagu noor armumine poisipõlves . 
872	NA	 Näed siis , mida teevad aastad ! 
872	NA	 Ta oli teel lapsega vanapiiga juurde , et vähemalt õnne soovida . 
873	NA	 Sven oli mõtlematus ! 
873	NA	 Ivo oli pinginaabri kaasa kutsunud paljast kalambuurilustist , nagu ta üldse kiireid , seikluse maiguga otsuseid armastas . 
873	NA	 Ja mida ta nüüd selle vana joodikuga peale peaks hakkama ? 
873	NA	 Mees vusserdab tal tänase päeva ära ! 
874	NA	 Mida mees selle Napoleoni piraadiks hakkamisega mõtles ? 
874	NA	 Jumal teab , mis laialivalguvas alkohoolikuhuumoris sellised mõttekäigud sünnivad ! 
874	NA	 Aga järele pärida polnud Ivo viis . 
874	NA	 Kui tahad jutu jämedat otsa oma peos hoida , on mõistlik vastaspool kukalt sügama sundida . 
875	NA	" "" Ma ei tegele ammu enam sellega , "" märkis Ivo ja ootas ära Sveni nõutu ilme , enne kui lisas — ta ju kirjutas neid absurdiluuletusi üldse vaid kirjandusõpetaja kiuste . "
875	NA	 Loomulikult on koolipoisi meelest teravmeelne riietada traktor roosasse öösärki ja lugeda indiaanipealiku pagunitelt tärne , aga teatavast east alates hakkad absurdistki mõtet otsima . 
876	NA	 Sven kuulas osavõtmatult , ja kui Ivo vait jäi , kinnitas — tema mõtleb tõsiselt — miks ei hakanud Napoleon piraadiks või vähemalt veinitallajaks , karjuseks Miks ta laskis ennast seal saarel vangis pidada ja mõnede arvates arseenikuga ära mürgitada ? 
876	NA	 Tema tagasitulek oli ju lootusetu katse maailma vastu mässata . 
876	NA	 Kui lihtne oleks ometi olnud ära kaduda ! 
876	NA	 Kes teda siis nii väga nägupidi tundis ! 
876	NA	 See ei olnud ju veel fotograafia aeg , televisioonist rääkimata . 
876	NA	 Kasvad karva , ajad teised kaltsud selga ja oledki läinud ... 
877	NA	" "" Ma ei viitsi ! "" ütles Ivo , kuid Sven jätkas . "
877	NA	 Nagu Menšikov pagenduses , nagu Nikolai II bolševike vangina Kui võimatu on ometi vahetada sotsiaalset rolli ! 
877	NA	 Jäädakse iseendaks , maksku see pealegi elu . 
877	NA	 Tähendab — elada kellegi teisena on hullem , kui surnud olla . 
878	NA	 Kuusalu-tagused nõmmemetsad voolasid vastu . 
878	NA	 Kord põras kummide all pindamiskillustik , kord sahises sile mustkate . 
878	NA	 Ivo mõtles — mis elu see olekski , kui ta näiteks peaks olema Sveni asemel ? 
878	NA	 Tema oli Ivo Lepala , ka kõikide probleemide kiuste . 
878	NA	 Ta ei tahtnud teise mehe kokkukäkerdatud saatust , talle piisas enda omast . 
879	NA	 * * * 
880	NA	 Selleks et hakata kuulma mesilaste töölendu , märkama kaugusi mähkivat põuavina , pruuniks kiskuvaid valge ristikheina õisi , et jälle tunda end keset kuuma , meelast suve , oli vaja vaid mõni minut vallamajas telefonitoru hoida . 
880	NA	 Ühtesulavate päevade rutiin oli selleks korraks möödas . 
881	NA	 Kael kangekaelselt kenus nagu maleratsul , ülahuul hammaste vahel , läks Marit Möller mööda tolmust söödirada kodu poole . 
881	NA	 Tahtis ta tõesti Ivo oma elust lõplikult välja arvata või kartis üksnes kaotada osa omanditundest selle väikese inimese suhtes , kes teda koju ootama oli jäänud ? 
881	NA	 Kui ta seda endale ise öelda oleks osanud ! 
882	NA	 Triin pühkis tulistvalu minema — tervelt pool tundi oli ta pidanud toas istuma . 
882	NA	 Ja Marit kummardus üle magava lapse . 
882	NA	 Ta libistas käed ettevaatlikult mähkmete alla ja võttis imiku sülle . 
882	NA	 Väike roosa rusikas hakkas nägu hõõruma , laud avanesid ja hägus-sinised silmad tunnistasid Maritit . 
882	NA	 Naine võttis rinna paljaks , poetas roosa nibu lapsele suhu . 
882	NA	 Peale paari lutsatust laskis too suu valla ja hakkas naerma . 
882	NA	 Ei olnud veel söögiaeg . 
883	NA	 Pooleteise tunni pärast , oli Ivo öelnud . 
883	NA	 Sellest ajast oli möödunud pool tundi . 
883	NA	 Võimatu oli uskuda , et keegi võiks tõesti nüüdsama Tallinnast saabuda . 
883	NA	 Õpetajanna jaoks oli viimane aasta olnud väga paikne ja kõik kaugused omandanud jälle peaaegu lapsepõlveaegsed mõõtmed . 
883	NA	 Ta ei uskunud , et mees võiks tõesti tulla , kuigi mõistus käskis end igaks juhuks siiski korda seada . 
883	NA	 Rohkem küll selle hüpoteetilise õpetaja kui Ivo enda pärast . 
883	NA	 Marit ajas kleidi maha ja pesi ennast jaheda veega . 
883	NA	 Kõik oli muidugi asjatu . 
883	NA	 Veerand tunni pärast on tal jälle higi väljas . 
883	NA	 Oli kord selline lõunamaine suvi ! 
884	NA	 Vastutahtmist otsis Marit kapist hilpe . 
884	NA	 Ta valis pitsilise kaelaava ja väikeste puhvvarrukatega ungari pluusi linase seeliku juurde . 
884	NA	 Eeldatavasti peidavad need natuke ta värsket täidlust . 
884	NA	 Kuigi ka see teda eriti ei häirinud . 
884	NA	 Kui Ivo kord juba loata siia trügib , siis nähku ta Maritit just sellisena , nagu ta on ! 
885	NA	 Huvitav siiski , kas Ivol on mõni järjekordne romaan ? 
885	NA	 Paistis küll , et ta tõepoolest mingi õpetajannaga ringi kolab . 
885	NA	 Miks muidu see enesekindel naerutõuge hääles ? 
886	NA	 Üks auto ronis põlluvaheteel nende talu poole . 
886	NA	 Mingi tumedate klaasidega kirsipunane , luksuslik , kuidagi sünge masin . 
886	NA	 Kes see küll siia eksinud on ? 
886	NA	 Ja siis Marit taipas . 
886	NA	 Pilk kellale — Ivo oli peaaegu minuti pealt täpne olnud . 
886	NA	 Mida ta ometi seni vahtinud oli ! 
886	NA	 Tulijatele tuleks ju midagi lauale panna ! 
887	NA	 Marit litsus end põsega vastu aknaraami . 
887	NA	 Kes see küll Ivoga kaasas on ? 
887	NA	 Kedagi ei olnud . 
887	NA	 Mees peatas auto värava taga ja väljus , tuli mõtlikul moel õue , vaatas kahele poole . 
887	NA	 Ilmselt pelgas koeri . 
888	NA	 Kuri naer tõusis naisele näkku . 
888	NA	 Mida tähendas see kirjadega pommitamine , mida tähendas õpetaja , kelle Ivo lubas kaasa tuua ? 
888	NA	 Oli ju Ivo ise õpetaja ! 
888	NA	 Niisiis on mees ilmselt lõpuks tänaval ja tuleb teda nuruma . 
888	NA	 Noh , seda võis ju natuke nagu ettegi arvata ! 
889	NA	 Kui Ivo hoovipoolsest aknast möödus , lipsas Marit tagakambrisse ja sulges vaheukse . 
889	NA	" Ta laskis kaks korda koputada , tõukas siis ust pikkamisi , et hingede kägin välja kostaks , ja hõikas : "" Sisse ! "" "
889	NA	 Nad astusid üheaegselt eeskambrisse ja sulgesid mõlemad tagasikätt ukse enda järel . 
889	NA	 Ivo peatus ja Maritki peatus . 
889	NA	 Ivo harutas aegamisi , sõnagi lausumata paberi lillede ümbert . 
889	NA	 Millised lopsakad täisvalged roosid ! 
889	NA	 Olid need viimase rahaga ostetud ? 
890	NA	" "" Tere ! "" ütles Ivo ja ulatas kimbu . "
891	NA	" "" Tere ! "" "
891	NA	 Marit sirutas käe ja mees surus seda lühidalt . 
891	NA	 Ei olnud nagu lausa magusa lipitsemise moodi . 
891	NA	 Naine võttis roosid kergelt naeratades vastu , nuusutas neid põgusalt . 
891	NA	 Polnud lõhnav sort . 
891	NA	" Seljaga mehe poole , valis Marit vaasi , kui Ivo nõudlikult lausus : "" Nagu näed , ei tea ma nii paljugi kas mul on põhjust sind õnnitleda . "" "
892	NA	" "" On , "" sõnas Marit . "
893	NA	 Ivo oli pea natuke küljele kallutanud ja vaatas teda ootavalt . 
893	NA	 Mehe ilu oli Maritit alati häirinud , see vaieldamatu nägusus , rahulik sarm , see , et niisugune mees iga naise pilku köidab , võim , mis tal sellega vastassoo üle käes on ... 
894	NA	 Marit ei kavatsenud vabatahtlikult midagi loovutada . 
894	NA	 Ta valas vett vaasi , seadis keskendunult lilli Ja Ivo ei jäänud ka kuigi pikalt ootama . 
894	NA	" Ta lõdvestus , pöördus veidi , ukse poole , oli kahevahel , kuid jäi siiski paigale , lausus natuke üle-õla , muuseas , ükskõikselt , selgitavalt : "" Teadsin , et see moment kord kätte jõuab . "
894	NA	 Kui sa oskad mulle midagi süüks panna , siis ole hea , esita oma süüdistus . 
894	NA	 Tsiviliseeritud kohtupidamise tava nõuab , et kohtualusele selgitatakse , milles teda süüdistatakse . 
894	NA	 Et ta oskaks ennast kaitsta . 
894	NA	" Mina ise ei suuda endale mitte mingit süüd välja mõelda . "" "
895	NA	 Marit kihvatas . 
895	NA	" "" Sa oled kolme lapse isa "" "
896	NA	" "" Ma arvasin , et nelja , "" ütles Ivo ja ta ilme oli tõesti küsiv . "
897	NA	 Sõnatult läks naine tagakambri ukse juurde , avas selle ja viipas mehe sisse astuma . 
897	NA	 Laps siples oma võrevoodis ja lalises tasakesi . 
897	NA	 Ivo peatus meetri kaugusel ja vaatas teda tükk aega sõnatult . 
898	NA	 Maritis tärkas järsku soojusehoog ja ta puudutas laubaga mehe õlga . 
898	NA	 Päevitunud , lihaseline , tumeda karvakräsuga kaetud paharetikäsi põimus ta õlgade ümber . 
898	NA	 Selle haarde jõulisus rääkis tundetulvast . 
898	NA	 Marit lõi korraks nõrgaks , kuid kogus end kohe . 
898	NA	 Ta vajas otsustavat kalkust , sest teadis ette , kui väga ta Ivole hetke pärast on sunnitud haiget tegema . 
899	NA	" "" On ta poiss või tüdruk ? "" "
900	NA	" "" Poiss . "" "
901	NA	" "" Ja mis ta nimi on ? "" "
902	NA	 Oligi käes see hetk . 
902	NA	" "" Peep , "" ütles Marit kiiresti , jälgides , et ta hääl vähimatki ei reedaks . "
902	NA	 Käsi ta õlgade ümber korraks nagu värahtas , pigistas siis teda lühidalt ja valus-kõvasti ning mees astus akna juurde . 
902	NA	 Midagi näis talle kibedat nalja tegevat . 
902	NA	 Seda muhelust või pigem muiet ta seal varjaski . 
903	NA	 Maritit läbisid kiiresti tundevarjundid , mida asjaolude meenutamine tõi , ja ta taipas äkki külmvalusalt , et mees võib vabalt meenutada üht Kairi nimelist blondi tüdrukut , ega pea üldsegi Peebu pärast armukade olema , selle kahemeetrise , siidpehmete kastanpruunide vurrudega Peebu ... 
904	NA	 Ta oli sisimas ikkagi lootnud teha selge arve . 
904	NA	 Nüüd olid vahekorrad taas sassis , ta oli sellest tõmmust playboyst jällegi sõltuv , nii väga kui ta sellist sõltuvust ka vihkas . 
905	NA	" "" Sa ei pidanud sõna ! "" ütles Marit kiiresti . "
905	NA	" "" Sa lubasid "" "
906	NA	" "" Oo , vabandust ! "" "
906	NA	 Ivo oli äkki õelalt sarkastiline . 
906	NA	 Ta väljus ja tõmbas ukse kiiresti , märgatava kolksuga kinni . 
906	NA	 Marit tajus äkilist kahetsusevahku . 
906	NA	 Selle mehe ettehoiatamata lahkumised olid talle tuttavad . 
906	NA	 Muidugi oli ta üle piiri läinud , ja ta taipas , et seekordne minek võib Ivol viimane olla . 
906	NA	 Kuid samas oli too tagasi , pistis oma mustalokilise pea ukse vahelt sisse , naer näol . 
907	NA	" "" Tule appi ! "
907	NA	" Ma ei saa su tellitud õpetajat puu otsast kätte . "" "
908	NA	 * * * 
909	NA	" Hea meelega oleks Sven Sarap öelnud südamepõhjast : "" Persse ! "" "
909	NA	 Tema hädiselt magus naeratus ei väljendanud midagi peale lapsepõlvekasvatuse . 
909	NA	 Muigav klassivend ja tema tüsedakene blondiin , kes varjamatult naeru lõkerdas , ajasid Sven Sarapile tülgastusse peale . 
910	NA	 Ta oli ärganud teadmisega , et on teel kuristikku ja sellest ei ole mingit pääsu . 
910	NA	 Veel enam , tal polnud vähimatki soovi sellest kogu sellest õnnetusest mingil moel hoiduda . 
910	NA	 Täis mehelikku karmust , tegi ta endale teatavaks , et hakkab jooma ja joob , kuni kõik on möödas . 
910	NA	 Rumal enesesäästmise instinkt võib takistada teda praegu endale silmust kaela panemast , aga kui ta oma kaks ja pool tuhat on läbi kõri lasknud , pole seda instinkti enam olemas . 
910	NA	 Mil viisil lõpp tuleb , polnudki tähtis . 
910	NA	 Ta oli viimased aastad alkoholita hakkama saanud ja nädal või teine padujoomingut teda veel koomasse ei vii . 
910	NA	 Igatahes oli kõik nüüd selge . 
910	NA	 See maailm ei vajanud Sven Sarapit ja tema ei vajanud seda maailma . 
911	NA	 Ometi ei suutnud ta endale seda lõbu keelata , et ajanud selga viimase pintsaku , sidus ta kaela roostepunase ristlipsu . 
911	NA	 Just nimelt sidus , ei riputanud haledat valmistoodet kummiga kaela . 
911	NA	 Helehalli , kergest siidikoeliset kangast pintsaku kõrvale olid tal küll vaid samuti helehallid jämelinased püksid , mis selleks põrmugi ei sobinud . 
911	NA	 Ja lausa füüsilist piina tundes pidi ta jalga ajama kõva tallaga mustad tänavakingad . 
911	NA	 See oli kõik , mis tal veel oli . 
912	NA	 Ometi pidi ta tee kord olema õnnetähega märgitud ! 
913	NA	 Millalgi hirm-ammu oli ta olnud Kulla , kullerkupupuhmast meenutava helekuldse lokikuhilaga paksuke põnn , kellele kõik , eranditult kõik lubatud oli ! 
913	NA	 See Kulla oli väsimuseni sülest sülle käia võinud , pere noorim kahe suure õe järel . 
913	NA	 Mida ta ka ei teinud , ikka oli see vaid imetlust esile kutsunud . 
914	NA	 Sveni kasvatati nagu see tema ühiskonnakihile kohane oli . 
914	NA	 Istudes nüüd siin külas pooleteise meetri kõrgusel toomingaoksal , kus ka tagajalule kerkinud oinas teda ohustama ei küündinud , leidis ta , et see olukord teda mingil moel ei häbista . 
914	NA	 Mees nagu tema ei saanud normalselt üldse sellise supi sisse sattuda . 
914	NA	 Ja ebanormaalsete olukordade eest ei saa ta ju vastutada . 
914	NA	 Mida oli selle juurde muiata või lõkerdada ? 
915	NA	 Sõber Ivo oli alati väga tundlik olnud kõige suhtes , mis ta mehisusele varju võis heita . 
915	NA	 Ta oli endale rumalal viisil kohustuseks võtnud julge olla . 
915	NA	 Sven polnud kunagi uskunud , et mehelik julgusemüüt võiks olla midagi muud , kui ilus vale . 
