par_nr	head	sentence
353	NA	 Ükskõik , mida Terranooval ei otsustataks , on Hartaga lõpp , Zeman teadis seda . 
353	NA	" Sest kaua ei õnnestu neil "" Vituse "" ja Capaneusi obside ühistöös valminud prognoosi varjata . "
353	NA	 Hästi , nad hävitavad need esimesed asteroidid . 
353	NA	 Aga ilmaruum saadab oma haamrilööke edasi ja jääbki saatma . 
353	NA	 Mõnel planeedil lihtsalt on selline saatus . 
353	NA	 Ja igasugused Hartad seda ei mõjuta . 
353	NA	" Inimene ei pea , ei tohi saada Capaneusile kaitsvaks "" Jumala käeks "" — selline oli Harta koostamise ajal Konservatooriumi ainus ja püha tõde . "
353	NA	 Kõik edaspidine johtus sellest dogmast . 
353	NA	 Capaneusi inimestest võib saada kunagi inimkonna noorem vend . 
353	NA	 Aga ainult siis , kui loodusel lastakse tema kallal rahulikult tema enda äranägemist pidi tööd teha . 
353	NA	 Muid tehislikke variante pole tarvis . 
353	NA	 Kui loodus — see ilmaruumi ainus ja tõeline Jumal — on määranud Capaneusile kunagi jõuda sinna , kuhu viitab igasugune geoloogiline ja bioloogiline inimesele arusaadav teadvus , siis kunagi nad kohtuvad . 
353	NA	 Kunagi , kui aeg on küps . 
353	NA	 Ja ei kohtu mitte kui isand ja ori , mitte kui looja ja loodu , mitte kui paluja ja andja . 
353	NA	 Nad kohtuvad siis , kui Homo sapiens capaneaum on ilmutanud huvi , vältimatut huvi , mis tal peab tekkima , kui Mõistus hakkab otsima ilmaruumist seoseid ja oma olemasolu põhjust . 
353	NA	 Nad kohtuvad partneritena , võrdsete kaaslastena ja kuidagi teisiti nad kohtuda ei tohi . 
353	NA	 Aeg selleks saab — saaks või võinuks saada , mõtles Zeman — küpseks , siis kui Capaneusi esimeste linnade esimestes pühakodades on tuhaks põletatud esimesed teadlased , kes enda olemasolu ja ilmaruumi olemasolu põhjuseid ja mehhanisme otsides on läinud vastuollu tärkava religioossusega . 
353	NA	 Siis , kui astronoomia on muutunud teaduseks , mis rohkem tõstatab küsimusi , kui neid lahendab . 
353	NA	 Siis , kui Capaneusi esimesed ulmekirjanikud on kaante vahele vorminud unistuse leida kosmosest vennasmõistus . 
353	NA	 Ühesõnaga siis , kui neid oodatakse ... 
354	NA	 Aga Universumil paistavad olevat teised plaanid . 
354	NA	 Kosmos otsib oma tasakaalu ja leiab , et Capaneus , mille kallal elu loomisega ta kunagi nii kaua vaeva nägi , jääb teele ette ja tuleb pühkida olematusesse . 
355	NA	" "" Selle Hartaga on lõpp , "" ütles Lilkus . "
355	NA	" "" On vaja uut . "" "
356	NA	" "" Missugust uut ? "" "
357	NA	" "" Sellist , mis sätestaks inimesele õiguse neid inimesi kaitsta . "
357	NA	 Sellist , mis teeks meist nende igavesed valvurid ja hooldajad . 
357	NA	 Kui meil õnnestuks nüüdne asteroidide rünnak tagasi tõrjuda , siis võib-olla järgmine seanss kunagi tuhande aasta pärast oleks palju lihtsam . 
357	NA	 Kes teaks , milline tehnika siis meie käsutuses on ? 
357	NA	" Võib-olla on see teostatav vaid ühe näpuliigutusega ? "" "
358	NA	" "" Sa tahad liiga palju . "
358	NA	" Meil pole selleks õigust ... "" "
359	NA	" "" Meil pole õigust täita oma kohust ? "" ägestus Lilkus pisut . "
359	NA	" "" Sa tahad öelda , et ainult sellepärast , et Capaneusi rass pole Maalt algust saanud , pole meil õigust endast nõrgemaid aidata ? "
359	NA	 Sest just niimoodi näen mina seda asja . 
359	NA	 Nad on samasugused inimesed kui meie , aga ainult teiselt planeedilt . 
359	NA	" Inimene on loodud maailma lihtsalt mitmest erinevast maailmast . "" "
360	NA	" "" Meil pole õigust muutuda nende jaoks kaitsvateks jumalateks . "
360	NA	" Tead seda vana kõnekäändu — kui sa päästad kellegi elu , oled sa tema eest kogu oma elu vastutav ? "" "
361	NA	" "" Ma sain nagu ennist aru , et sa pooldad asteroidide hävitamist , "" oli teadlane nõutu . "
361	NA	" "" Nüüd sa räägid , et meil pole selleks õigust . "" "
362	NA	" "" Ma olen päri , et praegune rünnak tuleks hävitada . "
362	NA	 Aga Azarjani avastused muudavad pisut pilti . 
362	NA	" Me peaksime endale nüüd võtma kohustuse kaitsta planeeti Capaneus igavesti ... "" "
363	NA	" "" Just nimelt ! "" "
364	NA	" "" Ja Capaneus jääks meile võlgu . "
364	NA	" Ja seda võlga ei suudaks nad kunagi tasuda , see oleks nende jaoks liiga palju . "" "
365	NA	" "" Aga keegi ei hakkaks nende käest seda võlga tagasi küsima ! "" "
366	NA	" "" Hakkab küll , Zev , hakkab küll . "
366	NA	" Kümne tuhande aasta pärast , kunagi siis maandub siin inimeste tähelaev ja sealt astub välja üks pika musta habemaga kapten , ütleme , et ta nimi on näiteks Lev Zilkus ja teatab : "" Tere-terekest . "
366	NA	 Nüüd me siis olemegi siin . 
366	NA	 Ega te juhuslikult ei märganud eile taevas tugevat sähvatust ? 
366	NA	 No vot , teadke siis , et need olime meie , kes ühe asteroidi siin hävitasid . 
366	NA	 Me aitasime teid suurest sitast välja ja nüüd on teie kord ... 
366	NA	" "" "" "
367	NA	" "" Igati normaalne vastastikune abistamine ja koostöö , muide , "" torkas Lilkus muiates vahele . "
368	NA	" "" Aga kas ka võrdsetel alustel ? "
368	NA	 Julgen kahelda . 
368	NA	" Inimkonnast ei tohi saada kapaneuslaste igavene lapsehoidja . "" "
369	NA	" "" Lapsehoidmine on igati sümpaatne ja inimlik tegevus . "
369	NA	" Ja väga vajalik tegevus — selle eesmärgiks on tagada tulevase ühiskonnaliikme valmisolek sellesse sulanduda ettevalmistatud olekus ning millise tegevuse käigus ühtlasi ka kindlustatakse lapse esmaste hügieeniliste ja füsioloogiliste vajaduste rahuldamine põhjusel , et ta pole ise nende täitmiseks objektiivsete asjaolude tõttu võimeline , "" defineeris Lilkus kiiresti ja jätkas oma äkilisest ideest tiivustatuna . "
369	NA	" "" Lapsehoidmine põhineb looduslikel vajadustel . "
369	NA	 Täpselt sama on praegu ka Capaneusiga . 
369	NA	" See planeet vajab lapsehoidjat , kes tema eest hoolitseks ja aitaks ... "" "
370	NA	" "" Ja kasvataks ? "
370	NA	 Tee nii , ära tee naa ... 
370	NA	 Nii ei tehta , see pole korralik ! 
370	NA	 Iga lapsehoidja kasvatab last oma ühiskonna väärtushinnangute järgi . 
370	NA	 Aga just seda ei tohi me Capaneusiga teha . 
370	NA	 Ta peab ise leidma tee . 
370	NA	" Ja kui ta kunagi vajab järelaitamistunde , siis küsigu ta seda ise , "" vastas Zeman rahulikult . "
370	NA	" "" Nad peavad ise aru saama , mida mõistusega pihta hakata , kuidas olla inimene . "
370	NA	" See on midagi sellist , mida me ei saa ega tohi neile õpetada . "" "
371	NA	" "" Kuidas olla inimene ? "" osatas teadlane . "
371	NA	" "" Inimese füsioloogia lähem uurimine näitab , et inimese ainsaks looduslikult argumenteeritud olemasolu põhjuseks on järglaste saamine . "
371	NA	 Muu pole oluline ! 
371	NA	 Ja mõistus on antud selleks , et järglastel oleks järglaste andmine hõlpsam . 
371	NA	 Selles ongi tsivilisatsiooni ja kogu teaduse arengu mõte — et sinu lastel oleks mugavam , ohutum , kergem , inimlikum järglasi saada . 
371	NA	 Loomulikult tuleb selleks nende elu paremaks muuta . 
371	NA	 Kõik , mida me iganes mingil loomingulisel ajendil teeme , on meie laste jaoks , Bent . 
371	NA	 Edasi kesta — alati ja igavesti — ongi kogu inimeseks olemise mõte ja kunst . 
371	NA	 Ja edasi kesta tingimustes , kus järglastel on parem elada , et järglasi saada . 
371	NA	 Kahjuks oleme me oma mõistust suutnud ekspluateerida viisil , mis võib järglaste olemasolu üldse lõpetada . 
371	NA	 Aga see on iseasi ... 
371	NA	 Me arendasime sõjatehnikat , et kaitsta mingi ühe inimsootsiumi õigust järglasi saada . 
371	NA	 Nüüdseks on see me meile andnud sellised relvad , et ... 
371	NA	" Ah , ma ei taha sellest rääkida . "" "
372	NA	" "" Hästi , aga milleks on siis filosoofia , kirjandus , kunst ? "" "
373	NA	" "" Aga loomulikult selleks , et lahti mõtestada maailma , kuhu meie järglased sünnivad ! "
373	NA	" Selleks et aru saada , kes ja kus me oleme , et seda maailma mõista . "" "
374	NA	" "" Ja kuidas haakub siia vajadus päästa Capaneusi maailm ? "" uuris Zeman mõtlikult edasi . "
374	NA	 Talle tõesti meeldis kuulata Lilkuse uitmõtteid . 
374	NA	 Need aitasid tal mõnikord pageda Capaneusi hallist ja süngest elust . 
375	NA	" "" Kõige otsesemalt . "
375	NA	 Lihtsalt ära vaata neid kui võõrplaneetlasi , kui võõrast rassi ! 
375	NA	 Nad on samasugused inimesed kui meie . 
375	NA	 Sest asi pole ju lõpuks ainult Maas . 
375	NA	 On üks ja ainus inimrass , mis lihtsalt võrsub mitmelt erinevalt planeedilt . 
375	NA	" Asteroidide hävitamisega me kaitseme nende ehk siis iseendi õigust saada järglasi . "" "
376	NA	 Zeman ohkas . 
376	NA	 Mitte et ta poleks Lilkusega nõus olnud ... 
376	NA	 Aga selle ilusa jutuga pole praegu Konservatooriumis midagi pihta hakata . 
376	NA	 Sest lõppeks on ju Harta vaid teatavat laadi kaitsekilp , mille taha varjatakse poliitilist soovi säästa hiigelsummasid tõrjelaevastiku väljasaatmiseks . 
376	NA	 Vähemalt praegustes tingimustes on Harta seda . 
377	NA	" "" Meile jääb igaveseks teadmine , et oleme nende elu päästnud , "" ütles siis Foogt . "
377	NA	" "" Ja seda on liiga palju . "
377	NA	" Nad ei hakka meid kunagi võrdsetena tunnustama . "" "
378	NA	" "" Siis me ei räägi neile ? "" pakkus Lilkus . "
379	NA	" "" Ja oleme salajumalad ? "
379	NA	 Seegi poleks aus . 
379	NA	" Igasugune lugupidamine , ka enesest , algab aususest . "" "
380	NA	" "" Hästi , poleks aus . "
380	NA	 Aga , kas see on aus , kui me käed rüppes istume ja pealt vaatame , kuidas vennasrass ilmaruumist pühitakse ? 
380	NA	 Kujuta ette , kui nad suudaksid praegu meiega sidet pidada , praegu meiega kontakteeruda ... 
380	NA	 Või ütleme nii tuhande aasta pärast suudaksid . 
380	NA	 Ja kui nad paluksid abi — meile sajavad kaela mõrtsukasteroidid , palun tulge meile appi , hävitage need kuradima kamakad , olge inimesed ! 
380	NA	 Siis me ju aitaksime neid , Foogt , on ju nii ? 
380	NA	 Ja kas sa tõesti arvad , et nad praegu ei paluks seda abi , kui ainult saaksid ? 
380	NA	" Ma arvan , et paluksid küll . "" "
381	NA	 Estrada 45. 
381	NA	 Ardaman ; kell 07.08 
382	NA	 Sarvik on nii armas ! 
382	NA	 Tema okkaline kere ja luukollased odalised sarved on ju nii vahvad . 
382	NA	 Sarvik pole üldse kuri ega vastik ega tige elajas , ta lihtsalt on sarvik , ta on imetaja , tal on pojad , kelle eest ta hoolitseb . 
382	NA	 Ta on elusolend ja tal on õigus elus olla . 
383	NA	 Capaneus on imearmas päikseline planeet , neitsilik oma puutumatus ilus ja peibutav ürgsuses . 
383	NA	 Capaneus on maailma ilusaim maailm . 
384	NA	 Ja Dhaka on hea sõbranna ja kohusetundlik ohvitser . 
384	NA	 Ta pole sugugi kalk karjerist ega pugeja . 
384	NA	 Pealegi pole ta nii ilus kui mina . 
385	NA	 Kes oli öelnud , et kui hing laulab , siis mõistus vaikib ? 
385	NA	 Või oli see vastupidi ? 
385	NA	 Ah , pole tähtis ... 
386	NA	 Süstik sööstis pehmelt mööda kanalit alla , kõrvus undas ja vibreeris mõnusalt . 
387	NA	" "" Kas sa tantsida oskad ? "" küsis Estrada Zemanilt . "
387	NA	" "" Mina tantsin väga hästi . "
387	NA	 Nii kahju , et Pesas ei saa tantsida , kas pole ? 
387	NA	" Kui me puhkusele saame , võiksime kuhugi tantsima minna . "" "
388	NA	 Foogt noogutas . 
388	NA	 Nad istusid süstiku vastasseinadel ja olid kõidetud turvarihmadega istmete külge . 
388	NA	 Estrada pilk rippus Zemani malbel näol . 
388	NA	 Mees naeratas talle . 
389	NA	" "" Kui sa tahad , võin ma sulle tantsida . "
389	NA	 Ma oskan peaaegu kõiki Kastiilia rahvatantse . 
389	NA	" Need meeldiksid sulle kindlasti . "" "
390	NA	" "" Muidugi . "
390	NA	" Mulle meeldiks vaadata , kuidas sa tantsid . "" "
391	NA	" "" Kas sa oled millegi pärast mures , Bent ? "" "
392	NA	 Loomulikult oli Zeman millegi pärast mures . 
392	NA	 Ja Estrada ka teadis , mille pärast . 
392	NA	 Kui mitte tema maailm poleks praegu olnud helgemast helgem , oleks ka tema olnud mures . 
392	NA	 Tüdruk teadis , et Konservatoorium ei suuda kuidagi otsusele jõuda , mida nende asteroididega teha . 
392	NA	 Erinevad grupeeringud , erinevad parteid , õukonnapoliitika . 
392	NA	 Lõputud vaidlused Harta tõlgendamise üle . 
392	NA	 Ja Bent kiirustas . 
392	NA	 Kui asteroidid jäetakse hävitamata , on ju Capaneusil nii palju teha . 
392	NA	 Kõik programmid tuleb tööle panna kiirendatud rezhiimil . 
392	NA	 Nii palju on teha , nii palju jääks tegemata ... 
393	NA	 Meil on midagi olulist teha , Linne kallis , oli Zeman talle Pesas öelnud . 
393	NA	 Midagi sellist , mida ainult meie kaks teha saame . 
393	NA	 Ja kuidas talle olid need sõnad meeldinud — ainult meie kaks ! 
393	NA	 Mis see on , Bent , kas midagi seoses meie kadunutega ? 
393	NA	 Jah , on küll . 
394	NA	 Estrada teadis , et Zemanil on plaan . 
394	NA	 Ja teda ei huvitanudki eriti , milles see seisnes . 
394	NA	 Tähtis oli ainult see , et tema sai Foogti abistada , et nad nüüd kahekesi laskusid T-punkti ja on ainsad inimesed seal all . 
395	NA	 Oli ta tõesti nii tundlik ja pani tähele asju , mida teised ei pannud ? 
395	NA	 Või oli see sellepärast , et teda usaldas Foogt rohkem kui ülejäänud Vaatlejaid ? 
395	NA	 Või tahtis Zeman lihtsalt temaga koos olla ? 
396	NA	 Nad võtsid kaasa tugevad seiretablood , laserpüstolid , peaaegu kogu Vaatleja tavavarustuse , lisaks oli Zemanil mingi hermeetiline kohver , mille sisust polnud Estradal aimu . 
396	NA	 Mida me tegema hakkame , Bent ? 
396	NA	 Me lahendame need kuradima mõistatused ja Foogti hääl oli kõlanud isegi pisut vihaselt ! 
396	NA	 Ta ei olnud palju rääkinud , kuid Estrada sai aru , et Zeman on tegemas mingit suuremat eneseületust . 
396	NA	 Midagi on mehe sees murdunud või murdumas ja tema — Estrada — saab Foogtile siin toeks olla . 
396	NA	 Estrada ei teadnud , kuidas Foogt oli nende reisi registreerinud , ta teadis vaid , et teoksil on midagi erakorralist . 
396	NA	 Foogt ise on Vaatlejaga alla laskunud . 
397	NA	 Ja terve öö oli Estrada üksinda Foogti kabinet-kodus kuumalt linade vahel vähernud , oodanud lükandukse pea hääletut avanemist . 
397	NA	 Aga Zeman veetis öö Azarjani nõiaköögis ekraanide taga . 
397	NA	 Hommikul , enne teeleasumist oli ta suudlusega Estrada äratanud , talle klaasi piima voodisse toonud ( ikka seda juhtkonna oma , kõrge rasvasisaldusega , otse Terranoovalt ) ja mingite paberitega lehvitanud . 
398	NA	" "" Mul on nüüd mingi ülevaade , Linne , "" oli Foogt oma unisele armukesele öelnud . "
398	NA	" "" Sinu paigaldatud kaamerast oli palju abi . "
398	NA	 Kokku lahkus VI-B-st kakskümmned üks naist . 
398	NA	 Nad läksid päevaste vahedega ja alati kolmestes gruppides . 
398	NA	 Need , kelle sarvik lõhki rebis , olid esimesed tagasipöördujad . 
398	NA	 Jäi veel kaheksateist . 
398	NA	 Neist on kolm veel tulemata . 
398	NA	" Kui me kohe lähme , siis jõuame . "" "
399	NA	" "" Kuhu jõuame , Bent ? "" "
400	NA	" "" Tööle . "" "
401	NA	 Süstik peatus , nad astusid sellest välja , saatsid tagasi ( julgeolek ! ) ja hakkasid tööle . 
402	NA	" "" Nad veedavad mägedes , sest umbes seal usun neid käivat , kaks päeva . "
402	NA	 Kõik kolmesed grupid kulutavad meile veel tundmatusse punkti jõudmiseks ühe päevateekonna , tagasitulekuks samuti ühe ja veedavad kohapeal ühe päeva . 
402	NA	 Naasjad on kõik küllaltki räsitud , väsinud ja kulunud olemisega . 
402	NA	 Sinu kaamera poolt edastatavast pildist on näha , et nad on palju roninud ja seda meie koopanaised harilikult ei tee . 
402	NA	 Sinu kirjeldus sellest , kuidas sarvik neid hakkis , oli väga hea . 
402	NA	 Naised olid liiga vaevatud , et sarvikule vastu hakata . 
402	NA	 Liiga kurnatud ... 
402	NA	 Millest , on küsimus ? 
402	NA	" Mis ajab neid Mõõkkaljudele ronima ? "" "
403	NA	" "" Aga mis ajab sind nende jälgi otsima ? "" "
404	NA	 Estrada nägi , kuidas Zeman äkitselt seisatas , ümber pööras ja talle mõtlikult otsa vaatas . 
404	NA	 Kui ilusad silmad tal on ! 
405	NA	" "" Tead , võibolla on need minu lapsed . "
405	NA	" Tegelikult kõike , mida me teeme , teeme me oma järglaste huvides . "" "
406	NA	 Estrada astus Foogtile lähemale , võttis ta käest kinni . 
407	NA	" "" Sa tahad minuga lapsi saada ? "" "
408	NA	" "" Me kõik tahame ja peame lapsi saama . "
408	NA	 Inimese eksistentsil pole muud mõtet . 
408	NA	" Aga meie lastest me jõuame veel rääkida . "" "
409	NA	 Nad seisid keset Capaneusi ürgmetsa , mis alles hiljuti oli Estradale tundunud nii kõleda ja eemaletõukavana . 
409	NA	 Täna aga siras kohalik päike nii kirglikult eredalt , tüdruk nägi enda ümber ainult elu ja tärkamist , nägi looduse soovi olla ilus ja vajalik . 
409	NA	 Foogt seadis oma aparatuuri üles , uuris siis tähelepanelikult oma seiretablood , silmanurgast nägi Estrada , et mees keskendus tema poolt paigaldatud kaamera pildile . 
410	NA	" "" Kui minu arvestused on õiged , siis peaksid viimased naised siit varsti tagasi minema . "
410	NA	" Me oleme praegu nende eeldataval marsruudil . "" "
411	NA	" "" Mida me teeme ? "" "
411	NA	 Kui hea on seda kelleltki küsida ! 
411	NA	 Kui hea ja julgustav on , kui on keegi , kellelt alati küsida , mida teha ! 
412	NA	" "" Me ootame . "" "
413	NA	 Ja nad ootasid . 
413	NA	 Seiretablool vilksatasid aegajalt Capaneusi kummalise fauna esindajad . 
413	NA	 Vaatlejad olid end neutraliseerinud preventiivse odooriga , nad ei lõhnanud ja ükski grimoon ega dinolüüp nende vastu huvi ei tundnud . 
413	NA	 Ninasõõrmeisse paigaldatud imeväiksed filtrid vältisid odoori nende endi jaoks . 
413	NA	 Nad kükitasid suurte sõnajalgade varju , hoidudes neid vigastamast ja Estrada tundis end jälle nii äralõigatuna kõigest ümbritsevast . 
414	NA	" "" Linne ! "" "
415	NA	" "" Mis on , kallis ? "" "
416	NA	" "" Tegelikult me varitseme . "
416	NA	" Ma olen lõksu üles seadnud . "" "
417	NA	" "" Lõksu ? "" "
418	NA	" "" Jah . "
418	NA	" Öösel , kui sa magasid , kasutasin ma himaajasid ... kraanasid , noh . "" "
419	NA	" "" Neid dillonkraanasid ? "" "
420	NA	" "" Neidsamu . "" "
421	NA	 Dillonkraanadega ehitati Pesast kunagi Transpordipunkt , ehitati kanal süstikule läbi Mõõkkaljude graniidi . 
421	NA	 Need robotkraanad töötasid nagu ka Capaneusil mittekasutatavad ning rangelt keelatud heljukid reaktiivsetel õhkpatjadel . 
421	NA	 Tegelikult olid nad lendavad robotid , mis tassisid asju , kuid olid võimelised ka ehitus- ja korrastustöödeks . 
421	NA	 Millegipärast nimetas Zeman neid mõnikord himaajadeks ja Estradal polnud õrna aimugi , kust Foogt on sellise sõna võtnud . 
421	NA	 Aga mingi tabamatu külm ja kalk noot oli Zemani hääles . 
422	NA	" "" Kraanasid saab Pesast juhtida , neid saab ülesandele välja saata ... "" "
423	NA	" "" Aga ainult Foogti eriloal ? "" "
424	NA	" "" Ja ma andsin endale sellise loa . "
424	NA	 Olukord nõudis seda . 
424	NA	 On ilmnenud teatud asjaolud , mis tingisid sellise vajaduse . 
424	NA	" Ma lasin neil üht-teist ümber tõsta . "" "
425	NA	" "" Ümber tõsta ? ! "
425	NA	" Aga me ju ei tohi ... "" "
426	NA	" "" Mina tohin ! "
426	NA	" Me tegutseme praegu direktiivi Cap45B/87 alusel . "" "
427	NA	" "" Ma ei tea sellist dirtektiivi ! "" "
428	NA	 Loomulikult ta ei teadnud ! 
428	NA	 See on ju salajane dirktiiv . 
428	NA	 Sest räägib ta Foogti erivolitustest . 
428	NA	 Ja nüüd Foogt seletaski tüdrukule nende erivolituste sisu . 
428	NA	 Ettenägematute asjaolude puhul on Foogtil selle direktiivi alusel õigus tegutseda sisuliselt ilma igasuguste reegliteta . 
428	NA	 Ta võib teha kõike , kui ainult suudab leida kompromissi oma vande ja kohustustega mittesekkumist silmas pidades . 
428	NA	 Kuid loomulikult peab Foogt oma teotsemistest hiljem aru andma ja selle juures on tal tunnistajat vaja . 
428	NA	 Foogt võib erivolitustega tegutseda ainult siis , kui on keegi , kes tema sõnu hiljem kinnitab . 
428	NA	 Keegi , kes on temaga kaasas , näeb , kuuleb ja teab kõike , mida Foogt teeb . 
428	NA	 Keegi nagu Estrada , keda Zeman pea ainsana Pesast täielikult usaldab . 
429	NA	 Estrada ohkas ja silus käega läbi juuste . 
429	NA	" "" Ja mida me siis varitseme ? "" küsis ta siis õrnal häälel . "
430	NA	" "" Neid naisi , Linne . "
430	NA	" Nad tulevad varsti , aga ... "" "
431	NA	" "" Aga ? "" "
432	NA	" "" Kas sa usaldad mind ? "" "
432	NA	 Zeman tuli Estradale väga lähedale , võttis ta näo käte vahele ja peaaegu hingas oma küsimuse talle silmadesse . 
433	NA	" "" Ma armastan sind ! "" sositas Estrada vaevu huuli liigutades ja sulges silmad , sest tundis jälle seda magusat peapööritust , mis juba kaua oli teda vallanud , kui Zeman talle nii lähedale juhtus . "
434	NA	" "" Sa pead mind usaldama ka , "" ütles Zeman ja puudutas sõrmega õrnalt tüdruku ninaotsa . "
434	NA	" "" Ma olen korraldanud nii , et nad ei jõua kunagi koopasse tagasi . "" "
435	NA	 Estrada avas silmad . 
435	NA	 Ta ei mõistnud . 
436	NA	" "" See pole päriselt mittesekkumise rikkumine , sest ma arvan , et ... "" "
437	NA	 Aparatuur hakkas piiksuma ja seda oli kuulda ainult mehe ja naise kuulareis . 
437	NA	 Midagi , mille peale olid andurid seadistatud , hakkas lähedale jõudma . 
437	NA	 Zeman hüppas püsti ja viskus seiretabloo taha . 
438	NA	" "" Ruttu ! "" hüüatas ta samaaegselt häält alla surudes . "
438	NA	" "" Võta kõik seljast ära ! "" "
439	NA	" "" Bent ! "" "
440	NA	" "" Varustus , ma mõtlen . "
440	NA	" Kogu elektroonika , me peame ennast Pesast ära lõikama , midagi ei tohi lainepikkusi segada . "" "
441	NA	 Estrada toimis nii , nagu Zeman ütles . 
441	NA	 Hetke pärast oli ta lihtsalt üks inimene metsas . 
441	NA	 Inimene , kel polnud relvi , sidepidamisvahendeid ega hügieeniisolatsiooni . 
441	NA	 Millegipärast tundis ta ennast kuidagi loomulikumana , ühte sulavana ümbrusega , inimesena . 
441	NA	 Ja ta jõudis veel imestadagi , et kaitsetus ja reeglite rikkumine ei pannud teda hirmu tundma . 
441	NA	 Sest ta tõesti usaldas Bent vris Zemanit . 
442	NA	 Ka Foogt oli ennast varustusest vabastanud ja Estrada taipas , et tegelikult panid nad end Pesas riidesse ainult sellepärast , et mitte üleliigseid küsimusi tekitada . 
442	NA	 Ilma varustuseta ei tohi Capaneusile laskuda . 
442	NA	 Või siis tohib ainult nende Foogti erivolitustega . 
442	NA	 Bent mõtleb ka kõigele ... 
442	NA	 Aga miks see mõte teda häiris ? 
443	NA	" "" Me ei tohiks seda seljast võtta ja välja lülitada , "" sositas Estrada arglikult . "
444	NA	" "" Me viime läbi eksperimenti.Vaatlusandmete põhjal oli Foogtil tekkinud kahtlus , kas mitte liiga palju võõrast tehnikat ei mõjuta Capaneusi asukate käitumist , sest oma eelmisel retkel oli Vaatleja Estrada täheldanud sideseansside ajal sarviku seletamatut käitumist . "
444	NA	" Olid ju , eks ? "" "
445	NA	" "" Kui sa seda ütled , "" ta kõhkles pisut . "
446	NA	" "" Või tahad sa vaimudest raporteerida ? "" "
446	NA	 Zeman naeratas ja vaatas julgustavalt Estradale otsa . 
447	NA	" "" Eksperiment ? "" "
448	NA	" "" Erivolitusi kasutades laskusid Vaatleja Estrada ja Foogt alla , neutraliseerisid end preventiivse odooriga ja jälgisid lühikese ajavahemiku jooksul toimuvat . "
448	NA	 Igasuguseid kontakte välditi , niipalju kui see oli võimalik ... 
448	NA	" Ära muretse , ma formuleerin kogu asja neile parasjagu segasesse ja ametlikku keelde . "" "
449	NA	 Siis tulid hääled . 
449	NA	 Foogt kükitas endiselt oma seiretabloo ees , mida ta ainsana oma aparatuurist polnud välja lülitanud . 
449	NA	 Silmanurgast nägi Estrada tuttavaid pilte , tablool toimuv leidis aset üsna lähedal . 
449	NA	 Vilksatas mingi vari . 
449	NA	 Sarviku vari . 
450	NA	 Dhaka 45. 
450	NA	 Ardaman ; kell 11.08 
451	NA	 Azarjan seisis Operatiivkeskuse lävel ja tema näoilme näitas , et ta kas ei saanud või ei tahtnud aru saada , mida talle vastati . 
452	NA	" "" Foogt on Estradaga all , "" kordas Dhaka ükskõikselt . "
452	NA	" "" Läksid varavalges . "
452	NA	 Aga nad on ühenduse välja lülitanud . 
452	NA	" Noorpaari asi . "" "
453	NA	 Tal oli seda insenerile valus öelda , aga midagi polnud teha . 
453	NA	 Azarjan oli Estradasse armunud . 
453	NA	 Kõik Pesas teadsid seda . 
453	NA	 Aga vist Azarjan ainsana ei teadnud , et lootusetult armunud . 
454	NA	" "" Aga mul on Foogti vaja , "" pomises Azarjan meeleheites . "
454	NA	" "" Ta ei tohi sidet välja lülitada . "" "
455	NA	" "" Foogt tohib kõike . "" "
456	NA	" "" Miks ? "
456	NA	" Miks ta alla läks ? "" "
457	NA	" "" Ma ei tea . "" "
458	NA	 Azarjan astus üle läve , uks sulgus vaikse undamisega . 
458	NA	 Insener istus toolile ja sättis ennast ebamugavusi trotsides rätsepaistesse ja toetas pea käte vahele . 
459	NA	" "" Ta ütles mulle öösel , et täna me lahendame selle kuradi mõistatuse . "
459	NA	 Terve öö nõidusime peilingu kallal . 
459	NA	" Ja ta arvas , et nõidusime välja . "" "
460	NA	" "" Misasja ? "" "
461	NA	" "" Foogt lasi mul kogu seiresüsteemi suunata ühte punkti Capaneusi pinnal . "
461	NA	" Ütles isegi kellaajaliselt , millal sealt midagi tulema peaks . "" "
462	NA	" Dhaka päris teraselt : "" Kas see on see teie tundmatu transmissioon , mida püüate ? "" "
463	NA	" "" Mitte päris . "
463	NA	 Seda olematult laienpikkuselt vaheltlõigatud signaali olen ma nüüd ka hiljem kinni püüdnud , aga aru sellest pole saanud . 
463	NA	 Foogt aga lasi mul aparatuuri nii sättida , et see haaraks ühe Capaneusi pinnalt tuleva energiavoo . 
463	NA	 Ma ei tea täpselt , mida ta sealt jahib , aga sain aru , et on väga oluline . 
463	NA	 Nüüd on ta aga ise läinud ... 
463	NA	" Ja mul on teda vaja ! "" "
464	NA	" "" Juhtus midagi ? "" "
464	NA	 Dhaka pilgutas kiiresti oma musti ripsmeid ja seiras kaastundlikul pilgul inseneri . 
464	NA	 Oli näha , et ta polnud öö läbi maganud , mees oli kurnatud ja väsinud , lisaks oli ta ka viimse piirini ärevil ja pingul . 
464	NA	 Midagi pidi olema juhtunud . 
465	NA	" "" Miks sul teda vaja on ? "" "
466	NA	" "" Asteroidid ! "
466	NA	" Seal üleval juhtub midagi enneolematut ! "" "
467	NA	" "" Kosmoses ? "" "
468	NA	" "" Kus mujal ? "" "
