par_nr	head	sentence
199	NA	 See on Donald . 
199	NA	 Erik liigutas end unes , kompis käega mu põlvi . 
199	NA	 Haarasin ettevaatlikult käekoti , võtsin telefoni , lülitasin välja . 
199	NA	 See oli Donald . 
199	NA	 Ma vist jään juba sellest viinahaisust purju . 
199	NA	 Mis on öö . 
199	NA	 Lasin sõrmedega ettevaatlikult üle Eriku pea ja ta ei liigutanud ennast , milliseid unenägusid sa näed , keda sina kardad . 
199	NA	 Erik vaid nohises omaette . 
200	NA	 Selline joomine oli , et ma vist lõpuks roomasin veeresin kodu uksest sisse , niimoodi neljakäpukil ja muudkui vajusin kuhugi otsa ja see ema vist rääkis minuga midagi , aga ma ei saanud sittagi aru , kuid tema ikka podises , vittu küll , jumala purjus olin , kohe täiesti nagu . 
200	NA	 Madis lamas voodis ja kell näitas , et varsti on keskpäev . 
200	NA	 See ema vist tegi nädalavahetuse suurpuhastust või midagi sellist , ahjaa , ma vist oksendasin kuhugi midagi ja mitte vähe . 
200	NA	 Vittu küll , kuidas pea valutab , loodetavasti on isal õlut külmkapis , muidu ma küll suren nagu juut gaasikambris , vittu küll , täiesti õudne . 
200	NA	 Ei jaksanud ennast liigutada . 
200	NA	 Ja siis pani isa raadio üürgama ja Madis kuulis voodisse neid uudiseid , vittu küll , praegu on kuradi nädalavahetus , mis teil viga on , no ma ei saa aru . 
200	NA	 Ma vist peaksin kuskilt natuke raha muretsema , et neid kuradi võlgu nagu natuke tagasi maksta või midagi sellist . 
200	NA	 Pange see kuradi raadio kinni , vittu küll , nüüd oli Madisele mingi vastik maitse suhu roninud . 
201	NA	 “ Miks sa ei helistanud . ” “ Mul oli igasugu tegevust . ” Madis sulges silmad ja kadus parematele jahimaadele . 
202	NA	 Laupäeva lõuna ajal nägi Paul teda uuesti . 
202	NA	 Nüüd oli tüdruk üksi ja ta paistis kuidagi väsinud ja mõtlik olevat , väike ärevus tungis mäslevasse punkhinge . 
202	NA	 Paul kõndis talle natuke järele , siis peatas ta . “ Tere . ” Tüdruk ei ütelnud midagi , vaatas korraks otsa ja kõndis edasi . “ Oota . ” Tüdruk ei vaatanud ta poole . 
202	NA	 Keskealised mehed jõid bussipeatuses õlut . “ Oota , palun . 
202	NA	 Mina olen Paul . ” Tüdruk kõndis edasi . 
202	NA	 Paul ei jätnud oma jonni . “ Oota . 
202	NA	 Mis sinu nimi on . 
202	NA	 Ma nägin sind eile õhtul , sa olid seal supermarketi juures ja siis läksid mingisse autosse , eks. ” “ Mida sa tahad . ” “ No natuke tuttavaks saada . ” “ Kas sa ei ole ikka veel aru saanud , et sa käid mulle närvidele . 
202	NA	 Mingi haige oled või , et mind muudkui jälitad . ” Sellepeale ei osanud punkar Paul kohe vastatagi . 
202	NA	 Ta vaatas maha . 
202	NA	 Õnneks ei liikunud tüdruk kuhugi . 
202	NA	 Jalutav koer vedas jalutajat edasi . 
202	NA	 Tuvi peatus kõnniteel . “ No mis sul viga on . 
202	NA	 Mis su nimi on . ” “ Mis see sulle annab . ” “ Ma ei tea . 
202	NA	 Ega see sult tükki küljest ei võta , kui sa oma nime ütled , ole normaalne . ” “ Mis see sulle annab . ” “ Miks sa nii kuri oled . ” “ Hea küll , ära käi mulle rohkem närvidele , sa oled täielik tita nagu , Evelin , noh , oled väga rahul , lähed nüüd nurga taha pihku peksma või . ” Paul ei oodanud , et teda niimoodi sõimatakse . 
202	NA	 Mehed vaatasid neile järgi ja naersid . “ Mis sinul viga on . ” “ Mis see sinu asi on . 
202	NA	 Okei , ma lähen nüüd minema , eks , ja sina kõnnid hoopis teise suunda ja sa ei hakka mind jälitama , eks , jäta mind rahule . ” Paul noogutas , astus sammu tagasi . 
202	NA	 Evelin kõndiski minema . 
202	NA	 Paul vaatas talle järgi . 
202	NA	 Natuke väsinud ja tõrges kõnnak . 
202	NA	 Tüdruk kadus nurga taha . 
202	NA	 Mida ma tegin , küsis ta endalt , mis mul viga on . 
202	NA	 Õngitses suitsu välja ja pani selle põlema . 
202	NA	 No future , let's destroy . 
203	NA	 Aga Evelin on omamoodi sama ilus nagu Carmen . 
203	NA	 Ja see ei andnud Paulile öösel rahu . 
204	NA	 õnnetud lojused voolasid tänavalt alla ja ma lihtsalt seisin ootasin seisin mina olen valgusfoor palun pöörake paremale palun seiske natuke enam ei lähe kaua palun pöörake vasakule meil on selline kord ja ilma korrata ei jõua kuhugile niiet palun järgige mu nõuandeid kui teile elu on kallis voolake edasi voolake edasi mina mina olen see see jah see valgusfoor jah just see valgusfoor mina olen roheline ja kollane ja punane tuli seisa oota mine mine jah kallis kui ei ole korda siis ei ole midagi kuidas läheb tänan küsimast minul läheb hästi hästi hästi jah hästi hästi hästi the sky is red and i can't stop running põrguväed on valla mina olen vaba i'll shake off your flesh 
205	NA	 need kondid klõbisevad keset tänavat tere tere oled hommikune valgus tsip tsip tsip this is bad trip loojad loojad võistlevad andekuses tsip tsip tsip this is bad trip tuli mingi erik ja ütles et tal on probleem selline suur probleem aita mind palun vootele no mida ma öelda oskan ütlesin vaid et kuule mees mind ei huvita this is eric's trip see minusse ei puutu mul oli selline tunne et ta ei saanud midagi aru võtsime natuke viina tema maksis ja siis ta oksendas ja mul oli totaalselt totaalselt igav ütlesin et oh sa megasuperhüper ma pean minema viu viu viu ja ma läksingi ei meeldi mulle sellised mehed nemad segavad jah nad segavad sind ma ei taha seda mul ei ole aega minu masin on varsti läbi ja ma ei taha segajat millest ma üldse räägin kas ma olen vaba 
206	NA	 Kogemata sattusid Liana ja Toivo korteris kokku . 
206	NA	 Hetkeks kangestuti . 
206	NA	 Liana noogutas külmalt ning läks oma tuppa , Toivo kadus kööki süüa valmistama . 
206	NA	 Minutid möödusid , aga Liana ei ilmunud ikka toast välja . 
206	NA	 Toivo kõndis köögis edasi ja tagasi . 
206	NA	 Vahel on päevi , kus lihtsalt peab toimuma kõik negatiivne . 
206	NA	 Liana oli ikka tuppa sulgunud . 
206	NA	 Kas ta kardab mind , kas ma olen ta silmis tõesti nii alla langenud , et asi veel täielikum oleks , oli Toivo unustanud sibulad pannile kõrbema , vandudes tõmbas ta panni ära ja keeras moodsa elektripliidi kinni . 
206	NA	 Kõik need on nüüd kõrbenud ja uuesti hakka laua kohal pisaraid valama . 
206	NA	 Ja miks tema ei võinud mind aidata , mis printsessiks ta end peab . 
207	NA	 “ Tule siia . ” “ Mida sa tahad . ” “ Kus sa öösel jälle olid . ” “ Mis see sinu asi on . ” “ Miks see siis minu asi ei ole , teatavasti on sul minu ees teatavaid kohustusi . ” “ Ja nendeks on . ” “ Seda sa tead isegi . ” “ Nägid , ma panin veearve külmkapi peale , selle peab ülehomseks ära maksma . ” “ Ja just mina pean ära maksma , kurat , mina olen ainuke , kes selles perekonnas teenib raha , kõike peab ikka ise tegema , et sind keegi aitaks , seda ei juhtu kunagi . ” “ Kellelt sa siis raha saad . ” “ Kurat , jää vait , ära käi mulle koguaeg närvidele . ” 
208	NA	 See on selge , et ma pean siit hullumajast lahkuma . 
208	NA	 Liana võttis käekoti ja jättis vihase Toivo omaette porisema . 
208	NA	 Värsket õhku ja olen taas endine . 
208	NA	 Värsket õhku . 
209	NA	 Vahel ma mõtlen , et mu isaks oleks võinud Adolf olla . 
209	NA	 Mitte see kuradi kontorirotist hädapätakas . 
209	NA	 Või ma oleksin võinud elada siis , kui Adolf elas . 
209	NA	 Oleksin ka neid juute ja homosid ja neegreid ahju ajanud , ma oleksin ise selle kuradi ahjusuu kinni põrutanud . 
209	NA	 Ja pärast tuhka välja rookinud , uue tuha jaoks . 
209	NA	 Järgmised juudid , homod ja neegrid . 
209	NA	 Ja muud sellised . 
209	NA	 Kaubarongidega tuleb tuhka ära vedada . 
209	NA	 Adolf oleks küll minuga rahule jäänud . 
209	NA	 Oleksime koos võidelnud aaria rassi eest , kes teab , võibolla siis oleksime nendele raiskadele tule alla teinud . 
209	NA	 Kui praegu oleks see aeg , siis ma küll teaks , mida teha , et meie siis võitnuks . 
209	NA	 Kahju , et siis seda tuumapommi valmis ei saanud , oleks ikka väga kõva tulemuse välja pigistanud . 
209	NA	 Kindlasti on minus natuke aaria verd , ma arvan küll . 
209	NA	 Jah , päris kindlasti . 
209	NA	 Ma olen puhas inimene . 
209	NA	 Madis jätkas noolte loopimist märklauda , kuhu oli kinnitanud mingi rõveda neegri pildi . 
209	NA	 Kõige paremad tabamused olid silma või kõrri , need peaks päris valusad olema . 
209	NA	 Vittu kui igav . 
210	NA	 Ole tugev ja palveta jumala poole ja ära unusta tablette eks ära unusta tablette , kui sul on raske siis tule tagasi meie juures saad sa end kindlana tunda , ära unusta tablette korralikult võtmast muidu sa hakkama ei saa . 
210	NA	 Jaa jaa jaa muidugi muidugi tabletid muidugi tabletid on head jajah muidugi kui on raske siis tulen tagasi muidugi muidugi jumal aitab muidugi muidugi jumal on hea jumal aitab muidugi muidugi tabletid teevad mulle head tabletid aitavad muidugi muidugi , astusin väravast välja see on sügis . 
210	NA	 Värske külm õhk natuke vihmane . 
210	NA	 Tabletid raha kõik on olemas ma saan hakkama muidugi muidugi jumal aitab mind tabletid on hea on hea jumal on hea jumal aitab mind muidugi muidugi värske külm õhk natuke vihmane . 
211	NA	 Hommikul teatati Toivole , et keskpäeval lastakse Jaan haiglast välja . 
211	NA	 Nii kiiresti , üllatus Toivo , ma arvasin , et ta on elu lõpuni sinna aheldatud . 
211	NA	 Ta on ilmutanud paranemise märke ja otsustati proovida , kuidas ta hakkama saaks , vastati Toivole . 
211	NA	 Keskpäevaks ilmus Toivo haigla ette . 
211	NA	 Vaatas autoaknast , kuidas Jaan arglikult maailma tagasi astus . 
211	NA	 Welcome to the desert of the real . 
211	NA	 Sõitis talle järele , kuid korraga helistati töölt ja pidi ära sõitma . 
211	NA	 Jaan jätkas oma eksirännakut saatjata . 
212	NA	 Mingi selline nõmedalt rõve plika kõndis mu poole ja jäi seisma ja küsis suitsu ja ma mõtlesin , et vittu küll , mida värki , sellised rõvedused mind küll ei huvita ja ma ütlesin , et mul nagu ei ole suitsu ja see plika tegi sellist rõvedat nägu , ma vaatasin , et ta on täiesti sea nägu , tee mis tahad , ja see kõndis minema ja mul oli jumala pohhui , sellisega ei magaks isegi siis , kui tal kott peas oleks , Madis sülitas maha ja kõndis edasi , kuhugi on need kuradi tuttavad täiesti kadunud , kohe täitsa imelik nagu . 
213	NA	 Mõtlesin , et ma näen viirastusi või midagi sellist . 
213	NA	 Astusin mingist suvalisest sisehoovist läbi ja seal oli üldiselt pime ja märg ja nõme , ainult õue teises otsas oli tänavalamp või selline , ja sinnapoole suundusingi , sest sealt sai vist minema . 
213	NA	 Ja siis vaatan , et püha müristus ja tuhat põrgut , väike ahv istub majaseinal , kohe järgmisel hetkel tundus , et seal on hoopis selline inimlaps . 
213	NA	 Panin siis pilgule uue teravuse peale , pagan võtaks , kass hoopis , nui neljaks kasvõi , kass mis kass , varjud võivad inimese ära petta . 
213	NA	 Erikul tuli kohe kergendus peale , see esimene laine ei toonudki õnneks mingeid hullemaid nägemusi kaasa ja kõik on ikka korras . 
213	NA	 Eks ta siis komberdas edasi ja püüdis elust hammastega kinni hoida . 
214	NA	 Ainult et hambad vajasid väikest turgutamist . 
215	NA	 see oli see oli jaan jah see oli jaan või mis iganes temast järgi oli jäänudki imelikud juhtumised siin linna peal ajad lähevad üha imelikumaks midagi on toimumas põrguväravad on valla kõik pühitakse eest astusin talle ligi aga ta ei tundnud mind kõik minevik on vist ta peast pühitud aga aga ta pidi ju elu lõpuni seal mädanema jaan jaan kas sa tõesti ei mäleta mind jaan jaan kas sa tõesti ei mäleta et ma su päästsin jaan jaan mis nad sinuga teinud on kas sul on valus tahtsin teda peatada kuid ta tühjad tühjad tühjad silmad ehmatasid mind eemale ja ta läks ja läks ja läks kadus nurga taha ei vaadanud kuhugi ei mäletanud midagi midagi kahtlast on toimumas toivo on kuskil ligidal keegi ei pääse kuhugi 
216	NA	 Donald ei mõistnud enam , mida Liana temast veel tahtis . 
216	NA	 Kutsus teda teatrisse ja restoranidesse , aga Liana ei vastanud kõnedelegi . 
216	NA	 Donald ei saanud aru , mis naiselik kapriis siis seekord valitseb või milles asi on , oli naisel eriti äge menstruatsioon ja nüüd tahab üksi olla . 
216	NA	 Kui aus olla , siis see segadus mõjus Donaldi töö tulemuslikkusele natuke ruineerivalt ja see tegi närviliseks . 
216	NA	 Aga ei , naine pidi ikka tempe tegema , ega tema ju ei hooli , kui teise inimese elu keerab jäädavalt rentslisse . 
216	NA	 Donald lõpetas hommikuse korrastamise . 
217	NA	 Liana tahtis juba telefoni vastu seina puruks virutada , kuid viimaks helistas peale Donaldi keegi muu . 
217	NA	 Mida ma nüüd kuulama pean . 
218	NA	 “ Ütle , millega sa rahul ei ole , et sa niimoodi teed . ” “ Noh , ma ei tea , kas sa siis ise aru ei saa . ” “ Millest ma peaksin aru saama . 
218	NA	 Ma võin kõik need asjad muretseda , mis sul vaid vaja peaks minema , kas sa siis ei ole veel aru saanud , et põhimõtteliselt oled sa elu lõpuni kindlustatud , vähemalt niikaua , kuni ei tee mingeid totaalseid rumalusi . ” “ Aga isa , elu ei ole ainult asjades . ” “ Ja milles ta siis on , et sina saaksid igasuguste meestega ringi karata , kui vaid isu tekib . 
218	NA	 Liana , sul on ikkagi oma mees ja ta armastab sind . ” “ Miks sa minule neid rumalusi räägid . ” “ Mis rumalusi . ” “ Noh , seda ühte ja sama juttu . 
218	NA	 Ma olen juba kahekümne kuue aastane ja ikka olen sulle nagu mingi mänguasi , mida soovi korral edasi ja tagasi liigutada . ” “ Ma ei taha muud kui sul oleks hea elu . ” “ See on sinu hea elu , mitte minu . ” “ Ära hakka mind tüütama selle vana jutuga . 
218	NA	 Kui sa nii tark oled , miks sa siis ei ela oma elu . ” “ Hea küll , ma ei viitsi vaielda . ” 
219	NA	 Isa on imelik . 
219	NA	 Liana vaatas , kuidas tänavale paigutati uusi reklaame . 
219	NA	 Ja see Erik on ka imelik . 
219	NA	 Aga heas mõttes imelik . 
219	NA	 Mida tema mõtleb . 
219	NA	 Tuul puhus seeliku alla , külm . 
220	NA	 Mida mina mõtlen . 
221	NA	 “ No totaalselt täiesti umbes nagu . ” “ Normaalne . ” 
222	NA	 “ Kas see on seesama nõmedik , kes sind rahule ei jäta . ” “ On jah see värdjas . ” “ Täielik idioot . ” “ Totaalne . ” “ Täielik , täielik idioot . ” “ Täiesti . ” “ Närvidele käivad sellised . ” “ Totaalselt . ” “ Miks sa ei lase talle peksa anda , mingil paksul või sellisel , Veiko ja teised . ” “ Ma ei tea , peaks vist jah . ” “ Selline pervert , ma ei saa aru , sellised tuleks vanglasse saata . ” “ Jah , nojah , midagi jah . ” “ Kas sa ka ei käinud täna koolis . ” “ Ei . 
222	NA	 Ei viitsinud . 
222	NA	 Mingi kontrolltöö oli vist . ” “ Täielik piinamine . ” “ No täiesti jah . ” “ Mul on totaalne siiber . ” “ Mul ka . ” “ Õudne , nii siibrisse käib kõik . 
222	NA	 Natuke juua tahaks , närv on jumala püsti . ” “ Ma vist täna ei taha . ” “ No mis sinul siis viga on . ” “ Täna ei viitsi , mul on vaja midagi teha . ” “ Aga mulle on juba hommikust saati helistatud ja ma vist küll lähen , tullakse autoga järgi ka . ” “ Mina ei viitsi . ” “ Sa oled noor ainult üks kord või no midagi sellist . ” “ Mis see siia puutub . ” “ Ma ei tea , öeldakse niimoodi . 
222	NA	 Öeldakse ju . ” “ Ma ei tea , vist jah , vahet ei ole . ” “ Mul on kohe selline tõeline suhe tekkinud , naljakas , üle pika aja . 
222	NA	 Marko on selline päris tore , vähemalt ma arvan nii . 
222	NA	 Me oleme Markoga juba päris mitmel peol koos olnud , ja Marko muudkui helistab mulle , kutsub muudkui jooma ja nii edasi ja neil on auto ka . ” “ Marko on normaalne . ” “ Marko on täiesti normaalne , totaalselt normaalne . 
222	NA	 Helistame Markole ja otsime selle sinu jobu üles ja Marko peksab tal ajud totaalselt sodiks , mis sa arvad , ah . ” “ Ma ei tea , mul ei ole aega , mul on vaja natuke asju ajada , ma pean vist koju minema . ” “ Aga helista mulle , ma ei tea , õhtul näiteks , eks. ” “ Küll ma helistan . 
222	NA	 Aga täna ma ei tule kuhugi . ” “ Okei , okei , süüdista iseennast , sa ei ole veel nii vana . 
222	NA	 Ma helistan sulle ise õhtul , eks. ” 
223	NA	 Õhtul ei helistanud Evelinile keegi . 
223	NA	 Vanemad jõudsid enne kümmet koju ja proovisid teda õhtust sööma sundida . 
223	NA	 Evelin püüdis neile selgeks teha , et peale kaheksat ei sööda kunagi , ta ei taha oma tervist rikkuda . 
223	NA	 Telekast polnud midagi vaadata . 
224	NA	 “ Palju õnne sünnipäevaks . ” “ See on alles homme . ” “ Noh , vabandust . ” Toivo vaatas , kuidas Liana väljaminekuks riideid otsis . 
224	NA	 Ilus naine tegelikult . 
224	NA	 Korraks kohtusid pilgud . 
224	NA	 Ei , ei midagi erilist . 
224	NA	 Mida täna veel teha . 
224	NA	 Natuke igav . 
224	NA	 Kuhu ta läheb . 
224	NA	 Ükskõik . 
224	NA	 Loll naine . 
224	NA	 Mõttetu inimene . 
224	NA	 Ta on nii igav . 
224	NA	 Ükskõik . 
224	NA	 See ei tähenda mulle midagi . 
224	NA	 Puhkan niisama . 
225	NA	 Vaatasin neid inimesi enda ümber üksteisele esinemas ja mul hakkas igav . 
225	NA	 Tahan hoopis magama minna , mõtles Liana ja nägi korraga Donaldit klubisse sisenemas . 
225	NA	 Liana muutus põgenevaks jahiloomaks ja kadus korterisse magama . 
225	NA	 Vist millalgi seisis Toivo ukse peal , kuid naine oli unedesse kadunud . 
225	NA	 Toivo läks tagasi oma asemele ja püüdis end magama sundida . 
225	NA	 Vahel harva , tõesti harva , tunnen ma puudust Liana järele . 
225	NA	 Aga sellest saab üle . 
226	NA	 Magamata öö ja hommikune tõrjuv Liana ärritasid Toivot ning ta otsustas Jaani korraks üles otsida ja siis otsustada , mida temaga peale hakata . 
226	NA	 Lõunaks olid jäljed üles leitud , Toivo proovis mehega rääkida , kuid midagi mõistlikku selle suust ei kuulnud . 
226	NA	 Ta oli kõigest närviimpulsside poolt liigutatav korjus . 
226	NA	 Ta ei ole sellist elu väärt , mõtles Toivo , ning lasi Jaanil edasi koperdada . 
226	NA	 Loodetavasti antakse sulle kõik patud andeks . 
226	NA	 Jumala nimi olgu kiidetud . 
227	NA	 muidugi keerles nüüd see sitapea jaani ümber kas oleks võinud üldse midagi muud oodatagi 
228	NA	 Järgmine üllatav otsus oli jalutama minna . 
228	NA	 Eks siis Erik ajas ohates riided selga ja lahkus korterist . 
228	NA	 Hommik , kell üheksa . 
228	NA	 Oma üllatuseks avastas ta , et hommikune maailm sisaldab elu . 
228	NA	 Ikka veel . 
228	NA	 Midagi pole muutunud , kõik on seesama . 
228	NA	 Kõik tõttasid kuhugi ja sügise külm päike lajatas Erikule näkku . 
228	NA	 I have a dream of a better sun . 
228	NA	 Ei , see oli kuidagi teistmoodi . 
228	NA	 I have a dream of a better nation . 
228	NA	 Daydream nation . 
228	NA	 Ahah , või nii , sa vaata vaid , tõesti üllatav . 
228	NA	 Mu veri pulbitseb , kallis , ma olen keevavereline mees . 
228	NA	 Pöörane mehike . 
228	NA	 Vahva vunts ja muidu mõnus . 
228	NA	 Erik vaatas päikesesse . 
228	NA	 I have a dream of a lost nation . 
228	NA	 Ei , vale , kõik läks valesti . 
228	NA	 I have a dream of a better nation . 
228	NA	 A daydream nation . 
229	NA	 Astusin kõrtsi ja see oli päris tühi , ainult paar välismaalast ja paar ilusat tüdrukut ja ma istusin ja toodi õlu ja nagu igav nagu ja võtsin ajalehe , ooo , nii värske ajaleht ja nii palju toredaid uudiseid maailmast ja mingi mees magas ja mida mida mida , tal oli nagu koer seal tooli all , jebedijee , Erik jäi koera vaatama ja koer pööras näo ta poole , see oli hoopis kutsikas ja kutsikas hakkas saba liputama , selline imelik kutsikaaju , kes tahab kõigiga sõbrustada ja kutsikas jooksiski Eriku juurde ja Erik lasi käe ta nina ette , kutsikas nuusutas ja tõmbas siis keelega üle sõrmede . 
229	NA	 Erik naeratas . 
229	NA	 Armas see väike krantsike , no mis sa ütled . 
229	NA	 Kutsu hüppas toolile ja Erik silitas teda , saba liputas koera . 
229	NA	 Hei hei hei , kuidas läheb , pisipoiss , kas sa oled pahandust ka teinud . 
229	NA	 Noh , pole häda , kutsikatele on kõik lubatud , ekstaole , kutsikatele on kõik lubatud . 
229	NA	 Kutsu hüppas toolilt maha ja vänderdas tüdrukute juurde , need hakkasid teda lausa kallistama . 
229	NA	 Väärt elajas , mis sa muud oskad öelda . 
230	NA	 Raha oli peaaegu otsas , aga õnnestus veel ühe joogi välja venitada . 
231	NA	 Ma olen arg inimene . 
231	NA	 Turvamehed tulid ja krabasid magajast kinni ja proovisid teda äratada . 
231	NA	 Surusid jõuga sõrmed kaenlasse ja saatsid kõrtsu sadistliku naeratuse . 
231	NA	 Kuradi idioodid , kellele nad esinevad . 
231	NA	 Erik jäi neid vihaselt jõllitama . 
231	NA	 Turvamehed irvitasid vastu ja väänasid meest edasi . 
231	NA	 Ma olen arg inimene . 
231	NA	 Kutsikas vänderdas ikka tüdrukute juures . 
231	NA	 Värdjakari on välja lastud . 
231	NA	 Nad rebisid mehe toolilt püsti ja vedasid uksest välja . 
231	NA	 Üks tüdruk haaras kutsika sülle ja jooksis järgi . 
231	NA	 Ma olen nõme inimene . 
231	NA	 Erik vajus tusaselt tooli . 
231	NA	 Confusion is next . 
231	NA	 Tüdruk tuli tagasi ja koer oli tal ikka süles . 
232	NA	 Ta silmad . 
232	NA	 Ta silmad on kõige ilusamad . 
232	NA	 Kuidas ta vaatab mind . 
232	NA	 Või kedagi teist . 
232	NA	 Või kuhugi eemale . 
232	NA	 Silmad ja näoilme . 
232	NA	 Nad ei ole uhked , kuid hoopis elavad . 
232	NA	 Natuke nukrad . 
232	NA	 Natuke rõõmsad . 
232	NA	 Natuke uurivad . 
232	NA	 Nende silmadega võib ta sinust läbi vaadata või üldse mitte märgata . 
232	NA	 Tunnen ta järele puudust . 
232	NA	 Mina ei suuda teda üles leida , tema tuleb ainult siis , kui tema tahab . 
232	NA	 Ja ma pean valmis olema . 
232	NA	 Ja ma pean valmis olema , et võibolla teda enam ei tulegi . 
232	NA	 Erik rüüpas uuesti . 
232	NA	 Võibolla on see magic läbi . 
232	NA	 Ja ma pean kõigest mälestustega elama . 
232	NA	 Kannatama nende mälestuste pärast . 
232	NA	 Siis sa mõtled , kas seda kõike üldse vaja oligi . 
232	NA	 Kas ma üldse olingi kõike seda väärt , milleks mind hetkeks õnnistati . 
232	NA	 Kus on algus ja kus on ots . 
232	NA	 Erik rüüpas ja süütas siis suitsu . 
232	NA	 Need silmad . 
232	NA	 Kui ma vaid oskaks , siis jääksin vaid temaga . 
232	NA	 Kui ma vaid oskaks . 
232	NA	 Võibolla tema aitaks pääseda nendest unenägudest ja nägemustest . 
232	NA	 Kuidas ma purustan enda kätega oma pea . 
232	NA	 On see unes või ilmsi . 
232	NA	 Kuidas tunnen hetkelist rahulolu , kui kuul purustab pea . 
232	NA	 Miks ma pean kõike seda nägema . 
232	NA	 Ma tahan , et need silmad vaataksid minusse ja puhastaks kõigest sellest saastast . 
232	NA	 Mida ma loodan . 
232	NA	 Erik kustutas suitsu , värskendas kurku viinaseguga . 
232	NA	 Peaasi on niimoodi mitte pimedaks jääda . 
232	NA	 Vahel ma lihtsalt joon niipalju , et vaid pääseda nendest nägemustest , lihtsalt vajuda püdelasse varju . 
232	NA	 Ja et siis ärgata ja uuesti selle varju kaitset otsima hakata . 
232	NA	 Külm , Erik lonksas , sooja ei saanud . 
232	NA	 Millal sa tuled . 
232	NA	 Millal su silmad puudutavad mind ja ma ei pea kartma neid nägemusi , kas sa pühid mind puhtaks . 
232	NA	 Kas sa puudutad mind . 
232	NA	 Kas sa puudutaksid mind . 
232	NA	 Ja mina saaks kuidagi sind aidata . 
232	NA	 Kas sa tuled . 
232	NA	 Kas sa tahad mind puutuda . 
232	NA	 Erik jõi ja vaatas siis hirmunult , et pool pudelit ainult alles . 
232	NA	 Ja pole veel korralikult purjuski . 
232	NA	 Perses värk . 
233	NA	 Ei jõudnudki vannituppa , enne purskus okse põrandale . 
233	NA	 Erik vaatas seda rõvedat loiku . 
233	NA	 See polnud küll eriti vajalik , ausalt . 
234	NA	 Läksin sellele mingile vanaema päris mitmendale juubelile ja no ma ei tea , miks ma küll seda tegin ja end sinna kohale vedasin , mida need vanemad küll kurat võtaks mõtlesid , ma ei tea , tahtsid mind nagu vist enneaegsesse surma saata või kuidas , täiesti segased peast , nad ei saa enam mitte millestki aru . 
234	NA	 Madis lihtsalt istus lookas pidulaua ääres ja tõstis klaasi ja sõi ja need inimesed kukkusid korraga laulma oma seltskonnalaule või mida iganes , igatahes , ta silmades oli vaid puhas õudus . 
234	NA	 Nüüd ma saan aru , miks vanaisa end surnuks jõi , sellist asja ei kannataks vist poolt päevagi välja . 
234	NA	 Olen tõeline okse , kui ma kasvõi suud paotan . 
234	NA	 Kõht sai vähemalt täis , mõnus . 
235	NA	 Vahel on nii igav , et ma võtaksin lihtsalt ühe väikse ja korraliku automaadi ja läheks tänavale ja korraldaks ühe tõeliselt korraliku veresauna . 
235	NA	 Laseks igasugu värdjaid maha nagu loogu . 
235	NA	 Ja vittu küll , kui keegi mind takistada püüaks , teeks tast ühe korraliku sõelapõhja . 
235	NA	 Madis sülitas aknast välja , vaatas , kuidas tatt langes ja kukkus vaikse lärtsakaga asfaldile . 
235	NA	 Viskas suitsu järele , tõmbas akna kinni . 
235	NA	 Köögis oli segamini suitsuhais ja värske õhk , see meeldib mulle , on nagu värskendav selline . 
235	NA	 Kurat , telekast pole midagi vaadata , ei viitsi mingit mõttetut saasta uuesti ja uuesti vaadata . 
235	NA	 Siis ma olengi selline ajupesu valmis , teen kõike seda , mida need värdjad tahavad . 
235	NA	 Terve elu on nagu üks pikk võitlus , sa nagu ei saagi niisama olla , siis oledki sellele kõigele kuradile kaotanud . 
235	NA	 Mida homme teha . 
235	NA	 Juua tahaks , pole enam ammu kõvasti pidu pannud , vanemad peavad mind vist juba imelikuks . 
235	NA	 Samasuguseks ajupesuks nagu nemad on . 
235	NA	 Ükskõik tegelt . 
236	NA	 Mingi selline kuradi ajudeta mees haaras korraga mult käisest kinni ja kus siis kukkus alles lõugama , et ikka jumala nimi olgu kiidetud ja jumala nimi olgu kiidetud ja jumal on hea ja mida kõike veel , Madis tõstis selle käe enda pealt ära , ikka täiega imelik , kuidas sellistel lubatakse tänavatel kõndida , ma ei tea , visake mingile üksikule saarele , las kisavad ja surevad seal . 
236	NA	 Jumal küll . 
