par_nr	head	sentence
387	NA	 Paul hüppas laualt põrandale , otsis korraks seinalt tuge , vaatas õudusega naise poole ja siis põgenes toast . 
387	NA	 Väike rumal poiss , ära pista nägu sinna , kuhu sul asja ei ole . 
388	NA	 “ Lükkame kehad kokku . ” 
389	NA	 Sõrmed liikusid üle su nibude , rinnast alla kõhule , häbemekarvadeni , üle puusa su tuharateni , kõikjal kuskil voolavad veresooned , hingavad minuga ühes rütmis . 
390	NA	 “ Kas sa armastad mind . ” “ Ma ei tea . ” “ Ma ka ei tea . ” “ Imelik . ” “ Ei ole . 
390	NA	 Mida sa siis ootad . ” “ Ma ei tea . ” “ Mitte miskit erilist ei ole võimalik juhtuda . ” “ Ma tean . ” “ Inimlik lähedus , mis see veel on . ” “ Mingi klišee . ” “ Kõik on klišee . ” “ Ma vajan sind ikkagi . ” “ Kas sa oled kindel . ” “ Jah . 
390	NA	 Jah . ” “ Sa oled liiga hea mu vastu . ” “ Ei , ei ole . ” “ Sa oled hea inimene . ” “ Ei , ei ole , sina ei tea mitte midagi . ” “ Mis siis . 
390	NA	 Kui ma üldse kedagi usaldan , siis võibolla ainult natuke sind . ” “ Ma kasutan sind julmalt ära . ” “ Ära vasta palun sellele kõnele . ” “ Hea küll . ” “ Kes see helistas . ” “ Vahet ei ole . 
390	NA	 See ei ole tähtis . ” “ Ja mis on tähtis . ” “ Ma tõesti ei tea . 
390	NA	 Miks sa küsid nii totraid küsimusi . ” “ Mida me homme teeme . ” “ Mida sa tahad . ” “ Ma ei tea . ” “ Mida sa ütled , seda me teeme . ” “ Lähme loomaaeda . ” “ Lähme , okei . ” “ Äkki sajab vihma . ” “ Kas sina kardad vihma . ” “ Ei . 
390	NA	 Aga need loomad on peidus . ” “ Kõik ei ole . ” “ Jah , kõik küll ei ole . ” “ Mida sa nüüd tahad . ” “ Kalla mulle juua . ” “ Sa jood liiga palju . ” “ Küll see üle läheb . ” “ Tõesti , ära palun joo niipalju koguaeg . ” “ Ma ei tea , ma proovin võibolla . ” “ Kas sa lubad . ” “ Ma ei julge . ” “ Muidu ma sinuga loomaaeda ei tule . ” “ Miks sa mind nüüd kiusad . ” “ Ma ei kiusa , ma lihtsalt tahan , et kõik lõppeks hästi . ” “ Mis siin veel hästi lõppema peaks . ” “ Ma ei tea . ” “ Täiesti ükskõik tegelikult . ” “ Ükskõik . ” 
391	NA	 “ Sul on selline värske seebi lõhn . ” “ Kas see meeldib sulle . ” “ Jah . 
391	NA	 Ma ise valisin selle ja ostsin sulle . 
391	NA	 Igasuguse seebiga ei saa pesemas käia . ” “ Ma ei tea , mul on vist küll täiesti ükskõik . ” “ Sina oled mees , tüüpiline mees , sa ei saa sellistest asjadest aru , sinu arusaam hügieenist piirdub vaid hommikuse näopesu ja siis hammaste pesemisega , millestki muust sa küll mitte midagi ei tea . 
391	NA	 Ära hakka minuga vaidlema , ma olen väsinud . ” “ Aga ma pesen seebiga käsi ka . ” “ Seda ma küll ei usu . ” “ Iga päev pesen . ” “ Enne söömist ka . ” “ Noh , jah , põhimõtteliselt küll , see on ju normaalne . ” “ Mida sa seletad , pane end lõpuks riidesse , siin korteris on nii külm . ” “ Siin on alati külm . ” “ Kuhugi mujale ei taha kolida . ” “ Tahta võib , aga mis siis , ega see midagi ei muuda . ” “ Õudne peavalu . ” “ Sul ka . ” 
392	NA	 “ Kes seal peegli taga on . ” “ Ma ei tea . ” “ Löö see katki . ” “ Ma ei julge . ” 
393	NA	 “ Mis see veel on . ” 
394	NA	 “ Kõik naised on sellised petturid . 
394	NA	 Kõik . ” “ Mida sa ajad . ” “ Mida , loll oled või . 
394	NA	 Tõmbad neilt rinnahoidjad ära ja alles jäävad sellised tavalised mügarad või midagi sellist . 
394	NA	 Kõik on puha pettus . ” Madis ei viitsinud midagi mõelda . “ Mingi alaealine oled või . 
394	NA	 Pole ammu õde pannud või . 
394	NA	 Sa oled ikka täielik . ” “ Vittu mida . ” “ Midagi muud ka öelda oskad . ” “ On midagi ütlemist või . ” “ Mida . ” “ Mida . ” “ Türa jää vait raisk . ” Madis sulges väsimusest silmad . 
394	NA	 Järgmine hetk pidi peaaegu toolilt maha prantsatama . “ Vittu milline värdjas , sa oled ikka täielik idioot . ” Ja siis algas väiksemat sorti kaklus või rüselus , mille võitjaks ei tulnud õieti keegi . “ Täiesti haige . ” “ Vittu jää vait . ” 
395	NA	 Öö . 
395	NA	 Kõik magama . 
395	NA	 Hommik . 
395	NA	 Edasi . 
396	NA	 Faksimasin susistas uue paberi välja . 
396	NA	 Hajevil Donald võttis paberi käte vahele . 
396	NA	 Peakontorist uuriti , miks kohalik haru viimastel kvartalitel nii vähe kasumit toodab . 
396	NA	 Rasked ajad peaks ammu läbi olema . 
396	NA	 Donald ei mõistnud , miks selle küsimusega just tema poole pöörduti . 
396	NA	 Mees ringutas väsinult ja vaatas , kui palju on hommikust möödunud . 
396	NA	 On ja ei ole ka . 
396	NA	 Donald leidis , et nüüd on aeg lõunatada . 
397	NA	 Lõunalt tagasi tulles avastas Donald uue faksi . 
397	NA	 Peakorter oli otsustanud , et lähinädalatel saadetakse neile mõneks ajaks ekspert appi . 
397	NA	 Nüüd hakkavad pead lendama , mõtles murelik Donald , ma pean end igati kasulikuks tegema . 
397	NA	 Alustuseks kontrollis mees , kuidas ta töö jaoks riietunud oli . 
397	NA	 Laitmatult , leidis Donald . 
398	NA	 Karin naeratas totakalt Donaldiga kokku põrkudes . 
398	NA	 Lubati üksteisele helistada , õhtul võiks midagi teha , viimane kord oli päris tore . 
398	NA	 Uksed avanesid ja sulgusid . 
399	NA	 Ootasin keskpäevani . 
399	NA	 Vaatasin üles , tundus , et teda pole seal . 
399	NA	 Liana lükkas vihma riietelt maha . 
399	NA	 Kuidagi vastik oli trepist üles ronida ja siis seda ust avada . 
399	NA	 Toivot polnudki kohal . 
399	NA	 Liana lukustas ukse . 
399	NA	 Kui korterist kasvõi paar päeva eemal olla , siis tagasi tulles tabab sind alati see imelik lõhn . 
399	NA	 Seda lõhna ei oskagi kirjeldada , lihtsalt imelik . 
399	NA	 Toivo oli korterit isegi enda järel koristanud , kraanikausis polnud ühtegi musta nõud . 
399	NA	 Noh , sa oled nüüd suur poiss , Liana vaatas , et ega talle kirju pole tulnud . 
399	NA	 Ainult telefoniarve . 
399	NA	 Pistis käekotti . 
399	NA	 Läks vannituppa , võttis kapist vajalikud kreemid ja värvid . 
399	NA	 Otsis toast kohvrit , leidis , hakkas kapist riideid valima . 
399	NA	 Lõpuks jõudis otsusele , et ta ei saa niimoodi õhtuni kapi ees närviliselt sorteerida ja riideid maha visata , midagi tuleb ikka kohvrisse panna . 
399	NA	 Lõpuks sai kohver täis . 
399	NA	 Võttis riiulist paar raamatut . 
399	NA	 Päris raske kohver . 
399	NA	 Mida veel . 
399	NA	 Peab vist tagasi tulema , Erikut ei taha sellesse asja segada , paistab , et võin varsti endale päris kenad musklid kasvatada . 
399	NA	 Helistas endale takso vastu , hakkas siis kohvrit ukse poole hiivama . 
399	NA	 Sulges ukse . 
399	NA	 Varsti tulen tagasi . 
399	NA	 Ja koristan enda jäljed ja lõhnad siit . 
400	NA	 Tööpäev sai lõpuks läbi ja Donald laskus tugitooli ja puhkas natuke . 
400	NA	 Harjumatult tühi pea . 
400	NA	 Kingi tuleks uuesti viksida . 
400	NA	 Uue ülikonna peaks muretsema . 
400	NA	 Kuhugi lõunasse puhkama sõitma . 
400	NA	 Kui kümne minuti pärast end liigutada suudan , siis saan Kariniga kokku . 
400	NA	 Ja nikun tal ajud sõelapõhjaks . 
400	NA	 Kui ma ei liiguta , siis lülitan telefoni välja ja see on Karini enda asi , mis ta nende reserveeringutega teeb ja kuidas end rahuldab . 
400	NA	 Kümme minutit . 
400	NA	 Okei . 
400	NA	 Ma liigun . 
400	NA	 Eriti ei viitsi , aga ma liigun , Karin peaks mulle elu lõpuni tänulik olema , nii häid mehi on vähe . 
400	NA	 Lugesin veel viimaseid teateid . 
400	NA	 Ei midagi erakorralist . 
400	NA	 Öötöö on out . 
400	NA	 Igast harjavarrest ei ole võimalik pauku välja imeda . 
400	NA	 Mantel selga . 
400	NA	 Väljas sadas ikka vihma , Donald ohkas ja astus kontorist tänavale . 
401	NA	 Keegi ei helistanudki . 
401	NA	 Mulle lihtsalt tundus nii . 
402	NA	 Vihm jooksis kraevahelt sisse . 
402	NA	 Donald kõndis vapralt edasi . 
402	NA	 Karin peab mulle megatänulik olema , et end tema heaks liigutan , see kohting läheb talle kalliks maksma , aga noh , üksiku rahuldamata naise asi . 
402	NA	 Ta vist oli millalgi abielus , aga mees oli ehk kummaline . 
402	NA	 Donald jäi ristmikul seisma . 
402	NA	 Punane tuli . 
402	NA	 Mina ei riku seadust . 
402	NA	 Ainult üks auto lähenes ristmikule . 
402	NA	 Politseiauto peatus Donaldi kõrval . 
402	NA	 Donald ootas rohelist tuld ja ei vaadanud auto poole . 
402	NA	 Tema seadust ei riku . 
402	NA	 Kaks politseinikku astusid autost välja . 
402	NA	 Donald ootas rohelist tuld ja ei vaadanud nende poole . 
402	NA	 Politseinikud jäid ta kõrval seisma . “ Kas teie olete Raavo . ” “ Jah , milles asi . ” Järgmine hetk lamas Donald asfaldil , teine politseinik oli virutanud talle peale vastamist kolaka vastu pead . 
402	NA	 Donald proovis püsti tõusta , siis virutasid mõlemad talle näkku ja kõhtu ja ta varises uuesti tänavale , seejärel haarasid kaenla alt kinni ja vedasid pimedasse kangialusesse . 
402	NA	 Donald proovis neile vastu hakata ja abi röökida , aga üks politseinik surus tal suu kinni , Donald vaid kähises natuke . 
402	NA	 Pidev valu jooksis üle keha . 
402	NA	 Üks hetk seisis nende kõrval kolmas mees ja peksmine lõppes . “ Kas sa tead , kes ma olen . ” Donald vaatas üles . 
402	NA	 Silmad ei suutnud kohe nägu eristada . “ Jah . ” “ Kas sa tead , miks ma siin olen . ” “ Mina ei ole midagi teinud , laske mind vabaks , palun , laske vabaks . ” “ Jäta jauramine . 
402	NA	 See ei meeldi mulle . ” Politseinik lõi Donaldile jalaga kõhtu ja see tõmbus krõnksu ja oigas valust . 
402	NA	 Tõnis ootas . “ Sina igavene sitakott mehkeldasid minu tütrega ja kogu kuradi linn teadis seda . ” “ Mina ei ole midagi teinud , ausalt , mina ei teinud , laske mind vabaks ja ma ei räägi sellest kõigest mitte kellelegi , ausalt , laske mul minna . ” “ Jäta see kuradi titade jutt , sa ei ole enam kümneaastane . 
402	NA	 Kas sa tõesti arvasid , et ma lasen enda nime niisama täis teha , ah , kas sa tõesti arvasid , et ma peidan nina liiva alla . 
402	NA	 Kuradi värdjas raisk . ” Politseinikud hakkasid uuesti Donaldit peksma , see proovis kasvõi minema roomata , aga ta lohistati tagasi Tõnise ette . 
402	NA	 Politseinikud hingeldasid natuke . 
402	NA	 Donald ei näinud enam selgelt enda ümber , verd voolas silmadesse . “ Kõige õigem oleks sind lihtsalt maha lüüa . 
402	NA	 Jah , või supikontideks hakkida , jah , paras vaesteköögis neile virisevatele pensionäridele sisse sööta , mis , neil ka pidupäevad siis . 
402	NA	 Aga ma ei tee seda . 
402	NA	 Kui sa tahad , võid sa nädala pärast haiglas surra , mingite sisemiste verejooksude või muu kätte , see mind enam ei huvita . 
402	NA	 Kas sa tõesti arvasid , et oled siin linnas nii kõva mees , et võid endale kõike lubada . 
402	NA	 See on minu linn . 
402	NA	 Siin ei tee sinusugused tatinägudest kärnkonnad seda , mida nemad tahavad . 
402	NA	 Okei . ” Peksti natuke edasi ja Donald kaotas teadvuse , kuid ta äratati tagasi . 
402	NA	 Imelik tuim valu kogu kehas . 
402	NA	 Ma ei suuda hingata . “ Laske mul minna palun . ” “ Mida sa sitt mu tütrega tegid . ” “ Ma peaaegu ei tunne teda . ” “ Sa ära valeta mulle , kas sa arvad , et ma ei tea midagi , mis siin linnas toimub . ” “ Me ei teinud midagi . ” “ Ära ole loll ja lõpeta valetamine . ” Peksti natuke ja Donald ei jaksanud enam roomatagi , mingi klomp tõusis suhu ja ta oksendas asfaldile ja endale ja vihm kukkus temale ja oksele ja verele , Donald püherdas selles sopas . “ Teeme nüüd nii . 
402	NA	 See on selge , et sa püsid mu tütrest eemal . 
402	NA	 Ja see on selge , et sa maksad mulle väikese valuraha , noh , linna heakorra reeglite rikkumise eest . 
402	NA	 Mul on lepingu blankett kaasas , sa kirjutad nüüd ilusti allkirja ja saad vaba mehena edasi kõndida , eks , või eelistad sa edasi roomata selles pasas , paistab , et seda oskad sa nüüd paremini . ” Tõnis võttis portfellist paberi ja sulepea . 
402	NA	 Donald ei näinud peaaegu midagi enda ümber , politseinikud talutasid ta istuma , võtsid Donaldi portfelli ja panid selle paberi sinna peale . 
402	NA	 Üks politseinik hoidis vihmavarju portfelli kohal . 
402	NA	 Tõnis ulatas sulepea , surus sõrme paberile . “ Siia . ” “ Ma ei teinud teie tütrega midagi . ” Donald vaheldumisi nii kiunus kui halises , politseinikud vaatasid vastikusega ta paistetanud nägu . “ Jää vait raisk ja kirjuta alla . ” Ja Donald kritseldaski vabiseva käega allkirja mingile paberile . “ See on selge , et ajakirjanduse poole ei tasu sul pöörduda . 
402	NA	 Pealegi ei usu sind mitte keegi , minu linn armastab mind , sina oled vaid üks värdjalik ja valelik välismaalaste perselakkuja , kes müüks oma ema ka neile seksiorjaks maha . ” Tõnis võttis paberi ja asetas korralikult portfelli . 
402	NA	 Donaldi portfell kukkus märjale vere ja okse segusele asfaldile ja üks politseinik virutas selle jalaga eemale , Donald varises uuesti maha ja jäi lamama . 
402	NA	 Tõnis vaatas korra tagasi , Donald proovis end põlvili ajada . “ Ära siis pikka viha pea , amigo , see on kõigest au ja äri küsimus . ” 
403	NA	 Paul vaatas , kuidas politseinikud peksid mingit meest ja keegi kolmas seisis seal kõrval ja see olukord ei meeldinud talle . 
403	NA	 Selline asi on politseivägivald , jõudis Paul lõpuks järeldusele , see on diktatuur , siit edasi ei ole enam midagi muud kui klassivõitlus . 
403	NA	 Seisja tundus kuidagi tuttav , see veel vaataks korraks Pauli poole ning nüüd jõudis Paul järgmisele järeldusele , et kõige õigem oleks kiiremas korras lahkuda ja hiljem analüüsida ja järeldused teha . 
403	NA	 See viib klassivõitluseni . 
404	NA	 Avasin ukse . 
404	NA	 Koja põrandal olid värsked vesised jäljed . 
404	NA	 Tormasin tuppa . 
404	NA	 Ei , õnneks kõik korras , Liana oli kõigest käinud ja oma saasta ära vedanud . 
404	NA	 Nüüd võib lukku vahetada . 
404	NA	 Vaatasin magamistuppa , ta peab vist tagasi tulema , kui ta muidugi ei taha minust naiste riiete kandjat harjutada . 
404	NA	 Toivo läks kööki , pooltühi veeklaas seisis laual . 
404	NA	 Võttis selle kätte , vaatas lähemalt . 
404	NA	 Liana huuled puutusid seda , natuke huulepulka oli klaasile jäänud , Toivo tõstis selle suu äärde , tõmbas keelega üle huulepulga jälje , see on see on nagu õrn suudlus , midagi magusat voolas süljes ja ta tõmbas uuesti keelega üle klaasi ja punane jälg oligi kadunud . 
404	NA	 Millal ma teda viimati suudlesin , millal me üldse magasime , millal surusin end tema oigavasse kehasse ja lasin end vabaks . 
404	NA	 Ma pean midagi tegema . 
405	NA	 Liana ei mõistnudki , kuhu ta raamatud kadunud olid . 
405	NA	 Võibolla laenasin kellelegi , kuid siis peaks seda mäletama . 
405	NA	 Võibolla peitis Toivo need mu eest ära , ei , nii madalale ta ei lange , Liana jõudis Eriku korterisse , kuid Erik oli taas kadunud . 
406	NA	 Tulin töölt ja olin jumala väsinud , aga seal kodus ei viitsinud istuda , nad hakkasid jälle oma kuradi lolle jutte rääkima ja mul sai ikka täielik siiber , ütlesin , et mul on mingi kokkusaamine . 
406	NA	 Võtsin siis külmkapist paar vorstikest ja kugistasin alla ja tõmbasin faking minema . 
406	NA	 Kedagi eriti ei leidnudki , läksime lihtsalt kesklinna ja jõime natuke õlut , pagana külm , varsti ei saagi enam väljas juua , tuleb punker otsida . 
406	NA	 Räägiti , et esmaspäeval sai paar venda ilge kolaka ja see ajas ikka pasa keema . 
406	NA	 Kuradi purjus välismaalased tulid teed küsima ja saatsime nad jumala perse , vittu värdjad raisad , nikkuge oma litse kodus ja mitte siin , kuradi närvidele käivad sellised raisad . 
406	NA	 Mõtlesin , et varsti võiks küll magama minna , mis siin ikka igavleda , tööpäev ka . 
407	NA	 Unes käis selline haiglane möll ja mingi hetk ei saanud kuraditki aru , et olin ma nüüd unenäos või kus ja kuidas ja miks , mitte midagi ei saanud aru . 
407	NA	 Midagi ma tegin ja midagi tehti minuga ja see kõik ei olnud just eriti normaalne ega tore ega vittugi . 
407	NA	 Madis pilgutas pimedas silmi ja haigutas ja mõtles , et see kõik oli ikkagi unenägu või midagi sellist . 
407	NA	 Okei . 
408	NA	 Takso vedas Donaldi kontorisse . 
408	NA	 Taksojuht nõudis lisatasu istmete puhastamise eest . 
408	NA	 Uimane Donald andis raha juurde ja proovis end taksost välja tõsta . 
408	NA	 Lõpuks trepikoja ees seistes hakkas tal kõht keerama ning Donald oksendas enda sisemust välja . 
408	NA	 Milles mina süüdi olen . 
408	NA	 Kas ma nüüd surengi , ma ei taha ju surra , mul oli kõik juba valmis plaanitud , uus oksehoog ja Donald kõõksus trepiastmetel . 
409	NA	 Võibolla peaksin arsti juurde minema . 
409	NA	 Ja kuradi Tõnise ja muu värdjakamba kinni panema . 
409	NA	 Kuradi sitapead . 
409	NA	 Kuradi sitapead . 
410	NA	 Vanamutt arvas , et mind huvitavad hilisõhtused uudised ja kutsus vaatama . 
410	NA	 Paul vaatas natuke , aga kõik oli sama mis koguaeg . 
410	NA	 Läks tuppa tagasi . 
410	NA	 Huvitav , mis Evelin teeb . 
410	NA	 Miks tal alati muud tegemist on . 
410	NA	 Mis üldse punkmaailmas toimub . 
410	NA	 Ükskõik . 
410	NA	 See on igav . 
410	NA	 Kui lõputult igav on olla . 
410	NA	 Ei viitsi veel magama minna . 
410	NA	 Kurat kui värdjad need politseinikud on , see on see õigusriik . 
410	NA	 Ja kes see põhivärdjas seal oli . 
410	NA	 Paul lamas voodis ja vahtis lakke ja minutid venisid . 
410	NA	 Ükski õige inimene ei lähe enne kahtteist magama . 
411	NA	 Tõnis oli jätnud teate , et võiks nädalaks soojale maale puhkama sõita . 
411	NA	 Ja las Toivo ise otsustab , kas kaasa tulla või mitte . 
411	NA	 Teeme nii nagu vanadel aegadel . 
411	NA	 Liana kustutas sõnumi . 
411	NA	 Erik magas veel rasket und . 
411	NA	 Kõik need ööd on toredad , kuid pikapeale muutuvad väsitavaks . 
411	NA	 Ma ei ole enam nii noor . 
411	NA	 Ma ei ole veel nii vana . 
411	NA	 Liana ohkas . 
411	NA	 Erik lamas liikumatult . 
411	NA	 Tuleb vist kohvi juua , muidu üles ei ärka , naine läks kööki , pani vee keema , läks vannituppa nägu pesema . 
411	NA	 Ka veepladin ei äratanud Erikut . 
411	NA	 Temal vist muud aega ei olegi kui ainult õhtu ja öö , mõtles Liana presskannu vett valades . 
411	NA	 Aga nüüd ma tahan ilusaks saada . 
412	NA	 Tihtipeale ei suuda enam meenutada seda , mida enne magamaminekut tegin . 
412	NA	 Kas ikka jõudsin veel suitsu teha või vajusin otse Liana kõrvale , otse ta juurde , kas seksisime või oli see kõik poolik unenägu , Erik vaatas Liana riietumist , kuid ei jaksanud erutuda , väsimus murdis mitmest küljest ning ta jäi uuesti magama . 
413	NA	 Ja nüüd midagi täiesti suvalist . 
413	NA	 Läks siis Erik tualetti . 
413	NA	 Vaatas end korraks peeglist , kõik oli enamvähem ok , võibolla silmad olid natuke liiga punased . 
413	NA	 Juhtub ka paremates perekondades . 
413	NA	 Astus siis vapralt pissuaari juurde ja asus asjatoimingutele . 
413	NA	 Vaatas seina . 
413	NA	 Selg valutas . 
413	NA	 Keegi mühatas kabiinides . 
413	NA	 Eks vaatas siis Erik kabiinide poole . 
413	NA	 Ja äärmisest kabiinist vaatas üks pikk lõust vastu . 
413	NA	 Ta pea oli lihtsalt üle kabiini ääre . 
413	NA	 Erik pidi üllatusest peaaegu põrandale või lausa pükstele sirtsutama . 
413	NA	 Lõpuks pomises tere ja nii hiiglane kui Erik pöörasid pea seina poole . 
413	NA	 Selline kurb lugu siis käimlakultuurist . 
414	NA	 Järgmine kord tuli punapea elukaaslasega . 
414	NA	 Toivo pidi raevust plahvatama . 
414	NA	 Punapea tutvustas meest . 
414	NA	 Fred . 
414	NA	 Tutvusid töökohas , kus punapea oli talle otsene alluv . 
414	NA	 Toivo vaid istus ja kuulas . 
414	NA	 Raev . 
415	NA	 Elukaaslane rääkis innukalt , kui tore on neil koos elada ja koos töötada , teie olete ka vist vanad tuttavad . 
415	NA	 Punapea naeratas häbelikult ja nad hoidsid käest kinni . 
415	NA	 Toivo suutis vaid kaasa noogutada . “ Ma kuulsin , et teil pidi linnavalitsuses soe koht olema . ” “ Mhmh . ” “ Siis ma võiksin teile oma firmaga mõnikord kasulik olla , vabandust , et ma teie poole nii otsekoheselt pöördun , aga noh , me mõlemad oleme ärimehed ja kuskilt tuleb ju kasu teenida . ” “ Mhmh . ” Punapea lausa säras , et nii hea tutvuse oli sobitanud , elukaaslane vaatas samuti Toivole optimistlikult otsa . 
415	NA	 See vaikis . 
415	NA	 Ta tundis , et kui vaid suu avaks , siis ta lihtsalt tungiks neile kallale . 
415	NA	 Punapea oli Toivo haardeulatuses , kuid kuulus võõrasse haardesse . 
415	NA	 Need sõrmed ei ole minu näppude vahel . 
415	NA	 Mitte miski ei ole enam minu oma . 
415	NA	 Värdjakari . 
415	NA	 Kurat võtaks . “ Kui sobiks , siis ma maksaks ise õhtusöögi eest , noh , firma esinduskulud või nii . ” “ Mhmh . ” Võibolla peaks Madisele helistama , temast võiks isegi midagi välja kujuneda . 
415	NA	 Kunagi . 
415	NA	 Toivo vaatas punapea huuli , alles ma suudlesin sind ja selles ei olnud midagi võõrast , alles katsusin su keha , ja selles ei olnud midagi võõrast . 
415	NA	 Miks nüüd korraga mu elu nii kuradi perses on . 
415	NA	 Miks punapea valetas . 
415	NA	 Miks ta mind kõigest mingi linnavalitsuse koha eest ära kasutas . 
415	NA	 Värdjakari . 
415	NA	 Värdjakari . 
415	NA	 Loomastunud inimesed . 
416	NA	 Punapea oli sellise näoga nagu polnukski midagi juhtunud . 
416	NA	 Loomastunud inimesed maigutavad suud . 
417	NA	 Õhtusöök lõppes ja Toivo oli vihast meeletu . 
417	NA	 Punapea ja ta elukaaslane muudkui vadistasid õnnelikult ja paar korda püüdis mees Toivot õlale patsutada . 
417	NA	 Jalutati aeglaselt vanalinnas ja paarike pakkus , et võiks veel kuhugi tähistama minna , noh , firma kulul . 
417	NA	 Toivo kehitas õlgu ja kähises arusaamatult . 
417	NA	 Ta vaatas , kuidas nad hoidsid üksteiselt käest kinni ja sõrmed pigistasid sõrmi ja nahk oli nahal . 
417	NA	 Nad rääkisid ja vaidlesid omavahel ja siis naersid selle vaidluse peale ja kõige lõpuks kallistasid . 
417	NA	 Tänavad olid juba päris tühjaks jäänud . 
417	NA	 Kuhu ma auto parkisin . 
418	NA	 Plahvatus . 
418	NA	 Toivo tappis mõlemad . 
419	NA	 Kurat kui tüdinenud ma olen . 
420	NA	 Keegi jooksis eemale . 
421	NA	 “ Madis . ” “ Jah . ” “ Kus sa oled . ” “ Kesklinnas . ” “ Sa tuled kohe siia . ” “ Miks . ” “ Mul on sind ülikiirelt vaja , praegu on hädaolukord . ” 
422	NA	 Hingame sisse . 
422	NA	 Hingame välja . 
423	NA	 “ Võta jalgadest kinni . 
423	NA	 Kiiresti . ” 
424	NA	 Öö . 
424	NA	 Vaikus . 
424	NA	 Kõik magavad . 
424	NA	 Keegi ei tea . 
424	NA	 Mis juhtus . 
424	NA	 Ma ei tea . 
425	NA	 Madis hingas sisse . 
425	NA	 Madis hingas välja . 
425	NA	 See kõik peab olema unenägu . 
425	NA	 Või muidu . 
426	NA	 Äratuskell . 
426	NA	 Tarmo avas silmad . 
426	NA	 Vaatas kella . 
426	NA	 Äratas Terje . 
426	NA	 Sõid hommikust . 
426	NA	 Pesid hambaid . 
426	NA	 Läksid tööle . 
426	NA	 Tegid tööd . 
426	NA	 Tulid töölt . 
426	NA	 Sõid õhtust . 
426	NA	 Vaatasid telekat . 
426	NA	 Pesid hambaid . 
426	NA	 Kontrollisid kella . 
426	NA	 Läksid magama . 
427	NA	 Kutsub . 
427	NA	 Kutsub . 
427	NA	 Ja kõik . 
427	NA	 Paul valis neljandat korda Evelini numbri . 
427	NA	 Kutsub . 
427	NA	 Kutsub . 
427	NA	 Ja kõik . 
427	NA	 Paul vaatas kella , kool peaks ammu läbi olema . 
427	NA	 Valis viiendat korda . 
427	NA	 Telefon väljalülitatud või levipiirkonnast väljas . 
428	NA	 Evelin viskas telefoni riidekappi . 
428	NA	 Kaua võib , millest see Paul nüüd aru ei saa . 
428	NA	 Saalist kostis reibast muusikat . 
428	NA	 Evelin sidus tossudel paelad kinni ja juba ootaski see kihvt aeroobikateener , ma tahaks täpselt samasugust keha . 
428	NA	 Ei ühtegi grammi rasva . 
429	NA	 Keegi ei vasta . 
430	NA	 No future , let's destroy . 
431	NA	 Proovisin nõusid pesta , kuid nad lihtsalt kukkusid käte vahelt põrandale . 
431	NA	 Peale teise taldriku purunemist tuli Liana ja palus endale võimaluse anda . 
431	NA	 Erik vajus laua äärde istuma . 
431	NA	 Purjus peaga pole vist kõige õigem majapidamistöid teha , ei paista nagu õnnestuvat . 
432	NA	 “ Toivo . ” “ Jah . ” “ Kuidas läheb . ” “ Tavaliselt . ” “ Ahah . 
432	NA	 Kuule , ma lahendasin ise selle probleemi ära , poisid otsisid selle Raavo või kelle kuradi üles ja ta nõustus meile valuraha maksma , niiet ära siis enam muretse , nüüd on kõik korras . ” “ Ahjaa , muidugi . 
432	NA	 Noh , tore , jah . 
432	NA	 Kuidas sul endal läheb . ” “ Eks linn püsib ikka omal kohal , mõned on värdjad ja litsid edasi ja mõned teevad koostööd . ” Vanamees on hulluks läinud . 
432	NA	 Toivo vaatas väsinult end peeglist . 
432	NA	 See kuradi Tõnis võibki patrama jääda , anna ainult võimalus ja suvaline plära voolab sulle pähe . 
432	NA	 Mis kell on . 
432	NA	 Varsti hakkab vist lund sadama . 
432	NA	 Ebanormaalne sügis . “ Ahjaa , kuidas Lianal läheb , ma pole teda ammu näinud , on tal ikka kõik korras . ” “ Normaalselt , kõik on normaalne , pole erilist midagi . ” Öisest joomisest pea täiesti paks . 
432	NA	 Tuleb minna mineraalvett ostma . 
432	NA	 Kõik läks valesti . “ Sinu osakonnas pole midagi katastroofilist . ” “ Ei , ei , muidugi mitte . ” “ Nojah , eks tegelikult ma tean seda isegi . ” 
433	NA	 Miks punapea mind niimoodi pettis . 
433	NA	 Lihtsalt lõi mulle noaga selga . 
433	NA	 Ei mingeid süümepiinu . 
433	NA	 Toivo sulges silmad . 
433	NA	 Loomastunud inimesed , mis siin muud öelda . 
434	NA	 Nagu see veel puudus , põrkas Toivo üle pika aja Lianaga kokku . 
434	NA	 Mõlemad põrnitsesid altkulmu teineteist , Toivo ei suutnud midagi mõelda . 
434	NA	 Liana tuletas talle taas meelde , kui perses kõik on . 
434	NA	 Liana jälle ei mõistnud , kuidas ta sellise läheduses üldse viibida võis . 
