par_nr	head	sentence
81	NA	 Esimese aasta järel on teil õigus — ja see on minu poolt kehtestatud õigus — üht-teist meie menetluste kohta teada saada . 
81	NA	 See suurendab piinu , uskuge mind . 
81	NA	 Nii et teadke — te viibite siin senikaua , kuni hakkate harjuma , hakkate kohanema oma isiku mõnitamise , alandamise ja piinamisega . 
81	NA	 Kui teie kaebed lakkavad ja miski teile enam piina ei valmista , alles siis lasen ma teid vabaks . 
81	NA	 Siis , kui olete harjunud oma isiku lõputu ja jäägitu alandamisega . 
81	NA	" Siis , mitte varem . "" "
82	NA	 Ta pöördus minekule . 
83	NA	" "" Te ei ole inimene , "" sosistasin mina . "
84	NA	" "" Aga vaat selle üle ei otsusta küll teie , "" viskas ta üle õla , jäi siiski uksel peatuma , heites mulle veel viimase pilgu . "
84	NA	" "" Samas võib teil mõnes mõttes õigus olla , kuigi sel pole mitte mingisugust tähtsust . "
84	NA	 Enam ja minu jaoks . 
84	NA	" Muuseas , miks ma teie arvates üldse olen selle vangla direktor , miks pürgisin sellele kohale ? "" "
85	NA	" "" Sest te olete kurjategija ! "" "
86	NA	" "" See on alati suhteline mõiste . "
86	NA	 Sest tegelikult ka mina kannan siin oma karistust . 
86	NA	 Karistust , mille määrasin endale ise ja kannan lõpuni , lootuseta leida iial lunastust , andeksandmist ja andestust . 
86	NA	 Minu süü on igavene , hoolimata kahetsusest . 
86	NA	" Ainult siin ja selles ametis saan ma ennast karistada kuriteo eest enese vastu , selle eest , et ma pidasin end kunagi humanistiks , filantroobiks ja sellisena ka tegutsesin , et ma uskusin , lootsin ja armastasin , et ma pidasin inimest inimeseks . "" "
87	NA	 Siis ta läks , jättes mind oma kaaskannatajate meelevalda . 
