par_nr	head	sentence
469	NA	" "" Nad lülitasid side välja täpselt kolmteist minutit tagasi . "
469	NA	" Ilmselt juhtub seal allgi midagi enneolematut . "" "
470	NA	 Dhaka ei hoolinud , kas tema sõnad tegid Azarjanile haiget või mitte . 
470	NA	 Ta oli ammu üle kasvanud Pesa läppunud erootilistest mängudest . 
470	NA	 Juba kuid oli ta täiesti kiretult jälginud tolle noore naiivse plika — Estrada — armumist Foogti ja Azarjani lootusetut kiimlemist . 
470	NA	 Tema ise oli Capaneusile tulnud karjääri tegama , mitte osalema sumbunud süsteemi kiredemöllus . 
470	NA	 Äralõigatuna loomulikust elukeskkonnast muutub inimene haiglaselt tundlikuks igasuguse seksuaalse ärrituse suhtes . 
470	NA	 Kuid mitte tema — Cirnetta Dhaka ! 
470	NA	 Vaid üks kulukas ja salajane operatsioon Terranooval ja lähima viie aasta jooksul on ta vaid väliselt naisterahvas . 
470	NA	 Töö kaugplaneetidel nõuab seda , et suguorganid teeksid läbi väikese kuuri ... 
470	NA	 Ta ei mäletagi enam , mis tunne see on . 
470	NA	 Tunne tahta teist keha . 
470	NA	 Ja Dhaka ei mõistnud , miks pole Konservatoorium teinud väljalülitamisoperatsiooni ( nagu ta seda kirurgilist sekkumist inimese ihadesse nimetas ) , kogu Pesa meeskonnale kohustuslikuks . 
470	NA	 Nii palju asjatut sebimist ja edvistamist jääks ära , nii palju kasulikku aega tuleks juurde . 
470	NA	 Tal on siin töö ja teda ei huvita mehed . 
470	NA	 Ega naisedki enam . 
470	NA	 Sisimas enda üle ülbelt muiates , mõtles Dhaka , et oleks ta Capaneusil endine , oleksid nad Azarjaniga võistlejad . 
470	NA	 Ja oleksid ka Foogtiga ... 
470	NA	 Linne on põrgulikult ilus tüdruk . 
470	NA	 Aga see on juba hoopis teine lugu . 
471	NA	" "" Miks nad ühes läksid ? "" pomises Azarjan . "
471	NA	" "" Foogt ei käi ju tavaliselt all . "" "
472	NA	" "" Ma ju ütlesin juba , et ilmselt toimub midagi enneolematut . "
472	NA	" Kõik ekspeditsioonid olid samuti kiiremas korras tagasi kutsutud . "" "
473	NA	" "" On nad tagasi ? "" "
474	NA	" "" Kõik viisteist inimest . "
474	NA	" Õnnelikult Pesas tagasi . "" "
475	NA	" "" Miks kõik ei võiks olla nagu tavaliselt ? "" "
476	NA	" "" Sest tavalised ajad on möödas ? "" pakkus Dhaka irvitades . "
476	NA	 Sest tavalised ajad Pesas olid möödas . 
476	NA	 Ja mitte ainult asteroidide pärast . 
476	NA	 Dhaka nägi seda viimased päevad pidevalt Zemani silmadest , kuulis tema toonist . 
476	NA	 Ja vahest ta arvas , et tunneb seda muudatust Foogtis ainult tänu seksuaalse tundlikkuse puudumisele , sest nüüd valdavad tema instinktid kõike seda , millest ta varem ilma oli . 
476	NA	 Dhaka nägi ja kuulis kõike ilma segava foonita ; ta ei haistnud enam meestes ega naistes midagi külgetõmbavat ; teda ümbritsev atmosfäär oli vaba ihalistest lisanditest . 
476	NA	 Nüüd ta nägi , tundis ja teadis . 
476	NA	 Kõik tema ümber sai selgemaks ja arusaadavamaks . 
476	NA	 Kuid see oli aega võtnud . 
476	NA	 Jah , ta oleks võinud magada kellega tahes , füsioloogiliselt polnud mingeid piiranguid . 
476	NA	 Tema keha oli ikka samamoodi valmis . 
476	NA	 Kuid ainult tehniliselt , sest see ihu ei ihaldanud enam lähedust teiste ihudega , vaid soodustas ainult aju teotsemisi ja püüdlusi , oli allutanud ennast täiesti vaimsete vajaduste rahuldamisele . 
476	NA	 Tema ihu sõi , puhkas , treenis ennast , oli terve ja lasi ajul end juhtida , et teda valdav inimene saaks Suureks ja Tähtsaks . 
477	NA	" "" Kas ei ole mingit võimalust Foogtile teadet saata ? "" "
478	NA	 Dhaka mõtles pisut . 
478	NA	" "" Ma arvan , et side on maas sellepärast , et ta ei taha , et keegi energeetikat üleliia ekspluateeriks . "
478	NA	" Tead ju tema poliitikat lausside kahjulikkusest ja iga planeedi omast hingest , mida meie kommunikatsioonivahendid võivad häirida ? "" "
479	NA	" "" Need on teoreetiliselt huvitavad mõtted , "" soostus Azarjan käega laubalt higi pühkides . "
479	NA	" "" Aga keegi pole neid kunagi tõestanud . "" "
480	NA	" "" Tõestatakse teoreeme , mõtteid põhjendatakse . "" "
481	NA	" "" Mul on Foogti vaja ja ruttu ! "" "
481	NA	 Azarjani hääl muutus juba peaaegu kiunumiseks . 
481	NA	 Kui lapsik ta on , mõtles Dhaka . 
481	NA	 Ilma oma arvutiteta on ta nii abitu . 
482	NA	" "" On olemas direktiiv Cap90/a , "" kuulis Dhaka ennast ütlevat . "
482	NA	" "" Kui sul on midagi edasilükkamatut ja Foogti pole võimalik saada sideseansile , võib Asefoogt , see tähendab opertiivkeskuses valvet pidav Asefoogt , kedagi volitada Foogtiga füüsilist kontakti looma . "
482	NA	" On sul midagi edasilükkamatut ? "" "
482	NA	" Aga ise mõtles ta sellele "" öisele nõidumisele "" . "
482	NA	 Talle meenus mingi failikatke , mis kuvarinurgast oli ennist läbi jooksunud . 
482	NA	 Midagi , mis teda pisut rahutuks oli teinud . 
482	NA	 Sest see teatas talle , et toimumas oli midagi , mida ta ei teadnud . 
482	NA	 Hüsteeria äärel vaakuv Azarjan oli hea võimalus selle teadasaamiseks . 
483	NA	" "" Mida põrgut , või edasilükkamatut ? ! ... "
483	NA	" "" Vitus "" on pime ja kurt ! "
483	NA	 Kui Konservatooriumis otsustatakse tõrjelaevastik teele saata , tuleb sellest suurim raharaiskamine peale Excelsuse ülesostmist . 
483	NA	 Meil on signaal 'Robinson1' , Cirnetta ! 
483	NA	" Kas sa kujutad ette ? "" "
484	NA	 Ta kujutas ette . 
484	NA	 Ja tahtis olla see , kes sellest Foogtile teada annab . 
484	NA	 Robinson1 , mõelda vaid ! 
485	NA	" "" Cap90/a läheb kohe käiku . "
485	NA	" Foogt leitakse üles . "" "
486	NA	" "" Me ei tea ju , kus nad on ? "" hädaldas Azarjan edasi . "
487	NA	" "" Nad ei saa olla kaugel kohast , kus nad side välja lülitasid . "" "
487	NA	 Muidugi ! 
487	NA	 Nüüd tuli talle meelde . 
487	NA	 Kodeeritud käsklused dillonite komandodraivis . 
487	NA	 Foogti poolt kodeeritud . 
487	NA	 Erivolitused ja salajane direktiiv . 
488	NA	" "" Keda me volitame ? "" "
489	NA	" "" Keda mina volitan , tahtsid sa öelda . "
489	NA	 Ma volitan iseennast . 
489	NA	 Mine tagasi oma arvutite juurde , kui seal kosmoses on midagi olulist toimumas . 
489	NA	 Täida Foogti korraldusi ! 
489	NA	 Siin võtab Lukovitš juhtimise üle , ta on seda ammu igatsenud . 
489	NA	" Mida ma Zemanile ütlen ? "" "
490	NA	" "" Tulgu siia , tulgu ruttu siia ! "
490	NA	 Ta peab seda nägema ja minul pole õigust Konservatooriumile raporteerida . 
490	NA	 Ma ei saaks ühendustki ... 
490	NA	" Robinson1 ! "" "
491	NA	 Robinson1 ! 
492	NA	 Süstikus sulges Dhaka silmad ja katsus viimaste päevade sündmustes selgusele jõuda . 
492	NA	 Midagi oli toimumas , midagi oli muutunud ja selle kõige põhjuseks ei saanud olla ainult asteroidid . 
492	NA	 Zeman ja Estrada ? 
492	NA	 Nad magavad koos . 
492	NA	 Hästi ja mis siis sellest ? 
492	NA	 Lõppeks on nad siin ju kõik vaesed ihalised olendid . 
492	NA	 Estrada peab oma romaani saladuseks , ise aga õilmitseb ja särab nagu esimest lendu tegev mägikondoret . 
492	NA	 Zeman on targem ja kavalam , tal on alati mitu mõtet rohkem , kui keegi aimatagi oskab , Foogt ei räägi küll oma suhtest noore Vaatlejaga , kuid ei salatse ega varja seda suuresti . 
492	NA	 Ja mis siin varjata ongi ? 
492	NA	 Piisab vaid Estrada nägemisest . 
492	NA	 Kuigi Dhaka ise ei tunne enam iha , ta tunneb selle ära . 
492	NA	 Ta mõistab Estrada kirgi , need on nii läbinähtavad ja naiivsed , nii pimedad . 
492	NA	 Aga Zeman ? 
492	NA	 Foogt ei tee kunagi midagi sellist , mida poleks vaja teha . 
492	NA	 Ta ei maga sekunditki rohkem kui füüsiliseks taastumiseks tarvis ja ta ei maga kellegagi , kellega pole tarvis . 
492	NA	 Ta vajab Estradat . 
492	NA	 Aga ei vaja mitte nagu neid materialiseeritud viirastusi , keda tappes ta oma kiima rahuldab . 
493	NA	 Öösel oli Zeman dillonkraanadega midagi teinud . 
493	NA	 Kõik käsklused olid Foogti erivolitustega blokeeritud ja ta oli Estrada kaasa võtnud . 
494	NA	 Mitte ükski kaamera ei edastnud VI-B lähedast pilti , kogu ühendus oli maas . 
494	NA	 Ja ka Dhaka ei saa oma seiretablood ega ühendpaneeli sisse lülitada , sest ta ei tohi teada 45-märgilist Foogti eriparooli , millega lausside oli ajutiselt tapetud . 
494	NA	 Ei tohi teada ega kasutada . 
494	NA	 Mis sest , et tõenäoliselt oli see 'ucaucaucaucaucaucaucaucaucaucaucaucaucaucaUCA' . 
495	NA	 Estrada on Zemani kindlustus erivolituste põhjendamiseks , tema tunnistaja . 
495	NA	 Kui tuleb uurimine , siis istub see Kastiilia kaunitar Foogti kõrval ja kinnitab tema sõnu , aitab põhjendada ... 
495	NA	 Ojaa , ja kuidas veel aitab ... 
495	NA	 Kinnitab iga silpi , ise vaevalt millestki aru saades . 
496	NA	 Ise vaevalt midagi mõistes . 
497	NA	 Estrada 45. 
497	NA	 Ardaman ; kell 11.43 
498	NA	 Nad olid kaks poolalasti inimest suurte sõnajalgade varjus , keda ümbritsevast eraldas vaid kaitsev odoor , neid ei saanud haista , aga ikkagi olid nad haavatavad ja see tunne oli erutav ja põnev ühtaegu . 
499	NA	 Nende ees lebasid kõik sidepidamisvahendid , kaitseturvised ja relvad . 
499	NA	 Kõik need kasutasid mingeid välju , mis imesid energiat kas otse või läbi akumulaatorite Pesa aatomigeneraatorist ja kõik need on praegu tabud , välja lülitatud , surnud . 
499	NA	 Enam ei tohi midagi häirida Capaneusi loomulikku mõtlemist , nii oli Bent öelnud . 
500	NA	 Foogti jalge ees oli ka see saladuslik kohvrike , mille ta nüüd avas . 
500	NA	 Estrada jälgis imestunud pilgul , kuidas Zeman vilunud liigutusetga puust ja metallist osasid üksteise külge monteeris . 
501	NA	" "" Mis see on , Bent ? "" "
502	NA	" "" Amb . "" "
502	NA	 Tasase klõksatuse saatel asetus mingi käepideme sarnane osa soonelise pära külge . 
502	NA	 Zemani sõrmed tegutsesid peaaegu ilma silmadeta , mis teraselt seiretablood jälgisid . 
502	NA	 Hääled olid üha lähemal . 
503	NA	" "" Mis on amb ? "" "
503	NA	 Estradale meeldis vaadata , kuidas osadest moodustus mehe sitkete käte all tervik . 
503	NA	 Nendes liigutustes ja valmivas mõistatuslikus riistas oli mingi seletamatu harmoonia . 
503	NA	 Iga detail asetus tabamatult targa liigutusega omale kohale , kostsid vaiksed plõksud . 
503	NA	 Riista harmoonia sulas ühte Capaneusi metsiku iluga . 
503	NA	 Estrada kujutas meeltes ette Zemani tugevaid käsi oma kehal . 
504	NA	" "" See on relv . "
504	NA	 Parim relv enne lollakaid tulirelvi . 
504	NA	 Täpne , hääletu ja surmav . 
504	NA	" Mehaanika ja geomeetria tippsaavutus . "" "
505	NA	" "" Ja sa oskad seda käsitseda ? "" "
506	NA	 Zeman muigas . 
506	NA	" "" Jah , oskan küll . "
506	NA	" See pole mõni automaatne laser , ta nõuab , et teda armastataks ja temaga tegeldaks . "" "
507	NA	" "" Kust sa seda õppisid ? "" "
507	NA	 Aga sel polnudki mingit tähtsust . 
507	NA	 Estrada teadis Foogti kiindumust vanade võitluskunstide vastu , teadis tema põlgust masinate ja tehnika vastu . 
508	NA	" "" Pole oluline . "
508	NA	 See on väga vana relv , Linne , üle neljasaja aasta vana . 
508	NA	 Üldiselt käib selle juurde ka üks loits , aga ma arvan , et täna tuleme ilma toime . 
508	NA	" Sellele ammule on pühendatud mitu poeemi , sest ta on tapnud väga palju inimesi . "" "
509	NA	 Tapnud ? 
509	NA	 Keda oleks meil vaja täna ja siin tappa , mõtles Estrada , kuid vastuse asemel kuulis ta metsast liginevaid hääli . 
509	NA	 Ühte neist tundis ta väga hästi — hirnatuse ja rögisemise vahepealne kurjakuulutav häälitsus oli tal selgesti meeles . 
509	NA	 Liiga selgelt , et nüüd mitte Foogti õlast kahmata ja allasurutud häälel hüüatada : 
510	NA	" "" Bent , see on sarvik ! "" "
511	NA	" "" Väga hea . "
511	NA	 Ma ootasin teda . 
511	NA	" Ta on täpselt seal , kus pidigi olema . "" "
511	NA	 Kiiresti kontrollis Zeman veel seiretablood , enne kui viimase välja lülitas . 
511	NA	 Nüüd olid nad ainult oma eneste kõrvade ja silmadega . 
511	NA	 Nojah , ja Zemani ammuga ka . 
512	NA	" "" Pikali , "" käsutas mees ja rabas Estrada käega enda kõrvale lehtede vahele . "
512	NA	 Kiiresti tõmbas ta tüdruku pea endale lähedale ja sositas : 
513	NA	" "" Linne , ma usaldan sind ja ma tahan , et sina mind ka usaldaks . "
513	NA	 Meil on vähe aega . 
513	NA	 Kohe jõuavad sinna lagendikule need naised , need viimased kolm tagasitulijat . 
513	NA	 Öösel tõstsin ma himaajadega nende eelmiste laipade , keda sarvik hekseldas , kehaosasid pisut ümber . 
513	NA	 Tõttöelda jäi materjalist veidi puudu ja ma pidin neid veelgi tükeldama . 
513	NA	 Paigutasin nad nii , et koopaelanikud arvaksid , et naised jõudsid peaaegu tagasi , enne kui sarvik neid ründas . 
513	NA	 Kindluse mõttes lasin koidikul koopa juures ka sarviku hääli . 
513	NA	 Nad arvavad nüüd , et sarvik on nende koopa sihikule võtnud , nad kardavad . 
513	NA	 Hommikul hakati jahti organiseerima . 
513	NA	 Sinu odoorlaengust pole see sarvik aga seiretabloo järgi ikka veel päriselt toibunud ja jõlgub koopa ja raja läheduses . 
513	NA	" Jaht algas tund aega tagasi , nad ajavad sarvikut just nende naasejate peale , sättisin laibatükid just nii . "" "
514	NA	 Mingi suurem loom tuhises nende kõrvalt mööda , haistmata peitunud inimeste lõhna . 
514	NA	 Ilmselt oli see rabahunt . 
515	NA	" "" Bent , aga mittesekkumine ? "" "
516	NA	 Zeman pigistas tugevalt Estrada kätt . 
516	NA	" "" Kogu see planeet lendab niikuinii kuradile ja meil pole aega enam antropoloogia magistrikraadidega jännata . "
516	NA	 Laibatükkide ümberseadmisest ei tea mitte keegi , sest himaajade tööandmed on blokeeritud . 
516	NA	 Sarvik ise või kes tahes võis jäänuseid mööda metsa pillutada . 
516	NA	 Pealegi ei hakata seda kontrollima . 
516	NA	 Sinu eksimus laengu seadistamisel on siin määrava tähtsusega , aga ka sellest ei saa keegi kunagi teada . 
516	NA	 Ma olen selle juba unustanud , kuigi oleksin pidanud raporteerima . 
516	NA	 Mul on tarvis , et sa kinnitaksid , et me olime eksperimentaalsetel kaalutlustel lausside ja kaitseülikonnad välja lülitanud , kui sattusime ootamatult jahi ja naasvate naiste vahele . 
516	NA	 Ja edasi tegutsesime vastavalt olukorrale . 
516	NA	" Sarvik oli tarvis eemal hoida . "" "
517	NA	" "" Miks , Bent , milleks see kõik ? "" "
517	NA	 Foogti käsi pigistas tugevamalt Estrada oma . 
517	NA	 Ta ei saanud tunda mehe juuste lõhna , aga ta meenutas selle oma ninasõõrmeisse ja pidas seda ainsaks kaitseks hirmu eest , mis külma hingusena end üle väriseva ihu laotas . 
517	NA	 Estradal oli külm ja ta tahtis pissile . 
518	NA	" "" Need sinu helerohelised vaimud . "
518	NA	 Meil on praegu ainus võimalus neid veelkord näha ja püüda . 
518	NA	 Azarjani kõige võimsamad arvutid peilivad neid praegu . 
518	NA	 Nad võivad olla küll nähtamatud harilikule kaamerale , aga nüüd nad ei pääse ! 
518	NA	 Rohkem võimalusi enam ei tule . 
518	NA	" Mitte iialgi . "" "
519	NA	" "" Kas ma võin hügieenikotti kasutada ? "" "
520	NA	" "" Rooma parem põõsa taha , aga kähku , nad on peaaegu siin ! "" "
521	NA	 Kuid Estrada ei jõudnud põõsa taha , sest sarviku võigas häälitsus kostis juba liiga lähedalt . 
521	NA	 Ja lähedal olid ka jälitajate karjed , kisa ja trampimine . 
521	NA	 Zeman õngitses kohvrikesest metalse kasseti , millest turritasid nooleotsad , seadis selle ammu rauale ning tõmbas vinnastusmehhanismi pingule . 
521	NA	 Kuidagi ei paistnud need nooled just surmarelvadena , selleks olid nad liialt lühikesed ja tömbi otsaga . 
521	NA	 Kuid ikkagi hoomas Estrada relvast õhkuvat harmooniat ja ohtu . 
521	NA	 Relva külge oli kinnitatud optiline sihik . 
521	NA	 Zeman võttis veel kohvri küljetaskust raamitud klaasid , mille ta siis elastse paelaga kukla taha kinnitas , nii et klaasid katsid silmi . 
521	NA	 Estrada teadis , et seda asjandust nimetati prillideks , kuid ta ei suutnud meenutada , milleks täpselt neid kasutati . 
521	NA	 Kuid ta mõistis , et nüüd pidi Zeman sihtima ja olema väga täpne , kui tahtis puude vahelt röhatavale sarvikule pihta saada . 
521	NA	 Kuid ta ei saanud aru , milleks oli vaja põgenevat looma tappa . 
522	NA	 Zeman tõusis kükakile , tõstis ammu õlale , seda kõverdatud käsivarrega põlvelt toetades . 
522	NA	 Siis mees kivistus sekundeiks täiesti liikumatusse asendisse . 
522	NA	 Ta isegi ei hinganud , kuid Estrada oli kindel , et just nüüd luges mees mõttes oma loitsu . 
522	NA	 Midagi tinises , klõpsatas ja Estrada tajus näos äkilist õhupuhangut . 
522	NA	 Hetke pärast kostis võsa vahelt kiunatus . 
522	NA	 Kiunatus ! 
522	NA	 Kes oleks võinud arvata , et see sarviline koletis võib sellist häält teha ! 
523	NA	" "" Kas mööda ? "" sositas Estrada . "
524	NA	" "" Ei , ta sai tabamuse tagajäsemesse . "
524	NA	" Ma suunan teda . "" "
525	NA	" "" Suunad ? "" "
526	NA	" "" Ega's ma teda praegu tappa ei taha . "" "
526	NA	 Kassetist kostis taas klõpsatus , Zeman vinnastas uue noole . 
526	NA	" "" Teda on vaja pisut meie naiste poole ajada ja teda veelgi hirmutada , "" ütles Zeman vaikselt , prillide taga silmi kissitades ja iga sõna vahele pika pausi jättes , nagu teeb millelegi keskenduv inimene . "
526	NA	 Uus tinin ja vuhin , uus kiunatus , Estrada ei näinud sarvikut puude vahel , kuid teadis ja kuulis , et loom on lähedal . 
526	NA	 Kuidas ta suutis küll puude vahelt lasta ? 
527	NA	" "" Aga nooled , Bent ? "
527	NA	" Need ei tohiks ju siia jääda . "" "
528	NA	 Järjekordne nool läks teele . 
528	NA	 Mees keeras end ja vaatas Estradale teravalt otsa . 
529	NA	" "" Lõpeta ükskord see pärimine , sa segad mind . "
529	NA	" Mine kuse ja ole ükskord vait ! "" "
530	NA	 Estrada kahvatas , välgunooled lõid tema teadvusesse lõõmava valulöögi . 
530	NA	 Zemani kuju hägustus ta silme ees , kurku tõusis soolane klomp , kuskil nina ja silmade vahel hakkas äkitselt tervalt pitsitama . 
530	NA	 Ta oli uskunud , et on unustanud , kuidas nutta , sest viimane kord oli ta seda teinud siis , kui kuulis Berkovski Xamnahthu surmast . 
530	NA	 Ta pööras pea ja nuuksatas . 
531	NA	 Aga Foogt ei reageerinud , sest seadis uut kassetti vinnale . 
531	NA	 Kassetti , millest turritavad nooleotsad olid palju teravamad . 
532	NA	 Dhaka 45. 
532	NA	 Ardaman ; kell 12.15 
533	NA	 Tal oli akumulaatoriga laserpüstol , kaitseturvis ja hügieeniisolatsioon , mis ainsana kogu varustusest töötasid . 
533	NA	 Viimast kasutas Dhaka süstikus ja jättiski selle sinna . 
533	NA	 Kaitseturvisest ei pidanud suuremat abi olema , kuid laserpüstoli jättis ta igas juhuks alles . 
533	NA	 Asefoogtil on siiski mõned omad privileegid ja mitte kõiki neist ei saa Foogt blokeerida . 
533	NA	 Kuid võimalus püstoli kasutamiseks oli niigi minimaalne . 
533	NA	 Seiretablood tal ei olnud , kuid naine lootis oma instinktidele , olid need ju viimaste aastate jooksul aina teravamaks muutunud . 
533	NA	 Ta saab hakkama . 
534	NA	 Ülesanne number üks , kinnitas Dhaka endale , on leida Foogt ja teatada talle , et ta peab viivitamatult Pesasse laekuma , kuna Azarjanil on signaal 'Robinson1' . 
535	NA	 Ülesanne number kaks on selgitada välja , mis mängu Foogt Capaneusil mängib ja kas siit kuskilt ei paista mittesekkumise rikkumist . 
536	NA	 Poole tunni pärast oli ta võsastunud välul , kust viimast korda oli Zeman ja Estrada peiling kinni püütud . 
536	NA	 Vaatlejaoskused polnud Dhakas taandunud , ta suutis endiselt hääletult liikuda , ürglooduses orienteeruda , olla hääletu ja nähtamatu nagu jahti pidav kikiimora . 
537	NA	 Siis kuulis ta hääli ja tardus . 
537	NA	 Hääled kuulusid otseselt koopainimestele — artikuleerimata kisa , hõiked , möirgamine . 
537	NA	 Sekka kostus jooksumüdinat ja ragisevate oksade praksatusi . 
538	NA	 Dhaka heitis end kiiresti pikali ja kuulatas terasemalt . 
538	NA	 Aga midagi oli valesti . 
538	NA	 Mitte hääled ei lähenenud temale , vaid tema ise oli äkitselt sattunud häälte keskele . 
538	NA	 Oli jahikära , kuid mitte jahinaised . 
538	NA	 Häälte tekitajad oleksid pidanud olema siinsamas , tema ümber , taga ja ees . 
538	NA	 Heli oli , aga pilti mitte ... 
538	NA	 Ta kergitas pead ja silmitses terasemalt ümbrust . 
538	NA	 Igal helil peab olema tekitaja ja iga heli võib olla esmane või taasesitatav . 
538	NA	 Kullipilk puulatvadesse andis talle vastuse . 
538	NA	 Ja Zeman oli öösel kasutanud dilloneid . 
539	NA	 Dhaka tõusis ja liikus ettevaatlikumalt edasi . 
539	NA	 Tasapisi hakkas ta kõrv eristama uusi hääli . 
539	NA	 Ja midagi oli neist teistsugust . 
539	NA	 Nad olid ehedamad . 
540	NA	 Kui ta veel ühe puhmastiku vargsi silme eest kõrvale lükkas , ta nägi . 
540	NA	 Ja tahtis samas , et ta poleks seal olnud , et Foogti rahulik hääl vastaks talle kuularites , nagu alati oli seda teinud . 
540	NA	 Sest tegelikult polnud ta jahtiv kikiimora , oli vaid pelgalt laserpüstoliga varustatud naisterahvas vaevalt paar sammu eemal kohast , kus sarvik raevuses vihahoos oma ohvreid tükeldas . 
541	NA	 Aga püstoli kaba hakkas talle ikka alluvalt ja kuuletuvalt pihku . 
542	NA	 Bent vris Zeman 45. 
542	NA	 Ardaman ; kell 12.24 
543	NA	 Jahiseltskond oli maha jäänud ja nii see pidigi olema . 
543	NA	 Ta oli suunanud paaniliselt hirmust segi aetud sarvikut nii , et ta üha enam kiiremini tagaajajate käest pääseks . 
543	NA	 Ja ilmselt kannatas loom ka endiselt Estrada odoorlaengu shokist . 
543	NA	 Aga kaks tömbimat noolt olid liiga innukaid jahimehi pisut tagasi hoidnud ja edasi oli mänguväli Zemani päralt . 
544	NA	 Koopainimesed olid oma ülesande täitnud — sarvik oli minema aetud ja oht sedapuhku möödas . 
544	NA	 Tõsi , tegu oli kunstlikult esilekutsutud ohuga . 
544	NA	 Kuid mittesekkumine oli niigi ajalugu . 
545	NA	 Estrada tihkus Foogti selja taga põõsastes nutta , ka temaga tuli veel tegelda , kuid see polnud praegu nii oluline . 
545	NA	 Ta pidi lootma sarviku modelleeritud käitumise algoritmidele , tema psüühika tundmisele , vedamisele ja õnnele . 
545	NA	 Enesealalhoiuinstinkt on üks vanimaid bioloogilisi realiteete ja harilikult toimib ta igas maailmas samamoodi . 
545	NA	 Ohutunne , selle defineerimine , vaenlase märkamine , loogiline tegevus rünnaku tõrjumiseks — kõike seda sarvik tundis . 
545	NA	" Kaks Konservatooriumi zooloogi oli Capaneusi sarvikust ju lõppeks oma "" doktorid "" kirjutanud ja Zeman oli neid töid lugenud . "
545	NA	 Sest ta luges palju ja peaaegu kõike , mida Pesa produtseeris . 
545	NA	 Kuid nüüd oli loom olnud paranoilises jälituses ja jõudis välja täpselt õigeks ajaks sinna , kuhu pidi . 
545	NA	 Ta ei saanud teada , et tagaajajad olid maha jäänud , sest hääled kostusid ikka veel . 
545	NA	 Igaks juhuks oli Zeman öösel himaajadega ka sarviku läänepoolse põgenemistee katnud , sinna said paigutatud kõlarid nagu koopa juurdegi . 
545	NA	 Ainult koopaelanikele mängiti raevunud sarviku hääli ja sarvikule ajujahi omi . 
546	NA	 Sarvik oli piiramisrõngas , sest idakülge kattis Zeman oma nooltega , mis looma vaid õrnalt vigastasid ja teda vast ka rohkem marru ajasid . 
546	NA	 Ja kui zooloogide tööl üldse mingit väärtust on , siis sarviku käitumine saab olla ainult ühene . 
547	NA	 Ta ründab . 
547	NA	 Sissepiiratud sarvik ründab alati . 
547	NA	 Ta oskab ja tahab inimesi rünnata , aga ta ei tee seda hulljulgelt ega arutult . 
547	NA	 Ta ründab kohta , kus piiramisrõngas kõige nõrgem on . 
547	NA	 Nii on ta alati teinud . 
547	NA	 Ja nii teeb ta ka täna . 
548	NA	 Neile hetkedele seal Capaneusi ürgmetsas on Zeman hiljem tihti tagasi mõelnud . 
548	NA	 Ta küsib endalt , kas ta tegi midagi valesti või kas ta täna talitaks samamoodi . 
548	NA	 Ja ta ei tea vastust . 
548	NA	 Loomulikult ta riskis , kuid seda oli ta teinud eluaeg . 
548	NA	 Loomulikult rikkus ta mittesekkumise põhimõtteid . 
548	NA	 Kuid nendel ei saanud siis enam mingit tähtust olla . 
548	NA	 Muidugi ületas ta oma võimu piire . 
548	NA	 Aga Zeman on parun ja rüütel . 
548	NA	 Kui on vaja võidelda , ta võitleb . 
548	NA	 Ja kui tal on ülesanne , ta lahendab selle . 
549	NA	 Ta oli kõike arvestanud õigesti . 
549	NA	 Sarvik , jahinaised , hääled , Azarjani kompuutrid , ustav Estrada ... 
550	NA	 No ja ettenägematud tegurid on ettenägematud tegurid . 
550	NA	 Nendega ei saa arvestada . 
551	NA	 Sarvikul polnud orienteerumisaega tarvis . 
551	NA	 Mets , hääled ja hullunult teravad meeled saatsid ta viharöhkimise saatel naistele kallale . 
551	NA	 Rünnak oli ootamatu ja heitlus kiire . 
551	NA	 Naised olid väsinud ja kurnatud , nad peaaegu ei jõudnuki vastu hakata , ennast kaitsta , põgenemisest rääkimata . 
552	NA	 Pisut varem , kui raevunud loom neist mõnekümne meetri kauguselt mööda tuhises , haaras Zeman tihkuvalt Estradalt käest ja sundis teda endaga kaasa jooksma . 
552	NA	 Nad pidid lähemalt nägema . 
553	NA	 Tüdruk oli nutmise lõpetanud , ta huuled olid tugevalt kokku surutud ja kui ta küürakil jooksis , tundis Zeman Estrada näos sõnatut küsimust . 
553	NA	 Õieti oli see ootus ja palve . 
553	NA	 Kuid veel polnud Foogtil aega tüdrukut rahustada , ta pigistas vaid tema sõrmi ja vedas teda enda järel . 
553	NA	 Siis , kui kostis esimene karje , rebis ta Estrada uuesti pikali . 
553	NA	 Nüüd olid nad parajas kauguses . 
553	NA	 Ja Zemanil polnud tarvis mingeid kaameraid ega salvestusatribuute . 
553	NA	 Azarjani peilinguarvutid tegid ise kõik , mis vaja . 
553	NA	 Tema aga tahtis , pidi ! seda kõike oma silmaga nägema . 
553	NA	 Sest ainult nii tekib Zemanis emotsioon ja teadmine . 
553	NA	 Neid vaime polnud määratud näha kaamerasilmale , sest needki olid hariliku tehnilise jälgimise eest blokeeritud . 
553	NA	 Nii lihtne see oligi ! 
553	NA	 Ju nad siis aimasid ette ... 
553	NA	 Kuid Azarjani kompuutrite vastu nad juba ei saa . 
553	NA	 Ja kui isegi saavad , siis ikkagi jääb Zemanile tema mälupilt . 
554	NA	 Kui Estrada taipas , millist etendust tal taas jälgida tuleb , katkestas ta oma vaikimise ja sosistas : 
555	NA	" "" Ma ei taha , Bent , palun , mitte enam ! "
555	NA	" See on sama sarvik , ma tundsin ta ära . "" "
556	NA	 Kuid Foogt ei vastanud . 
