par_nr	head	sentence
336	NA	 Just selline suur , soe , hea tunne nagu sünnipäevahommikul . 
336	NA	 Vaevalt viie minuti eest oli ta kahjutorkega südames unepehme kompsu oma sülest ära andnud , astunud siia vingesse ja võõrasse maailma . 
336	NA	 Marit oli kogu öö oodanud seda tundi , kui ta sinna katusealusesse tillukesse korterisse siseneb ja lapsega kahekesi jääb . 
336	NA	 Kolleeg pidi korraks ära sõitma , ta oli Mariti appi palunud . 
337	NA	 Esimesel ümbermähkimisel oli naise tundlik nina hapukat vinet hoomanud . 
337	NA	 Imiku kubemevoltide põhjad punetasid pisut , neisse oli siginenud valkjat eritist . 
337	NA	 Muidugi oleks vannitamisega ka õhtuni oodata võinud . 
337	NA	 Küllap see emal nii plaanis oligi . 
337	NA	 Kuid Marit ei mallanud oodata . 
337	NA	 Õe laste juures õpitust piisas . 
337	NA	 Ta tegi sooja vee , kontrollis vilunult küünarnukiga temperatuuri ja tõi väikese poisi köögilauale . 
337	NA	 Pliit oli ruumi selleks ajaks juba palavaks ajanud . 
337	NA	 Nii võis külmetamist kartmata pikendada seda naudingut , pesta lasteseebi lahusega hellalt väikest , mõnutundest kilkavat ja jalgadega põtkivat keha . 
338	NA	 Kui noor ema õhtu hakul tagasi jõudis , leidis ta lapse Mariti süles õndsalt magamas , tühi lutipudel laual . 
338	NA	 Natuke nagu järsult võttis ta Maritilt lapse ja asetas voodisse . 
338	NA	 Oli ta tõesti kade ? 
339	NA	 Auto jäi seisma ja Marit ärkas kujutlusest . 
339	NA	 Kas ta siiski liiga kauaks polnud unistama jäänud ? 
339	NA	 Ta vajutas linki ja tõukas õlaga ust , taibates liiga hilja , et oli selle hoopis lukku pannud . 
339	NA	" Järsult keeras ta lingi vastasasendisse ja kuulis samas pehmes toonis lausutud sõnu : "" Üks hetk , palun ! "" "
340	NA	 See kohtumine pidi juhuslik olema ! 
340	NA	 Kuidas oleks Ivo teadnud teda seal teel varitseda ? 
340	NA	 Ärritusseisundist kumas aga samal ajal läbi muhelema sundiv kujutlus - ta tõstab imiku kausist , hoiab kätel , et lasta veel nõrguda . 
340	NA	 Naerma luksatades , päästab poiss valla kaarja kuldkollase joa ... 
341	NA	" "" Me oleme mõlemad üksi , "" ütles mees . "
341	NA	" "" Milleks teeselda ? "" "
342	NA	" "" Kes teeskleb ? "" küsis Marit . "
343	NA	" "" Meie mõlemad . "
343	NA	 Ütlen ausalt , mul on üksi igav ja paha . 
344	NA	 Ja teie ei sõida ka maale . 
344	NA	" On mul õigus ? "" "
345	NA	" "" Ei , "" tahtis Marit turtsuda , kuid vaikis . "
346	NA	" "" Kui keegi nii kaunilt ja vanamoeliselt küsiks , kas mul on ka tõsised kavatsused , siis ma ütleksin , et mul ei ole mitte mingeid kavatsusi - mitte mingeid , ma kordan . "
346	NA	 Me pole teineteise omand . 
346	NA	 Ma pakun praegu - sõidame kuhugi . 
346	NA	 Mul on viis-kuus liitrit bensiini . 
346	NA	 Ajame juttu , jalutame Me ju ei tea veel üldse , kas tahamegi midagi rohkemat . 
346	NA	" Me ei tunne ju teineteist . "" "
347	NA	" "" Miks te Kairit ei kutsu , "" tahtis Marit nähvata , kuid mõistis väga hästi , et see oleks jutu lõpp . "
347	NA	" Ta ütles hoopis : "" Ei taha jalutada . "
347	NA	 Liiga külm on . 
347	NA	 Tulge parem üles , ma keedan kohvi . 
347	NA	 Või veel parem , viige auto ära ja tulge natuke hiljem . 
347	NA	" Ma panen seni midagi pannile . "" "
348	NA	" "" Kutsuksin teid meeleldi enda poole , kuid mul pole isegi kahte taldrikut , "" pomises Ivo . "
348	NA	 Kui ta ära sõitis , saatis Marit teda silmadega ja talle meenus , et kakaokreem on ikka alles külmutuskapis . 
349	NA	 * * * 
350	NA	" "" Ja kuidas sind koolis hüütakse ? "" "
350	NA	 Marit oli vist natuke vinti jäänud . 
350	NA	 Tal oli nii kerge ja soe olla . 
350	NA	 Kirsimaitse oli tal huultel . 
350	NA	 Ja ta tundis , nagu oleks punane liköör ta huultelegi puna andnud . 
350	NA	 Need kuumasid . 
351	NA	 Ivo raputas pead - vaevalt see teema meeldib . 
351	NA	 Hüüdnimed on enamasti ikka sõimunimed . 
351	NA	 Mees oli oma magustoidu lõpetanud ja lutsis nüüd mõnuga hõbelusikat . 
351	NA	 See vahtis ta suust nagu longus nokk . 
351	NA	 Ja naljakal moel ei olnud see kole . 
351	NA	 Niiviisi võib kommete vastu eksida vaid see , kes väga hästi teab , mille vastu ta eksib ja kes neid kombeid ka laitmatu vabadusega täita oskab . 
351	NA	" "" Tahad , ma mängin sulle parem midagi ? "" "
352	NA	" "" Millega sa mängid ? "
352	NA	" Selle lusikaga ? "" "
353	NA	" "" Miks mitte ! "
353	NA	" Kas sa Rogersi "" Oklahomat "" tead ? "
353	NA	" Tahad , ma mängin "" Valge tõlla laulu "" ? "" "
353	NA	 Ja Ivo hakkaski lusikat suust võtmata altsaksofoni imiteerima . 
353	NA	 Ta sõrmed jooksid kujutletavatel klappidel , pöidlad toetasid pilli alt . 
353	NA	 Ta joonistas sellega õhku kaheksaid . 
353	NA	 Siis võttis lusika suust , laulis ja imiteeris kätega jooksvate hobuste kapju . 
353	NA	 Klip , klip-klapp , ta , taa , ta-ta-taa-ta . 
353	NA	 Valge tõld sõidab teel Nad naersid . 
354	NA	" "" Mängid sa ikka veel pilli ? "" "
355	NA	" Ivo tõsines , raputas pead , "" Ei enam , ammugi enam mitte . "" "
355	NA	 Ta ei tahtnud pikemalt rääkida . 
355	NA	 Nad olid joonud mõlemad vaid paar tillukest pitsi likööri . 
355	NA	 Lõõgastus oli pärit toasoojusest ja vist ka sellest , et pinge nende vahelt kadunud oli . 
356	NA	" "" Ja ikkagi tahan ma su hüüdnime teada ! "" jonnis Marit . "
357	NA	" "" Minu teada on neid kaks , "" ütles Ivo vastu tahtmist . "
358	NA	" "" Enne hüüti Lipa-lapa . "
358	NA	 See on perekonnanimest - Lepala . 
358	NA	 Aga selles on midagi olemuslikku ja see on solvav . 
358	NA	" Viimased aastad olin Master Soap . "" "
359	NA	" "" Seep ! "
359	NA	" Issand , selline kole nimi ! "" "
360	NA	" "" Kuidas võtta , "" pomises Ivo , ise mõtles - mis see Kultuura parem on ! "
360	NA	 Oo ! oli Kairi öelnud - Kultuur ja Kultuura . 
360	NA	 Peebu mamps on Kultuur , kuigi on pisem ja naiselikum Mis sa selles lesbis leiad ? 
360	NA	 Ja kui Ivo skeptiliselt vaikis , lisas - Peep ju teab ! 
361	NA	 Kas see poiss räägib oma ema sel viisil taga ? 
361	NA	 Ivo ei tahtnud hästi uskuda . 
361	NA	 Aga midagi täpsemat ta tüdrukult ei kuulnud ja pärimast keelas teda sisetunne . 
362	NA	 On selliseid inimesi , kellel võitlustaktika on sünnipäraselt veres . 
362	NA	 Kairi oli üks neist . 
362	NA	 Küllap ta aimas , et kui Marit veel rääkinud ei ole , siis võib ta seda teha , ja rääkis ise - kaks aastat tagasi , ühes suusalaagris vedanud ta kihla , et läheb Peebu voodisse . 
362	NA	 Poiss oli kõigi ühine suur sümpaatia ja Kairil oli isu ühele sõbrannale kätte maksta . 
362	NA	 Dressis ! täpsustas plika . 
362	NA	 Sellest polnud kihlveos juttu . 
362	NA	 Ja ka ajast ei olnud juttu . 
362	NA	 Lihtsalt läheb . 
362	NA	 Aga enne kui sõbrantsid , sai Kultuura jaole . 
362	NA	 Küllap keegi mainis talle ! 
362	NA	 Sellest ajast vihkavat ta Kairit . 
362	NA	 Muud tal polnudki kui Peep ees ja Peep taga . 
363	NA	 Armastav tädikene ! 
363	NA	 Sellest peale jättis poisi vähemalt teiste ees rahule ... 
364	NA	" "" Miks sind nii koleda nimega kutsutakse ? "" painas Marit ühtesoodu . "
365	NA	" "" Kuidas võtta ! "" kordas Ivo . "
365	NA	" "" See nimi on teenitud . "
365	NA	" Igatahes parem kui eelmine . "" "
366	NA	 Need olid ta endised õpilased , Toomiste ja Rudnev , kaks kunagist kõõmapead , IQ kummalgi mitte üle 80. 
366	NA	 Kuid nähtavasti olid nad oma punktid õigetelt jahimaadelt korjanud . 
366	NA	 Igatahes sõitsid nad maja ette tuttuue 08-ga , tulid lahtinööbitud suvemantlite lehvides paraadukse poole . 
366	NA	 Ivo jälgis neid ükskõikse pilguga oma kabineti aknast . 
366	NA	 Ta ei aimanud veel , et poisid tulevad tema elu uut peatükki sisse juhatama . 
366	NA	 Enne nii rasvased ja kammimata pead särasid nagu esindusjuuksuri reklaamipildil . 
366	NA	 Mantlite all olid laitmatud hallid ülikonnad ja hästi seotud lipsud . 
366	NA	 Nad käitusid vabalt ja enesekindlalt . 
366	NA	 Üksnes nende veendumus , et nad õpetaja Lepala või siis nende jaoks tõepoolest Lipa-lapa nõusse saavad , see asja ettemääratuse toon häiris Ivot natuke . 
366	NA	 Nad ju ei tahtnudki muud kui vaid teada , kuidas keedetakse seepi . 
366	NA	 Oli aasta 1986 ja perestroika oli edenenud sinnamaale , et riigil oma kodanikele enam pesuvahendeid pakkuda polnud . 
366	NA	 Ivo seletas poistele - rasva , naatriumhüdroksiidi , männivaiku või kampolit ja natuke soola Peenematele tualettseepidele veel üht-teist , glütseriini näiteks , lõhnakomponente . 
367	NA	 Poistel oli kaasas kolmeliitrine purk millegi hallikaspruuni ja võikalt haisvaga . 
367	NA	 Puhastusseadmete rasvafiltritest , läheb prügimäele , seletati talle . 
367	NA	 Kas sellest saab ? 
368	NA	 Alles hiljaaegu oli kalatööstus lasknud teha analoogilise tellimustöö - kuidas kalarasva jäätmeist šampooni keeta . 
368	NA	 Ivo ei teadnud sellest tehnoloogiast suurt midagi , kuid keemikuna aimas teed , mida mööda tuleb minna , et sellest jälkusest puhtad rasvhapped kätte saada . 
368	NA	 Jõuti asja ärilise küljeni ja siin laskis ta end muidugi alt tõmmata . 
368	NA	 Esialgu ei olnud poistel talle midagi pakkuda , ent kui tehnoloogia õnnestub ja rahuldavaid tulemusi annab , saab ta kogu tootmistsükli jooksul 20 % puhaskasumist . 
369	NA	 Ivo Lepala oli selleks ajaks kaksteist aastat õppejõu ametit pidanud . 
369	NA	 Naine ootas kolmandat last . 
369	NA	 Nad elasid ikka alles Pelgulinnas kahest tibatillukesest toast ja köögist koosnevas korteripugerikus . 
369	NA	 Ja polnud üldse lootustki , et ta midagi paremat saada võiks . 
369	NA	 Rallisõit kui kulukas ajaviide oli viinud neid selleni , et ta ei saanud endale isegi uut ülikonda lubada . 
369	NA	 Sellest ajaviitest oli ta juba loobunud . 
369	NA	 Tuli loobuda ka saksofonimängust , sest seegi ei toonud midagi sisse , ja aega vajas ta nüüd laboritööks . 
369	NA	 Poole aasta pärast esitas ta AS ToRu-le , mis koosnes Toomistest ja Rudnevist ja veel kellestki mr . 
369	NA	 X-ist , täieliku tehnoloogilise tsükli koos tootmisliini projektiga . 
369	NA	 Teatavate lihtsustuste ja labastamiste hinnaga saadi see käima ja turule ilmus roosakas ning natuke imalmagusalt lõhnav seep . 
369	NA	 Esialgu polnud muidugi mingit puhastulu , sest võlad oli vaja maksta . 
369	NA	 Aasta lõpul aga hakkasid honorarid siiski tilkuma . 
369	NA	 Paistis , et mees oli teinud oma suure slämmi ja võib oma töövilju nautidada . 
369	NA	 Raha muidugi piisas vaid kõige hädavajalikumaks . 
369	NA	 Nad said riided selga ja naine ostis vitstest punutud lapsevankri . 
369	NA	 Siis aga tuli kurb sõnum - AS ToRu on lakanud eksisteerimast ja müünud kogu tehnoloogia AS Eldoradole , kellel pole Ivo Lepala ees loomulikult mingeid kohustusi . 
369	NA	 Ta uuris välja , et see Eldorado koosnes kellestki mr . 
369	NA	 X-ist , Rudnevist ja Toomistest . 
369	NA	 Jurist lahutas käsi - lepingus oleks pidanud olema punkt tehnoloogia müümise tingimuste kohta . 
369	NA	 Kui ta tahab , võib ju riskida ja püüda kohtule tõestada , et teda on tüssatud Kuid mis keelab neil sulidel veel kolmandat aktsiaseltsi loomast , kus pole ei Rudnevit , Toomistet ega mr . 
369	NA	 X-i , vaid tundmatu elupaigaga Juhan Lepp ja Co ? 
370	NA	 Selleks ajaks oli Ivogi juba üht-teist taipama hakanud . 
370	NA	 Ta oli ärimaailmaga kokku puutunud ja oskas korraldada nii , et tema keemiaklassi marssisid sisse nahktagides tõmmud mehed , kaasas piimaplekitäis rasvafiltrite eraldusprodukti . 
371	NA	 Pärast sündsat kolmenädalast vaheaega helistas Ivo ja käskis tehnoloogiaprojektile järele tulla . 
371	NA	 Ta nimetas summa . 
371	NA	 Selle peale teises toruotsas ainult köhatati . 
371	NA	 Tõele au andes ei esitanud Ivo neile siiski lihtsalt ToRu tehnoloogia ärakirja . 
371	NA	 Ta oli kirjelduse uuesti vormistanud , jaganud selle rohketeks punktideks ja veel ka alapunktideks , oli lisanud iga lõigu ajalise kestuse . 
371	NA	 Ta ulatas kausta ja sai vastu rahasumma , mida poleks uskunud kunagi korraga käes hoida võivat . 
371	NA	 Ja ometi oli see vaid kolmandik tema nimetatust . 
371	NA	 Ülejäänu saab siis , kui asi vastuvõetavaks tunnistatakse . 
371	NA	 Ivo soostus . 
371	NA	 Läks terve nädal , enne kui talle helistati - kus on 45 minutit tehnoloogilisest tsüklist ? 
371	NA	 Ta lubas vaadata ja vabandas samas . 
371	NA	 Tõesti , üks leht oli köitmisel välja jäänud . 
371	NA	 Tal oli väga piinlik . 
371	NA	 Nii võib jääda mulje , et ta tahtis kedagi petta . 
371	NA	 Ta ütles ka aja , millal järele võib tulla . 
371	NA	 Koos puuduva rahasummaga . 
372	NA	 See oli vahetund . 
372	NA	 Ta istus kateedris , tema ees kees väikesel gaasitulel liitri jagu mingit haisvat vedelikku . 
372	NA	 Temale sai läheneda vaid kateedri avatud otsa poolt ja sinna oli ta seadnud taburetile anuma seebikivilahusega . 
372	NA	 Retordis kees väävelhape ja gaasipõleti tillukese leegi võis ainsa pöidlalükkega muuta meetriseks tulelondiks . 
372	NA	 Ta sai rahapakid , loendas need üle , libistas sõrmega üle nurkade - ei , keskel ei olnud ajalehepaber , vaid ikkagi rublad . 
372	NA	 Raha laualt koristamata võttis ta sahtlist paberilehe ja ulatas meestele . 
372	NA	 Ning pühkis raha samasse sahtlisse . 
372	NA	 Mehed lugesid paberit , vaatasid teineteisele otsa , vaatasid Ivot . 
372	NA	" "" Maladets , drug ! "" ütles tõmmum nahktagi ja nad hakkasid naerma . "
373	NA	 Koridoris helises kell ja klassiruum täitus tüdrukutest . 
373	NA	 Tasa vandudes ja pead vangutades kadusid keemikud uksest välja . 
373	NA	 Ivo üritas tõusta , et tundi alustada , kuid jalad ei kandnud . 
374	NA	 Paberil , mille ta oli meestele ulatanud , seisis kirjas vaid üks alapunktideks jaotamata tehnoloogialõik : 2h35' - 3h20' segu jahutatakse veega kuni temperatuurini 45°C . 
375	NA	 Nad said isegi odavalt , ütles Ivo Maritile . 
375	NA	 Tootsid kuni krooni tulekuni ja vedasid Venemaale . 
375	NA	 Vastu tõid sütt ja autosid . 
375	NA	 See oli paljude miljonite äri . 
375	NA	 Muuseas , keegi Eldoraado meestest oli lihakombinaadi õuel kuuli reide saanud . 
376	NA	 Õppejõud Lepala ei olnud enam mingi Lipa-lapa . 
376	NA	" Mees sõitis sestpeale hoovi päris kobeda "" Regattaga "" , kandis korralikku ülikonda , ja teati rääkida , et ta on kolinud neljatoalisse kõigi mugavustega korterisse . "
376	NA	 Sellest ajast saadik oli ta Mr. Soap . 
377	NA	 Ivo tänas perenaist ilusa õhtu eest ja väljus . 
377	NA	 Hilisõhtu oli veel vingemaks ja vastikumaks muutunud . 
377	NA	 Tuul tõi harvu läbi riiete nõeluvaid vihmapiisku . 
378	NA	 Oma raudvoodis , kurguni teki all sooja saanud , mõtles Ivo tagasi tänasele päevale ja muigas kurvalt . 
378	NA	 Teada ju on , mis sellest loost tuleb . 
378	NA	 Mis mõtet on end petta . 
378	NA	 Ühe otsuse tegi ta siin praegu endale teatavaks - omaalgatuslikult ei astu ta Maritile ainsatki sammu lähemale ega anna mingit lootust , mingeid lubadusi . 
379	NA	 * * * 
380	NA	" "" See oli tegelikult Pyrrhose võit , "" ütles Ivo . "
380	NA	 Nad jalutasid Mõdriku mõisapargis , tulid omapärase , maja poolitava läbikäigu kaudu sissesõiduteele ja pöörasid silla poole . 
380	NA	 Oli punane õhtutund . 
380	NA	 Nad olid sõitnud siia bussiga , et lihtsalt paigaga tutvuda ja siis järgmisega Rakverre naasta . 
380	NA	 Kuid selgus , et täna , pühapäeval , käis busse poole vähem . 
380	NA	 Nüüd olid nad viimast sõiduvõimalust oodates lausa hilja peale jäänud . 
381	NA	 Ivo lonkis laisalt , pöidlad püksirihma vahele torgatud . 
381	NA	 Marit käis ta kõrval , hoides kahe käega mehe küünarnukist kinni . 
381	NA	" "" Räägi veel midagi endast , "" oli ta palunud . "
382	NA	" "" Härra käis nüüd riides ja elas neljatoalises ja sõitis välismaa autoga . "
382	NA	 Ja see kõik maksis raha . 
382	NA	" Ja katsu sa lastele veel midagi lihtsat selga saada , kui nad on juba kord neid nimesiltidega hilpe proovinud . "" "
383	NA	 Aga uusi seebikeetjaid ei ilmunud kusagilt . 
383	NA	 Oma olemuselt oli Ivo tüüpiline kodanlane . 
383	NA	 Tema suguselts oli täis arste , kohtunikke , apteekreid Vana vabariigi ajal olevat ta emapoolne vanaisa suurärimees olnud , kartulieksportöör . 
383	NA	 Tegelikult küll vist ainus tõesti markantne kuju terves vahmiilis . 
383	NA	" Mõisaaedniku kaheklassilise haridusega pojast meheks , kellel "" Kuldlõvis "" alaline oma number oli , kelle ees portjeed uksi lahti rebisid . "
383	NA	 Tema oli self-made-man . 
383	NA	 Ivo ei olnud seda juba loomult . 
383	NA	 Ta arvas , et kui haritud inimene teeb oma tööd , pealegi veel nagu tema - topeltkoormusega , siis peab ta sellest ka inimese kombel ära elama . 
383	NA	 Ent ühiskond arvas selles asjas sootuks midagi muud . 
383	NA	 Ja tuli välja kurioosum . 
383	NA	 Selleks , et elada , nagu see temale kohane , tuli haritud keemikul loobuda osast tunnikoormusest ja võtta lisaks mootorihäälestaja koht ühes autoteeninduse firmas . 
383	NA	 Sel ajal , kui valdav enamik siinsetest tuusadestki veel Togliatti linna toodetega ringi käristas , leidus nende hulgas piisavalt seesuguseid , kes igatsesid , et nende sõiduriist kõigist teistest nobedama minekuga oleks . 
383	NA	 Poolteist aastakümmet ralliklubis olid Ivole mootorite hingeelu tundmisel hea kapital . 
383	NA	 Ta töötas pikaldaselt ja põhjalikult . 
383	NA	 Kogu bensiini tee paagist summutini ja elektri tee generaatori rihmast massilülitini sai üksipulgi üle käidud , aparaatidega paika pandud , nii et pedaalist tuli just nii palju , kui sealt üldse tulla võis . 
383	NA	 Ja selle eest maksti . 
383	NA	 Kuid selgus , et ta oli jällegi halb ärimees . 
383	NA	 Vastikusest kätemäärimise vastu ja jõudluse nimel oli ta ikka mõnda abilist enda ja mutrivõtme vahel hoidnud . 
383	NA	 Ühel kenal päeval leidis ta , et firma ei soovi enam seda kallist meest palgal pidada . 
383	NA	 Poisid teadsid nüüd isegi , mida teha . 
383	NA	 Tehti räpakamalt ja lünklikumalt , ent siiski niipalju , et omanik vahet tunneks . 
383	NA	 Mis puudu jäi , selle andis juurde rääkida . 
383	NA	 Käes olid ka kõige kitsamad ajad üldse , metsik inflatsioon , krooni tuleku šokk ja bensiinihinna pöörane tõus . 
383	NA	 Ja nii tuligi Ivol soostuda naise töölekippumisega . 
384	NA	 Nad jäid seisma kaarjal kivisillal ja vaatasid , kuidas forellid ojas õhtuse vee kohal suruvaid sääski napsasid . 
384	NA	 Mustapäine mees muigas oma mõtete üle ja vaikis . 
385	NA	" "" Buss tuleb ! "" hüüatas Marit ja nad traavisid tagasi , peatuskoha poole . "
386	NA	 Nagu Ivo poleks teadnud , mida naine kuulda tahab ! 
386	NA	 Teda huvitab ainult üks asi - miks on mees siin ja üksi ? 
386	NA	 Mis juhtus tema abieluga ? 
387	NA	" "" Räägi nüüd sina ka midagi endast ! "" palus Ivo bussis . "
388	NA	" "" Ega see vist auto ja korter ja riided üksi ei olnud , "" arvas Marit teadvat . "
388	NA	" "" Küll seal olid ikka Kirovi saunad ja "" Liivi Lahega "" lõbusõidud ka . "" "
389	NA	 Ivo ei viitsinud lõõpida . 
389	NA	 Liiga pikast jalutuskäigust oli ta lihtsalt väsinud . 
389	NA	 Ja pealegi oli ta jõudnud sinnamaale , et tahtis ise ka aru saada , mis oli siis ikkagi tegelikult juhtunud . 
389	NA	 See vajas kõige möödunu silme eest läbi libistamist ja uuesti hindamist . 
389	NA	" "" Eks need ka . "
389	NA	" Milleks siis raha siin ilmas on , kui seda ei kulutata . "" "
390	NA	" "" Ja ilusad tüdrukud ? "" - "" Jah , ka ilusad tüdrukud , "" nõustus mees . "" "
391	NA	" "" Sa olid sel ajal juba kolme lapse isa . "" "
392	NA	" "" Kas sa mäletad , kui me Viitnal olime ? "" "
393	NA	 Marit tegi mõistmatu näo . 
394	NA	" "" Kas mul oli abaluude küljes midagi , mis valgeid tiibu meenutab ? "
394	NA	 Ja muuseas , ma olen ikka veel kolme lapse isa . 
394	NA	" Ja kolan siin sinuga ringi . "" "
395	NA	 Marit ei vastanud midagi ja vaatas vaikides aknasse . 
396	NA	 Buss oli parajasti linna esimeste majade juurde jõudnud . 
396	NA	 Siit turuplatsini oli veel viie minuti maa . 
396	NA	 Selle aja jooksul ei vahetanud nad silpigi . 
397	NA	" "" Naised esitavad meestele täiesti vastukäivaid nõudmisi , "" ütles Ivo muiates , kui nad üle pikkades õhtuvarjudes turuplatsi läksid . "
397	NA	" "" Selles pole mingit loogikat . "
397	NA	" Kõigepealt soovivad nad võrdsust . "" "
398	NA	" "" On see ebaõiglane ? "" "
399	NA	" "" Ei , üldse mitte . "
399	NA	 Kuid sellega on kummalised lood . 
399	NA	 Sest mehed on ju loomult nii truudusetud . 
399	NA	 Valmis iga lipakaga ringi tõmbama . 
399	NA	" Kas see võrdsuse nõue ei käi äkki ka selle õiguse kohta - ise samuti silma pilgutamata ringi lasta ? "" "
400	NA	" "" Tahad sa mu kannatuse proovile panna ? "" "
401	NA	" "" Võiksin ise sedasama küsida , "" turtsatas Ivo . "
401	NA	 Loomulikult ajab loogika naised õelaks . 
401	NA	" "" Aga siiski - et iga seelik on valmis naiselt nende mehe või kallima käest ära võtma , on ju iseenesest selge . "
401	NA	 Kas siis sellega pole iseenesest tunnistatud naiste moraalitust ? 
401	NA	 Nii et miks pole mees ausam ja truum kui naine ? 
401	NA	" On see siis võrdsus ? "" "
402	NA	 Marit vaikis ja vahtis oma ninaotsa . 
402	NA	 Ivo jätkas : 
403	NA	" "" Iga naine tahaks , et tal oleks mõlema käe iga sõrme jaoks paar austajat . "
403	NA	" Kuusteist , ütleme . "" "
404	NA	" "" Kakskümmend ! "" ütles Marit . "
405	NA	" "" See on siis , kui pöidlad ka ühes lugeda . "
405	NA	 Hästi ! 
405	NA	 Üle ühe naine endale päriselt ei taha . 
405	NA	" Mitu tükki ta tahab siis poissmeheks jätta , viisteist või üheksateist ? "" "
406	NA	" "" Miks siis kohe poissmeheks ? "" "
407	NA	" "" Sest mehele tohib ju meeldida üksainus naine . "
407	NA	 Ja see naine on loomulikult just see naine , mitte keegi kolmas . 
407	NA	 Nii tuleks siis ühe õnneliku paari kohta viisteist või üheksateist poissmeest ja kuusteist või kakskümmend vallalist naist , sest naisi on rohkem . 
407	NA	 Loogiliselt tuleks nüüd järeldada , et kui tahes kena tüdruk peaks leppima ainult ühe imetlejaga ? 
407	NA	 Ilma mingi valikuvõimaluseta ! 
407	NA	 No teate ! 
408	NA	" Või siis täiesti matemaatilise loogika alusel peaks olema selge , et mehele võib meeldida mitu naist , olgu siis korraga või kordamööda . "" "
409	NA	" "" Miks sa seda mulle räägid ? "" "
409	NA	 Mariti kulmud olid tõmbunud ninajuurele kokku . 
410	NA	" "" Lihtsalt selleks , et ühte teemat sisse juhatada . "
410	NA	 See on selline igipõline teema - miks on mehed igavesed lorud ? 
410	NA	" Ja miks on nii paljud naised ütleme siis kenasti kompleksivabad ? "" "
411	NA	" "" Oskad sa siis ütelda , miks ? "" "
412	NA	 Ivo ohkas sügavalt ja hakkas naerma . 
412	NA	" "" Ma arvan , et tuleb loobuda kunstlikust võrdsustamisest . "
412	NA	 Mees on mees oma vedrude ja hammasratastega ja naine on naine . 
412	NA	" Teine on teisest soost loom . "" "
413	NA	" "" Kust lehest sa selle välja lugesid ? "" päris Marit . "
413	NA	" "" "" Maajast "" või "" Nelli Teatajast "" ? "" "
414	NA	" "" Näed siis , juba ongi solvangud platsis , "" naeratas Ivo . "
414	NA	" "" Jumal tänatud , olemegi kohal ja pikemat riidu pole vaja ette võtta . "" "
414	NA	 Ta kergitas kätt ja lahkus kergel sammul , ilus ja rahulikult elegantne , nii et kas või nuta ! 
415	NA	 * * * 
416	NA	" "" Jumal hoidku , ei ! "" ütles Ivo puhtast südamest . "
416	NA	 Marit jäi talle imestusest tummana otsa vaatama . 
416	NA	 See ütlemine tuli küll siiralt . 
416	NA	 Ta oli ometi kõik nii kenasti läbi mõelnud . 
416	NA	 Nad jalutasid linnakalmistul . 
416	NA	 Marit oli Ivole Jakob Liivi hauda näidanud , siis ühte väga head ja mõnda üsna head skulptuuri . 
416	NA	 Aga seda jumalavallatut teemat ei võtnud ta enne ette , kui nad tagaväravast väljas ja raja treppe mööda juba pooles vallseljakus olid . 
416	NA	" "" Nii et sulle siis meeldiks , kui sinu ümber kihab ilusatest tüdrukutest , kes kõik sinusse armunud on ? "" "
416	NA	 Ta teadis , mida ta siis edasi ütleb , kui Ivo soostunud on , kuid mees hoopis eitas . 
416	NA	" "" Kust sa seda võtad ? "
416	NA	 Pole midagi tüütumat kui armunud naine - juhul , kui sa ise temasse armunud ei ole . 
416	NA	 Ja kui neid veel palju on , siis on see ju lausa nuhtlus . 
416	NA	 Ma olen pidanud seda mõnegi korra taluma . 
416	NA	" Ausalt , mulle aitab ! "" "
417	NA	 Marit vihastas . 
417	NA	 Ta peopesad läksid külmaks ja niiskeks . 
417	NA	 Mida see mees endast ometi mõtleb ! 
417	NA	 Ivo vaatas talle kõrvalt näkku ja hakkas naerma . 
417	NA	" "" Ole kallis , ära palun võta südamesse ! "
417	NA	 Kuid tõepoolest , keskkoolis oli üksvahe selline olukord ja instas - tead ju - keemias on igavene tüdrukute vägi . 
417	NA	 Issand , kui tüütu see võib olla , kui üks sulle kogu aeg juhuslikult ukseaugus vastu tuleb , kui teine ennast su külje vastu nühib ja kolmas sulle nii-i ilusate silmadega südamepõhja vaatab . 
417	NA	 Kui sul on korraga kolm austajannat , siis saad kindlasti kaks verivaenlast . 
417	NA	 Ja pealekauba tunned ise , et käitud loomuvastaselt , kui sa seda , mida pakutakse , tänutundega vastu ei võta . 
417	NA	 Tegelikult on ainult üks tee - mitte kellestki üldse väljagi teha . 
417	NA	" Paremal juhul hakatakse sind siis lihtsalt homoks pidama . "" "
418	NA	 Mees rääkis liiga siiralt . 
418	NA	 See polnud kelkimise moodi . 
419	NA	" "" Eks sa olnud ka kena poiss , "" soostus Marit leplikult . "
419	NA	" "" Selline noor paharet . "" "
420	NA	" "" Jah , muidugi . "
420	NA	" "" Ivo naeris . "
420	NA	" "" Mitte selline vana Peltsebul nagu praegu . "" "
421	NA	 Ta tõmbas lehekuulmest mahlaka heinakõrre ja hakkas seda mäluma . 
421	NA	" "" Ma arvan , kui asjad käivad vastu loomulikku suunda , siis ei istu nad kellelegi . "
421	NA	 Kui ma sulle ütleksin , et tean , ma meeldin sulle , siis sa vihastaksid hingepõhjani . 
421	NA	 Sest isane ei tohi mingil juhul soosingule ette kindel olla . 
421	NA	 Ta peab ennast näitama , kohevile ajama , saba liputama , kõrvu kikitama . 
421	NA	 Ja teise isasega purelema , nii et karvatutte lendab . 
