par_nr	head	sentence
183	NA	 Kõik inimesed , kes ei kirjuta , näib mulle , on suhteliselt õnnelikud . 
183	NA	 Mina olen õnnelik vahel ainult siis , kui ma kirjutan , ja vahel siis , kui mul kirjutamine ja üldse kõik meelest ära läheb . 
183	NA	 Kogu ülejäänud aja olen ma sõnade vaevas . 
183	NA	 See on lõputu lausetetegemine , lõputu monoloog . 
183	NA	 Ma ei saa seda rääkida , sest keegi ei kuulaks tundidepikkust monoloogi ( mina küll vahest kuulan , s.t. ma olen lihtsalt vait ja lasen rääkida , sest ma ei oska midagi vastu öelda ja inimesed võtavad seda mõistmisena ) , pealegi , rääkides ma takerduksin , paus tuleks sisse , ma hakkaksin kätega vehkima jne. 
183	NA	 Varem või hiljem jääksin ma toppama , sest ma näeksin , et teine ei saa millestki aru . 
183	NA	 Mingist tema reaktsioonist ma mõistaksin , et mu sõnadel on olnud täiesti juhuslik efekt , sõltuv rohkem sellest , mis sellel teisel parajasti peas on , kui sellest , mis ma öelda tahtsin , seda enam , et ma seda ei teagi . 
183	NA	 Kui mulle öeldakse , mis ma öelda tahtsin , olen ma sellega enamasti kohe nõus . 
183	NA	 Selles mõttes on enda kirjutatu kohta kirjutatut lugeda alati huvitav . 
183	NA	 Ühtlasi saab alati selgeks , et põhiline on ikkagi ütlemata jäänud . 
183	NA	 Iga raamat , iga luuletus , iga artikkel on olnud põletav , häbistav läbikukkumine , sõltumata sellest , kas neid on kiidetud või laidetud . 
183	NA	 Võib-olla mõni luuletus mitte . 
183	NA	 Nende kohta pole osatud midagi öelda , aga mõni on neid lugenud ja noogutanud , ja siis on jäänudki mulje , et ehk seal ikka on midagi , ehk ikka õnnestus midagi öelda . 
183	NA	 Luule on selles mõttes kõige petlikum . 
184	NA	 Aga mind huvitab ikkagi väga , kust tuleb see ebanormaalne , hüpertrofeerunud tahtmine öelda . 
184	NA	 Sellele pakutakse , nii palju kui ma tean , laias laastus kolme seletust . 
184	NA	 Esimene on psühhoanalüütiline , mis seisneb selles , et minus on unbewusste , väljendamatu ehk alateadvus , mis tahab saada väljendatud , aga kuna ta nimelt on unbewusste , siis ta ei saa väljendatud , sest mingi võimas keeld , õigemini hirm on ees . 
184	NA	 Selle asemel , et seda välja öelda , välja oksendada , ma käin nagu kass ümber palava pudru . 
184	NA	 Aga see muudkui vaevab ja vaevab ja siis ma muudkui räägin ja räägin . 
184	NA	 Mu keha , mu teadvus ( või hing , psüühe ? ) mäletab midagi , mida mina ei mäleta , midagi valulikku . 
184	NA	 Midagi on talle tehtud . 
184	NA	 Talt on tema õigus ära võetud ja see on talumatu . 
184	NA	 Õigus tuleb tagasi võita . 
184	NA	 Aga see , mis keelab mulle mu õigust , on minus võimsam kui see , mis teda taga nõuab . 
184	NA	 Siis ma muudkui kirjutangi , teengi sõnu , räägin üksi , sest ükskord mäletamata minevikus ma ei saanud öelda kellelegi midagi eluliselt tähtsat . 
184	NA	 Nüüd on selle ütlemiseks muidugi hilja , aga ma üritan ikka ja jälle , ma olen välja arendanud terve üksirääkimise keele , ma olen seda õppinud muidugi raamatutest , kirjandusest , sellest üksirääkimise kunstist . 
184	NA	 Mul on tunne , et see leevendab , rahustab natuke . 
184	NA	 Aga päriselt see ei aita ja mul on oht lõpetada sama halvasti , kui kirjanikud enamasti on lõpetanud . 
184	NA	 Sest kõik , niipalju kui ma tean , on halvasti lõpetanud . 
185	NA	 Teine seletus oleks ka psühhoanalüütiline , aga selle kohaselt ei pärineks see unbewusste , see väljaütlemata asi , see sõnastamata hirm mitte minu isiklikust minevikust , mitte lapsepõlvest , isegi mitte imikueast , vaid kuskilt eelmisest põlvkonnast , tavaliselt üle-eelmisest . 
185	NA	 Nagu Vanas Testamendis on öeldud , et vanemate patud jne. 
185	NA	 Seda võimalust uurib või sellel teemal spekuleerib transgeneratsiooniline psühhoanalüüs . 
185	NA	 Eile ostsin poest selleteemalise raamatu . 
185	NA	 Vaatame . 
185	NA	 Ja nendest hirmsatest asjadest kaks põlve tagasi , neist pole ju puudu , aga ... 
185	NA	 Aga ma ei oska nendega midagi peale hakata . 
185	NA	 Ma võin ju endale sugereerida , et kõik tuleb sealt ja sealt ja seda mõneks ajaks uskuma jääda ja mõnda aega käia ringi äraseletatud näoga , aga lõpuks tuleb ikka vana ängistus tagasi , lauseteveski hakkab mu peaajus jälle tööle , jälle ma tahan rääkida , rääkida , rääkida . 
185	NA	 Ja sealjuures olen ma päevad otsa põhiliselt vait . 
185	NA	 Ja ma ei tahagi eriti rääkida . 
186	NA	 Kolmas seletus on mõistagi metafüüsiline , mis seisneb selles , et miski või Keegi räägib meis , meie kaudu . 
186	NA	 Meie elu on Kellegi kõne . 
186	NA	 Lihtsamal juhul see Keegi kõneleb nii , et elu on nagu elu ikka : võetakse naine või minnakse mehele , saadakse lapsi ja teenitakse raha . 
186	NA	 Ühesõnaga , elatakse inimese elu . 
186	NA	 Teisel juhul on sellel Kellelgi meiega natuke teised plaanid . 
186	NA	 Ta tahab , et me räägiksime . 
186	NA	 Aga kuna Tema jääb alati varjatuks , siis jääb meie kõne ka alati segaseks . 
186	NA	 Me kokutame nagu Mooses . 
186	NA	 Me ei tea , mis ta meist just täpselt tahab . 
186	NA	 Tegelikult võib see , mis ta tahab , olla väga lihtne , aga oma pärispatuses loomuses me ajame kõik kole keeruliseks . 
187	NA	 Neljas seletus on , et on veel üks neljas seletus , mis on õige , selge ja arusaadav , aga me ei saa seda kätte , sest ... 
187	NA	 ( vt. kolm eelmist seletust ) . 
188	NA	 Ja tõde on veel see , et kogu oma väärastunud lobisemishimus ei igatse ma midagi rohkem kui vaikust . 
188	NA	 Et see jääks vait . 
188	NA	 Et see vaikiks , nagu vaikib taevas , pilvede liikumine , puude kohin , lindude laul , linna mühin , arvuti surin , südamelöögid , öö ja päev , mis mind ühest unest teise tantsitavad . 
188	NA	 Ma tahan , et need kaks und saaksid kokku , et unbewusste saaks välja oksendatud , et tuleks palavik ja paranemine . 
188	NA	 Ma tahan nutta ja karjuda , ma tahan endal juhtme kokku lasta . 
189	NA	 Ma kirjutan , et vabaneda kirjutamisest , aga mulle näib , et see töötab hoopis vastupidi . 
189	NA	 Kirjutades ma põlistan oma vale . 
189	NA	 Ma loen seda ja hakkan seda lõpuks uskuma . 
189	NA	 Sõnad , mida paber või arvuti kõvaketas mäletab minu asemel , hakkavad ka elama minu asemel . 
189	NA	 Ma loen ja noogutan : õige , õige . 
189	NA	 Või loen ja ei saa midagi aru . 
189	NA	 See pole ikka see , see pole ikka mina . 
189	NA	 Ühed elavad teiste kirjutatud , raamatutest loetud elu , teised kirjutavad ise endale elu ja elavad seda . 
189	NA	 Vahet pole . 
189	NA	 Teine variant on võib-olla isegi ohtlikum . 
190	NA	 Ma tahan ennast sõnademetsast läbi ja välja kirjutada , jõuda lagendikule , kus ma lõpuks näen , kuhupoole minna . 
190	NA	 Isegi kui selguks , et ma olen tulnud täpselt vastassuunas , oleks see ikkagi kergendus . 
190	NA	 Väljajõudmine on alati kergendus . 
191	NA	 Kirjutamine on kõigist kunstidest kõige visuaalsem , ta püüab kõike visualiseerida , ka seda , mis pole üldse nähtav . 
191	NA	 Nagu seda vaikimist , mis on kõigi asjade olemus ja mida ma mõnikord nii selgesti näen , tõstes silmad oma kirjaridadelt , arvutiekraanilt , ja vaadates valget seina , millele kumab väljast sellist valgust , mis ütleb , et päike on välja tulnud ja paistab üle õue katustele . 
191	NA	 Nüüd ma näen seda juba peegeldumas arvutiekraanil , ilma et mul pruugiks pead pöörata . 
191	NA	 Peale sõnade , mis ma olen kirjutanud , paistavad sealt need katused , taevast ja minu , kirjutaja , must siluett kahe maailma vahel . 
192	 11. 11. 01 	 11. 11. 01 
193	NA	 Päike on tõusnud ; alguses oranžikas , siis kollakas , siis valge valgus on roninud üle-õue maja valget sakilist seina pidi allapoole , jõudmata siiski veel ülevalt kolmanda korruseni . 
193	NA	 Tuvid soojendavad ennast karniisidel vastu päikest , öö oli külm , isegi vist alla nulli . 
193	NA	 Õhk , kui aken lahti teha , on jäine , aga vaiksem ja puhtam kui tavaliselt , sellest saab aru , et on pühapäev . 
193	NA	 Varahommikul oli selles isegi mingit taimset hõngu , härmatanud rohu , külmavõetud lehtede lõhna . 
193	NA	 Näis , kas nüüd tulevad lehed puude otsast maha . 
193	NA	 Eile oli Saint-Germaini mets küll veel üsna tihe , kuigi ta laseb madalat päikest juba paremini läbi . 
193	NA	 Ja mõni puu keset raiesmikku kiirgab kollaselt vastu eresinist taevast , kui õhtupäike talle peale paistab . 
193	NA	 Seisin ja vaatasin seda puud . 
193	NA	 Olin jooksnud , niisama vahelduseks ja et sooja saada , jäin päikese käes seisma , süda tagus , kopsud lõõtsutasid , aga aeglasemalt , aeglasemalt . 
193	NA	 Seal teeraja kõrval oli laik ererohelist karusammalt , kõige peenemate lehekesteni välja valgustatud , läikiv . 
193	NA	 Vaatasin , pea kuklas , seda kollaselt kiirgavat puud vastu sinist , õhtu poole aina sügavamat sinist taevast . 
193	NA	 Vaatasin teda nagu usklik ikooni . 
193	NA	 Ikoonid või üldse pildid ei sisenda mulle enamasti midagi . 
193	NA	 Neil võib olla küll sära , aga mis on see taeva ja puude säraga võrreldes ? 
193	NA	 Pildimuuseumi parimad pildid on alati need , mis avanevad kuskilt katteta jäetud aknast , ükskõik , mis sealt siis ka ei paistaks . 
193	NA	 Vaatasin seda puud , nagu võib-olla usklik vaatab kullatud ikooni , sest ma ei tea , kuidas ta seda vaatab , aga ma arvan , et umbes nii . 
193	NA	 Et ta vaatab nii , et ikoon kaob ja selle asemel näeb ta midagi muud , õieti mitte midagi , lihtsalt sära , rahu , ma ei tea mida . 
193	NA	 Mitte et ma kummardaksin puud või ka päikesevalgust , mis tema peale paistab , või ka sinist taevast , selle tühjust . 
193	NA	 Ma ei kummardanud , seisin niisama . 
193	NA	 Puu pole Jumal , päike pole Jumal , taevas pole Jumal , ja ma ei tea , kas Jumal on nende kõikide sees või kohal või taga või on ta need loonud nii , et ma neid vaataksin , andnud mulle selleks vaatamise . 
193	NA	 Ma tean , et hea on sellisel külmal selgel sügispäeval joosta mööda pruunidest ja punastest lehtedest kaetud rada , kuni süda hakkab taguma , kopsud lõõtsutama ja kogu keha läheb teisele soojusrežiimile . 
193	NA	 Jooksma hakata ainult on raske , kui pole ammu jooksnud , tundub , et selg valutab , et hing jääb kohe kinni jne. 
193	NA	 Aga pärast on hea . 
193	NA	 Jääda päikese käes seisma ja rahuneda , pilk läheb sügavamaks koos hingamisega . 
193	NA	 Kaks musta varest lendavad vuhinal otse mu kõrva juurest mööda , panevad võpatama . 
193	NA	 Vist ei pidanud mind inimeseks , ei vaevunud ringi tegema . 
193	NA	 Rõõm ja rahu on kehalised , ikka ja alati kõigepealt kehalised . 
193	NA	 Ja mõtlemine ei vii kuhugi , see on häiritud keha reaktsioon , ebamugavustunne , mida olemasolemine paratamatult tekitab , muud midagi . 
194	NA	 Vahepeal helistas Ly Tallinnast . 
194	NA	 Oli ennast üksi tundnud , ma lohutasin teda , et ma olen kogu aeg üksi , mul ei tule muud varianti meeldegi . 
194	NA	 Ta rääkis , et oli lehest lugenud intervjuud ühe noore autoriga , kes olevat oma esimese romaaniga hakkama saanud . 
194	NA	 See pole veel ilmunud , keegi pole seda lugeda saanud , aga autor annab juba intervjuud , et kujutage ette , ma tegin seda ! 
194	NA	 Ta olevat istunud kaks ja pool nädalat ja see olevat muudkui tulnud ... 
194	NA	 Ma tean , et see on suurepärane tunne , eufooria , rahulolu , vabanemine . 
194	NA	 Aga ma pole kunagi uskunud , et see tunne oleks kuidagi vastavuses tulemusega . 
194	NA	 Rahulolu tuleb sellest , et oled rääkida saanud , et see on paberile voolanud . 
194	NA	 Mida see teistele ütleb või kas ütleb , kuidas sa seda teada saad ? 
194	NA	 Varsti vist antakse intervjuusid juba teemal , et mul tuli mõte kirjutada romaan , teate , kui lahe tunne see oli ... 
194	NA	 Ja eesti kultuuriilm võib jälle kergemalt hingata : ühel meist tuli mõte pähe ! , eesti kultuur pole surnud , vaid elab , halleluuja ! 
194	NA	 Sirp saab edasi ilmuda , Looming ja Vikerkaar saavad edasi ilmuda , me saame üksteist vastastikku kiita ja austada ja Kultuurkapitali helde allikas voolab igavesti meie väljasirutatud karikatesse ! 
195	NA	 See kõik on üsna ebaoluline , aga ikkagi kurb . 
195	NA	 Kultuur on õigustus , kuigi aina ebaolulisem , kultuuriadministratsiooni ja kultuuriinstitutsioonide edasikestmiseks . 
195	NA	 Ei , kirjandus- ja kultuurieluga kokkupuutumine , isegi kaugelt , on kahjulik . 
195	NA	 See määrib , reostab mõtteid . 
195	NA	 Mis minul selle kõigega pistmist on ? 
195	NA	 Ma olen tahtnud saada osaks sellest ja nüüd ma tahan sellest lahti saada . 
195	NA	 Ma kirjutasin ennast sinna sisse , Sirpi , Vikerkaarde , Loomingusse . 
195	NA	 Nüüd on aeg ennast välja kirjutada . 
195	NA	 Ma ei tea , kas see on võimalik , aga ma tahan proovida . 
195	NA	 Igaühel peab ju vähemalt üks vabanemisvõimalus olema . 
195	NA	 Iga asi näib huvi pakkuvat ainult sedavõrd , kuivõrd temaga kokkupuutumine , teda tundma saamine laseb näha tema tühjust . 
195	NA	 Muidu jäädki arvama , et seal on midagi . 
196	NA	 Selleks et Pére-Lachaise'i surnuaiale saada , tuleb kõigepealt endal minna maa alla , metroosse . 
196	NA	 Ma ei armasta seda metrood enam sugugi . 
196	NA	 Varem mulle päris meeldis seal sõita ja inimesi vaadata . 
196	NA	 Enam ma ei taha neid inimesi näha , pealegi veel seal igaveses hämaruses , suletuses . 
196	NA	 Mulle tundub , et televisioon näitab mulle inimkonda täiesti piisavas annuses . 
196	NA	 Telekat saab kinni ka keerata . 
196	NA	 Metroos saab ainult silmad kinni panna , aga see eriti ei aita . 
196	NA	 Inimesed on peaaegu kõik murelike , tõrjuvate , vahel lausa vaenulike nägudega . 
196	NA	 Nad on sunnitud selles vagunis , selles tunnelis , selles linnas , selles ühiskonnas , selles sajandis , selles elus koos olema , aga neil pole sellest mingit rõõmu . 
196	NA	 Mõni lõbus seltskond , kui selliseid juhtub olema , mõjub lausa häirivalt , ebaviisakalt selles pingelises õhkkonnas . 
196	NA	 Ja siis veel need pillimehed oma kääksutamisega , oma tuimade valenootidega , kistud naeratusega ja alati samade viisidega , mis metrookolinaga ebameeldivalt segi lähevad . 
196	NA	 Kõige parem metroo juures on ikkagi see , et lõpuks saab sealt välja . 
197	NA	 Surnuaial pole inimesi eriti tihedalt , ka mitte pühapäeval nagu täna . 
197	NA	 See on meeldiv . 
197	NA	 Elavaid , ma mõtlen , sest surnud ei loe . 
197	NA	 Hea , et on olemas see laibakultus , mis on teinud surnuaia ja jätnud sellega natuke maad majadest vabaks . 
197	NA	 Kuigi ka see maa on kaetud kividega ja ehitatud täis väikesi surnumajakesi , ei varja need väljavaadet , ei riku avarust . 
197	NA	 Ja puid on seal siiski ka , isegi vanu lõhnavaid küpresse . 
197	NA	 Nende juures tuli mul meelde , et vanaema rääkis alati suure austusega elupuust ja näitas mulle elupuud kuskil Rõõmu tänava aias , kui ma temaga seal jalutasin ( see oli mu kohustus , vanaemaga jalutada , et temaga midagi ei juhtuks , et ta surnult maha ei kukuks ) . 
197	NA	 Ma sain aru , et elupuu omamine aias on tõeline privileeg . 
197	NA	 Vanaema oli need oma aeda istutanud , sinna aeda , selle maja juurde , mida ma kunagi ei näinud ja mida ma võisin kujutleda kaotatud paradiisina . 
197	NA	 Vähemalt üks elupuu on seal veelgi alles , üsna rääbakas ja poolkuivanud , sest ta on teiste puude alla jäänud . 
197	NA	 Ma nägin teda seal , aga siis mul ei tulnud vanaema elupuu-austus enam meelde . 
197	NA	 Lapsena ma rääkisin isale , et meil aias võiks ka elupuu olla , aga isa millegipärast ei võtnud vedu . 
197	NA	 Ma arvan , ta tahtis pigem unustada neid elupuid seal Vahukülas , mille järgi ta nimegi vist on saanud . 
197	NA	 Seda enam olin mina sunnitud neid mäletama . 
197	NA	 Meie mälu on täis asju , mida me eluski näinud pole , ja neisse usume me kõige vankumatumalt , täiesti ebateadlikult . 
197	NA	 Seda nimetataksegi vist kultuuriks . 
198	NA	 Vanaisast ja vanaemast jutustas isa hiljaaegu sellise loo . 
198	NA	 Vanaisa oli käinud Kaitseliidu laskevõistlustel ja saanud seal esimese koha . 
198	NA	 Teisel aastal oli ta tahtnud uuesti minna , aga parajasti oli rukkilõikus käsil . 
198	NA	 Vanaema oli oma hargi põllul maa sisse löönud ja kuulutanud , et kui Juhan mõtleb minna laskevõistlustele , siis tema ka põllule ei jää . 
198	NA	 Vanaisa oli siis öelnud , et hea küll , ja oligi minemata jätnud . 
198	NA	 Isa kommentaar oli selline , et vanaema ise armastas küll mööda lüpsivõistlusi käia ja pidas oma auhindadest väga lugu . 
198	NA	 Mulle armastas ta korrata , kuidas ta pidi hommikul kell neli lehma alla minema ja kuidas lapsed tuli ju koolitada . 
198	NA	 Vanaisast ei rääkinud ta mulle kunagi midagi . 
198	NA	 Ma pidin temaga ikka jalutama mööda ühtesid ja samu Pääsküla tänavaid , käest kinni . 
198	NA	 Ma ei tohtinud ära kaduda , nii nagu Juhan ühel päeval oli kadunud , kui ta need mehed sinna põllule oli juhatanud . 
198	NA	 Sest kadunud oli ta jälgi jätmata . 
198	NA	 See võib inimesega juhtuda . 
198	NA	 Mina ei tohtinud kaduda , ma pidin saama iseenda vanaisaks . 
198	NA	 Ma ei rääkinud ka kunagi vanaemale vastu . 
199	NA	 Pére-Lachaise'i surnuaia väravas müüakse plaane , mille järgi jalutajad saavad kuulsuste haudu leida . 
199	NA	 Sattusin täna juhuslikult Chopini hauale . 
199	NA	 Mis see on , mis inimesi sinna tõmbab ? 
199	NA	 Chopini haud ei tundu küll kuidagi huvitavam kui mõne Duponti või Duvali haud , vastupidi , need unustatud inimeste unustatud draamad on palju intrigeerivamad . 
199	NA	" See sajandialguse haud kirjaga : "" Emale . "
199	NA	" Ainus , kes mulle oli jäänud . "" "
199	NA	 Mõnele perekonnahauale on graveeritud ka sõjas kadunud või deporteeritud ja hukatud perekonnaliikme nimi . 
199	NA	 Nagu vist on ka vanaisa nimi vanaema nime all Karjaküla surnuaias , kuigi vanaisal pole selle Karjakülaga iial mingit pistmist olnud . 
199	NA	 Võimalik , et mu kirjutamine pole muud kui paaniline püüd mitte kaduma minna , kuulata lõpuni vanaema sõna . 
200	NA	 Metroos tagasiteel arvutasin ajaviiteks , et ma olen Eestis suhteliselt rohkem raamatuid müünud kui Houellebecq Prantsusmaal . 
200	NA	 Eesti kirjanikul pole praktiliselt mingit võimalust ennast vabaks kirjutada , ennast inimestele sõnade müümisega inimestest vabaks osta . 
200	NA	 See natuke raha , mis sa saad , ainult demoraliseerib . 
200	NA	 Sest kui oled kord maigu suhu saanud , siis tundub igasugune teine teenistus nii mage ja mõttetu , et ei tasu mitte proovidagi . 
200	NA	 Sõnadega raha tegemine on nagu õnnestunud valerahategemine , aga veel parem , sest täiesti seaduslik . 
200	NA	 Sa võid enda lihtsalt rikkaks rääkida , teha oma elu rahaks , seda ometi endale hoides . 
200	NA	 Kuigi ma ei tea , kas see õnnestub . 
200	NA	 Võimalik , et sul seda elu siis enam ikkagi ei ole . 
200	NA	 Mis müüdud , see müüdud . 
200	NA	 Ma tean maailmas kirjanikke , kes on oma raamatutega rikkaks saanud , aga ma ei tea mitte ühtegi , kes oleks saanud ka õnnelikuks . 
200	NA	 Hea kirjandus sünnib meeleheitest . 
200	NA	 Sa kas tapad enda ära või kirjutad romaani , mis müüb . 
200	NA	 Kusjuures esimene välistab küll teise , kuid teine ei välista ikkagi esimest , in posteriori . 
200	NA	 Kirjutamine mõjub suurepärase valuvaigistina , isegi antidepressandina , aga tema mõju ja mõnu vähenevad aastatega nagu ravimitegi puhul . 
200	NA	" "" Minu kurbust ei kustuta kellegi jaks , selle saatsid sa , Jumal , ise , "" nagu kirjutab poeet ja tal on õigus , ja tema õigus ei aita teda . "
200	NA	 Arusaamine ei too leevendust . 
200	NA	 Ikkagi ma tegelikult kadestan seda tüüpi , kes oma romaanikirjutamisest Sirbile intervjuu andis . 
200	NA	 Tal on see esimest korda . 
200	NA	 Ja esimest korda on see kõige võimsam . 
200	NA	 Seda enam ei tule . 
201	NA	 Pühapäeva õhtupoolik on üksiku elus ikka see kõige raskem . 
201	NA	 Mitte et ta kuigivõrd erineks teistest õhtupoolikutest ja mitte et sa isegi mõtleksid kõigile neile perekondadele , kes on oma koosolemises ( ja kes on ka pühapäeva õhtupoolikuks enamasti tülli läinud , sest ka perekondadele on see raske ) , aga elu mõttetuse vastu igapäevased rohud siis ei aita . 
201	NA	 See on selgemast selgem , see mõttetus ja see , et ta kuhugi ei vii . 
201	NA	 Pühapäeva õhtupoolikul tuleb sulle meelde , et Camus' suure aplombiga asetatud küsimus enesetapust jäi tal vastamata , nii kirjanduses kui ka elus . 
201	NA	 Õigemini ta vastas , aga vastus jäi kahemõtteliseks : see autoõnnetus , lõppude lõpuks ... 
202	 12. 11. 01 	 12. 11. 01 
203	NA	 Kirjutamine on regressioon , tagasiminek , sukeldumine mällu , lootusega sealtkaudu ringiga tulevikku jõuda . 
203	NA	 Kirjutamine on enda ankurdamine ajas , aga aeg ise ei seisa paigal , sellest see iha öelda midagi uut , midagi uutmoodi : leida endale ankrupaik eespool , seal , kuhu vool ei ole sind veel kandnud . 
203	NA	 Küsimus on , kas saab kirjutades leida lõputult uut või muutub kirjutamine ise lihtsalt harjumuseks . 
203	NA	 Mu viis rääkida , mu kõnerütm , mu lausekonstruktsioon ei muutu eriti , ma võin nad ainult täiuseni välja arendada , välja lihvida oma kõnepuusliku , nii et ta juba kaugelt ära tuntav oleks . 
203	NA	 Kui see on nii , siis mul ei ole võimalik öelda midagi uut , mida ma poleks juba öelnud . 
203	NA	 Sest see , mida on võimalik öelda , ei ütle ennast mitte mu ette valmis mõeldud mõtetes , vaid selles sõnameloodias , sõnakoes , mis koob ennast minu teadmata ja tahtmata . 
203	NA	 Aga – ta koob ennast aina ja ikka ühtemoodi . 
203	NA	 Tahtlik muutmine ei aita . 
203	NA	 Ei aita üleminek lühilausetele , võrdluste vältimine , harjunud lausepöörangutest hoidumine . 
203	NA	 Kui mul oleks mingi uus sisu , siis see laulaks ennast ise teisel viisil . 
203	NA	 Igal linnul oma laul , ja mina laulan ikka nii , nagu nokk loodud . 
203	NA	 Mu viis mõelda ja öelda , mu kõneviis , mu lauluviis takistavad mul ütlemast midagi uut . 
203	NA	 Mu kõne on vurrkann , mis pöörleb ühe koha peal , kuni ümber kukub . 
203	NA	 Siis on vaikus , ainult kaja kumiseb veel kõrvus . 
203	NA	 Mida ma tahtsingi öelda ? 
203	NA	 Mäletan ainult seda , et tahtsin midagi öelda . 
204	NA	 Romaanivorm on omapärane vorm. Kuigi ta näib nii vedel , on ta siiski väga kindel ja üldse mitte nii palju lubav . 
204	NA	 Romaan on enda positsioneerimine ajas , ühiskonnas , metafüüsikas , psühholoogias . 
204	NA	 See on teatud inimesekoordinaadistik , korraga väga isiklik ja väga sotsiaalne . 
204	NA	 Romaan on ülimalt seltskondlik vorm. Kui sul on silma oma koordinaate ära tunda , siis tunneb ka seltskond ennast ära neis koordinaatides , need saavad fikseeritud , nüüd ja igaveseks . 
204	NA	 Romaan pakub alati üht kindlat vaatepunkti inimene-olemisele , võimalust ennast ära tunda , endast mõelda ja rääkida . 
204	NA	 Vaata inimest ! 
204	NA	 Selline ta siis ongi . 
205	NA	 Romaanitraditsioon on kõigepealt evangeelne traditsioon , ta sai tuule tiibadesse siis , kui ühiskond sekulariseerus , traditsiooniline religioon ei pakkunud enam piisaval määral seda koordinaadistikku , evangeeliumidest enam ei aidanud enese jutustamiseks . 
206	NA	 Ükskõik kui palju poleks romaanis tegelasi , on seal alati üks kangelane , kirjutaja ja lugeja alter ego . 
206	NA	 Ma pole veel näinud romaani , kus oleks kaks võik rohkem kangelast . 
206	NA	 Arvatavasti sellist ei saagi kirjutada . 
206	NA	 See kangelane ei pruugi ilmuda sugugi kohe , esimestel lehekülgedel , esimestes peatükkides . 
206	NA	 Perekonnaromaanides võib kuluda mitu köidet , enne kui kangelaseni välja jõutakse . 
206	NA	 Kõigepealt on Vana Testament , siis alles tuleb Evangeelium . 
206	NA	 Kogu perekonnaloo mõte aga on selles , et kangelane selle loo lõpuks lunastab . 
207	NA	 Moodne romaan on siiski pigem uustestamentlik , kangelane on kohal algusest peale , tihti on tegemist minaga . 
207	NA	 Minajutustus on muidugi erakordne leiutis , aga sealjuures täiesti loogiline trinitaarse maailmapildi väljendus . 
207	NA	 Selles minas saavad kokku Isa ( mina kui jutustaja , see , kes selle kõik on teinud ) , Poeg ( mina kui ise , kui inimene ise ) ja Püha Vaim ( jutustusviis , see poeetiline miski , mis loole elu sisse puhub ) . 
207	NA	 Kolmainsus : autori mina , autor ise ja autori hääl . 
208	NA	 Romaanikangelase kristoloogiline olemus on ilmne . 
208	NA	 Kangelases – olgu ta siis mina või mõni tema , aga kõik me teame , et Madame Bovary , see olen mina – ühineb inimlik alge jumalikuga . 
208	NA	 Kangelase inimlikkus seisneb tema ainukordsuses , isiklikkuses , veidruses , neis asjades , mida me otseselt ei saa temaga jagada . 
208	NA	 Küll aga saame temaga jagada seda , et veidrused on olemas , et meiegi , nagu kangelane , oleme üksikinimesed , kõigist teistest erinevad . 
208	NA	 Meie üksikus on universaalne . 
209	NA	 Kangelase jumalikkus seisneb selles , et alati esindab ta mingit ideed , mingit inimlikku omadust , mis oma äärmusesse jõudes muutub üld- ja seega üleinimlikuks . 
209	NA	 Kangelane on kas väga suur armastaja , väga suur kõhkleja vms. 
209	NA	" Tegelikult on ta vist alati kõigepealt väga suur armastaja , kuni selleni , et tema armastus ei leia enam mingit inimlikku väljundit , moondub mõrvaks , enesetapuks , täielikuks üksildumiseks , loobumiseks , mingiks seksmaniakaalsuseks kuni kompulsiivse sadismini näiteks "" American Psycho's "" . "
209	NA	 Igal juhul on selles midagi nii suurt , et see paneb meid värisema iseenda tundmatu põhjatuse ees . 
209	NA	 Üldiselt me ise , ei autori ega lugejana , pole võimelised minema sellise äärmuseni , aga me tunneme endas seda absoluudiiha , iha viia armastus selle hirmsate , jumalike järeldusteni . 
209	NA	 Jumal on armastus , aga Jumal on ka hirmus , nimetu Jumal . 
