par_nr	head	sentence
1364	NA	 Ja kui ma pean jälgima , ajahetkes või tagantjärele , nagu nüüd , nagu praegu , pool sajandit tagasi toimunud tapatalguid või reetmisi , kahtlen inimeses kui liigiski . 
1364	NA	 Aga see suur mõte ei aita mind tapetud isa foto ees põrmugi . 
1365	NA	 Kas te olete ikka kindel , et fotol on teie isa , küsinud seepeale uurija , katkestanud hetkeks lauamassaaži ning vaadanud teda pealtnäha huvitult . 
1365	NA	 Et näete , te võite ju ka ise eksida , nõnda vaikis see nägu . 
1366	NA	 Olen küll , oli ta hetkegi mõtlemata vastanud ning jäänud siis tükiks ajaks vait . 
1367	NA	 Kõige hullem on see , et midagi ei ole välistatud . 
1367	NA	 Tema tundis küll fotolt oma isa täiskindlalt ära , kuid lootus ei kao . 
1367	NA	 Kõik on küll täiesti-täiesti kindel , aga - äkki ! 
1368	NA	 Aga äkki juhtus ime , tehti järjekordne trikk ning tema isa , sinu isa , meie isad ikkagi pääsesid . 
1368	NA	 Nad viidi üle mere ja maa , pandi teise nime all elama . 
1368	NA	 Vahel ta mõtleb ehk ( ? ) minustki - mõtleb kindlasti ja ei mõtle ka - , sest kogu kahekümnenda sajandi viiekümnendate aastate algus on aktiivsetest vastastikustest luuremängudest pinevil , hingerahu pärast ei ole tal mõistlik mõtelda , ja ma ei tea , kas olen sellega rahul . 
1369	NA	 Edukaile metsavendade hävitamisaktsioonidele võib ehitada nii mõndagi . 
1369	NA	 Eesti Leegioni mehed , SS-i ja piirikaitsesse mobiliseeritud mehed , Kaitseliidu ja Omakaitse mehed , lihtsalt talupoisid ja -tüdrukud - noored naised , noored mehed , kes mobilisatsiooni- ja küüditamishirmus metsa on läinud . 
1369	NA	 Need viimased on tihti kogenematud ja ajastu - , sõja- ja maailmajagamise taibuta , nii et siin on tööpõld igasugusteks mängudeks lai . 
1370	NA	 Nii oli ta mõtelnud , kui uurija laiali asetatud käed mudisid kirjutuslauda , nagu oleks see vahast . 
1370	NA	 Mudib lauda ning kord lähendab , kord kaugendab keha sellest sulavahalisena mõjuvast esemest . 
1371	NA	 Keha rahutule plastikale vastandubki see ootamatu jutt : oli see ikka teie isa , olete kindel , ja ega seda kolmekümmet inimest hõlmavat metsavendade gruppi pruukinud organiseerituna ju ollagi . 
1372	NA	 Ja mehi , kes maha lasti ja kes auraamatuis kirjas , polnud ka , oli ta vahele ütelnud . 
1373	NA	 Nojah , need ikka olid , uurija südikas hääl oli langenud . 
1374	NA	 See on nii keeruline lugu , ainult agentide toimikud aitaksid . 
1374	NA	 Äkki oli uurija lauamasseerimise katki jätnud . 
1374	NA	 Ja tema oli tekkinud vaikuses ikka veel mõtelnud imele . 
1374	NA	 Mis see minu isakohane ime siis oleks ? 
1374	NA	 Reetmine oleks see ime , oli ta kibeda muigega nentinud . 
1374	NA	 Siis toimunuks kaks imet ühekorraga : Kaarlit päästev ja teisteks tegudeks ettevalmistav surm oleks esimene ime ja teine ime olnuks isa enda kasutamine MGB luures . 
1375	NA	 Sa mõtle vaid , isegi Kaarel rääkis , kuidas kaitseliitlased ja nõukogude sõdurid olid Piira ristil ühe kraavi juures lahingut pidanud ning Meinhard laskis tsikk-tsik-tsikk - Kaarel oli teinud sihtimis- ja triklile vajutamise liigutusegi - kolm sõdurit ahelikust maha . 
1376	NA	 Siis pidi mu isa ju päris täpne laskur olema , oli ta küsinud , ja märganud Kaarliga rääkides esmakordselt mehe elavaid ja isegi nagu tunnustavaid silmi . 
1377	NA	 Kaarel lasknud käed järsult alla ja vastanud : jah , ma olin siis alles kolmteist ja nägin seda lahingut pealt , kuigi isa keelas ja pidime hoidma eemale . 
1378	NA	 Aga Kolgal , aga Kolgal ... ? 
1379	NA	 Ja Kaarel oli taas talle selja keeranud , nagu poleks ta küsimust kuulnudki . 
1380	NA	 Seda imet , isa iga hinna eest pääsemise imet ei saa ma kuidagi soovida , oli ta mõtelnud , kui noor uurija teisel pool lauda vaikis arvatavasti juba pikemat aega . 
1381	NA	 Uurijaga rääkimise - ja ka vaikimispauside ajal - oli ta silmad üle lasknud Kaitsepolitseiameti ametlikust 15. oktoobril 1999. aastal koostatud paberist , mis pidi vastama tema palvele uurida tema isa Meinhard Reiteri surma . 
1382	NA	 Ta luges : 
1383	NA	 Materjalide kontrolli käigus on kindlaks tehtud , et Meinhard Reiter ( sündinud 17. 
1383	NA	" 10. 1917 Rakveres ) lahkus koos perega oma kodust Kaigu vallast Moora külast 1948. aastal ning asus end koos abikaasa Vilma Reiteriga okupatsioonivõimude eest varjama , kuna teda kiusati poliitilistel põhjustel taga - tema majapidamine oli kuulutatud "" kulaklikuks "" koos kõigi sellest tulenevate repressioonidega . "
1383	NA	 Lisaks oli Meinhard Reiter olnud 1941. aastal Omakaitse liige ning võidelnud ( enne Saksa okupatsiooni algust ) selle koosseisus Eesti vabanemise eest , samuti oli olnud Meinhard Reiter 1944. aastal õigusvastaselt mobiliseeritud Saksa armee alluvuses tegutsenud piirikaitserügementi . 
1383	NA	 Kuni 1953. a. 16. veebruarini varjas Meinhard Reiter end relvastatuna metsas Põltsamaa rajooni Kaigu külanõukogu territooriumil . 
1384	NA	 — — — — — — — — — — — — — 
1385	NA	 Meinhard Reiteri surm 16. veebruaril 1953. aastal on registreeritud Rapla rajooni Perekonnaseisuaktide büroos tagantjärele 29. veebruaril 1958. aastal surnu abikaasa Vilma Reiteri teate ja Põltsamaa rajooni Miilitsaosakonna tõendi 05. septembrist 1958. alusel . 
1386	NA	 Vilma on lausa olematul päeval oma mehe surmast teatanud , oli ta vahepeal läbi uurija kohalolu ja kõneümina mõtelnud , sest 1958. aasta ei olnud liigaasta , selle aasta veebruaris oli 28 päeva . 
1387	NA	 Ja veel oli ta mõtelnud , et Kaarel Kolgamets tuli julgeoleku kutse peale metsast välja septembris 1958. 
1388	NA	 16. veebruaril 1953. aastal läkitati Eesti NSV Riikliku Julgeolekuministeeriumi ( RJM ) Põltsamaa Rajooniosakonnast ( RO ) Alaküla Kolga tallu operatiivgrupp ENSV RJM Erioperatiivjaoskonna vanemoperatiivvoliniku riikliku julgeoleku vanemleitnant Morozovi juhtimisel ülesandega üle kuulata taluperenaine Elmiine Vigel koos eelneva varitsuse organiseerimisega võimalike talu külastavate metsavendade tabamiseks . 
1389	NA	 Nimetatud meetmed olid vastavalt RJM eriteatele ette võetud eesmärgiga likvideerida Põltsamaa rajooni territooriumil varjuva okupatsioonivõimudele vastupanu osutava metsavenna Arthur Pihelgase grupp . 
1390	NA	 Edasi oli paberil kirjas RJM ERITEATE PEAAEGU SÕNASÕNALINE Kolga lahingu kirjelduse KORDUS , selle vahega , et tapetuks osutus Meinhard Reiter . 
1391	NA	 Kaarel Kolgamets ei osanud 6. septembril 1999. aastal - kas 6. september on tõesti kirjas kui vihje Kaarli igikestvat puutumatust tagavale metsast väljatulekule 6. septembril 1958. aastal - , jah , Kaarel ei osanud seletada , miks tema ja Meinhard Reiteri isikud julgeoleku dokumentatsioonis vahetusse läksid . 
1391	NA	 Meeste äratundmisel valeandmeid esitanud Magda Kolgamets ja Elmiine Vigel on tänaseks surnud . 
1392	NA	 Niisama lihtne see ongi , oli ta just nagu läbi silmadele langeva hämarliniku mõtelnud ning lugenud edasi : 
1393	NA	 Operatiivgruppi juhtinud Anton Morozovi seletusest nähtub , et RJM operatsioonide eesmärgiks oli nn. bandiidid ehk metsavennad kinni pidada ja alles juhul , kui osutatakse vastupanu , nad tappa . 
1393	NA	 Muud sisulist juba nimetatud dokumentidele A. Morozov ei lisa . 
1393	NA	 Bandiitide hävituspataljoni - Siin on Valmar Varenik Bandiitide hävitamise pataljoni nime kirjutanud valesti , ütlesin vahele . - rühmaülema Jüri Konksu seletuse ning julgeoleku dokumentatsiooni põhjal oli tema kaasatud operatsiooni operatiivgrupi teejuhina , ning lahingust osa ei võtnud . 
1394	NA	 Muidugi , tõmbas valge lina ümber ja ootas lagedal väljal - sest Kolga talu asus keset põlde ! - lahingu tulemust või jõi toas koos Elmiine Vigeliga kohvi , oli ta tõusvat absurdi- ja protestitunnet enda sees üritanud maandada . 
1395	NA	 Ja kui lahingukära vaikinud ja surnuid hakati üle lugema , kirjutas Bandiitide hävitamise pataljoni rühmavanem Jüri Konks vahetatud mehe surmaaktile ja relvaekspertiisile alla . 
1395	NA	 Ka tema , kes ta mõlemat meest lapsepõlvest saadik tundis , kinnitas oma allkirjaga , et minu tapetud isa , Meinhard Reiter , on Kaarel Kolgamets . 
1395	NA	 Tal ei olnud hirmugi , et pettuse väljatuleku korral ootab teda karistus . 
1396	NA	 Jüri Konks oli ainult teejuht , nii on RJM-i eriteates kirjas ja ta ise tunnistab ka , et ta oli ainult teejuht ega tea lahingust midagi . 
1396	NA	 Ei ole mingit põhjust tema tunnistust kahtluse alla panna , seletanud uurija . 
1397	NA	 Jüri Konks oli Bandiitide hävitamise pataljoni rühmavanem , see ütleb ju kõik , oli ta hüüdnud , okupatsioonile vastupanu osutav metsavendade grupp oli otsustatud likvideerida , ta oli sõrmega vastavale sõnale Kaitsepolitseiameti vastuses tähelepanu juhtinud . 
1398	NA	 Jüri Konksu nimi on tapmisakti all , ta ise on oma allkirjaga kinnitanud meeste vahetamise . 
1398	NA	 Ta peab ju seda seletada oskama ? 
1399	NA	 Jüri Konks täitis ainult käsku , vastanud uurija , ja talle oli tulnud meelde , et Kaarel ütles kord täpselt sedasama . 
1400	NA	 Ja Kaitsepolitseiameti lõppjäreldus kinnitas vaid seda , mida arhiivis nähtud julgeolekudokumendidki : 
1401	NA	 Seega kogutud materjalide alusel hukkus metsavend s. o. relvastatuna NSV Liidu okupatsioonivõimudele vastupanu osutanud Meinhard Reiter 16. veebruaril 1953 Alakülas Kolga talus relvastatud kokkupõrkes NSV Liidu okupatsioonivõimudega . 
1401	NA	 Materjalidest ei nähtu , et toime oleks pandud tsiviilisikute tapmist ega muid inimsusevastaseid kuritegusid , nagu see on sätestatud KrK § 61' lõikes 1 ning selles viidatud rahvusvahelise õiguse normides . 
1401	NA	 Seetõttu ei ole kuriteosündmuse puudumisel võimalik M. Reiteri avalduse ning selle kontrolli käigus kogutud materjalide põhjal kriminaalasja algatada . 
1402	NA	 Lähtudes eeltoodust ja juhindudes KrMK § 5 lg 1 p 1 , § 96 lg 1 ja 2 , 3 
1403	NA	 määras 
1404	NA	 1. 
1404	NA	 Keelduda kriminaalasja algatamisest KrK § 61 ? järgi . 
1405	NA	 2. 
1405	NA	 Koopia käesolevast määrusest saata avaldaja M. Reiterile . 
1406	NA	 3. 
1406	NA	 Saata koopia käesolevast määrusest Riigiprokuratuuri järelvalvet teostavale prokurörile A. Blumenfeldile . 
1407	NA	 Määruse koostas : Valmar Varenik ( allkiri ) 
1408	NA	 Sain nagu nuiaga pähe , ütles ta mulle . 
1408	NA	 Metsavend oli ühe suleviipega - õieti trükitud sõnaga - muudetud tsiviilisikust sõduriks ja teda võis ka sõnaliselt tappa nelikümmend kuus aasta hiljemgi . 
1409	NA	 Hiljem otsisin ma talle vastava paragrahvi välja : § 61 ? 
1409	NA	 1. lõige on niisugune : 
1410	NA	 § 61 ? . 
1410	NA	 Inimsusevastane kuritegu 
1411	NA	 ( 1 ) Inimsusevastaste kuritegude , sealhulgas genotsiidi toimepanemise eest , nagu need kuriteod on määratletud rahvusvahelise õiguse normides , s. o. tahtlike tegude eest , mille eesmärk oli täielikult või osaliselt hävitada rahvuslik , etniline , rassiline , usuline , okupatsioonirežiimile vastupanu osutav või muu sotsiaalne grupp , sellise grupi liikme tapmise või talle raske või üliraske kehavigastuse või vaimsete hälvete tekitamise või tema piinamise eest , laste vägivaldse äravõtmise , relvastatud ründe , okupatsiooni või anneksiooni korral põliselanike deporteerimise või väljasaatmise , majanduslikest , poliitilistest ja sotsiaalsetest inimõigustest ilmajätmise või nende õiguste piiramise eest - karistatakse vabadusekaotusega kaheksast kuni viieteistkümne aastani või eluaegse vabadusekaotusega või surmanuhtlusega . 
1411	NA	 [ Minu sõrendused - M. Reiter . ] 
1412	NA	 Ma lugesin koodeksiparagrahvi uuesti üle ja võrdlesin Valmar Vareniku koostatud määruse tekstiga ega saanudki aru , mida see Kaitsepolitseiameti poolt väljastatud ametlik paber sisuliselt tähendab . 
1413	NA	 Nii et Eesti okupeerimine , küüditamised , vangilaagrisse saatmised ja metsavendade tapmised on seaduslikud tänase päevani , ja need , keda poliitilistel põhjustel taga kiusati - ta oli vedanud uurijalt saadud paberil sõrmega jätkuvalt ridade järge - , oleksid pidanud minema end ise üles andma , oli ta uurijale kriminaalasjast keeldumise määrusest endast valitud kohti ette lugenud . 
1414	NA	 Ärge pöörake teile isiklikult kätte toodud ametliku vastuse sõnu pea peale , oli uurija pärast äkilist ja samal hetkel mahasurutud hääletõusu vastanud . 
1415	NA	 Mida see siis tähendab , oli ta mõtelnud ja vaadanud vastas istuvale mehele otse silma . 
1415	NA	 Kas Arhiivimees on siis Kaarel Kolgametsa protežeerijana andnud oma alluvatele korralduse , kui kaugele tohitakse mu isa surma uurimisel pärast Kaarli autasustamist ülepea minna ! 
1416	NA	 Siis peaks ametliku vastuse koostaja , politseidirektoriks tituleeritud Varenik ja vastas istuv uurijagi Harry-Ott Trabandi - ohhoo ! ta nimetab esimest korda seni hoolikalt Arhiivimehe pseudonüümi taha varjatud nime ! - jah , Trabandi kaudu Eesti Vabariigi ordeni saama selle eest , et kõigi Kolga lahinguga seotud inimeste aru ja suu jääks teatud piiri taha kinni . 
1416	NA	 Tõesti , Meinhard Reiter on ebamugav mees pärast surmagi . 
1416	NA	 Mis riigis me õieti elame ! 
1417	NA	 Me elame jumalariigis , kuid usume kirikut , vastas ta endale . 
1417	NA	 Mina istusin palmipuudepühal ühes Austria külakirikus ja lugesin oma meieisapalve lõpuni , alles siis mõtlesin , miks jumalapoega võeti vastu kui kuningat . 
1417	NA	 Mina olen Meinhard Reiteri laps ega saa tagasi sündida , minu lindprii seisus on igal paberil - ka selles Eesti Vabariigi uurimisameti vastuses - silmaga näha . 
1418	NA	 Mulle ei antud kuigi pikka mõtlemisaega , seletas ta edasi , sest uurija oli mehise vaoshoitusega jätkanud : Mina metsavendi ei alahinda , nemad olid võitlejad ... 
1419	NA	 ... ja Nürnbergi protsessi järgi ei kuulu nende tapmine tsiviilisikute vastu toimepandud kuritegude hulka , küsisin jahmunult . 
1419	NA	 Et kui oli lahing , siis ... 
1420	NA	 Täpselt ! 
1420	NA	 Kas te üldse teate , et niisugused protsessid ei vii kuhugi . - Ma ei nõua ju praegu protsessi , otse karjusin vahele , aga uurija ei kuulanud mind . - Ka OLETATAVAL tapjal on õigus kaitsele ! 
1420	NA	 Nõnda see noor mees just ütles , sest rääkis peaaegu peatumata ega lasknud minul end segada . 
1421	NA	 On , on , on , hüüdsin ma uuesti vahele . 
1421	NA	 Mina ei taha Kolgat korrata . 
1421	NA	 Kas te siis tõesti ei taipa , et surnud mehe au ka midagi tähendab ! 
1422	NA	 Kui Kaarlile poleks antud ordenit , ei ärritukski ta ehk nõnda kui praegu . 
1422	NA	 Just uurija ametiau puudumine tekitas kes-teab-kust esilekerkinud sõnatut raevu . 
1422	NA	 Orden on ju au märk . 
1423	NA	 Kas Eesti Vabariiki isamaana enam ei tajuta , kui iseseisvuse eest langenute elu ja au on sel konkreetsel juhul jaburatele mälestustele ordeni andmise läbi muudetud tühiseks ? 
1423	NA	 Ja kui see pole ainult üksikjuhtum ? 
1424	NA	 Valjusti oli ta küsinud : 
1425	NA	 Oskate te seletada , miks Kaarel Kolgamets oma mälestused kirjutas ? 
1425	NA	 Mis valu teda tagant sundis , kui nüüd on selgunud , et miski ses kangelasmeele kirjelduses ei vasta tõele ? 
1426	NA	 Ma ei tea . 
1426	NA	 ( Öeldud järsult ja mehiselt . ) 
1427	NA	 Mida Kaarel Kolgamets pärast mu isa surma tegi ? 
1427	NA	 Näiteks 1954. aasta jaanuarist kuni sügiseni 1958. 
1428	NA	 Ma pole seda uurinud . 
1429	NA	 Ta oli vait jäänud ja endalegi ootamatult mõtelnud : Aga äkki ongi tegemist väga laiaulatusliku operatsiooniga - sellele oli uurija pärast esmakordselt materjalidega tutvumist vihjanud - , kuid siis tuleks seda operatsiooni vaadelda kahel täiesti erineval tasandil . 
1429	NA	 Üks tasand puudutab jahti Arthur Pihelgase ja hiljem Aadam Mündi juhitud metsavendadele , nende tapmist või kinnivõtmist , teine Kolga lahingu meestevahetust ja midagi , mis sellele vahetusele järgnes . 
1430	NA	 Uurija järsk vastus Ma pole seda uurinud oli ta meeled ja mõtted äkki erksaks teinud . 
1430	NA	 Tähendab , on , mida uurida . 
1431	NA	 Ei taheta uurida sellepärast , et just Trabant on Kaarel Kolgametsa Kotkaristi IV järgule esitanud ega taha oma vea ilmsikstulekut . 
1431	NA	 Teine põhjus on esimese järg , sest Kaarli metsavennaelu viis viimast aastat on sama hämarad kui esimesed . 
1432	NA	 Ja siis , täiesti aru saades , et uurija on tema arutlustest ja rünnetest tüdinud - mis saaks siis , kui kõigi tapetute järeltulijad selgust otse nõudma hakkaksid ? - , oli ta viimse piirini väsinult küsinud : 
1433	NA	 Ja kuhu mu isa maetud on ? 
1434	NA	 Teie isa , ütles uurija rõhukalt , viidi julgeolekumaja puukuuri ja öösel sealt metsa , metsavennad maeti salaja , et hauakohtagi alles ei jääks . 
1434	NA	 Te ju teate seda ? 
1435	NA	 Vaatasin ja vaikisin . 
1435	NA	 Muidugi teadsin . 
1435	NA	 Miks ma ei teadnud . 
1436	NA	 Elu on püha , seletas uurija mulle . 
1436	NA	 Kõnekäänd ütleb , et surnud matavad ennast ise . 
1436	NA	 Hauakivi paneku koha näitavad teile ehk need , kes tema matsid . 
1436	NA	 Kui vaeva näete , kui jutule saate . 
1436	NA	 Teile võidakse öelda rohkem kui mulle . 
1437	NA	 Jurist , kes mind uue aja kommetega kurssi viis , oli tõesti kolmekümne viie aastane . 
1437	NA	 Mis on minu elu tema kõrval , kui ma ei tea ajaloo toimimisest midagi . 
1438	NA	 Nii lihtne seletus , nii lihtsad on aastakümnetetagused mõrvad . 
1439	NA	 Mis ma sulle ütlesin , ohkas ema ilmega , nagu vaataks imikut , hoia suu kinni ja lase neil rääkida . 
1439	NA	 Mis sa uurid ? 
1439	NA	 Sa võid peksagi saada , kui aina torgid ja küsimusi esitad . 
1439	NA	 Tema igatahes ei mäletavat enam midagi . 
1440	NA	 Ja minu osaks on uned . 
1441	 33 . 	 33 . 
1442	NA	 Ennäe - maapealset õiglust ikkagi tahan . 
1442	NA	 Mõtlesin isale , süütasin küünla , jäin magama ning nägin unes presidenti . 
1442	NA	 President tuli ise mu koju . 
1442	NA	 Ma polnud veel ärganud . 
1442	NA	 Kui president tuli , võpatasin unest üles ning hakkasin kurtma . 
1442	NA	 Nii ja nii on ja oli kunagi , aga tõde ja õiglust ei saa kuidagi kätte . 
1442	NA	 President on pikk mees - võib-olla ainuke pikk mees lühikese ajaloo kestel , sest iga hetk võime pimedusse tagasi kukkuda , miks muidu ma niitmist nii hoolsalt harjutan - , president silitas mu pead ning ütles , et mõistab , vägagi mõistab . 
1442	NA	 Ja mu kodutõestust mõistvat ta ka . 
1443	NA	 Kõik ilmalaanen laiali , tahtsin ma laulda , kui president uuris mu pabereid . 
1443	NA	 Minu alateadvus ei ole kunagi korralikult riides . 
1443	NA	 Mu alateadvus pole ka alasti . 
1443	NA	 Ikka kas lilleline või muidu kirju öösärk on alateadvusel ümber . 
1443	NA	 Öösärk ulatub varvasteni . 
1443	NA	 Selles ma siis presidendiga rääkisin , käsundusohvitser vaatas pealt . 
1444	NA	 Kodune oli . 
1444	NA	 Kohtumispaik ikka samas majas , kus seitseteist aastat olen elanud : laiad tugevad müürid , üle kolme meetri kõrgused laed , aknalaual võib lausa istuda . 
1444	NA	 Klaasid on kahekordsed ja raamid ka . 
1444	NA	 Tolmu oli palju ja segadust . 
1444	NA	 Mitte korter , vaid kolikamber rohkem . 
1445	NA	 President uuris pabereid , kuulas mind - see oli nii loomulik , et ta mu kutsumise peale otse koju tuli ! - ja kordas mitu korda , et mõistab , et järeldused on õiged , et päris tark tüdruk olen , ainult pangu ma end nüüd riidesse . 
1446	NA	 Teha pole siin midagi , teha pole sul midagi , aeg teeb ise , ütles president . 
1447	NA	 Presidendil oli käes pakk ajalehti , oli neid vist äsja lugenud , lehtedel oli loetud välimus . 
1447	NA	 Ja pikk mantel oli temal ka . 
1448	NA	 Kui soovitused kõik antud , hakkas president minema . 
1448	NA	 Siis mõtles veidi ja võttis taskust peotäie raha - unes tundus nii loomulik , ilmsuses ehmatab , sest raha tähendab tüli - , kas tahtsin või ei tahtnud , kuid silm kleepis end rahasse kinni . 
1448	NA	 Seda on alati nii vähe ja nüüd terve nutsak peos : kümnesed , kahekümne viiesed , isegi ühekrooniseid oli . 
1449	NA	 Väike tüli , mõtlesin pärast . 
1449	NA	 Väikese tüli ettemääratus ilmus seal unes , kui president mind kodus külastas . 
1450	NA	 Aga siis ei mõelnud ma midagi . 
1450	NA	 President läks ja käsundusohvitser ka . 
1450	NA	 Uksel veel silitas pead . 
1450	NA	 Käskis juuksed lühemaks lõigata , salgud olid õlgadeni . 
1450	NA	 Nii pikki juukseid kandsin lapsena . 
1451	NA	 Kui vana ma unenäos presidendiga kohtudes olin , enam ei mäleta . 
1452	NA	 Õiglust tahtsin , seda mäletan . 
1452	NA	 Kurtsin millegi üle . 
1453	NA	 Ja siis oli president läinud ja uni otsas . 
1453	NA	 Akna taga linnud , päike ja kastest kuivav rohi . 
1454	NA	 Ma elan nüüd suviti siin , aga unedes vahetan paiku . 
1454	NA	 Kord oli nii , et pea sees oli süsimust taevas täis sakilisi välke . 
1454	NA	 Aju sisemust nägin . 
1454	NA	 Välkude hääletut sähvimist . 
1454	NA	 Aju on masin . 
1454	NA	 Aju oli lühises . 
1454	NA	 Kui sellest õudusest ärkasin , ei teadnud enam , kus olen või olin . 
1454	NA	 Mu keha lamas millelgi , aga mis paigas , mis toas , mis ümbruses , seda mõistus ei teadnud . 
1454	NA	 Püüdsin liigutada kätt , haarata seinalambi lülitist , aga käsi ei tõusnud , ei mõistnudki enam , kus on lüliti . 
1455	NA	 Lamasin liikumisvõimetuna keset pimedust , ei suunda , ei valgust . 
1455	NA	 Tahtsin karjuda , kuid häält ei olnud . 
1455	NA	 Isegi huuled ei liikunud . 
1456	NA	 Kes ja kus ma olin viis või kümme sekundit ? 
1456	NA	 Mis igavikus ma olin ? 
1456	NA	 Päris ime , et unest ärganult tõusin lõpuks uuesti ellu , mööbliga tuppa , valguslampide alla . 
1456	NA	 Veel suurem ime on , et lõpuks siiski kirjutamisseisundis , tähed kui elusad olendid valges paberis seemneks sees . 
1457	NA	 Siin ja nüüd pärast presidendi lahkumist tuli see meelde . 
1457	NA	 Too unenägu sellesse ärkamisse ja meelde , kui president on ammu läinud . 
1458	NA	 Mis see siis on , mõtlesin . 
1458	NA	 Jumalale ma juba ei kurda . 
1458	NA	 Jumalale ei kaeba ma kunagi . 
1458	NA	 Palun lihtsalt . 
1458	NA	 Meieisapalves loodan unesse rahu . 
1458	NA	 Järgmisse päeva rahu . 
1458	NA	 Kõik õiglused ja ebaõiglused pole jumala arutlusaine . 
1458	NA	 Tema on määranud saatuse ning minu asi on , kas leian üles need vastuhaku ja elulootuse augud , mis on jäetud igaühe tarbeks kangasse sisse . 
1458	NA	 Selle teadmise tõttu ei palu ma Jumalalt kunagi , et ta teeks õigust , tasuks või leevendaks . 
1458	NA	 Jumala hooled on teised . 
1459	NA	 Kui Jumal mind ennast paluda lubab , on just see tema hoolivusmärk . 
1459	NA	 Olen hingekirjas , olen ilmakirjas ja maa peal , rohkemat tahta on ajalik äri . 
1460	NA	 Kui oma maja laial trepil öösiti seisan ja vaatan kõrgusse , tähtedetagusesse põhjatusse , mis aina kerkib ja kerkib , nii et vahel haaran uksepiidast kõhedust tundes kinni - nagu oleks piit see ankur , mis lendutõusmisest päästab ! - , ei mõtle ma jumalale erilisemalt kunagi . 
1460	NA	 Need tähed , see ilmaruum on jumala loodud ja küllap siis möödaminnes ma isegi . 
1461	NA	 Aadam ja Eeva kirjutatakse kodutute puhul alati väikese tähega . 
1461	NA	 Suureline oleks rohkem tahta . 
1462	 34 . 	 34 . 
1463	NA	 Alles kaua aega hiljem tunnistas ta mulle , et tegelikult ei ole ta ühelegi nõuandjale pahane . 
1463	NA	 Ta otse imestavat , kui tugev on tema enda silmapimedus : fotol olevat ema jalge ees asuvas seljakotis olnud marjad , tema näinud , et leivad . 
1464	NA	 Vaatasin fotosid läbi luubi , aga marju ei näinud . 
1465	NA	 Nii polevat ta ka tähele pannud , et pärast Kaarli ja Meinhardi punkrist lahkumist , pärast Kolga lahingut , tuli samale punkrile täpselt rihitud haarang . 
1466	NA	 See oli ime , et nad pääsesid , õhanud Kaarel . 
1467	NA	 Ju nad sellepärast pääsesid , et ka mina aitasin seda punkrit ehitada . 
1467	NA	 Ehitades palusin ma Jumalat , et Kõigevägevam meid hoiaks , oli kaustikust ette lugenud Kaarel . 
1468	NA	 Fotod on tehtud pääsemisjärgsel suvel . 
1468	NA	 Fotod ei ole tehtud salaja . 
1469	NA	 Neis on elujoovastus , ütles ta . 
1469	NA	 Seal pummeldati ja tantsiti , arutati , mis keegi teeb , kui kinni kukub . 
1469	NA	 Tögati ja visati üksteise üle nalja . 
1469	NA	 Kui keegi ütleski - ütlejad võisid olla naised , arvas ta , naistel on ohutunne tugevam - , et ärge möllake , äkki ikkagi pääseme eluga , oli üks juba üheksa aastat metsas olnud mees hõisanud : 
1470	NA	 MA TAHAN ELADA PRAEGU , PÄRAST TULGU VÕI VEEUPUTUS ! 
1471	NA	 See , mida Ameerika Hääle raadio lubas ja õhutas , tundus 1953. aastal juba pilkena . 
1471	NA	 Teed olid valvajaid täis , inimesed hirmul ja haaranguist tüdinud . 
1471	NA	 Surm tantsis metsades ringi kui pöörane . 
1472	NA	 Võib-olla üksikult olijail oli veel lootust , lisas ta vahele , suured metsavendade salgad võeti kinni või tapeti viimseni . 
1472	NA	 Nii ta arvavat , tema , kes ta neis punkrites tagantjärele veel mõtetes elab . 
1473	NA	 Seegi , mida Kaarli mälestused võltsivad või arhiivid nüüd välja annavad , polnud veel teada . 
1473	NA	 Tulevik puudus täiesti . 
1473	NA	 Vaid praegune elu oli teada ja kes tahes julgeolekus murduv mees või teadeteviija veel üsna samasugune metsavend kui teisedki . 
1474	NA	 Selle vahega ehk , et kui Kaarel Kolga lahingust pääses , oli meestele tulnud meelde , et ta just lahingu eeli päevade kaupa ringi trampis ja teised ei teadnud , kus tema õieti käis . - Nii oli talle Vilma millalgi rääkinud . - Juurelda polnud ju nagunii aega : ikka vaid haarangud , tulevahetus või hoiatuste peale põgenemine , ja need vahepealsed mölluhetked polnud muud kui pidu katku ajal. 
1475	NA	 Tal olevat imelik mõtelda , et mehed ise vast kõiki fotosid pole näinudki . 
1475	NA	 Meie näeme , meile vaatab üks allakolmekümneste kamp piltidelt naerukalt vastu , just nagu ütleksid kõik ja kooris : Vaadake meid , kas me pole toredad poisid . 
1476	NA	 Ja Vilma naeratab ja kaks naist muhelevad seal veel . 
