par_nr	head	sentence
145	NA	" "" Mul pole tõestuseks salvestusi , kaamera neid ei võtnud . "
145	NA	 Ja ma tunnen ennast kuidagi teistmoodi , pärast nende nägemist . 
145	NA	 Ei oska seda kirjeldada . 
145	NA	" Nad oli ju minust kaugel , aga samas ka väga lähedal , nagu minu sees . "" "
146	NA	" "" Kirjuta kõik üles , mida sina nägid . "" "
147	NA	" "" Hästi , ma teen seda ... "
147	NA	" Aga kas sa usud mind ? "" "
148	NA	" "" Ma usun , et sa räägid , mida sa nägid . "
148	NA	 Kaamera ei vangista reaalsust , nagu mõnikord arvatakse . 
148	NA	 Ma ei tea , miks kaamera neid ei näinud , aga meie tehnikud selgitavad selle kindlasti välja . 
148	NA	 Esialgu sellest piisab , Linne . 
148	NA	 Sa ei pea homme tagasi minema . 
148	NA	" Võid magama minna . "" "
149	NA	 Estrada oli oodanud midagi enamat — küsimusi , uurimisi , kaasatundmist . 
149	NA	 Lõppeks oli ju see olnud tema esimene missioon , ning hoolimata et läbikukkunud , ootas tüdruk siiski oma salaarmastatult toetust ja kiitust . 
149	NA	 Ta uskus end Zemanit hästi tundvat ja lootis seetõttu mehelt lohutust või vähemalt mõistvat suhtumist . 
149	NA	 Kuid Zeman polnud teda ka noominud ... 
149	NA	 Zeman oli täna imelik , ehk peitus siin Estrada võimalus ? 
150	NA	" "" Ma tahtsin küsida , et ega sa pahane pole , et ma läbi kukkusin , "" söandas ta siiski lõpuks küsida , enne kui ukse poole pöördus . "
151	NA	 Zeman tõusis oma hiidtugitoolist ja astus akna juurde , millelt avanes vaade kaljudes asuva Pesa kohal hõljuvatele pilvedele . 
152	NA	" "" Ma ei saa olla pahane , Linne . "
152	NA	 Sest pahandamine on isiklik emotsioon . 
152	NA	 Ma ei võta oma tööd tunnetega , sa peaksid seda teadma . 
152	NA	" Sinu ülesanne jäi küll esmapilgul täitmata , ometi tood sa väga olulist informatsiooni . "" "
153	NA	" "" Kas vaimudest ? "" "
154	NA	" "" Noh , nimetame neid siis pealegi niimooodi . "
154	NA	 Aga , jah , just vaimudest . 
154	NA	" Ma pean selle üle mõtlema . "" "
155	NA	" "" Kas poleks targem lasta arvutitel seda analüüsida ? "" päris Estrada ja vakatas samas , hoomates , et oli söandanud Foogti sõnades kahelda . "
156	NA	" "" Mida analüüsida , Linne ? "
156	NA	 Kas seda , mida ainult sinu silmad nägid ? 
156	NA	" Meil pole ju elektroonilist materjali , mida Azarjani orjadele läbinärimiseks anda . "" "
157	NA	" "" Olen nõus hüpnodetektortesti läbima , "" pakkus Estrada ennastsalgavalt , ise mõistmata , kas see ohverdus avaldaks Zemanile seda mõju , mida ta sisimas soovis . "
158	NA	" "" Kas Capaneus sind veel vähe vintsutas ? "
158	NA	 Pole mul vaja neid teste . 
158	NA	" Ma nägin su silmi , Linne , kuulsin su häält ja seda on praegu enam kui küll . "" "
159	NA	 Kas oli see nüüd Zemani poolt nii mitmekordne Estrada eesnime kasutamine või armunu hullumeelne julgus oma soovide täitumiseks ? 
159	NA	 Kuid kergelt õhetav Estrada julges siiski õrnal häälel küsida : 
160	NA	" "" Ja mida mu silmad siis sulle rääkisid ? "" "
161	NA	 Zeman ei vastanud kohe , vaid vaatas taas Estradale sügavalt otsa . 
161	NA	 Tüdruk ei suutnud peletada tunnet , et Foogti mõtted viibisid kaugel eemal . 
161	NA	 Võib-olla seal kaugel Excelsusel , kus kuskil jääsügavustes pidi igaveseks külmununa lebama selle tüdruku surnukeha , kes oli valmistanud jääskulptuuri , mis lebas kliimaseadmes Zemani laual . 
161	NA	 Ja oli seal lebanud sellest päevast peale , mil Zeman esmakordselt Pesa Foogti kabineti asustas . 
162	NA	" "" Üldiselt üsna palju . "
162	NA	 Sinu silmad üritavad varjata süütunnet , mida sa täiesti asjatult endale kaela määrid . 
162	NA	 Sa oled noor ohvitser ja võtad seetõttu oma ülesandeid üleliia tõsiselt . 
162	NA	 Me saame varsti niikuinii teada , kus need koopaõed ringi hulguvad . 
162	NA	 Kui ma käiksin Konservatooriumile rohkem peale , oleks meil varsti satelliidid üleval ja teoreetiliselt võiksime ju kogu selle kandi kaameraid täis toppida . 
162	NA	 Aga mina soovin isiklikku kogemust , saad aru ? 
162	NA	 Ma tahan , et sinusugused tundlikud inimesed näeksid meie hoolealuste silmi vahetult . 
162	NA	 Ma tahan , et sa kirjeldaksid oma tundeid , et sa ütleksid need välja . 
162	NA	 Miks ma olen sinu välja valinud ? 
162	NA	 Sa peaksid juba aimama . 
162	NA	 Sa oled tunnetega inimene , sa mõistad inimesi . 
162	NA	 Ja ma vajan sinu hinnanguid ja arvamusi . 
162	NA	 Ma ei viitsi vaadata neid lõputuid holosid — salvestusi või transmissiooni . 
162	NA	" See pole reaalne , Linne . "" "
163	NA	 Nüüd ! 
163	NA	 Kas nüüd oli Estrada lõpuks püüdnud selle Zemani avanemise , mis aitaks teda edasi ? 
164	NA	" "" Sa tahad , et ma kirjeldaksin oma tundeid ? "" "
165	NA	" "" Jah ! "" "
166	NA	" "" Kas siis tundeid saab kirjeldada ? "" "
167	NA	" "" Tuleb püüda . "" "
168	NA	 Estradale meenusid katked kuulujuttudest , kuidas praegune situatsioon oleks edasi arenenud Õukonnas Terranooval . 
168	NA	 See julgustas ja ühtlasi hirmutas teda . 
168	NA	 Sarviku sarved ... ta tahtis selle pildi eest põgeneda ! 
169	NA	" "" Ma ... ma ei oska . "" "
170	NA	 Ta teadis , kuid ei julenud . 
170	NA	 Terranooval oleks kõik olnud lihtsam . 
170	NA	 Tihti ei kulutatavat Õukonnas isegi sõnu ettepanekute peale . 
170	NA	 Aga siin pole Terranoova . 
171	NA	" "" Sa oled seda alati osanud . "
171	NA	 Ja oskasid ka täna . 
171	NA	" Mul oli sellest palju abi . "" "
172	NA	 Aga mulle ju ei olnud ! 
173	NA	" "" Sa ütlesid , et tahad , et ütleksin , mida ma tunnen ? "" "
174	NA	 Zeman tõmbas kätega läbi oma hallikaks tõmbuvate juuste ning naeratas siis Estradale julgustavalt . 
175	NA	" "" Mul on vaja sinusuguseid tundlikke ohvitsere , Linne . "
175	NA	 On väga vaja . 
175	NA	 Ära muretse tänase pärast , ma hakkan sind nüüd rohkem alla saatma . 
175	NA	 Sinust tuleb üks meie parimaid Vaatlejaid . 
175	NA	" Ka Dhaka palus välitööst veidi puhkust ja ta saab seda , Cirnetta on valveohvitserina suurepärane . "" "
176	NA	 Oh miks ta küll ütles 'sinusuguseid ohvitsere' , miks ta ei öelnud , et tal on mind vaja . 
176	NA	 Mina lähen alla , aga Dhaka jääb siia ... 
176	NA	 Mul pole enam aega . 
177	NA	" "" Bent , "" esmakordselt kõnetas Estrada Foogti nüüd eesnime pidi . "
177	NA	" "" Bent , ma tahan sinuga magada ! "" "
178	NA	 Nüüd oli see öeldud ja Estradale tundus , et see polnud üldse tema hääl , kes neid sõnu lausus . 
178	NA	 Ta mõtles , kas peaks äkki silmad sulgema , aga kuna ta seda ei teinud , ei paistnudki see enam oluline . 
179	NA	" Siis kuulis ta mahedat ja kindlat Foogti häält ütlemas : "" Mul on hea meel , et sa ei öelnud , et armastad mind . "" "
180	NA	" "" Miks ? "" "
181	NA	" "" Sest sellest poleks küllalt olnud . "
181	NA	" Ja seda teadsin ma niigi . "" "
182	NA	" "" Aga nüüd on küllalt ? "" "
183	NA	 Vastuse asemel astus Zeman noore Vaatleja juurde , suudles teda kirglikult ja oskuslikult huultele ning Estrada oli juhtunust liiga ehmatunud , et peale suu poekvil hoidmise midagi teha . 
183	NA	 Siis ütles Zeman : 
184	NA	" "" Lähemaks kaheksaks aastaks küll . "
184	NA	 Sa kirjeldasid täpselt oma tundeid ja see on hea . 
184	NA	" Lähme siis ... ! "" "
185	NA	 Estrada tahtis veel öelda , et ta ei kirjeldanud oma tundeid vaid soove , kuid sai aru , et on niigi palju rääkinud ja üleliigsed sõnad võivad rikkuda seda habrast lainepikkust , kuhu ta oli suutnud Zemani omalegi teadmata kuidas suunata . 
185	NA	 Aga Estrada märkas , et enne , kui nad Zemani kabinet-kodu tahanurka tatamile suundusid , vajutas Foogt nupule , mis langetas rippseina . 
185	NA	 Nii , et tatamile ei paistnud Zemani laual lebav jääskulptuur . 
186	NA	 Bent vris Zeman 43. 
186	NA	 Ardaman ; kell 10.04 
187	NA	 See kaugnõupidamine oli kolmas Capaneusi ajaloo jooksul , kolmas ja kõige tähtsam ja võimalik , et ka viimane . 
187	NA	 Pesa sidesaalis istusid Bent vris Zeman , Balthus Azarjan ja Teadusülem Zev Lilkus . 
187	NA	 Nende ees oli suur ekraan , mille kaheks lahtriks jagatud ülemises osas olid kaks suurt kõnelevat pead , alumisse osasse , mis kattis kogu ekraanilaiust , võis kuvada kõige erisugusemaid andmeid , holosid ja muud kraami , mida nõupidajatel võis tarvis minna . 
187	NA	 Ekraanilt rääkivad pead asusid muidugi Terranooval , Konservatooriumis ja need olid rektor Holger bont Hilversum ning Tema Majesteedi eriülesannetes esindaja Givi ibis Bach . 
187	NA	 Zeman teadis , et meeste taga istuvad veel mitmed nõunikud , kuid neil polnud tarvis kõnelda . 
187	NA	 Vähemalt Pesaga mitte . 
188	NA	 Azarjan nägi oma elus niivõrd esinduslikku seltskonda esmakordselt ja oli otsustanud rangelt kinni pidada Zemani nõudest rääkida ainult siis , kui temalt midagi küsitakse . 
188	NA	 Konservatooriumi kõrgaadel võib mõningates etiketiküsimustes olla küllaltki noriv ja nõudlik . 
189	NA	 Kõik osalised teadsid — nõu tuli pidada kiiresti . 
189	NA	 Sideseansi toimumiseks olid mobiliseeritud seitsme ruumiterminali koobaltradarid ja Konservatooriumile läks operatiivsus maksma väga palju — umbes ühe ekspeditsioonilaeva reisikulud . 
189	NA	 Nõupidamist juhatas ibis Bach ja Zeman oli väga rahul , et just see mees oli Tema Majesteedi erisaadikuks valitud . 
189	NA	 Bach oli igati mõistlik tegelane , üks vähestest ministritest , kes ei pidanud Konservatooriumi tühjaks aja- ja raharaiskajaks . 
190	NA	 Bachi hääl kostus kõlaritest läbi tugeva ragina ja müha . 
190	NA	 Ometi võis tema toonis tabada teatava rahulolu , mis ilmselt tuli olukorra tähtsusest . 
191	NA	" "" Meil on vähe aega , Capaneus , "" alustas Bach . "
191	NA	" "" Tehkem seega lühidalt . "
191	NA	 Teie ettekanded on meil käes , probleem fikseeritud . 
191	NA	 Lahendust ei ole , on palju variante , kuid kõik lähevad millegagi vastuollu . 
191	NA	 Kõigepealt , teen teile teatavaks veel ühe ebameeldiva uudise . 
191	NA	" Teile jõuab varsti transportlaev "" Vitus "" , mis toob harilikku toidu- ja muud kraami . "
191	NA	" "" Vitusel "" on peal samuti üsna võimas observatoorium . "
191	NA	 Paar päeva tagasi teatasid nad , et teile lähenev asteroid pole sugugi ainus . 
191	NA	 Tema taga on tulemas veel viis sama suurt kamakat , mingid aastad on seal intervalliks vahel . 
191	NA	" Ühesõnaga , arvestage kuue suure pauguga . "" "
192	NA	 Uudis oli muidugi rabav . 
192	NA	 Zeman juba teadis , kuidas see olukorda veelgi keerustab . 
193	NA	" "" Te saatsite meile oma raporti , kuid mitte sõnagi , kuidas te ise probleemi näete , "" jätkas Bach . "
193	NA	" "" Öelge nüüd Zeman , kuidas Pesa olukorrast aru saab ? "" "
194	NA	 Foogt kummardus kergelt ja nägi , kuidas rektor Hilversum talle julgustavalt noogutas . 
194	NA	 Hertsog bont Hilversum oli Capaneusi Harta vaimne isa , mittesekkumispoliitika väljatöötaja kõigis selle üksikasjades . 
194	NA	 Lisaks oli just Hilversum olnud see , kes kompromissitult oli nõudnud Zemani ülendamist Foogtiks . 
195	NA	" "" Capaneus on ainulaadne maailm , lugupeetavad , "" alustas Zeman . "
195	NA	" "" Maailm , mille tähtsus ja tähendus ei ole meie põlvkonna otsustada ega aru saada . "
195	NA	 Maalt väljumisest alates on inimkond otsinud omi vendi mõistuses , tegelnud selle ülesandega , suutmata kunagi üheselt öelda , miks see nii tähtis on . 
195	NA	 Endataoliste leidmine on sisemine vajadus , instinkt , kui soovite , mille tarbeks pole kunagi kokku hoitud aega ega energiat . 
195	NA	 Ka siis , kui eebenkütus oli veel leidmata ning kosmoselend oli mitmeid kordi keerulisem kui praegu . 
195	NA	 Nüüd on meil Capaneus oma ainulaadse rahvastikuga , mis viibib veel iidse Maa mõistes kvaternaari ajastus — maailm , millelt meie järeltulevad põlvkonnad leiavad vennasrassi . 
195	NA	 Oleme tulnud siia maailma ainult vaatlejatena ja oleme põliselanikkonnale andnud Harta — oma lubaduse mitte mingilgi viisil sekkuda siinsesse evolutsiooni , maailmapilti , iseeneslikku arengusse ning oleme tõotanud endast mitte kuidagi teada anda . 
195	NA	" Meie eesmärk on teadus . "" "
196	NA	" "" Me teame kõike seda , "" tundus nagu oleks Bach valgusaastate taga korraks kannatamatult köhatanud . "
196	NA	" "" Oleksite võinud sissejuhatuse ära jätta . "" "
197	NA	" "" Ma tahan jõuda selleni , "" jätkas Zeman laskmata end häirida , "" et Harta on sätestanud unikaalse ja vältimatu poliitika , mis siiani on lubanud ära hoida kõik arusaamatused , on tõmmanud piirid , sätestanud vastutuse . "
197	NA	 Harta on töötanud — igas olukorras ja alati . 
197	NA	 Hartast oleme leidnud suuniseid ja juhiseid . 
197	NA	 Harta on töötanud . 
197	NA	 Nüüd on Harta kaudselt põhjustamas esimest kriisi . 
197	NA	" On selge , et uues olukorras meil saab olema väga raske ainult Hartast juhinduda . "" "
198	NA	" "" Tahate öelda , et Hartat tuleks täiendada ? "" küsis rektor Hilversum . "
199	NA	" "" Võimalik . "
199	NA	 See oleks asja üks külg — niiöelda juriidiline nüanss . 
199	NA	" Hoopis tähtsam on see , et lahenduse leidmisel peame me väljuma Harta raamistikust , sest sealt me ei leia oma küsimustele vastuseid . "" "
200	NA	" Hilversum : "" Teil võib muidugi õigus olla , Zeman . "
200	NA	 Aga ma juhiksin meie konsiiliumi tähelepanu sellele , et Hartat luues oli üheks meie põhieesmärgiks tagada Capaneusi sekkumatu areng . 
200	NA	 Me välistasime enda jaoks kohe ideed kiirest kontaktist ja muust seesugusest . 
200	NA	 Me välistasime võimaluse muutuda aborigeenidele jumalaks , kaitsvaks ja juhendavaks käeks . 
200	NA	 Nii nagu polnud ka inimkonna kohal ühtegi kõrgemat tsivilisatsiooni . 
200	NA	" Ja Harta peaks välistama ka kauges tulevikus võimaluse , et inimkonna tegevuse jäljed Capaneusil muutuks neile jumala hääleks või tekitaks võltsreligioone . "" "
201	NA	 Zeman tundis , et siinkohal peaks ta sõna andma Zev Lilkusele , sest just sel teemal olid nad enne seanssi mõtteid vahetanud . 
201	NA	 Nii Foogt tegigi . 
201	NA	 Lilkus alustas oma möriseval basshäälel : 
202	NA	" "" Üldiselt on Harta juba viinudki ühe paradoksini , millest meil Foogtiga ka juttu on olnud . "
202	NA	 Tema pole minuga nõus . 
202	NA	 Kuid siiski , vaadake , kõrgeaulised — me ei tohi aborigeene millegi eest kaitsta . 
202	NA	 Nad peavad ise arenema , nii nagu loodus neile määranud on . 
202	NA	 Kuid planeet on ju konserveeritud . 
202	NA	 Me kaitseme neid meie endi eest ! 
202	NA	 Kui Konservatoorium poleks Capaneusi oma hoole alla võtnud , oleks siia saabunud meeletutes kogustes turiste , jahimehi ja muid uitajaid , kes kõik oleks loomulikku arengut omal moel mõjutanud . 
202	NA	 Me kaitseme Capaneusi inimeste eest ja see oleks nagu juba Hartaga vastuolus . 
202	NA	 Paradoks seisneb aga minu meelest selles , et meie jõudmine siia planeedile on samuti loomulik areng , kui vaadata asjale universaalselt , kogu-universumilises plaanis . 
202	NA	 Inimkonna areng oli loomulik ja kõik tema saavutused seetõttu samuti . 
202	NA	" Meie viibimine siin ongi loomulik areng . "" "
203	NA	" "" Järelikult on loomulik ka meie mittesekkumine , kui me nii oleme otsustanud , "" lõikas Hilversum . "
203	NA	" "" Need asjad vaieldi selgeks juba Harta loomise ajal , pole põhjust neid praegu üle arutada . "" "
204	NA	" "" Siiski , siiski , rektor , "" ei jätnud Lilkus , tundes terranoovalastele märkamatuks jäänud Zemani julgustavat müksu . "
204	NA	" "" Me kaitseme neid loomuliku arengu eest , mida meie hetkel peame loomulikuks . "
204	NA	 Te väidate , et kui me ei soovi sekkuda , ongi see loomulik . 
204	NA	 Mina kaldun arvama , et me hoiame ennast tagasi , sulgeme ennast kunstlike barjääride taha , et teha niiviisi endale asjad lihtsamaks ja mugavamaks . 
204	NA	" Kas see , mida me peame loomulikuks , on tegelikult loomulik , ah ? ... "" "
205	NA	" "" Zev , ärme hakkame praegu filosofeerima , "" kähvas Hilverum . "
206	NA	" "" Aga kust võtame me endale õiguse öelda , "" jätkas Lilkus häirimatult , "" et nende inimeste ellujäämine pole meie otsustada ? "
206	NA	 Rektor ja kõrgeauline ibis Bach , ma olen siin maailmas viibinud neliteist aastat ! 
206	NA	 Ja ma tean kuut tuhandet viitkümmend viit moodust , kuidas nende inimeste elu hõlpsamaks muuta , ilma end ise neile näitamata . 
206	NA	 Me ei taha , ei julge võtta vastutust selle planeedi käekäigu eest , kuigi võib-olla meile pandud universumiline kohus ongi neid aidata . 
206	NA	 Me peame need asteroidid hävitama . 
206	NA	" Ja rohkem öelda ei olegi . "" "
207	NA	 Matemaatik ja süsteemianalüütik Zev Lilkus oli olnud Capaneusi lahtimõtestamisel Zemani suurimaks toeks . 
207	NA	 Foogt oli habemikust teadlasesse väga kiindunud ja viimane vastas talle Foogti autoriteedi vastuvaidlematu tunnustamisega . 
207	NA	 Sest teatav jäärapäisus oli see , mis oli Zevi neliteist aastat Capaneusil hoidnud ja seganud tal saavutamast vähemalt asekrahvi tiitlit , mis aastate poolest talle ammu oleks omistatud . 
208	NA	" "" Paistab , et kipume liialt targutamisesse kalduma , "" sekkus autoriteetsel toonil Bach . "
208	NA	" "" Me peame leidma otsuse , mida teha kujunenud olukorras , mitte heietama asjade üle , mil puudub hetkel praktiline aspekt . "
208	NA	 Harta on olemas ja ütleb piisavalt konkreetselt , et me ei tohi nende ellu sekkuda . 
208	NA	 Sellest peaks piisama . 
208	NA	" Ma annan sõna rektor Hilversumile . "" "
209	NA	 Zeman teadis , mida rektor ütleb . 
209	NA	 Paistis , et jõujooned olid juba enne nõupidamist välja kujunenud . 
210	NA	" "" Harta on tõesti olemas , "" ütles rektor , "" kuigi Zeman kaldub arvama , et me ei pruugi Harta raamistikust lahendust leida . "
210	NA	 Mina kaldun arvama , et Harta on siiski ainus alus , millele tugineda . 
210	NA	 Kui me hävitame asteroidid , päästame me Capaneusi surmast . 
210	NA	 Me päästaksime ka kõik aborigeenid . 
210	NA	 See oleks seesama jumala käsi , mida me iga hinna eest oleme proovinud senini vältida . 
210	NA	 Ma nõustun , et Capaneusi hävimine oleks tragöödia . 
210	NA	 Paljud ei mõistaks meie otsust , paljud järeltulevad põlvkonnad mõistaks selle hukka . 
210	NA	 Kuid planeeti päästes looksime pretsedendi , millest tuleks ka edaspidi kinni pidada . 
210	NA	 Capaneusil on ees veel palju maavärinaid , vulkaanipurskeid , üleujutusi . 
210	NA	" Mida me siis teeme ? "" "
211	NA	 Küsimus oli retooriline , kuid Zeman kasutas rektori poolt tehtud efektset pausi , et sekkuda . 
212	NA	" "" Palun ärge unustage , et sel planeedil on viibinud ka teine ülirass , meile veel tundmatu mõistus . "
212	NA	 Ja kindlasti pole me veel leidnud kõiki nende siinviibimisest kõnelevaid märke . 
212	NA	 Palju on veel läbi uurimata . 
212	NA	" Kui Capaneus hävib , hävib ka see ülihinnaline tõendusmaterjal . "" "
213	NA	" "" Ahjaa , see suur X , "" köhatas Bach . "
213	NA	" "" Kui ma õigesti mäletan , siis on üks teooria , mille järgi nad toimetasid Capaneusi inimeste raevu eest eemale mingid kiskjalised , keda nende lemmikloomadeks peetakse ? "" "
214	NA	" "" Ja pange tähele — sekkusid niiviisi planeedi loomulikku arengusse , "" torkas Lilkus mornilt . "
215	NA	" "" Just nimelt , "" vastas Zeman . "
215	NA	" "" Sekkusid ja toimetasid nad planeedile Excelsus , millest te kindlasti kuulnud olete . "
215	NA	" Ja lisaks on siin veel see kuulus sümfooniaorkester , mille otstarvet pole me senini mõistnud . "" "
216	NA	" "" Peate silmas süvakoopas asuvat basaltuurete süsteemi , seda , mis muusikat teeb ? "" "
217	NA	 Jah , just seda uuretega ripp-basaldi skeemi pidas Zeman silmas . 
217	NA	 Tühjad basaldipurikad , uuristatud kanalid kaljude all , inimesele senikogematu akustiline süsteem , mille kellegi tundmatud käed olid meisterdanud . 
217	NA	 Kui üheaegselt lasta kanalisuudmesse teatava massi ja tihedusega metallist kuulikesed , võib kuulda midagi imelist ja vapustavat . 
217	NA	 Tuul , metall ja basalt mängivad oma omadustega viise ja teemasid , mida loodusel on oma ratsionaalsuses võimatu luua . 
217	NA	 Koobas asus Zaindi mandri teises mäestikus — Nathanias . 
217	NA	 Capaneusi inimene koopale ligi ei pääsenud , kuid viimased uuringud ksonograafiga olid näidanud , et kunagi võis olla sealkandis elanud samuti üks rahvakild . 
217	NA	 Need võisid olla omalaadsed algmägilased . 
218	NA	" "" Siin võib olla veel palju muudki . "
218	NA	 Keegi , ma arvan , et see on meie suur tundmatu , on siin varem olnud . 
218	NA	 Midagi on teda Capaneusil huvitanud . 
218	NA	 Mis ? 
218	NA	 Selle väljaselgitamisega me ju tegelemegi . 
218	NA	" Capaneusi hävimine kokkupõrkes asteroidiga võib kõik need jäljed kustutada . "" "
219	NA	" Terranoovalt vastas Hilversum : "" X on tõesti huvitav ja oluline ja ma valgustan kõrgeaulist senjöör Bachi sellest hiljem . "
219	NA	 Me jahime neid juba kaua , kuid ilma tulemuseta . 
219	NA	 Ainult ebamäärased vihjed . 
219	NA	 Aga nagu ma aru saan , kaldute te , Foogt , arvama , et asteroidid tuleks hävitada ja sellega Capaneus oma hoolealuseks kuulutada . 
219	NA	" Olen teist õigesti aru saanud , peate te sellist teguviisi õigeks ? "" "
220	NA	 Zeman vaatas taas Lilkuse poole ja nägi kuidas teadlane nõustuvalt noogutas . 
220	NA	 Zeman ohkas sügavalt ja katsus kõlada eriti veenvalt . 
221	NA	" "" Meil pole mingit soovi Konservatooriumi autoriteetse arvamusega lahku minna . "
221	NA	 Nii nagu Terranooval otsustatakse , nii ka jääb . 
221	NA	 Ma paluksin hetkeks teie tähelepanu alumisele ekraanile . 
221	NA	" Magister Azarjan demonstreerib teile midagi . "" "
222	NA	 Balthus Azarjan köhatas ettevaatlikult ja kuvas ekraanile pildi , mis ilmselt kujutas Capaneusi kosmosest vaadatuna . 
222	NA	 Siis hakkas ta pisut kõhkleval häälel rääkima . 
223	NA	" "" Kui meie obs avastas läheneva asteroidi , hakkasin ma veidi lähemalt uurima Capaneusi lähiümbrust , kui nii võiks öelda . "
223	NA	 Seni oli obs peamiselt tegelnud meteoroloogiaga . 
223	NA	 Nüüd huvitas mind mõnevõrra rohkem teada saada planeedi atmosfäärist ja stratosfäärist . 
223	NA	" Soovisin leida kõige täpsemad parameetrid võimalike purustuste kohta , ühesõnaga näha , mis asteroidiga detailselt juhtub Capaneusile lähenedes ... "" "
224	NA	" "" Jah , me saame aru , rääkige edasi , "" rehmas Hilversum kannatamatult käega . "
225	NA	" "" Kohe . "
225	NA	 Niisiis uurisin ma neid alasid , millele me varem polnud tähelepanu pööranud . 
225	NA	 Piisavat tähelepanu , julgeksin ma lisada . 
225	NA	" Vaadake , see on nüüd salvestus , tehtud koobaltradariga , kasutades daelneutronite lineaarskaneeringut ... "" "
226	NA	 Ekraani alumises osas ulatus äärest äärde Mõõkkaljude teravatipuline mäeahelik , selle kohal sõudsid iidses rahus rünkpilved . 
226	NA	 Siis laskus pildile ähmane vari ja kujutis peatus — skaneering oli sisse lülitatud . 
226	NA	 Ja siis hakkasid äkitselt mööda ekraani liikuma numbrid . 
226	NA	 Täiesti arusaamatus tähenduses numbrid . 
227	NA	" "" Mis need on ? "" küsis ibis Bach kohe . "
227	NA	" "" Mingid ilmastikuandmed ? "" "
228	NA	" "" Peaaegu . "
228	NA	" Kohe ma lülitan sisse filtri , "" kostis Azarjan võidurõõmsalt . "
229	NA	 Filtriks nimetatud programm hakkas numbreid töötlema . 
229	NA	 Arvude asemele ilmusid tähed ja andmed , mis tõepoolest rääkisid midagi ilmastikust , stratosfääri keemilisest koosseisust ja muust ebahuvitavast . 
230	NA	" "" Aga nüüd , "" jätkas insener , "" on meie arvutite tarkus otsas . "" "
231	NA	 Programm seiskus , numbrikombinatsioonid peatusid ja üle ekraani lahvatas kiri : TUNDMATU TRANSMISSIOON . 
232	NA	" "" Mis see on ? "" ei saanud Bach aru . "
233	NA	" "" Seda tahaksime ka meie teada , "" vastas Azarjan . "
233	NA	" "" Keegi edastab Capaneusil arusaamatut signaali . "
233	NA	 Meie arvutid seda lahti kodeerida ei mõista , ei saa me aru ka , kuhu see suundub . 
233	NA	" Aga keegi on siin planeedil veel . "" "
234	NA	" "" Kuidas nii , "" ei mõistnud Hilversum . "
234	NA	" "" Kas te saate ka aru , mida te räägite ? "" "
235	NA	" "" Kuulake , palun , "" ütles Zeman . "
235	NA	" "" Ja katsuge mõista . "
235	NA	 Me oleme kogu aeg teadnud , et meie X on siin planeedil kunagi viibinud . 
235	NA	 Midagi on sellele tsivilisatsioonile siin huvi pakkunud . 
235	NA	 Võite ise arvata , mis või kes . 
235	NA	 Seda X-i oleme me jälitanud juba mitukümmend aastat ja ikka ilma tulemusteta . 
235	NA	 Me ei tea , kes nad on , mida nad mõtlevad , mida taotlevad , kuidas nad välja näevad , milline tehnika neil on . 
235	NA	 Me ei tea neist midagi . 
235	NA	 Aga nad on siin viibinud . 
235	NA	 Ja ilmselt jätnud maha midagi , mis edastab neile ikka veel teatavat infot selle kohta , mis Capaneusil toimub . 
235	NA	 See signaal tuleb tõenäoliselt üsna Pesa opereeritava ala lähedusest . 
235	NA	 Me ei tea täpselt , kust , miks ja kes seda edastab . 
235	NA	 Loomulikult me hakkame seda uurima . 
235	NA	 Aga see kõik võtab aega . 
235	NA	 Aga aega meil ei ole — asteroid läheneb . 
235	NA	" Ja tuleb otsustada , mis sellega teha . "" "
236	NA	" Hilversum : "" Te advokateerite selgelt asteroidide hävitamise poolt , Zeman . "
236	NA	 See on arusaadav , olete Capaneusil nii kaua olnud , see on teile koduks ja nii edasi . 
236	NA	 Aga kas te teate , mida on asteroidide hävitamiseks tarvis ? 
236	NA	 Kujutate ette ? 
236	NA	" Jätame praegu selle Harta ja mittesekkumise , lõppeks on see meie tehtud ja kui tarvis , võime selle alati ümber teha ... "" "
236	NA	 Selle koha peal pani Zeman tähele Hilversumi grimassi . 
236	NA	" "" Aga räägime praegu ressurssidest . "
236	NA	 Meil läheks tarvis kuut lahinglaeva neutronplasma kahuritega . 
236	NA	 Operatsiooni maksumus tuleks sama palju kui kolm sõda vabariiklastega kokku . 
236	NA	 Ja pidage meeles , et maksma peab kõige eest Konservatoorium . 
236	NA	 Panused on kõrged , Foogt . 
236	NA	 Tema Majesteedi arvamus on alles kujundamata , aga leian , et antud olukorras võib maksumus kallutada teda mittesekkumise poliitika tuliste pooldajate hulka . 
