par_nr	head	sentence
1	 Viljaküla Brita pajatused 	 Viljaküla Brita pajatused 
2	NA	 Kristel Salu 
3	 1 . 	 1 . 
4	NA	 Tere , kõik see pere — kõik teie , kellele mina , alternatiivlaps Viljaküla Brita , osutusin hingesugulaseks ja kes seetõttu leidsid minu memuaaridele koha oma raamaturiiulis või kummutisahtlis või öökapil või kogunisti padja all ! 
4	NA	 Loodetavasti eelistab teie õnn endiselt kodust eluviisi ega kipu küla peale ringi töllerdama . 
4	NA	 Kui te aga nüüd küsite , kuidas minu alternatiivsusega praeguseks lood on , siis teadke , et see üha süveneb , mitte ei lähe üle , nagu viieteistkümnendaks eluaastaks meie praegusel ajal nii mõnegagi kahjuks on juhtunud . 
4	NA	 Mina nimelt ikka veel ei joo , ei suitseta , ei tarvita narkootikume ega laaberda ringi , vaid loen raamatuid , armastan loodust ja loomi ning minu südamehääl saab alati esimesena sõnaõiguse . 
4	NA	 Kui leidub neid , kellele säärase vanaaegse tüdruku memuaarid taas kord lugemisrõõmu pakuvad , siis on selliste inimeste õnnel küll kange iseloom . 
4	NA	 Aga just nimelt teile , mu kallid sõbrad ja hingesugulased , sündiski minu memuaaride teine osa , mille ma seekord nimetan pajatusteks . 
4	NA	 Ja mine tea , võib-olla kuulete minust veel ka siis , kui olen kaheksakümmend — oma raamatukestega suurteostele taustaks olles kurikuulsaks saanud ning seeläbi eluga ütlemata rahul seniilne mutike , kes on kogu elu kütnud oma südameahju , et õnnel oleks tema juures mõnus ja soe . 
4	NA	 Ja tema sõpradel samuti . 
5	 2 . 	 2 . 
6	NA	 Chris valmistub merekooli astuma . 
6	NA	 Ja-jah , see ilma vaatamise vajadus on tal ikka nii tublisti veres . 
6	NA	 Nii ta studeeribki viimasel ajal kõikvõimalikke meresõiduteemalisi raamatuid , uurib geograafiat ja laeva ehitust ja navigatsiooni ja mida kõike veel . 
6	NA	 Tal pole isegi pruuti , nii hõivatud on ta oma ettevalmistuskursusest . 
6	NA	 Ma tegin ükskord sellel pruudi-teemal juttu . 
6	NA	 Ja tema vastas : 
7	NA	" "" Ega selle pruudi otsimisega nii kiire ka pole . "
7	NA	" Kõigepealt pean ma kapteniks saama . "" "
8	NA	" "" Ja siis ? "" "
9	NA	" "" Siis ? "" "
9	NA	 Chris sügas mõtlikult lõuga . 
9	NA	" "" Noh , siis viib meretee mind ükskord mõnele Lõunamere saarele , kus ma pärast pikki eksirännakuid kohtan lõpuks tõmmut indiaanitüdrukut , kelle nimi on Tantsiv Tuul või Kõrbelill või Naerev Suslik ja kelle isa on suguharupealik Sinine Sebra või Matsutav Madu või Möirgab Koos Karudega , ning siis palun ma tolle indiaanitüdruku enesele naiseks . "
9	NA	 Ja kuna ma olen ikkagi kapten , siis ei saa too paps mulle oma tütre kätt mitte üks teps keelata . 
9	NA	" Säärane imeline õnnehetk tasub ju ootamist , eks ? "" "
10	NA	 Vaat sellised kõrgelennulised plaanid on Chrisil . 
10	NA	 Ma loodan , et ta tõepoolest saab ükskord kapteniks ja leiab oma Kõrbelille . 
10	NA	 Eks tulevik näitab . 
11	NA	 Tädi Klara aga ikka koob ja küpsetab ja ravib kõiksugu haigusi , mis külarahvast vaevavad . 
11	NA	 Ta on teinud oma maasikamoosi juurest kõva arengu edasi ning vaaritab nüüd kõikvõimalikke tervistavaid drooge , näiteks võilillesiirupit ja astelpajumehu ja nisuidumahla . 
11	NA	 Siis teeb ta veel naadisuppi ja nõgese pannkooke ning muid selliseid umbrohusööke , mis viivad lausa keele alla . 
11	NA	 Igatahes , kui ma nüüd linnas käies astusin ükskord sisse ühte kiirtoidu söögikohta , siis neist friikartulitest ja hamburgeritest ei tahtnud mul suutäitki alla minna . 
11	NA	 Sel hetkel seisin ma silmitsi tõsiasjaga , et minu sotsiaalne hakkab vist seiskuma ... 
11	NA	 Nii mõnedki linnainimesed on nimelt avaldanud arvamust , et pikast metsas istumisest võib mu sotsiaalne kasv kinni jääda . 
11	NA	 Noh , et metsistun ära ja tekib nagu arengupeetus või midagi seesugust . 
11	NA	 Aga siis tuli mulle pähe mõte , et Samueli sotsiaalne kasv on ju totaalselt pidurdunud , kuid tema õnn on rohkem kui kodus . 
11	NA	 Järelikult võib sotsiaalse kasvu seisma jäämine pikemas perspektiivis hoopis kasuks tulla . 
12	NA	 Emal-isal on ikka kiire , vahest veel enamgi kui mõni aasta tagasi , ja ka nemad ostavad suurtest selveritest valmistoitu . 
12	NA	 Nende suurte selveritega on üldse omaette lugu , ses mõttes , et sellised hirmsuured poed ajavad minul pea ringi käima . 
12	NA	 Poe käibe suurendamiseks on see muidugi hea , sest uimase peaga sisseoste tehes ei anna inimene enesele enam aru , mida võtta , mida jätta , ning loobib paremalt ja vasakult kärusse kõike , mis aga kätte satub . 
12	NA	 Nojah , sellest ajast , mil poelettidel haigutas tühjus , ei mäleta mina suurt midagi , ja seetõttu on minu eelnenud märkused võib-olla kohatud . 
12	NA	 Aga tädi Klaral , kes ka ükskord minuga koos linnas käis — ja ta on seda aega , kus midagi saada polnud , küll näinud — , läks ühes sellises ostuhulluse templis silme eest päris mustaks ja ta oleks peaaegu rabanduse saanud . 
13	NA	" "" Sa issaristike ! "" jutustas tädi Klara mulle pärast oma poeskäigu lugu . "
13	NA	" "" Olivad sääl mingisugused "" Hullude päevad "" . "
13	NA	 Jagati poolmuidu lokirulle ja hambaharju ja marineeritud tomateid plekkpurgis . 
13	NA	 Inimesed rebisid üksteisel peaaegu riideid katki , et aga jaole saada , justkui oleks sääl Rooma paavst olnd õnnistust jagamas . 
13	NA	 Võtsin siis ka , kui lõpuks ligi pääsesin , sest kui ikke nii odavalt antasse , siis tuleb ju võtta , isegi kui tarvis ei lähe . 
13	NA	 Aga oleks ma toda tiand , et mulle hullumärk külge pandasse , ma poleks midagist ost . 
13	NA	 Kõik mu kraam topiti ilma minu käest küsimata suurde kilekotti , kus pääl kirjas , et ma seal hullude kokkutulekul käind hull olen . 
13	NA	 Pärast vaatasin , et suurem jagu rahvast käis sedaviisi äramärgistatuna ringi . 
13	NA	 Siis hakkas mul väheke kergem , et olen teiste omasuguste seas . 
13	NA	 Aga see hambahari , too oli sihukeste raudharjastega , et paras elevandile . 
13	NA	" Ja tomatid , neid ei taht isegi alati nälgas küla kassid . "" "
14	NA	 Vaat selline lugu juhtus tädi Klaraga . 
14	NA	 Hea seegi , et vähemasti lokirulle sai ta kaks korda kasutada , enne kui need katki läksid . 
15	NA	 Samuel on ikka kunstnik . 
15	NA	 See tähendab , et tal on pintslid , paberid ja värvid ning ta teeb nendega pilte , mida kunstinautlejad seintele riputavad . 
15	NA	 Seletan seda veel kord kõigile arusaadavate sõnadega üle seepärast , et kõik ta kunstnikuks olemisest aru saaksid . 
15	NA	 Kui ma teda kümneaastasena kirjeldasin , siis tegin seda nii lapsele omasel lihtsal viisil , et üks tänapäeva üleharitud täiskasvanu ei saanud asjale pihta . 
16	NA	" "" Samuel , oled sa ikka kunstnik ? "" küsisin nüüd , viis aastat hiljem igaks juhuks üle . "
17	NA	" "" Oma teada nigu küll . "
17	NA	" Mis siis ? "" "
18	NA	" "" Noh , leidus üks inimene , kes minu eelmise kirjelduse läbi sinus kunstnikku ei näinud . "" "
19	NA	" "" Heh , võib-olla ta ei tahtnudki näha , "" kihistas Samuel naerda . "
19	NA	 Ta pööras ennast näoga minu poole , lõi oma joonistusploki lahti ja hakkas pliiatsiga sinna midagi visandama . 
20	NA	" "" Aga võib-olla on ta kusagilt välja nuhkinud , et mul puudub kunstnikuks olemist tõendav dokument , "" lisas ta siis . "
21	NA	" "" Kas see teeb sinust siis vähem kunstniku ? "" "
22	NA	" "" Selliseid leidub küll , kes nii arvavad , "" nentis Samuel . "
22	NA	" "" Mõned eelarvamuste küüsis olijad ei suvatse üldse su töösse süveneda , kui saavad teada , et oled iseõppija , ehkki selline inimene , kes omal käel on välja jõudnud sinna , kuhu teised aastaid koolis käies , vääriks just topelt tähelepanu . "" "
22	NA	 Samuel hakkas äkitsi naerma . 
22	NA	" "" Tead , maalikunstnik Paul Cézanne on öelnud , et üks tähtsamaid asju siin elus on õigeaegselt lõpetada hariduse omandamine . "" "
23	NA	" "" Aga praegu ju muust ei räägitagi kui hariduse omandamise tähtsusest , "" märkisin mina . "
24	NA	" "" Noh , selge see , et ilma ei saa . "
24	NA	" Aga ei maksa üle pingutada , muidu läheb südamehääl kaotsi , kui kõik kohad on suurt koolitarkust täis , "" seletas Samuel , kaval muie suunurgas . "
24	NA	" "" Ja seda , et kui süda enam midagi ei tunne , siis läheb õnn kodust ära , me juba teame . "" "
25	NA	" "" Nojah , aga kirurgiks ei saa ju ise õppida nagu kunstnikuks , "" arutlesin mina . "
26	NA	" "" He-hee , muidugist , kuid tõeliselt hea kirurg peaks kõigepealt ikka ka oma sisetunnet kuulama , enne kui skalpelli kätte võtab . "
26	NA	" Või mis preili arvab ? "" "
27	NA	" "" Jah , mina arvan ka , et süda ja mõistus peaksid koostööd tegema , siis tulevad igal alal parimad tulemused . "" "
28	NA	" "" Aga kuna mõistus on olnud enamasti ainuvalitseja , siis sellest kõik maailma hädad alguse on saanudki , "" pani Samuel nüüd meie vestlusele piraka punkti . "
28	NA	 Ta pani pliiatsi käest ja takseeris pilti , mida ta meie jutuajamise käigus oli visandanud . 
29	NA	" "" Näita nüüd mulle ka , mis sa seekord joonistasid ! "" palusin mina . "
30	NA	 Samuel vaatas mulle kavalal pilgul otsa , sirgeldas veel midagi pliiatsiga , ning andis siis joonistusploki minu kätte . 
30	NA	 Ja sealt vaatasin vastu mina , Viljaküla Brita . 
31	NA	" "" Selles näos on ilu ja iseloomu , eks ole ? "" märkis Samuel naeru kihistades . "
32	NA	 Hakkasin naerma . 
32	NA	" "" Ega Brital viga ole jah . "" "
33	NA	" "" Kui mehele lähed , siis jätad selle pildi tädi Klarale seltsiks . "" "
34	NA	" "" Kuhu kohta ma lähen ? "" küsisin ma lolli nägu tehes . "
35	NA	" "" Mehele , noh . "" "
36	NA	" "" Ah seesama vana jutt , et kõik naiste teed viivad mehele , jah ? "
36	NA	" Aga kes mind ikka tahab ? "" "
37	NA	" "" Kuda nii ? "" "
38	NA	" "" Mul on parajal määral arenenud ja pidevalt sõnavõtuvalmis huumorisoon , "" teadustasin mina ja purskasin naerma . "
38	NA	" "" Ma olen kuulnud , et säärased naisterahvad on mehepoegade suurim hirm . "
38	NA	" The worst nightmare , noh . "" "
39	NA	 Samuel naeris äkki nii hullusti , et hakkas lõpuks luksuma . 
39	NA	" "" Aga kas pole kõige hirmutavam just see , kui naisterahva repertuaar koosneb ainult sõnadest "" jah "" ja "" aamen "" ? "" "
40	NA	 Selle jutu peale saime mõlemad jälle paraja naeruteraapia kuuri . 
41	NA	" "" Sa oled nii tore , Samuel ! "
41	NA	" Selline teistmoodi , "" ütlesin ma lõpuks , kui olime maha rahunenud . "
41	NA	" "" Sinuga saab igasugu asju arutada , sa tõepoolest ei arva , et pea on ainult juuste kandmiseks , kui juhtud naisterahvas olema . "" "
42	NA	" "" Tänan komplimendi eest , kulla preili ! "" "
43	NA	 Tõusin trepilt püsti . 
43	NA	 Märtsilõpu päike paistis juba õige kuumalt ja mul oli olnud ütlemata tore laupäeva pärastlõuna . 
43	NA	" "" Sain oma raamatu tarvis jälle tublisti ainet , "" ütlesin Samuelile , panin oma kirjutamistarbed kotti ja hakkasin kodu poole astuma . "
44	 3 . 	 3 . 
45	NA	 Mööda külavaheteed kodu poole sammudes märkasin juba kaugelt eemalt Chrisi . 
45	NA	 Ligemale jõudes nägin , et ta parandas aeda . 
46	NA	" "" Tormituuled on tolle päris kreeni ajand , "" teadustas ta mulle . "
46	NA	" "" Kui mõni paraja auru all tegelane peaks siia vastu vajuma , siis oleks ta kogu täiega maoli maas . "
46	NA	" Järelikult — nii lakkekrantside kui ka aia edasise eksistentsi huvides püüan viimase ära parandada , enne kui hilja . "" "
47	NA	" "" Ma mõtlesingi , et ei tea , mis valu sind on lõpuks välja ajand — talv otsa oled toas istund ja raamatuid tudeerind . "
47	NA	" Äkki on kevad südames või nii ? "" "
48	NA	" "" Eks vahest tuleb end veidi luhvtitada ka , muidu lähvad ajud sõlme ja silme eest siiruviiruliseks , kops kobib ribide alt välja , et vaadata , kuhu see värske õhk nii kauaks toppama on jäänd ja süda saab kogu sest segadusest ajuvapustuse . "" "
48	NA	 Chris vidutas kavalalt silmi ja kõhistas naerda . 
49	NA	" "" Rahval on ütlemata tore teada saada , et sinu huumorisoon pole ikka veel umbe läind , "" märkisin ma naerdes . "
50	NA	" "" Neil , kes su memuaaridele järge ootavad või ? "
50	NA	 Vaata , sa pane sinna kirja , et huumorisoone umbeminek märgib täiskasvanuks saamise algust . 
50	NA	 Nii et kui sa enam naljast aru ei saa , siis on sinu diagnoos : täiskasvanu . 
50	NA	 Ja sellest tõvest , muuseas , paranevad väga vähesed . 
50	NA	" Võiks öelda , et tegelikult on too haigus praktiliselt ravimatu . "" "
51	NA	" "" Aga miskipärast peavad inimesed läbinisti täiskasvanuks olemist ütlemata väärtuslikuks , "" mõtisklesin mina . "
52	NA	" "" Vaevalt et keegi sellest t e g e l i k u l t rõõmu tunneb , kui tal lillakaspunane furunkel nina otsas on , "" itsitas Chris . "
52	NA	" "" Kuid kõik teevad näo , et oh , pole midagi , küll läheb üle . "
52	NA	 Aga enne , kui üle läheb , jõuab ta su elu päris põrguks teha . 
52	NA	" Ja lõpuks jääb järele arm , mis toda painajat ikka iga kell meelde tuletab . "" "
53	NA	" "" No leidsid sina ikka paraja võrdluse , "" olin mina naerust päris kõveras . "
53	NA	 Lõpuks suutsin oma kirjutamistarbed kotist välja koukida , et märkmeid teha . 
54	NA	" "" Ja-jah , tähenda aga kõik üles , mida see hull inimene suust välja ajab . "" "
55	NA	" "" Igatahes siiani pole ju keegi sulle veel hullumaja autot järele saatnud . "
55	NA	" Järelikult pole sa oma juttudega nii ohtlikuks osutunud , et vajaksid ühiskonnast isoleerimist . "" "
56	NA	" "" Võib-olla ei tea nad mu täpset aadressi . "
56	NA	" Hakka siis kallist bensiini raiskama ja mööda tolmuseid külavaheteid mõistujuttu ajavat turris juuksetukaga noorsandi taga ajama . "" "
57	NA	 Naersime nii , et võttis päris võhmale . 
58	NA	" "" Kes see ikka nalja teeb , kui ise ei tee , "" ütles Chris lõpuks . "
59	NA	" "" Muuseas , mõtle , kui palju me sellega jälle raha kokku hoiame , "" tuli mulle äkki mõte pähe . "
60	NA	" "" Ise nalja tegemisega või ? "" "
61	NA	" "" Nojah , noh . "
61	NA	" Muidu peaks me kilode kaupa banaane kokku ostma , et saaks iga meetri järel koore maha visata ja siis põõsas itsitada , kui keegi mõnel neist libastub . "" "
62	NA	" "" Või torte , et neid siis kiviheitemasinaga inimestele näkku pilduma hakata , "" pakkus Chris omalt poolt . "
63	NA	 Turtsatasime taas . 
63	NA	" "" Tegelikult tundub mulle , et nii mõnelegi ainult säärased asjad nalja teevadki , "" ütlesin ma lõpuks ja toppisin oma kirjutamistarbed taas kotti . "
63	NA	" "" Kas tuled ka meie poole ? "
63	NA	" Tädi Klara on täna kindlasti jälle mõne uut moodi umbrohusöögi valmis vaaritand . "" "
64	NA	" "" Kui ma oma töö siin valmis saan , siis võib-olla tulengi . "
64	NA	" Kui teil selle aja peale peaks veel mõni nõges potipõhjas just nimelt mind ootama . "" "
65	 4 . 	 4 . 
66	NA	 Sina , kes sa oled käesoleva raamatu lugemisega jõudnud täpselt nii kaugele , kus sa praegu oled , kibeled nüüd juba kindlasti teada saama , kuidas mul siis nende kavaleridega ikka lood on . 
66	NA	 Noh et kui Brita on ikka juba viisteist , siis peaks nagu poisid peas olema või nii . 
66	NA	 Räägin sulle siis loo ühest oma kavalerikandidaadist . 
67	NA	 Viimati otsustasin ma uue aasta linnas koos vanematega vastu võtta . 
67	NA	 Isa bisnis on lõpuks võimaldanud korraliku eluaseme muretseda ja seetõttu on nad emaga avaldanud arvamust , et võiksin nüüd taas linna kolida , sest uues majas saaksin enesele kolm korda nii suure toa kui tädi Klara juures , koos isikliku vannitoaga . 
67	NA	 Isa meelest on see ühele viieteistkümneaastasele neiule hullupööra ahvatlev . 
67	NA	 Tõenäoliselt arvab temagi , et sääl metsakolkas minu sotsiaalne kasv pidurdub . 
67	NA	 Aga , uskuge või mitte , üle kolme päeva ma linnas vastu ei pea . 
67	NA	" Kui oled ikka nii kaua looduse rüpes elanud kui mina , siis ajab juba sõna "" linn "" hirmujudinad peale . "
67	NA	 Jah , kuid uue aasta võtsin ma seekord siiski linnas vastu , sest ema oli uue kodu pärast nii elevil ja tahtis kangesti , et aitan tal kardinariiet ja muud seesugust valida . 
67	NA	 Lõppkokkuvõttes pidin siis ka aastavahetuseks linna jääma , et saaksime üle hulga aja veidi pikemalt koos olla . 
67	NA	 Too koosolemise mõte mulle muidugi meeldis . 
67	NA	 Kuid just siis , kui lootsin , et tuleb kena perekondlik koosviibimine ja pärast seda , kui paps on lõpuks magama läinud , saame emaga kas või hommikuni juttu ajada ja piparkooke krõbistada , vajus terve suguselts uksest sisse , verivorstirõngad ümber kaela . 
67	NA	" "" Sa issaristike ! "" oleks selle peale hüüatanud tädi Klara . "
67	NA	 Inimesed kohe peavad mööda ilma ringi kolistama . 
67	NA	 See , kes ütles , et tema kodu on tema kindlus , pidi küll kilomeetripaksuse müüri taga elama ja isiklikku sõjaväge pidama . 
67	NA	 Ei , ma pole absoluutselt inimvaenulik inimene — enamasti — , aga kutsumata külalised , kes eeldavad , et sa oled neid nähes rõõmust ogar , kui nad kogu oma keldri sisu su söögilauale tassivad ja selle eest üht korralikku süldipidu ja takkapihta veel öömaja loodavad saada , tekitavad küll isu võtta oma seitse asja ja hakata jalgsi läbi tuisu ja lume Viljaküla poole kõmpima . 
67	NA	 Sellest retkest ei tõotanud aga kõva pakase tõttu midagi välja tulla ja nii pidin ma südame kõvaks tegema ning arendama seltskondlikku vestlust sellest , millised numbrid mu tunnistusel ilutsevad ja kas mul ikka kavaleri on . 
67	NA	 Millest muust tulekski täiskasvanuil pähe ühe viieteistaastasega rääkida . 
67	NA	 See , et onupoeg Kaarel oli aga kaasa kutsunud oma sõbra Kristjani , tegi tollest õhtust eriti kurnava aastavahetuspeo . 
67	NA	 Too lakutud juustega ja äärmiselt ebaviisakas tüüp , kes peale kauba oli ilmselt terve pudeli kõige vängemat odööri enesele krae vahele kallanud , käis mul õhtu otsa kannul kui uni . 
68	NA	" "" Sul nimi ka on või ? "" päris ta norival toonil , olles istunud minu kõrvale laua äärde ja kallates parajasti tervet kausitäit pohlamoosi oma verivorstile kaela . "
69	NA	" "" Loviise Barbara Adelheid I , "" vastasin mina , teades päris kindlalt , et mu päris nimi on mitmekordse esitlemise järel talle juba pealuusse kulunud . "
70	NA	" "" Ohoo ! "
70	NA	" Päris kuninglik suguvõsa teil , "" kostis too Kristjan seepeale ja irvitas . "
70	NA	" "" Kas kosilasi on kah juba silmapiiril ? "" "
71	NA	" "" Nii et tapab , kuid ükski neist pole siiani suutnud kuud taevast alla tuua ja seetõttu olen neil soovitanud oma kandidatuuri maha võtta . "" "
72	NA	" "" Preili Barbaaral on õige suured nõudmised , "" noris Kristjan minu niinimetatud nime venitades . "
72	NA	" "" Aga kas kaasavara on ikka piisavalt suur , et su terav keel tähelepanuta jätta ja printsi kohale kandideerida ? "" "
73	NA	" "" Üheksakümmend üheksa pitslinikut , üks kuldrubla ja rääkiv papagoi , "" teadustasin mina ja vaatasin toas ringi , lootes leida kedagi , kes mind tolle tüübi käest päästaks . "
73	NA	 Paps , vastupidiselt minule , oli kaela sadanud suguseltsi üle rõõmust ogar ja esitles uhkelt oma uut eurostandardi järgi ehitatud maja . 
73	NA	 Emps saalis suguseltsi naisliikmete eskordi saatel kohvikannuga toa ja köögi vahet . 
73	NA	 Tõusin otsustavalt laua tagant püsti , et minna oma suurde isikliku vannitoaga eraklasse . 
73	NA	 Too Kristjan polnud aga härrasmehelikust käitumisest poolt sõnagi kuulnud ja tuli mulle järele . 
73	NA	 Kui ma tal ukse nina ees kinni lõin , ei paistnud ta ikka mõikavat , et tahan üksi olla . 
74	NA	" "" Pitslinikud just paljudele huvi ei paku , aga kui too papagoi riigisaladusi teab , siis võib tema abil kosilasi ligi meelitada küll , "" ütles ta mulle läbi ukse . "
75	NA	 Panin muusika mängima , kuid õige pea kostus muusika vahele intensiivne koputamine uksele . 
75	NA	 No on pealetükkiv tüüp , mõtlesin mina ja avasin ukse . 
76	NA	" "" Kas preili on miskipärast minu peale pahane või ? "" küsis Kristjan ja vaatas mulle suurte andekspaluvate silmadega otsa . "
76	NA	" "" Ma enam ei tee , mis iganes see ka oli , mis ma tegin . "" "
77	NA	" "" Ah , hea küll , kui sa juba siin oled , eks astu siis sisse , "" lõin ma käega ja vaatasin kella . "
77	NA	 Aasta lõpuni oli veel kolmveerand tundi . 
77	NA	 Kristjan loivas tuppa ja prantsatas pikema jututa tugitooli . 
78	NA	" "" Kus Kaarel on ? "" pärisin jutu jätkuks . "
79	NA	" "" Tõenäoliselt peab ta praegu su suguseltsile surmigavat loengut poliitilisest olukorrast riigis ja võib-olla on mõne uue parteigi kokku pannud . "
79	NA	 Ta on meil ju selline poliitagitaator . 
79	NA	 Lõpetab kevadel keskkooli ära ja kui ta asja tõsiselt käsile võtab , siis on ta varsti mõni minister või koguni president . 
79	NA	" Nii et hoia onupojaga sooje suhteid , võib edaspidi kasuks tulla . "" "
79	NA	 Kristjan pilgutas mulle silma ja irvitas . 
79	NA	 Ja siis sain ma kuulda säärast kriitikat oma muusikalise maitse , tädi Klara kootud kampsuni ja lõpuks koguni kolkaküla patriotismi kohta , et kahetsesin oma hetkelist leebumist nii kibedasti , kui üldse saab . 
80	NA	" "" Ega sa ometi solvunud ? "" küsis Kristjan lõpuks ilmsüütu näoga ja haigutas laialt . "
81	NA	" "" Sinu matslik käitumine tuleb tõenäoliselt sellest , et sa pole harjunud , et leidub ka mõni tüdruk , kes sind nähes vaimustusest ei kiljata ja kohemaid sulle kaela ei lange , kui sa oma vasikasilmi plaksutad , "" ütlesin mina ja haigutasin samuti demonstratiivselt . "
81	NA	" "" Sa püüad mind solvata , et oma enesetunnet tõsta . "" "
82	NA	 Kristjan jäi minu ootamatu rünnaku peale hetkeks vait . 
82	NA	" "" Kas su suguseltsis on mõni psühholoogiaprofessor , et sa psühhoanalüüsis nii tugev oled ? "" küsis ta siis . "
83	NA	" "" Ma olen ise nii andekas , "" vastasin nagu muuseas . "
84	NA	" "" Su kosilased pagevad kõigi nelja tuule poole , kui sa nendega säärast tarka juttu hakkad ajama . "" "
85	NA	" "" Tõesti või ? "" ajasin silmad imestusest suureks . "
85	NA	" "" Üks käib mul juba mitmendat tundi kannul ja ei ilmuta vähimatki märki , et tal oleks vastu ööd isu silmapiiri poole liduda ja tervitada aasta esimest päeva kuu poole uludes . "" "
85	NA	 Naeratasin oma kõige võluvamat naeratust ja märkasin , et Kristjani iroonilised kommentaarid olid selle jutu peale äkki otsas . 
86	NA	" "" Kell on mõne minuti pärast kaksteist , "" ütles ta hoopis . "
86	NA	 Elutoas avati juba šampanjapudeleid . 
86	NA	 Kristjan väljus toast ja tuli hetke pärast klaasidega tagasi . 
86	NA	" "" Kas preili võtab ka lonksu või mõjub see ta teravale keelele tuimestavalt ? "" küsis ta siis noriva tooniga . "
87	NA	" "" Magades ei lähe seda tarvis , kui sa just mu unenägudesse sisse ei astu ja o m a terava keele kuritarvitamist ei jätka . "" "
88	NA	 Kell lõi kaksteist . 
88	NA	 Läksin elutuppa ema-isa kallistama , rehkendades samas , mis kell läheb 1. jaanuari hommikul esimene buss Viljakülla . 
89	 5 . 	 5 . 
90	NA	 Otse loomulikult käisime tol korral , kui tädi Klara ka koos minuga linna tuli , külas tädi Martal ja onu Victoril . 
90	NA	 No on neil ikka tõepoolest pirakas häärber , nagu loss kohe ! 
90	NA	 Tädi Marta hõljus meile uksele vastu sulgedega negližees , papiljotid peas ja silmnägu porgandimehu täis . 
90	NA	" "" Mõjub jumele hästi , "" selgitas ta tolle löga laiutamise vajadust oma näol , kui tädi Klara teda esimesel hetkel ära ei tundnud . "
90	NA	 Sellest , kuidas tolles majas istuda või astuda , sai aga meie visiidi suurim mure . 
90	NA	 Mul oli tunne , nagu oleks me muuseumis , kus midagi näpuotsagagi puutuda ei tohi , rääkimata tarvitamisest selleks , milleks nood eksponaadid olid loodud . 
90	NA	 Onu Victor oli tol korral jälle mingil ärireisil , tädi Marta aga ootas üht kuulsat külalist . 
90	NA	 Meie ootamatu visiit ei paistnud teda just väga rõõmustavat , kuid kaugelt tulnud vanu tuttavaid ta siiski ukselt tagasi ei saatnud . 
90	NA	 Tõenäoliselt turgatas talle viimasel hetkel pähe , et ka meie peame oma ihusilmaga tema kuulsat külalist nägema . 
90	NA	 Ja kuna ta ilmselt ei osanud samas toda külalist m e i e nägemisest säästa , siis istusimegi varsti kui puped pulksirgelt sametisel kanapeel ja ootasime etenduse algust . 
90	NA	 Paarikümne minuti pärast too kuulsus saabuski . 
90	NA	 Kui Raimond Ruudi — kirjanik ja luuletaja täies aus ja hiilguses — tuppa astus , püüdsin ruttu meelde tuletada , kas mina , ülisuur raamatufänn , olen temast midagi kuulnud või ta teoseid lugenud , kuid esimese hooga ei meenunud mulle midagi . 
90	NA	 Temale ei paistnud minu raamat ka meenuvat , kuid see oli muidugi igati loomulik . 
90	NA	 Kirjanikuhärra , vanuses vast kusagil kolmekümne ligi , oli väga napisõnaline , vaatas meid tädi Klaraga üleoleval pilgul , ülbe muie suunurgas , jõi tassitäite kaupa kohvi ja kuulas teeseldud tagasihoidlikkusega tädi Marta kiidukõnet oma romaani kohta , kõrvad samas tollest ülistuslaulust õhetamas . 
90	NA	 Meie tädi Klaraga istusime hiirvaikselt ja mõtlesime ilmselt mõlemad , et mida küll oleks sobiv öelda , kui jutujärg meie kätte peaks sattuma . 
91	NA	" "" Tänavu see kevad naa varajane , "" poetas lõpuks tädi Klara , kui toas oli hetkeks vaikseks jäänud . "
91	NA	" "" Tea , kas teeb juunis tagasi ? "
91	NA	" Üks aasta istusime jaanitule ümber , vatijoped selgas . "" "
92	NA	 Tädi Marta vaatas meid pilgul , nagu näeks ta enda ees äkki issanda ilmutisi , selliseid kodukootuid , kelle intelligentsitase on alla igasugust arvestust . 
92	NA	 K u u l s a kirjaniku juuresolekul ei sobi ju ometi rääkida ilmast . 
92	NA	 Autogrammi küsimine , vaat see oleks olnud strateegiliselt õige käik ! 
92	NA	 Noh selleks , et saada enesele k u u l u s tuttav . 
92	NA	 Selleks , et saaks külarahvale rääkida , kuidas me kirjanikuhärrat oma ihusilmaga nägime ja temaga kogunisti juttu puhusime . 
