par_nr	head	sentence
2213	NA	" 1941. aasta augusti kuu 9-ndal või 10-ndal päeval , täpset päeva mina enam ei mäleta , tulid mulle minu talust umbes poole kilomeetri kaugusel metsa serval vastu kaks "" Omakaitse "" liiget . "
2213	NA	 Üks nendest oli Milling Villa vallast , Vendi külast , aga teise nime mina enam ei mäleta , mõlemal oli seljas püssid , keelasid minul metsa mineku ära , seletades et metsas on 19-nd punaarmeelast , ise aga seadsid end laske valmis , ning käskisid minul viia sõna Maak Jaagule , et tema tuleks kiiresti oma meestega haarangule . 
2213	NA	 Mina läksin Maaki talusse . 
2213	NA	 Maak Jaak istus parajasti laua juures ja sõi . 
2213	NA	 Mina , öelnud edasi saadetud korralduse , kuulasin , kuidas Maak seletas , et oli parajasti Metsakülast haarangult tulnud . 
2213	NA	 Seejärel haaras Maak Jaak relva ja läks uuesti haarangule . 
2213	NA	 Umbes paar tundi hiljem , enne päeva loojangut , kostis metsast äge tulistamine . 
2213	NA	 Mis seal metsas toimus seda mina ei tea . 
2213	NA	 Paar päeva hiljem aga oli rahvasuus jutt , et sellel haarangul Väike-Villa metsas oli maha lastud kolm punaarmeelast . 
2213	NA	 Väike-Villa mets algab meist umbes neljasaja meetri kauguselt , aga see koht , kus lastud maha punaarmeelased asub meist umbes 4 kilomeetri kaugusel . 
2214	NA	" 1943-nda aasta jaanuari kuul , täpset päeva mina enam ei mäleta , mina läksin Moksi metskonnast Kaigu asunduse suunas , siis Taali küla vahelisel maanteel tulid minule vastu haarangule sõitvad "" Omakaitse "" liikmed relvadega , kellede hulgas oli ka Maak Jaak . "
2214	NA	 Seekord Maak sõitis oma hobusega . 
2214	NA	 Kus nemad haarangul käisid või millised olid haarangu tulemused , seda mina ei tea . 
2215	NA	" Maaki talus töötas üks punaarmeelane , kes oli vangi langenud , tema nime mina ei tea , kuid hüüdsime teda "" Jegooriks "" , kes väga tihti käis meil ja rääkis , et Maak Jaak läks jälle haarangule . "
2216	NA	" 1944-nda aasta märtsi või aprilli kuul , täpset aega enam ei mäleta , rääkis mulle "" Jegoor "" , et Maak Jaak oli tulnud haarangult ja seletanud kodus , kuidas nemad Nõukogude nais parašütisti kinni võtnud külmunud jalgadega ja toonud Kaigu "" Omakaitse "" staapi . "
2217	NA	" Teine kord seletas "" Jegoor "" jälle , et Maak Jaak rääkinud pärast haarangult tulekut kodus kuidas nemad kinni võtnud ühe leitnandi , kelle hiljem maha lasknud , kuna kaks või kolm punaarmeelast olid toonud Kaigu asunduse "" Omakaitse "" staapi . "
2218	NA	" Küsimus : Millest Teie teate , et Maak Jaak kuni 1940-nda aastani oli kontrrevolutsiooniliste organisatsioonide "" Kaitseliidu "" ja "" Isamaaliidu "" liige ? "
2219	NA	" Vastus : Seda , et Maak Jaak oli "" Kaitseliidu "" ja "" Isamaaliidu "" liige mina tean sellest , et kuni 1940-nda aastani tema omas vintpüssi ja kandis "" Kaitseliidu "" vormi riideid ja käis "" Kaitseliidu "" ja "" Isamaaliidu "" salajastel koosolekutel . "
2219	NA	" Kuna tol ajal mitte- "" Kaitseliidu "" liikmed ei omanud vintpüssi ega "" Kaitseliidu "" vormi , ja ei tohtinud käia nende salajastel koosolekutel . "
2219	NA	" Seda , et tema oli "" Isamaaliidu "" liige tean mina sellest , et käis nende salajastel koosolekutel , kuhu aga mitte- "" Isamaaliidu "" liikmed ei pääsenud . "
2220	NA	" Küsimus : Millest Teie teate , et Maak Jaak 1941-se aasta augustikuul astus vabatahtlikult sõjalis-fašistliku organisatsiooni "" Omakaitse "" liikmeks ? "
2221	NA	" Vastus : Seda , et Maak Jaak 1941-se aasta augusti kuul astus vabatahtlikult "" Omakaitse "" liikmeks , mina tean sellest , et nägin teda kandmas vintpüssi ja käimas haarangutel , kuna mitte-vabatahtlikke "" Omakaitse "" liikmeid 1941-aastal ei olnud ja relvi võisid kanda ainult vabatahtlikud "" Omakaitse "" liikmed . "
2222	NA	 Küsimus : Mida Teie veel teate Maak Jaagu praktilistest kontrrevolutsioonilistest tegevustest rääkida ? 
2223	NA	 Vastus : Kogu Eesti NSV okupatsiooni aja oli Maak Jaak üks suurimatest fašistliku valitsuse abistajatest . 
2223	NA	 Nimelt kõik saksa sõjaväe normid tema tasus eeskujulikult ning tihti ületas neid . 
2223	NA	 Nii näiteks 1944-nda aasta kevadel , peale teiste normide täitmise , viis veel saksa sõjaväele hobuste toitmiseks umbes 10 koormat heinu ja põhku . 
2223	NA	 Peale selle oli tema kohalikkude fašistlikkude võimumeeste poolt määratud küla usaldusmeheks . 
2223	NA	 Maak , teenides sellel kohal nõudis karmilt talupoegadelt saksa sõjaväe normide tasumist . 
2223	NA	 Talupojad , kes ei tasunud norme , nendel laskis varanduse ülesse kirjutada ja konfiskeerida saksa sõjaväe kasuks . 
2223	NA	 Nii käitus Maak Jaak Kaigu asunduse elaniku Kuu Villemiga , kellelt konfiskeeriti üks lehm . 
2224	NA	 1944-nda aasta sügisel , enne vabastava Punaarmee saabumist Kaigu valda , Maak Jaak kartes karistust oma tegude eest Nõukogude valitsuselt tahtis põgeneda Rootsi , ühes kogu oma perekonnaga , mis aga temal ei õnnestunud Punaarmee kiire edasitungimise tõttu ning kolm nädalat hiljem pöördus koju tagasi . 
2225	NA	" Küsimus : Kus elab praegu see "" Jegoor "" , kes töötas Maak Jaagu juures teenijana . "
2226	NA	" Vastus : Seda mina ei tea , kus võib elada praegu "" Jegoor "" , igatahes tema oli pärit Ukrainast ja on väga võimalik , et sõitis koju . "
2227	NA	" Küsimus : Kes olid need teised vabatahtlikud "" Omakaitse "" liikmed , kes 1943-nda aasta jaanuarikuul tulid Teile vastu Taali küla vahelisel maanteel ja sõitsid ühes Maakiga haarangule ? "
2228	NA	" Vastus : Teised haarangule sõitvad "" Omakaitse "" liikmed olid , keda mina nägin : "
2229	NA	 1 ) Varblane , Vello Ennu p. - arreteeritud 
2230	NA	 2 ) Esper , Andres - praegu bandiit 
2231	NA	 Protokoll on kirjutatud minu sõnadega õieti ja minu poolt läbi loetud . 
2232	NA	 Allkiri V. Poolsen 
2233	NA	 Kuulas üle : RJK Järvamaa osak . oper . volinik nooremleitnant Piil 
2234	NA	 ( allkiri vene keeles ) 
2235	NA	 Ja nii ja kaude oli mulle teada antud , mis võis Meinhardit pärast Tšehhi põrgut ja sõjavangilaagrist kojutulekut ees oodata . 
2235	NA	 Kõnekas on , et selles ajas tekkinud valikute valemil ei ole lahendust , inimeste asemel võiks tarvitada ka tähti . 
2236	NA	 Või numbreid , ütlesin vahele . 
2236	NA	 Ühikuid ? 
2236	NA	 Veel parem . 
2236	NA	 See just tekitabki ängi , kui lõpuks taipad , et su kaasmaalased ja kõige kallimad pole muud kui tähed või numbrid suure hävitamismasina ees . 
2237	NA	 1941. aasta juuniküüditamine on nende kaebuste ja ülekuulamiste ajaks juba olnud , kuid inimesi küsitletakse nõnda , nagu oleks neil õigluse seisukohalt midagi ütelda . 
2237	NA	 Et näete , oli kontraid , kes ei kaitsnud eestlasi küüditanud riigi sõdureid ja püüdsid metsadesse eksinud Nõukogude parašütiste . 
2237	NA	 Võib-olla neidsamu , kes valvasid raudteid , millel veeti loomavaguneis inimesi . 
2238	NA	 Aga ma ei tea , kas ma saan üldse aru , mis põhjuste või ähvarduste survel on kellegi kohta teada antud ja kirjutatud kaebus , või mida mõtleb ülekuulatav , kui ta kuupäeva-ei-mäleta-mantra saatel loeb üles kõik Omakaitsemehed , kes iganes vastu on tulnud . 
2238	NA	 Lihtsa nalja või nöökega ei saa sellest perioodist kuidagi üle , sest ennast või pealekaebamist tögades teed neid inimesi tabanud vältimatu vangla või surma kerglaseks . 
2239	NA	 Kes surma sees kerglust näeb , lõikab endalt lolli ( vägilase ) kombel jalad alt ning tahab kes-teab-mitusada aastat hiljem Kääpa jõe põhja või kaldaservale äralõigatud jalgade kiituseks panna mälestusmärki . 
2240	NA	 Nii ülistatakse eneseneedjat , kes iseoma mõõga läbi langeb . 
2241	NA	 Parem räägin sulle , et mu hambad lõgisesid arhiivis hirmust , kuid needsamad hambad krigisesid ka valust ja vihast . 
2241	NA	 Et unustusse pääseda ja rahu saada , selleks ei üritagi ma välja kuulutada hirmumonumendi kavandite võistlust , kuigi riiklik toetus on mul ju samahästi kui käes . 
2242	NA	 Tule , tule siia , ütleb mustlane , ma räägin sulle , mis oli , tuleb ja mis südamel . 
2242	NA	 Ma ennustan sulle , kuidas haigusneedusest lahti saada . 
2242	NA	 Ainult pane siia peo peale - mustlane sirutab ette parema lahtise käe - niipalju raha , kui kõrgelt sa oma tervise ja hingerahu tagasisaamist hindad . 
2242	NA	 Ja kes siis koonerdab . 
2242	NA	 Kes ? 
2242	NA	 Paned välja kõik , mis sul on , et kohkudes nädalaid hiljem tänitavast mustlasest eemale hiilida . 
2243	NA	 Aga vahepeal on sul olnud kuum häbisegune lohutus , et äkki ... 
2243	NA	 Ja sa ise ei vastuta millegi eest : mustlane teab ja teeb , sõnub ja manab , sest minevik ja tulevik tõmbab enda poole vaid suli . 
2243	NA	 Seda arhiivi meie haiguste kirjeldajana pole ju ülepea olemas . 
2243	NA	 Ja kui vaja , siis ei ole ka vanemaid ja lapsi . 
2243	NA	 Iga hinna eest ellujäämistahe vist ( ? ) on ja raha on . 
2243	NA	 Rahaga saab osta edu ja kindlust , kuni järgmiste loomavagunite korrani . 
2244	NA	 Rahva totaalkaitse rakendamisel ei kordu 1939. aasta mitte kunagi , teatab ajalehes see , kes Kaarlile ordeni andis . 
2244	NA	 Kui igaüks end teise vastu , püss käes , sellisel viisil kaitseb , nagu loen unustusele määratud protokollidest , siis on esimese ohumärgi korral kõik end korraga maha lasknud . 
2244	NA	 Totaalselt . 
2244	NA	 Ja parimate sõprade abiga . 
2245	NA	 Vaene mustlane , ütlen ma täies tõetundmises , tema jääb siis küll tööta . 
2246	 49 . 	 49 . 
2247	NA	 Järgmisest toimikust vaatab mulle vastu Kaarli kiidetud kuldaväärt Jüri iseloomustus . 
2247	NA	 Jüri Konks on sündinud 1921. aastal kehviktalupidajate perekonnas ja töötanud 1941. aastani sulasena kulaklikes majapidamistes . 
2247	NA	 Suure Isamaasõja päevil 1941. a. - 1945. aastani on Konks teeninud leitnandina Nõukogude Armees . 
2247	NA	 Pärast demobiliseerumist tulnud kodukanti tagasi , olnud algul koolijuhataja , hiljem edutatud kohalikku maakonnalinna juhtivale tööle . 
2248	NA	 1948. aastast on Jüri Konks Bandiitide hävitamise pataljonis rühmakomandör . 
2248	NA	 On NLKP liige . 
2248	NA	 Iseloomustuse , õieti eluloofaktide rea lõpul teatatakse , et seltsimees Konks töötab ENSV Siseministeeriumi Põltsamaa Rajooniosakonnas . 
2248	NA	 Iseloomustus on välja antud 1954. aastal . 
2249	NA	 Ma võtan selle teatavaks , et lüüa lahti järgmine leht . 
2249	NA	 Siin kuulatakse üle Leo Avantust , kelle kohta saan pisut hiljem teada , et ta kuulub 1948. aasta maikuust isikliku avalduse alusel Bandiitide hävitamise pataljoni koosseisu . 
2249	NA	 Et ta on andnud vande ustavalt võidelda . 
2249	NA	 Eluloolised andmed näitavad , et tal on haridust 6 klassi , et on talupidajate perekonnast ja oktoobris 1944 mobiliseeritud Nõukogude Armeesse - nagu onu Alfredki , mõtlen teksti keskel ja aknast mõttetult välja vahtides - , on võtnud osa Kuramaa lahingust , saanud haavata miinikillust vasakusse jalga ja pärast mitmeid haiglaid demobiliseeritud . 
2249	NA	 Ta on tulnud koju tagasi mõni kuu varem kui Alfred . 
2250	NA	 Leo Avantust on autasustatud medalitega vapruse eest . 
2250	NA	 Järgneb loetelu . 
2251	NA	 Ja nüüd , 1953. aasta oktoobris , kuulatakse Avantust üle bandiitide abistamisega seoses . 
2251	NA	 Uskumatu , kuid tõsi , mõtlen ma siis ja tol hetkel . 
2251	NA	 Alles kolmkümmend sentimeetrit hiljem - umbes nii paks on mind teisest ja selgusttoovast toimikust eraldav dokumentide kiht - saan ma teada , et pärast 1953. aasta kevadtalvel ja sügisel toimunud suurhaaranguid on viimane metsavendade pealik Aadam Münt 1954. aasta aprillis , paar nädalat enne varitsusest lastud kuuli läbi langemist , tõotanud Avantusele kui äraandjale verist kättemaksu . 
2251	NA	 Viimane pealikuks valitu - just too , kes fotodel poseerib täies relvis valge lina taustal , nii et esialgu ei saa arugi , et pildistatud on metsas - jah , too peaaegu viimane mees sellest kahekümne kaheksa liikmelisest grupist teab paar nädalat enne surma üsna täpselt , kes on kes ja kes kus ja kellele on teateid edasi andnud , ainult tal ei ole sellest võimalik enam ühelegi hoiatust saata . 
2251	NA	 Oma vihkamis- ja kättemaksusõnadki ütleb ta naisele , kes on mõni nädal varem agendiks värvatud . 
2251	NA	 See on Anni-nimeline vana naine , kes loodab veel päästa oma juba kinni võetud ja kohtu alla mineva poja elu . 
2251	NA	 Tema mees on 1946. aastal Eestist välja saadetud . 
2251	NA	 Enne 1949. aasta küüditamist on Anni oma poja Endliga metsa tulnud ja 1953. aasta sügisel , pärast poja kinnivõtmist , kui tervest grupeeringust on järel vaid riismed , on ta nõus olnud aitama metsades hajali varjuvate meeste viimast peameest püüda . 
2252	NA	 Ma kujutan seda hästi ette . 
2252	NA	 Ka see situatsioon on ühes eriteates täpselt dokumenteeritud . 
2253	NA	 Eriteade on adresseeritud NSVL MN juures asuva RJK IV valitsuse ülemale , ENSV Kommunistliku Partei esimesele sekretärile Seltsimees J. Käbinile ja ENSV Ministrite Nõukogu esimehele Seltsimees A. Müürisepale . 
2254	NA	 Muude ettevõetud operatsioonide järel on eriteates kirjas , et pärast Endel Esperi arreteerimist 1953. aasta septembris on Anni Esper kõrge vanuse tõttu hakanud end oma sugulaste taludes varjama . 
2255	NA	 Ülekuulamiste käigus palus Anni Esper anda talle võimalus oma süü lunastamiseks Nõukogude võimu ees ja lubas kaasa aidata talle tuntud bandiitide likvideerimisele . 
2256	NA	 Pärast ülekuulamist värvati ta agendiks pseudonüümiga Vana , jäeti illegaaliks ning saadeti pealik Aadam Münti otsima . 
2257	NA	 Täites meie ülesannet astus agent Vana ühendusse Aadam Mündi bande liikme Saar Astaga ja hakkas end koos temaga metsas punkris varjama . 
2258	NA	 Meie ja agent Vana ühendusepidajaks sai agent Villu , kes oli Saare kutsel paar korda külastanud nende punkrit . 
2259	NA	 1954. aasta märtsi lõpul teatas agent Villu , et olles 28. märtsil punkris , kohtas ta seal bande pealikut Münti , kes vestluses Villuga rääkis , et tuli punkrisse selleks , et saada ühendust oma bande liikmete Mets Ilmari ja Rein Saarega ( Kaarli Omakülapoisiga , lisan mina ) . 
2260	NA	 Saanud Saar Astalt teada , et mõlemad bandiidid on juba ammu punkrist lahkunud ja ilmselt Riikliku Julgeoleku organite poolt kinni võetud , otsustas Münt oma kaaslaste hävitamise eest kätte tasuda . 
2260	NA	" Seejuures andis ta teada kavatsusest õiendada arved agent "" Liiviga "" , bandiitide abistaja Avantus Leoga ja Kass Ennuga , keda kahtlustas sidemetes meiega . "
2261	NA	 Peale selle teatas Münt , et kavatseb lähiajal minna otsima vendi Vinkuseid , kes varjavad end samas rajoonis . 
2262	NA	 Edasi rääkis Münt , et siis , kui ta punkrisse tagasi tuleb , vahemikus 13.-15. aprillini , kavatseb ta Saar Asta ja agent Vana paigutada punkrist ümber ühe oma kaasosalise talusse , aga ise võtta ühendust kõigi illegaalide ja bandiitidega , kes veel alles on , et suurendada oma grupi koosseisu ja asuda Nõukogude võimuga aktiivsesse võitlusse . 
2263	NA	 Arvestades Münt , Aadama kuritegelike kavatsuste tõsidust , võeti vastu otsus tema kinnipidamiseks , relvastatud vastupanu korral aga ta likvideerida . 
2264	NA	 Sel eesmärgil organiseeriti 12. aprillil 1954. aastal meie operatiivtöötajatest ja hävituspataljonide komandöridest koosnev varitsus , mis pidas raadioühendust sõjaväelise kaitsegrupiga , mis asus eemal . 
2264	NA	 Eelnevalt peeti Saar Asta kinni , viidi varjatult punkrist välja ning arreteeriti . 
2264	NA	 Äratundmise eesmärgil jäeti varitsusse agent Vana . 
2265	NA	 17. aprillil 1954. aastal kell 2300 ilmus varitsuse alale tundmatu bandiit , kes valgustas punkrit taskulambiga ja kes kinnivõtmisel osutas relvastatud vastupanu . 
2265	NA	 Tekkinud tulevahetuses bandiit tapeti . 
2265	NA	 Tapetus tunti ära bandiit Münt Aadam Jüri poeg , sündinud 1928. a. , bande pealik , eestlane , NSVL-i kodanik , parteitu , illegaal 1948. aastast . 
2266	NA	 Edasi järgneb 16 punktist koosnev loetelu kõigist kaupluseröövidest , kuid nende arvel on ka hävituspataljoni kahe rühmavanema tapmine , kirjas on kaasosaliste nimed . 
2266	NA	 Ühest tapmisest on koos Aadam Mündiga osa võtnud Rein Saar ja Andres Vihur . 
2267	NA	 Eriteate lõpus on kirjas nelja mehe nimed , kes end veel metsas varjavad , kuid nende seas ei ole Kaarel Kolgametsa ega Vilma Reiterit . 
2268	NA	 Tegelikult tähistab see aprillis 1954 koostatud ENSV RJK eriteade tolle kahekümne kaheksast inimesest koosneva metsavendade grupi lõppu . 
2269	NA	 Alla on kirjutanud ENSV Ministrite Nõukogu juures asuva Julgeolekukomitee esimees Karpov . 
2270	NA	 Ma olin Kaarli mälestusi mõistnud kui enesekaitseks kirjutatud metsavennaelu kirjeldust , kuid Aadam Mündi tapmine leiab Kaarli poolt äramärkimist viisil , mis osutab Vilmale . 
2271	NA	 Õieti tuleks alustada Kaarli mälestuste lõpuosast . 
2271	NA	 Ta võtab arvatavasti 1957. aastal - aastaarve Kaarel ei armasta - ühendust Alfrediga , et kuulda , mis ümbruses toimub . 
2272	NA	 Seda ühendusse astumise hetke mäletan Kütilt minagi , sest kuulsin , kui Alfred Maalile ütles : Kaarel räägib , et ta on kõik vahepealsed aastad end oma talu maadele ehitatud punkrites täitsa üksi varjanud . 
2272	NA	 Vanasti ei olnud seal küll ühtegi punkrit ja keegi ei teadnud teda sealt otsida . 
2273	NA	 Kaarel kirjutab mälestustes , et ta on kutsunud Alfredi esimest korda kiirtega metsa . 
2273	NA	 Kaarlil oli 20-sentimeetrise läbimõõduga peegel ja eemalt metsa äärest tantsitab ta peegeldatud päikesekiiri Alfredi pea kohal ja jalgade ees . 
2274	NA	 Et Kaarli legaliseerumisele on eriteate järgi mehe metsast leidmisel kaasa aidanud rida agente ja nende seas on ka Kiir , pean arvama , et kiirtetants pidi Alfredile kutsungina mõjuma . 
2274	NA	 Nii et sel isepärasel viisil on Kaarel Kiire-nimelise agendi elunime avanud . 
2274	NA	 Ma ei pea seda juhuseks . 
2275	NA	 Alfrediga vestlusest tõstab Kaarel esile Vilma legaliseerumist 1955. aasta lõpul . - Siingi on eriteates märgitud agent Kiire julgeolekut abistav roll ! - Vilmale näidatud julgeoleku ülekuulamisel Aadam Mündi verist mütsi ja küsitud , kas ta tunneb selle ära . 
2276	NA	 Kui ma tean - ja Aadam Mündi tapmisprotokoll on mul loetud ja kirjas - , et Aadam on tapetud 12. aprillil 1954. aastal , peaksin Kaarlit uskudes arvama , et seda mütsi on hoitud Vilmale näitamiseks peaaegu poolteist aastat . 
2277	NA	 Milleks ? 
2277	NA	 Ja miks näidatakse seda just Vilmale äratundmiseks ? 
2277	NA	 Kaarel loob oma peitepiltlikul viisil Aadam Mündi ja Vilma vahele selle mütsiga seose , mis osutab Aadama surmale . 
2278	NA	 Aadam Münt tõotab oma eelviimasel vaba ja elusa mehe ringkäigul kättemaksu agent Liivile , Avantusele ja kellelegi veel , kelle isikust ja sidemetest puudub mul aim . 
2278	NA	 Kaarel justkui kinnitaks selle mälestuste-mütsiga , et Aadam Mündi varitsusest tapmine ja Vilma kuuluvad mingis mälestusteruumis avanemata asjaoludel kokku . 
2279	NA	 Kes teab , see saab aru . - Kaheks nädalaks agendiks värvatud Anni Esper ja Asta Saar saavad aru , sest nad on ähvardust õigele nimele adresseeritult kuulnud . - Kes arhiivi uurima ei lähe , võtab situatsiooni lihtsalt teatavaks : oli niisugune Alfredi suu läbi Kaarlini jõudnud verise mütsi näitamise seik , kohusetundlik mees on ka selle kirja pannud . 
2280	NA	 Ta , kurat , tuleb veel Vilma ja Alfredi peale kaebama , hüüdis ta pealtnäha rahulikule jutule vahele , nagu oleks unustanud , kellest ta räägib . 
2280	NA	 Kui ma ikka mõtlen , et Agatha on aidanud Kaarlil mälestusi kenamaks sättida , siis on märgilise musta mantliga mehe kõrval nüüd ka Vilmale ja Alfredile osutus . 
2281	NA	 Sa ikka mäletad seda Eduard Vilde juttu , küsisin kiiresti vahele , ja tead , mida musta mantliga mees ütles . 
2282	NA	 Eesti soost arst - kes ongi musta mantliga mees - ütleb juudi tapnud krahvile : Teie olete mõrtsukas , sest ta on seda tapmist pealt näinud . 
2283	NA	 Ma pole seda Vilde noorpõlveteost lugedes kordagi märganud , et tapetud mees oli juut , imestas ta . 
2283	NA	 Minu mälus oli tegu rahvusromantilise jutuga , kus eesti soost haritlane võitleb oma suguvendade vaimuvalguse eest ja on läbini õilis . 
2284	NA	 Vilde jutus on juut tähtis persoon , jätkasin mina . 
2284	NA	 Arst Meding lubab kuriteo jätta üles andmata , kui krahv Palmer alandab talupoegadel renti , ehitab kooli ning asutab linnas andekaid õpilasi toetava abiraha . 
2284	NA	 Kui see tehtud , on Palmer liigkasuvõtjast juudi tapmise süüst kui mitte prii , siis lunastatud ikkagi . 
2284	NA	 Vilde jutt on Raskolnikovi hingepöörde eesti variant , lunastus ei peitu usus ega Jumalas , vaid õigesti paigutatud rahas , pilkasin mina . 
2285	NA	 Kes näeb tapetud juuti , kes mõrtsukat , sõltub taustast ja lugejast , jätkas nüüd tema . 
2285	NA	 Ainult see erinevus on , et minu isa ei olnud juut ja tehingut sõlmiv Meding nimetab mõrtsukaks tegelikku ja mitte väljamõeldud tapjat . 
2285	NA	 Lindprii seisuses juut on ikkagi nii tähtis , et Kaarli mälestustes havi käsul mu isa unenäkku ilmuda , ja selles näib Kaarel , ja sugugi mitte asjata , mingit aulikku suhtumist endasse lootvat . 
2285	NA	 Kui juut mängu toodud , on kõik ausa eesti mehe vääratused mis tahes tõsiolude suhtes selgeks klatitud , ütles ta muiates , nagu kahtleks ta kellegi arus . 
2285	NA	 Musta mantliga mehe sõnu Kaarel vist ei mäleta , muidu poleks ta meest kujutletud lahingus enda ette seisma pannudki . 
2286	NA	 Ülestunnistus , ülestunnistus , kordasin vastuseks . 
2286	NA	 Kas või sajandivanuste tekstide tagant kostab vaid tunnistus , sest muud tähtsust neil eestikeelsetel katsetustel ju pole , ning ma ei teadnud , keda ma pilkan , kas Kaarlit või teda . 
2286	NA	 Nii üheks olid nad ristjoonses varjamis- ja tagaajamismängus muutunud , risti üks haru nagu ei saanudki enam teiseta midagi olla . 
2287	NA	 Nii et Kaarli mälestused on ka pealekaebus , kordasin . 
2287	NA	 Ta seletab Kolga lahingu endale soodsalt ära - kui Agatha konsultanditemp välja arvata - ning annab ainult arhiiviandmete kõrvutamisel avanevate peitepiltide kaudu mõista , kust tuleks selle metsavendade grupi äraandjaid otsida . 
2288	NA	 Ta oli vait . 
2288	NA	 Nüüd oli tema vait . 
2289	NA	 Kui see on nii - ja ka mina olen veendunud , et on just nõnda - , peab mingi tähendus olema juudi passiga mehe surmal ja meie kõigi tuleviku seisukohalt kangelaseks tõstetud Kaarlil endalgi . 
2290	NA	 Räägime parem Avantuse Leo arreteerimisest , mis on ilmselge etendus , et meest metsavendade seas tekkinud kahtluste ja kättemaksu eest päästa , jätkas ta . 
2290	NA	 Aga võib-olla ka mitte , ütles ta nõutult . 
2290	NA	 Vahest on too Avantus mingitel hetkedel tõesti uskunud end julgeolekut üle kavaldavat . 
2290	NA	 Või osutanud siiski rohkem teeneid , kui operatiivsetel kaalutlustel lubatuks peeti ja kuidas neid sõnu sel puhul kirja pannakse , jah , teeneid , mis ületasid ehk teatava sõnatult kokkulepitud piiri . 
2291	NA	 Kes teab ? 
2291	NA	 Mina ei tea . 
2291	NA	 Ülekuulamise teksti jälgides näib , et Avantus on kitsikusse sattunud . 
2291	NA	 Ja vahest ei tea ta enam isegi , mis on õigesti ja mis valesti tehtud , kahe piiri ja jõu vahele kiilutud , nagu ta nüüd on . 
2292	NA	 Üle kuulatud on teda aga seoses Endel Esperi kohtuasjaga üsna samal ajal , kui Endli ema Anni on punkrist lahkunud ja varjab end sugulaste juures . 
2292	NA	 Vahest on Avantusel veel lootust , ustav vabatahtlik Bandiitide hävitamise pataljoni liige , nagu ta koos Jüri Konksuga 1948. aastast alates on . 
2292	NA	 Või ei ole ? 
2292	NA	 Või ikkagi pole , kui ta kongis oma hinge pahupidi pöörab ja vaeb , mis on mis ja kus on ta eksinud . 
2293	NA	 Igal juhul räägib ta kõigest , mis tehtud ja kus oldud , nii põhjalikult kui võimalik . 
2293	NA	 Hiljem vastandatakse ta Esperi Endliga ja tema naine vastandatakse pärast ülekuulamist Esperi Endliga , nii et põhituli läheb ikka Endli pihta , keda ootab ees kohus ja mahalaskmine . 
2294	NA	 Avantus võib tunda end siiski kindlana , otsustan lõpuks . 
2294	NA	 Otsustab tema sündmuste loogikat järgiva toimikute virna keskel istudes . 
2295	NA	 Kui minu virnast jäävad varemed , siis mis jääb minust järele , küsib ta valjult ning märkab siis endale suunatud pilke . 
2295	NA	 Mis mees see Rummo oli , kui ligikaudu millestki selletaolisest luuletas ? 
2295	NA	 Aga küsimus jääb peakolu sisse , kui ka rõhk ähvardab kõrvad lehtrina lehvikuks pressida , et kuuleksid ikka , mis vaja , või oleksid vait , kui tervis vähegi kannatab . 
2296	NA	 Avantust on üle kuulatud kaks tundi ja päeva ajal , mis on ju pärast Stalini surma suur õnnistus . 
2296	NA	 Esimene küsimus puudutab muidugi seda , kellega bandiitidest on Avantus sidet pidanud . 
2297	NA	 Rein Saare , Vihur Andrese , Esper Endli ja teistega , kelle nime ei tea . 
2298	NA	 Kes teie tuttavatest on veel bandiitidega sidet pidanud ? 
2299	NA	 Teistest sidepidajatest ei tea ma midagi . 
2300	NA	 On see nii ? kõlab järgmine küsimus , ja ennäe , kohe tuleb Avantusel meelde , et ta pole olnud päris täpne . 
2301	NA	 Ma räägin tõtt , ütleb Avantus , kuid praegu tuleb mul meelde , et 1951. aastal andsin Saar Reinu palvel tema emale Maalile edasi kirja , milles Saar palus emal endale vastu tulla . 
2301	NA	 Kas ema kohtamisel käis , seda ma ei tea . 
2301	NA	 Peale selle rääkis Saar Rein mulle , et tal on 1949. aastast head suhted Konks Jüriga , kes praegu töötab Põltsamaa rajooni RJM organites . 
2301	NA	 Saar Reinu sõnade järgi päästis Konks Jüri ta 800 rubla eest välja ohtlikust olukorrast . 
2302	NA	 Täpsustage , mis olukord see oli ? 
