par_nr	head	sentence
1	 Cuncti simus concanentes : Ave Maria 	 Cuncti simus concanentes : Ave Maria 
2	NA	 Indrek Hargla 
3	NA	 Ma olen seitsmekümne üheksa aastane haige rauk , minu jalad ei kanna mind enam , kuid seda tugevam on minu mälu . 
3	NA	 Ma mädanen oma pärusmõisas , mul on elada jäänud vaid mõned kuud , ehk veidi rohkem kui Sebastién hoolsalt aadrit laseb , kuid kõigest hoolimata olen ma õnnelik ja ikka veel armunud . 
3	NA	 Minu armastus on minu usk ja õnn ja seepärast suren ma rõõmuga , kahetsemata midagi . 
3	NA	 Ma ootan surma ! 
3	NA	 Nad mõtlevad , et naeratus mu kuivanud huultel on vanadusnõtrusest , kuid minu mälu on iga päevaga selgem ja pisarad mu silmis pole mitte kurbusest , vaid õnnest ja rõõmust . 
3	NA	 Ma olen ikka veel armunud . 
3	NA	 Ja ma olen ketser . 
4	NA	 Ma ei tundnud Lotharit tegelikult , olen temaga vahetanud vaid mõned sõnad ja tema hinge eest palvetanud . 
4	NA	 Ehkki seda poleks vaja — ma ju nägin tema viimast naeratust — palvetan ma ikkagi . 
4	NA	 Me armastame temaga ühte ja sama naist , ent kui poleks olnud Lotharit , oleksin ma praegu tõesti ainult see , kellena ma näin — haige ja känguv maaisand , kelle surma kõik ootavad . 
4	NA	 Ent mu mälestused on tõesti iga päevaga üha eredamad , mulle meenub üksikasju , lausekatkeid , nägusid , inimesi , maastikke ajast kui olin veel noor ja sugugi mitte nii õnnelik kui praegu . 
4	NA	 Hiljem olen ma uurinud Lothari elukäiku , olen külastanud linnu , kus käis ka tema , vestelnud inimestega , kes teda minust paremini tundsid . 
4	NA	 Ja kui ma nüüd silmad sulgen , kangastub mulle tema lugu , tema elu ja armastus , ja kui ma mõnda seika tema elust ehk ise ei tea , siis olen ma selle välja mõelnud . 
4	NA	 Iialgi ei pane ma neid mälestusi kirja , sest milleks tõmmata enda suguvõsa peale Vahimeeste , Peapiiskopi ja Keisri viha . 
4	NA	 Õndsad pole mitte pimedad , vaid need , kes on näinud ! 
5	NA	 Aga nüüd , enne surma , siin mõisas , üksikuna , kõledas toas , kus laual seisab piibel ja kann Sebastiéni segatud rohuga , ma kuulen avatud aknast karjuste hommikusi hõikeid ja lammaste määgimist , päike on taas tõusnud valgustamaks ühte viimasemaid päevi minu elust , kangastuvad mulle need päevad noorusest ja mul on raske uskuda , et see mees seal olen tõesti mina ise . 
5	NA	 Ma sulgen silmad , ma mõtlen ja meenutan , ma usun ja armastan , ma olen nii õnnelik ! 
5	NA	 Ma tahaks laulda ja juba ma kuulengi viiulite kauget kõla , trummide müra ja mudas tantsuhoos pladisevaid paljaid jalgu . 
5	NA	 Lothar on seal , ta hoiab ühes käes veinikannu ja teisega lehvitab , vein voolab ta habemest ja tilgub pruunile särgile , ta naerab ja laulab korraga , ta on joovastuses ja joobunud . 
5	NA	 Punapäine Justine seisab truult Lothari kõrval , heliseval häälel laulab temagi ... 
6	NA	 Justine'i laul lõikab mulle kõrvu ja südamesse ... 
6	NA	 Cuncti simus concanentes , laulab ta , ja üks surev vanamees ümiseb temaga siin kaasa . 
7	NA	 Ma mõtlen Lothari lugu , see on minu ainus tegevus enne surma , igal hommikul , kui mõis on liikvele läinud , istun ma siin oma toas , kuulan , kuulen ja mõtlen oma mälestusi . 
7	NA	 Vahest iga kord erinevalt , võibolla mõtlen ma iga kord mõne seiga juurde , ent alati ma kinnitan endale , et jah , just nii pidi see kõik olema . 
7	NA	 Meenutused on ainus raamat , mida ma loen , ainus minu armastus . 
7	NA	 Karjusedki akna taga laulavad midagi , nad on noored ja tõusnud just oma piigade kuumast sängist , aga olgu neitsi Maria mulle tunnistajaks , nemad ei tea , mis on armastus . 
8	NA	 Nii et jälle sulgen ma silmad ... 
8	NA	 Mida ma näen täna kõigepealt ? 
8	NA	 Kust algab minu raamat täna ? 
8	NA	 Ühte ma tean kindlalt — jälle on varasügis , lõunast saadik kestnud sadu on lõppenud , teed ja niidud auravad , see on ... 
9	NA	 ... See on Akvitaania , varasügis ... niidud auravad sadanud vihmast , õhtu eel on päike pilve tagant välja sõudnud ... pori on teedel kuivamas , ent vankrid on neisse sõitnud sügavad jäljed , mudas on raske liikuda ja rändurid eelistavad teeperve . 
9	NA	 Õhk on niiske ja sumbne , kannab endas hanede kluuksumist , koerte haukumist , veiste ammumist ja muidugi , oh muidugi , kostab ka juba õrnalt vilepillide lõbus tilin ja trummide põntsumine . 
9	NA	 Jah , ma näen nüüd — taamal aimub läbi udu roheliste mägede viirg , tee lookleb läbi karjamaade , seal lähedal algavad parun de Moinnes'i jahimetsad , kus võib küttida kulte ja hirvi . 
9	NA	 Päike ripub tumehalli pilve taga , saadab viimaseid kiiri , õhtu on saabumas , kuid kõik selle päeva olulised toimetused pole veel kaugeltki lõppenud . 
9	NA	 Mitu inimest peavad veel kohtuma , mitme inimese elu ja armastuse lugu on veel täna algamas . 
10	NA	 Ja näe — seal astuvad kaks palverändurit ! 
10	NA	 Nad on noored , ehk liiga noored isegi , et palverännule minna , sest kindlasti ei saa nende patukoorem olla juba nii ränk . 
10	NA	 Aga nende olekust aimub argust , ettevaatlikust , alandust ja hardust . 
10	NA	 Kes teab , mis neid on tõuganud sellele pikale teekonnale ? 
10	NA	 Aga et see pikk ja raske on olnud , võib näha nende välimusest . 
10	NA	 Nad on kurnatud , kindlasti teel olnud juba kaua , hilbud nende ümber on kokku sobitatud mitmest vanast kaltsust , nende paljad jalad on marraskil ja vermeis , näod kõhnad ja vaevatud . 
10	NA	 Kõndimisel on neil toeks pikad palverändurite kepid , kaela on nad sidunud paunad , mis sisaldavad nende maist vara — vaevalt seal peale paari vaskmündi ja kuivanud leivakoorukese midagi on , ning nööri otsa aetud jõekarbid peavad vastutulejatele kinnitama , et teel on nad Santiago de Compostelasse . 
11	NA	 Kuid pea ! 
11	NA	 Nüüd , kui nad on lähemale tulnud , võib näha , et üks neist on noormees ja teine neiu ! 
11	NA	 Noormees on neiust ehk aastat neli-viis noorem , kuid tema samm on jõulisem ja tarmukam , kapuutsi alt võib aimata pikki tumepruune juukseid ja esimesi habemeudemeid . 
11	NA	 Neiu on ilus . 
11	NA	 See on esimene mõte , mis teda nähes pähe tuleb . 
11	NA	 Küll mitte nii ilus , kui võiks olla . 
11	NA	 Ilmselt on pikaajaline haigus tema näkku vajutanud kahvatuspitseri ja silmadesse sügava mure . 
11	NA	 Kuid kui veidi tähelepanelikumalt teda silmitseda , võib nähe , et palveränduri kaltsud varjavad sihvakat , ent veidi ümarikku aga siiski kaunist tütarlapsekeha , mis on hiljuti õide puhkenud , viimased lapseea vormid naiselikele allutanud . 
11	NA	 Tal on kukla tagant patsi sõlmatud tumepruunid juuksed , väike terav nina , veidi punnis põsed ja lõual väike sünnimärk . 
11	NA	 Miski temas kõneleb , et ta on õnnelik ja õnnetu ühteaegu — ehk seepärast ongi ta oma kaaslasega nii hilisel ajal ja varases eas teel Santiagosse ? 
12	NA	 Väiksele kingule jõudes nad seisatavad ja vaatavad all laiuvat küla . 
13	NA	" "" Ma olen nii väsinud , Aidann , "" ütleb tüdruk . "
13	NA	" "" Kas me leiame siit öömaja ? "" "
14	NA	" "" Palverändur leiab alati öömaja , "" kinnitab noormees . "
14	NA	" "" Kuuled seda muusikat ? "
14	NA	 Ma arvan , et see kostab mõnest trahterist . 
14	NA	" Sinna me lähemegi . "" "
15	NA	 Nad ei räägi okstitaanis , pigem kõneldakse sellist keelt Lorraine'is kuid ka see kant ei pruugi olla noormehe kodumaa . 
15	NA	 Igatahes annab nende kõnepruuk tunnistust , et käidud on neil tõepoolest pikk maa . 
15	NA	 Aga Santiagosse minnakse ju igalt poolt , ja ikka pigem kaugemalt kui lähemalt , üle kogu kristlaste maa . 
16	NA	 Paistab , et ka neiu on nüüd muusikat kuulnud . 
16	NA	 Õhtutuul toob nendeni flöötide , viiulite ja vihueelade sulnist kaja ja imeilus viis , andes tunnistust , et mängivad parimad minstrelid , mitte mõned külamoosekandid , paitab nende kõrvu . 
16	NA	 Innustatuna peagi saabuvast puhkusest , sunnivad nad end edasi kõndima . 
16	NA	 Peagi näevad nad heki taga trahterit , muusika muutub üha valjemaks , muusika , mille meloodiat hoiab ülal üha kiirenev mitmehäälne laul , torupill ja trummid . 
16	NA	 Palveränduritele omase enesekindla alandlikkusega keeravad nad heki taha ja avastavad end trahterihoovist kuhu on kogunenud mitukümmend inimest , kanad sebivad ärevalt kaagutades nende jalge vahel edasi- tagasi ning keset hoovi näevad nad umbes kümneliikmelist kaltsudes seltskonda , kes hüppab ja kargab poris , mõned neist hoiavad tantsides käes pille ja kui nad neid just ei puhu , üürgavad valjult laulda : 
17	NA	 Cuncti simus concanentes : Ave Maria Cuncti simus concanentes : Ave Maria 
18	NA	 Nad tantsivad kätest kinni hoides , keerlevad pööraselt , mehed ja naised segamini , kõik noored , nende nägudelt peegeldumas kõige ehtsam rõõm ja tantsuekstaasist sündinud vabadus . 
18	NA	 Pori pritsib nende nartsudele ja naerustele nägudele , tilgub juustes ja plärtsatab vahest vastu trummi . 
18	NA	 Kui nad refrääni lõpetavad , laulab üks ja kõige noorem tüdruk üksi edasi , kõlaval ja imekaunil häälel : 
19	NA	 Virgo sola existente en affuit angelus Gabriel est appelatus atque missus celitus Clara facieque dixit : Ave Maria *1* 
20	NA	 Ja siis jälle kõik koos , ka külarahvas ja muud võõrastemaja külalised , isegi paar rändavat kaputsiini munka löövad madalal bassil sekka : 
21	NA	 Cuncti simus concanentes : Ave Maria Cuncti simus concanentes : Ave Maria 
22	NA	 Kaks noort palverändurit seisavad kui lummatud , kui manatud . 
22	NA	 Vaevalt nad mõistavad ladina keelt , kuid juba näib väsimus nende kontidest pühitud olevat , juba on laul neid virgutanud ja kaunis muusika nende meeli rõõmustanud . 
22	NA	 Nad seisavad seal ja vaatavad rõõmustavaid inimesi ja ilmselt pole neil raske taibata , et ka pillimängijad ja tantsijad on palverändurid , sellest kõnelesid maja ette maha heidetud pikad kepid , paunad ja mustad palvehelmed . 
23	NA	 Moosekantide joovastus muusikast on siiras ning nakatav , et varsti leiavad kaks noort palverändurit ennastki laulurütmis kaasa õõtsutamas ja ümisemas . 
23	NA	 Noored tantsijad võtavad aga kätest kinni , moodustavad ringi , kiidavad neitsi Mariat , jutustavad lauldes lugu tema nägemusest peainglist . 
24	NA	 Veel laulavad nad , sekka ka mõne kurvema , kuid lõpetuseks kõlab taas veel kiiremalt ja hoogsamalt Cuncti simus concanentes . 
25	NA	 Siis kostab rahva kiidukisa taevani ning sedamööda hakatakse ka trahterist söögi- ja joogikraami välja kandma . 
25	NA	 Väsinud ja õnnelikud palverändurid vajuvad roidunult aida ette õlekuhjale , kuhu neile tuuakse praevardaid ja veinikanne . 
25	NA	 Kaputsiinlased õnnistavad neid , ning neilegi pakutakse tee peale veinilähker kaasa , rahvas hakkab tasapisi laiali valguma , nii mõnelgi laulusalm veel huulil . 
25	NA	" Siis märkabki kõige pikemat kasvu noorepoolne palverändur Aidanni ja tema kaaslast ning viipab neid lõbusalt pidusöögist osa saama : "" Hei , vennad ja õed , tulge ja aidake meil neitsi Mariat tänada ja tema auks rännakust väsinud kehasid kinnitada ! "" "
26	NA	 See hüüdja , rändmoosekantide peamees , on Lothar . 
27	NA	 Ma rüüpan oma kannust kibedat rohujooki ja usun , et see on magus ja hõrk bordoo vein . 
27	NA	 Ma mälun veidi hapukat pasteeti , mille kokk mulle armulikult on seganud odrakördiga . 
27	NA	 Aga mu mõtted on seal , Akvitaanias , ning tegelikult krõmpsuvad mu hammaste all varda otsa lükitud küpsetatud vuttide kondid . 
27	NA	 Rasv mu lõual seguneb veiniga , tilgub higisele vammusele ja seal maha porri , millesse tantsijate on jätnud tuhandeid jalajälgi . 
27	NA	 Ma sirutan end nagiseval toolil ja ehkki olen asja tõusnud , tunnen liikmetes rännakuväsimust . 
27	NA	 Ma peaaegu viskun niisketele õlgedele ja rehman käega , et tüdruk endaga õrnalt kaasa tõmmata ... 
28	NA	 Noor palverändur tõmbab tüdruku endaga õlesülemile kaasa . 
28	NA	 Liialt malbelt ja soostuvalt puutuvad nende kehad korraks kokku , enne kui moosekandid neile ruumi teevad . 
28	NA	 Õlgedel on veel niiske , ent magus vein ja soojad vutid , mille kallale kaks noort palverändurit kohe asuvad , soojendavad nende kehasid . 
29	NA	" "" Sööge , vennad rändurid , "" pakub taas Lothar ja seda ei tule tal tõepoolest kolmandat korda korrata . "
29	NA	 Vaevalt Aidann ja Grethel oma armupalukesi tantsu ja lauluga teeninud on , ilmselt on neid koheldud nagu palverändureid ikka — mõned pisku liharibaga kondid , leivakannik ja juustuviil , hea õnne korral karikas kehvemat veini . 
30	NA	 Kuid ka moosekandid pole täna söönud , isukalt rebivad nad varda otsast vutte ja vastavad tänukooriga , kui peremees neile trahterist lisa toob — pikad vastküpsetatud valged leivad , terve kera niisket juustu ja veel veini , mis ilmselt on pärit siitsamast küngastelt . 
31	NA	" "" Lähete Bordeaux'sse ? "" küsib nüüd Lothar . "
31	NA	 Aidanniks hüütu noogutab vutti täis suuga . 
31	NA	" "" Hiljavõitu olete liikuma hakanud . "
31	NA	" Vihma on palju , hooaeg on möödas . "" "
32	NA	" "" Hooaeg ? "" ei mõista Aidann . "
33	NA	" "" No muidugi ! "
33	NA	 Saate taevast vett ja rahet , päikest on harva . 
33	NA	 Montserrat's on rahvast vähe ja seal on igav . 
33	NA	 Tegelikult pole seal üldse enam need vanad head ajad , mil öö läbi pidusid peeti ja tantsiti . 
33	NA	 Compostelas ehk veidi lõbusam , ma ei tea tõesti , pole seal juba kaks aastat käinud . 
33	NA	" Kuhu te edasi lähete , Compostelasse või Montserrat'sse ? "" "
34	NA	" "" Compostelasse , "" kinnitab Aidann kiiresti liha alla kugistades . "
34	NA	" "" Ikka Compostelasse Me oleme vaesed patused ja ... "" "
35	NA	" "" Sa oled Lorraine'ist ! "" hüüatab Lothar äkki lõbusalt . "
35	NA	" "" Kaasmaalane ! "
35	NA	 Sinu tunnen ma kõnepruugist kohe ära . 
35	NA	" Kust sa täpsemalt pärit oled ? "" "
36	NA	" "" Mina ja mu õde Grethel oleme pärit tegelikult Genterdami lähistelt Brabandist . "
36	NA	" Oleme otsustanud oma pattude lunastuseks ette võtta vaga teekonna Compostelasse ... "" ja nüüd räägib Aidann vintsutusest pikal teel , mida nad juba kevadel olid alustanud . "
36	NA	 Burgundias olid nad sattunud otse sõjakeerisesse , mõned korrad olid nad teelt eksinud , Grethel oli saanud mingi raske tõve , mis jumalale tänud , polnud katk , vaid lihtsam külmetus ja ühes külas oli neid ravitud ... 
36	NA	 Pikk ja raske oli olnud nende teekond , kuid tagasi pöörata nad enam ei söanda , eriti nüüd , kus on jälle Palverändurite Teel ja igal ristmikul on Madonna kuju , neid majutatakse lahkelt trahterites või kiriku kõrvale ehitatud puhkemajades , nad kohtavad teel pattudest vabanenud palverändureid , kes kannavad kaelas Santiago märki , merikarpi . 
36	NA	 Ei , enam nad ei pöördu tagasi , kuni on jõudnud Compostelasse . 
37	NA	 Nüüd kogunevad ka ülejäänud palverändurid Aidanni ja Gretheli ümber , selgub , et kõik noormehed olid pärit kas Antrauschist , põhjapoolsest Burgundiast või Bavaariast , kõik olid nad üliõpilased Bonnis ja kord aastas , juba mitmendat korda järjest , otsisid nad endale kenad tüdrukud kaaslasteks , võtsid pillid selga ning läksid palverännakule , ikka mõnesse lõunapoolsesse maanurka , sooja mere ja ilusate palmide lähedale . 
37	NA	 Nüüd tuli nende malev Montserrat'st , Barcelona lähistelt Musta Madonna kloostrist , mis oma kuulsate tantsu- ja laulupidudega , mida palverändurid korraldavad , üle ilma kuulus on . 
37	NA	 Kord aastas , jutustasid üliõpilased , pagevad nad tolmuste ja tindiste raamatute , kõledate auditooriumite , surmigavate õpetlaste ja tüütute pärusmõisade eest , et rännates ja lauldes aega veeta , maailma tunda õppida ja jumalat kiita . 
38	NA	 Lothar kuulab oma kaaslaste jutustust , noogutab , naerab aegajalt , rüüpab veini ja vahetab kuumi pilke Justine'iga , kes tema õlale naaldudes on palge viimase päikesekiire ette sättinud . 
38	NA	 Ent üks korts Lothari vasakus silmanurgas kõneleb neile , kes teda hästi tunnevad , et midagi on teinud teda murelikuks või ehk veidi valvsaks . 
38	NA	 Aegajalt heidab ta mõtliku pilgu Grethelile , siis jälle Aidannile ja näikse nagu raputaks ta isegi pead . 
39	NA	 Need kaks noort inimest ei saa olla vend ja õde , sest nende kehad kõnelevad teist keelt . 
39	NA	 Jah , nad armastavad teineteist , aga mitte nii nagu vend ja õde , vaid nagu poiss ja tüdruk , kelle armastus mässava lainetevahuga paisu taha koguneb , et sealt siis meeletu kirega valla pääseda . 
39	NA	 Ja mitte seda pattu nad ei kahetse , sest mitte kordki elus pole olnud neil põhjust oma veel puhkemata armastust patuks pidada . 
40	NA	 Aga õhtu on saabumas , kaste rullub juba üle niitude , ning veini , mis lustliku kõrtsimehe heldusest mitte ei taha lõppeda , näib olevat hubasem edasi juua tallilakas , kuhu neile sooje tekkegi olla juba viidud . 
40	NA	 Öösiti läheb juba külmaks , räägib kõrtsmik Jean-Jacques , Püreneedest tuleb hall , ja kuidas te hommikul pilli mängite ja laulate , kui öösel hääled kinni külmetate . 
40	NA	 Muidugi tahab ta , et need taevast sadanud minstrelid ka homme tema trahterisse rahvast kokku meelitavad , ning pillimeestelgi ei paista selle mõtte vastu midagi olevat . 
40	NA	 Nad tõusevad ja suunduvad talli poole , Lothar kõige viimasena oma Justine'ile noogutades ja uurivalt kahte noort palverändurit silmitsedes . 
40	NA	 Võibolla mõtleb ta sel hetkel oma kodukandile Lorraine'is , sellele väiksele kahekordsele majakesele Blambriti linna peatänavas , kus elab tema isa , auväärne ja lugupeetud notar ja kust kunagi pandi talle kaasa soovituskirjad , teener ja kukkur keisrimarku , et ta läheks Bonni ja asuks seal õppima kuulsas ülikoolis ... 
41	NA	 Ma vaatan aknast välja ja näen Schlettsi mõisa lookavajanud hooneid . 
41	NA	 Nad näevad ju välja peaaegu samasugused kui üks maja Blambriti linnas , mida ma külastasin ligi nelikümmend aastat tagasi . 
41	NA	 Ei , vastas mulle too hallipäine mutike , kes oli Lothari ema , ta ei tea , kus on nende poeg , nad pole temast enam aastaid kuulnud , kuid nad loodavad , muidugi loodavad , et tal läheb kõik hästi ja ta on õppinud Bonnis kas notariks või vähemalt preestriks , sest talaar oli poissi notarikuuest vahest rohkemgi meelitanud . 
41	NA	 Teie poeg on õnnelik , kinnitas tundmatu ratsamees siis , tema rõõmu ja armastust ei saa miski väärata , mille kinnituseks ulatas kukru kõlisevaid münte . 
41	NA	 See on teie pojalt , lisas ta ja kindlasti kirjutab ta teile kunagi pikemalt . 
41	NA	 Nüüd aga , auväärt proua , on mul aeg minna . 
41	NA	 Kohused , teenistus , mõistate isegi . 
42	NA	 Ikka veel näen ma silme ees seda südikat naisenägu ja olen üsna kindel , et oli ilus ja värske varahommik , kui kiire kabjaplagin munakividelt vastu kajas ... 
43	NA	 ... See on Lorraine , väike Blambriti linn , mida pidevates sõdades hertsogi ja Prantsuse kuninga vahel on piiratud ja mille elanikud hommikuti ei pruugigi teada , kes täna on nende uus isand . 
43	NA	 Aga seda noormeest , kes sel ilusal ja värskel hommikul laenatud hobuse selga hüppab , vanematega südamliku kallistuse vahetab , reisipaunad sadulasse ja lauto selga seob ja siis munakividele rõõmsa kabjaplagina maha jätab , see vist väga ei huvitagi . 
43	NA	 Tema elu on alles algamas , teda ootab Bonn , uued sõbrad , uued teadmised , uued armastused . 
43	NA	 Ühe akna all enne linnamüüri ta peatub , ootab viivu , kuid ilmselt on veel liiga vara , et mündivermija tütre nägu sinna ilmuks . 
43	NA	 Öösel sosistatud armutõotused on ilusa Marie' väsitanud ja praegu elab ta veel unenägudes , elab taas läbi oma kõige kalleima aarde röövi , millele ta ise nii innukalt kaasa aitas ega tahagi ärgata , sest päeval peab olema jälle nii vooruslik ja kombekas . 
43	NA	" Aga kindlasti aimab ta Lothari vaikselt hüütud sõnu akna taga "" J'ay mis mon coer ! "" ja kindlasti sosistavad tema huuled läbi une noormehele kirgliku vastuse . "
44	NA	 Kolme aasta pärast abiellub Marie raenõuniku pojaga , sünnitab talle kolm tütart ja neli poega , kellest kõige vanema nimeks saab Lothar . 
45	NA	 Lothar aga ratsutab sel hommikul vastu uutele armastustele . 
45	NA	 Teda ootab vabadus ja kindlasti leidub Westfaaliski Marie' sarnaseid kauneid tüdrukuid . 
45	NA	 Siiski kaob linnavärav silmist kiiremini , kui Marie' embused ta meeltest . 
45	NA	 Juba lõuna ajal tellib ta teeäärsest trahterist kannu veini , haarab lauto ega lahku enne , kui on loonud oma armastatu vooruseks ballaadi , mida sealkandis siiani lauldakse . 
46	NA	 Lothar ise ei saa seda kunagi teadma , nagu ka too keskealine lonkur raehärra , kes seal mõnekümne aasta pärast peatub ja pimeda viiuldaja viisile lõbusalt jalga kaasa tümpsutab . 
46	NA	" "" See laul oleks nagu minu Marie'st , "" hüüab ta rõõmsalt ega märkagi hallipäise trahteripidaja kummalist naeratust . "
47	NA	 Mitte ainult uued armastused ei oota aga Blambriti notaripoega Bonnis , vaid ka loendamatud uued kohustused ja tüütused . 
47	NA	" Oma isa kurvastuseks ei pöördu ta enne mitte õigusteadlaste , vaid teoloogide kateedri poole ja küllap on see Canterbury Püha Anselmi "" Meditatsioonide "" tundeline peast lugemine , mis tema ees õppetooli väravad avab . "
47	NA	 Olgu sõda kelle vahel ja mille pärast tahes , arvab ta , preestreid läheb ikka tarvis . 
47	NA	 Põhjas käärivat vastasseisu augustiinlase Lutheri ja Rooma preestrite vahel ei võeta Bonnis veel tõsiselt . 
47	NA	 Aasta pärast aga näib Lotharile , et on kogu õppinud Bonnis jumalateadust , tolmused raamatud lämmatavad tema hingamist ja häält , ning tint näikse lautomängust tundlikuks õppinud sõrmi tuimaks vormivat . 
47	NA	 Pürjeripiigade südamed ei murdu nii kergesti , kui Blambriti Marie' oma — Lothar ihkab vaheldust , ta on sattunud ühest vangikongist teise . 
48	NA	 Siis jõuavad Bonni esimesed sõnumid Vahimeestest . 
48	NA	 Algul võtavad õpetatud mehed neid tühistena ja vaid naeravad põlglikult augustiinlase ketserlike mõtete üle . 
48	NA	 Siis rüüstavad Vahimehed esimese kloostri ja Keiser annab korralduse , mille järgi usuteadust nüüd teistmoodi lugeda tuleb . 
48	NA	 Õpetatud mehed mõtlevad küll korra Rooma ja paavsti peale , ent löövad siis käega — kui Looja on tõesti peale juuda rahva ka teutoonid välja valinud , nagu õpetab peapiiskop Luther , siis eks jõua see teadmine Aachenisse tõesti varem kui pisikesse Westfaali provintsilinna . 
49	NA	 Ühel päeval näeb ka Lothar esimest korda Vahimehi . 
49	NA	 Nad ratsutavad linna sisse õhtuhakul . 
49	NA	 Üll mustast nahast reisiülikond , peale heidetud valge mantlid . 
49	NA	 Mantlite seljal ilutsevad Vahimeeste vapid — hundipea ja selle all kaks üksteise peale risti asetatud S- tähte . 
49	NA	 Salvatoris susceptores , Lunastaja Vahimehed tähendab see . 
49	NA	 Mitte asjata polnud need lainelise risti moodustavad tähed S ja S kurjakuulutavaks sümboliks saanud . 
49	NA	 Hirmunud inimesed sulgevad nende ees paugutades aknaid ja linnaisad kogunevad murelike nägudega raekotta . 
49	NA	 Kõigepealt suunduvad Vahimehed aga ülikooli , kus rektorile ulatatakse raamatute nimekiri . 
50	NA	 Öösel valgustavad Bonni sajad lõkked . 
50	NA	 Põlevate raamatute toss lämmatab linna . 
50	NA	 Lotharil on sel ööl raske hingata . 
50	NA	 Siiski võtab ta oma lauto ja laulab vaikselt üht kiidulaulu , mida hiljuti oli kuulnud Compostelast naasnud palverändurite suust . 
51	NA	 Kui inimese jalad ei kuula enam sõna ja sa oled aheldatud oma tuppa , siis reisid sa mõtetes ja meenutustes . 
51	NA	 Arstirohud ei leevenda valu , küll aga teevad seda mälestused . 
51	NA	 Ma ei luba Sebastieni saega oma jalgade kallale , kuigi ta väidab , et valu jääks pärast amputeerimist vähemaks . 
51	NA	 Ma kannatan ja piinlen , tunnen rõõmu mälestustest , kui suren mehena , kel on alles kõik ihuliikmed . 
51	NA	 Mida tähendavad minu valud märtrite kannatuste kõrval ? ! 
51	NA	 Laske mul rännata mõttes ja tuletada meelde neid teid , kus kunagi Lothari lõbus malev laulis , palvetas , tantsis ja armastas . 
51	NA	 Sebastien ! 
51	NA	 Veel seda mõrkjat rohtu , mida sa keedad külanõia retsepti järgi , ehkki mulle valetad , et see on Heidelbergis patenteeritud luuvaluravim ! 
51	NA	 Veel , ja jäägu sul teadmata , et ühes valude leevenemisega pulbitsevad minus kangastused nooruspäevilt . 
51	NA	 Ma ei tea , mida segab külanõid sellesse jooki , kuid nüüd ma näen Schlettsi karjamaade asemel aknast hoopis teravatipulisi halle mägesid ja lambanahkades vaskooni karjused ulatavad mulle kuuma raguu . 
51	NA	 See on ... 
52	NA	 ... See on Orreaga-Roncesvalles ... 
52	NA	 Üks koht igavesel Palverändurite Teel , teel , teravatipuliste mägedega piiratud platoo , veidi tsiviliseeritum vaskoonide asula , kus on kirik ja tee ääres kivist ristid , millelsse tahutud stseenid Santiago säilmete toomisest Galiciasse . 
52	NA	 Lothar jagab armastust ühe mägilasneiuga , kellele ta pole kaugeltki esimene ja kes mõistab ainult vaskooni keelt . 
52	NA	 Tüdruk ei nõua tõotusi , ta on lihtsalt armunud ühte järjekordsesse palverändurisse , nagu saabuval kevadel järgmisesse . 
52	NA	 Tema nimi on umbes Byerna ja tema saatuseks on saada tubliks kaasaks näiteks sepale Zubile , kelle sepikojast kõlavad veel hilisõhtul vasaralöögid , kus ta hambaid kiristades rautab mingi Leoni hidalgo hobust . 
52	NA	 Kindlasti ei jää temagi sel ööl kaasata ja kindlasti peab hoopis tema Byernalt truudusetuse pärast ees andestust paluma ... aga see kõik tuleb hiljem , kui Lothar ja tema kaaslased on jõudnud tagasi Bonni , kandes südames hoopis teistsugust truudust armastusele , mida on võimalik kogeda ainult ühes mäekurus Püreneedes . 
53	NA	 Lothar on küll Orreagas , kuid tema mõtted ja tunded ikka veel Saint-Marie-de-Lognac'is , tähtsusetus külas kaljutippude vahel . 
