par_nr	head	sentence
1333	NA	 Olin nii kindlalt jalasäärte ja seelikusabade taha varjatud , et isegi igav hakkas . 
1333	NA	 Toas oleks võinud midagi ka toimuda . 
1333	NA	 Näiteks surm , keda Vanatare-Juuli kartis ja vanaema ei kartnud , oleks nüüd võinud ennast korra näidata . 
1333	NA	 Ta oleks võinud praegu väga vabalt ahju juurest hiina kase poole minna , sest ahi ja hiina kask jäid lauast kõige kaugemale . 
1333	NA	" Vahtisin põnevusega ahju poole , nihelesin ja meelitasin mesimagusa sosinaga surma nagu Tommit : "" Tule nüid välla , ilus luum , no tule nüid ! "" "
1334	NA	" Vanaema käratas : "" Kuss ! "
1334	NA	" Mes sa mürad sääl ! "" "
1335	NA	 Minu imestuseks teadis ta ilma laua alla vaatamatagi , kus ma olen . 
1335	NA	 Surma väljameelitamist pidas ta aga harilikuks ulakuseks ! 
1336	NA	" Vana-Ilves lausus ohates : "" Saame lapsest aru . "
1336	NA	 Laps lahutab oma meelt . 
1336	NA	" Kui meie kõik praegu seda võiks ! "" "
1337	NA	" Vanaema küsis sõjakalt : "" Mespärast siss meie ei või ? "" ja andis emale käsu : "" Tuu igaühele tükk suhkurt ja sii segatilgapudel säält õmmelusemasina tagalt . "" "
1338	NA	 Suurde ärevusse sattudes ilmusin elusuuruses laua alt välja ja sattusin uuesti Vana-Ilvesega silm silma vastu . 
1338	NA	 Nüüd ta nägi mind . 
1338	NA	 Ütlesin väärikalt kõhtu õieli ajades talle tere . 
1338	NA	 Mul hakkas hirm , et äkki Ilvese nähes mulle ei tilgutatagi suhkru peale segatilku . 
1338	NA	" Ilves võttis põuetaskust mustjashalli õhukese ajakirja , andis mulle ning vabandas : "" Ei ole ühtegi lapsepärast raamatut ühes . "
1338	NA	" Siin on pildid ka sees . "" "
1339	NA	 Ema tõi suhkrutükid ja ladus need vanaema ette ritta . 
1339	NA	 Vanaema tõmbas omale lambi lähemale , pani prillid ette ja tilgutas väriseva käega väikesest pruunist pudelist iga tüki peale kolm jämedat tilka . 
1339	NA	 Kõik vaatasid lakke ja pistsid suhkrutükid ühekorraga suhu . 
1340	NA	" Nihutasin ennast matsutades laua äärde lambivalgusse , ronisin põlvili toolile ja tundsin ajakirja "" Pilt ja Sõna "" kaante libedusest ning segatilkadega suhkrutüki kibedast magususest täiesti ühesugust mõnu . "
1340	NA	" Silmad lugesid : "" On saabunud suurim pidu , lauluaeg on käes - nõukoguliku Eesti kümnes aastapäev "" , kõrvad aga kuulsid : "" Põle muud kui õnne tänada ! "
1340	NA	" Oleks ma veerand tundi varem läbi metsa tulnud , oleks just haarangu tule alla jäänd . "" "
1341	NA	" Vanaema päris morni uudishimuga : "" No kas olli ka pailu püssimehi ? "" "
1342	NA	" Ilves vastas häbelikult : "" Mu prillid läksid ühtelugu uduseks , ma pimedas ei näinud nii hästi . "
1342	NA	" Aga metsa ääres olid mehed ahelikus ja ilma tuledeta veoauto seisis tee pääl . "" "
1342	NA	" Ta pidas vahet , võttis prillid eest ära , uuris neid ja kõigutas imestusega pead : "" Miilits jõudis mootorrattaga mulle metsa vahel järgi , tema rääkis , et punker olnud tühi , kardavad , et mõni on haarangust kuulda saanud ja sõna käinud viimas . "
1342	NA	 Nüüd hakkab uurimine . 
1342	NA	 Oli arvamine , et see on ainult peibutusepunker , et õiget punkrit veel ei täägi , kus see on . 
1342	NA	" Inimene on kaval loom , surmahirm teeb inimese väega kavalaks ! "" "
1343	NA	 Ema vahtis kohkunud näoga Ilvesele suhu , tuli lambis vurises ja kell lõi . 
1343	NA	" Vanaema võttis korvist lõngakerade ja pooliku suka juurest oma lauluraamatu ning ütles Vana-Ilvesele kindla tumeda häälega : "" Minu tahtmene on , et te nüid loess nende inge iist , kis täna õhta viil oma otsa es leia , aga kel sii iis seisab . "" "
1344	NA	 Tema jämedate konksus sõrmede vahele kadus must lauluraamat peaaegu täiesti ära , kuid Ilvese kollakasvalges käes lõid selle kullatud ääred kurjakuulutavalt ja võimukalt hiilgama . 
1344	NA	" Ilvese prillid sähvatasid tulevalgel , ta hakkas sügava häälega lugema , vanaemale , mulle ja emale kordamööda küsivalt otsa vaadates : "" Keset surma hirmsaste põrguhaud meid kiusab ; kes meid sest teeb vallale ? "
1344	NA	 Kes sest hirmust peastab ? 
1344	NA	 Sa , Issand , ainuüksi . 
1344	NA	 Küll Sina armust halastad , kui on raske meie patt . 
1344	NA	 Püha Issand Jumal . 
1344	NA	 Püha vägev Jumal . 
1344	NA	 Ärgu põrgu riisugu lootust meie südamest . 
1344	NA	" Kürieleison . "" "
1345	NA	 Vanaema näost paistis , et ta on Võtiksaare Riksi põrgusseminekus kindel . 
1345	NA	" Ta kordas Ilvese järel hukkamõistvalt : "" Kürieleison . "" "
1346	NA	" Keerasin "" Pildi ja Sõna "" lehte , silmitsesin igavaid pilte ning ootasin , kas "" Kürieleison "" veel kostab . "
1346	NA	 Haarang valmistas mulle pettumuse . 
1346	NA	 Metsa ei tehtudki puhtaks , et mina saaksin seal julgelt ringi kolada ! 
1346	NA	 Haaranguõhtu pimeduses vaatasid mulle ajakirjast vastu lipsudega mehed , otsaesised kortsus ja pead kammitud . 
1346	NA	 Lausetest piltide all ei saanud ma suurt aru ja need ei huvitanudki mind . 
1346	NA	 Päris leheäärel aga asus pilt , mis kõigist teistest erines . 
1346	NA	 Seegi oli väike ja hall , ainult natuke suurem kui tikutoos - ja ometi paistis sealt suur külm avarus , vihased tardunud merelained läksid silmapiiril üle valkjaks taevaks . 
1346	NA	 Vihaste lainete ja igavese tuule taustal pööras pead noor Debora , eesti luuletaja . 
1346	NA	 Teiste poole kõõrdpilke heites õngitsesin kruupingi nurga pealt jämeda nüri puusepapliiatsi ja seda suus märjaks kastes värvisin kiiruga pildi-peal-olija valge pluusi potisiniseks . 
1346	NA	 Nüüd oli see pilt minu arust veel ilusam . 
1346	NA	 Uurisin tükk aega tähelepanelikult uhket nägu , mille sarnast ma polnud veel ühelgi inimesel näinud ja mis tekitas hämmastust ning igatsust . 
1347	NA	" Ilves luges kõminal : "" Oh igavik , oh igavik , kuis oled sa nii pikk , nii pikk . "
1347	NA	 Sa oled aeg , mis ajatu , sa oled ring , mis rajatu . 
1347	NA	" Keskpaigas sul on "" alati "" ja ääreks "" mitte iialgi "" . "
1347	NA	" Oh mõtle , mis on igavik . "" "
1348	NA	 See uhke nägu ja see salm kokku tegid mind järsku kurvaks , panin pea raskelt ajakirjalehele ja kuulatasin magusa võõrastusega sõnu , mis nagu tahtsid tungivalt midagi teatada . 
1348	NA	 Aga mida ? 
1349	NA	 Võib-olla rääkisid need sõnad sellest , et New Yorgis istub oma laua taga Isaac Bashewis Singer ja kirjutab paremalt vasakule . 
1349	NA	 Et aastakümned lähevad lennates mööda , vanaema ja Vana-Ilves surevad ära , haarangud unustatakse , aga tema istub ikka seal . 
1349	NA	 Tema vanad silmad liiguvad tähelepanelikult ja pingsalt , ta kirjutusmasin on tehtud nelikümmend aastat tagasi , ta võitleb sellega kuradi vastu ning julgustab ja üha julgustab meid , kuigi meie oleme elanud pool elu ilma tema nime tundmata . 
1350	NA	 Et ükskord peame oma lapseea arutud ja kurjad soovid heaks tegema . 
1350	NA	 Silmad kuluvad pähe ära ja sõrmed lähevad kirjutamisest kõveraks . 
1350	NA	 Peame võitlema kurja vastu . 
1350	NA	 Kuidas me sellega hakkama saame , kui me ise oleme kurjad , kadedad ja silmakirjalikud ? 
1351	NA	 Küll võitlus ja kannatus meid teiseks teevad . 
1351	NA	 Peame teiseks saama , maksku see või kogu südamevere . 
1351	NA	 Peame rinnuli lauale laskuma ja pliiatsit teritama , kopeeri vahetama , rõõmu tundma , tuge andma nendele , keda me kunagi näinud ei ole . 
1351	NA	 Järeleandmatult ning julgelt kinnitama : 
1352	NA	 Ja sünnitakse , kuigi tuleb surra 
1353	NA	 ja armutakse pettumuste trotsiks . 
1354	NA	 Mõnd ilu , hämmastavalt peent ja kurba 
1355	NA	 hing leiab , ilma et ta üldse otsiks . 
1355	NA	 * 
1356	NA	 * 
1356	NA	 A. Alliksaar . 
1356	NA	 
1357	NA	" Võpatasin arusaamatute sõnade ja ähmaste aimduste nõidusest üles - Ilves pani palitunööpe kinni , andis vanaemale kätt ning lausus : "" Nüüd on jalga küll puhatud . "
1357	NA	" Nüüd ma lähen kodu . "" "
1358	NA	 Tommi tuli laua alt välja ja sirutas magusasti , toolid kolisesid . 
1358	NA	 Mindi vöörusesse Ilvest saatma . 
1358	NA	 Astusin vanaema järel välja ja vaatasin , kuidas Ilves tähevalgel metsa vahele kaob . 
1358	NA	 Külm kõrvetas ninasõõrmeid , polnud kuulda muud kui ikka tasasemaks jäävat lume kriuksumist . 
1359	NA	 Must vana taevas tõusis kõrges kaares laudakatuse kohale . 
1359	NA	 Kõpu metsade põhjas , tühjadel sätendavatel lumeväljadel ja meie õues , igal pool läbisid õhku salapärased raadiolained kesköise Kremli kellahelinaga . 
1360	NA	 VIIMASEL VANA AASTA PÄEVAL SAADETI MIND Teistele ajalehti ära tooma . 
1360	NA	 Seal vaatasime koos Mairega jälle vanaaegseid moelehti ja sõime leiba kõrvitsamoosiga . 
1360	NA	 Lõpuks , peale Juuli mitmekordset meeldetuletamist hakkasin koju minema . 
1361	NA	 Lähenesin kodule suurt ringi tehes , hoopis teisest küljest , jääd lutsides ja vitsaraoga teeäärtesse viisnurki joonistades . 
1361	NA	 Sünget taevast hoidsid üleval veel ainult lumised kuuseladvad , see ähvardas iga hetk kaela langeda . 
1362	NA	 Väljakraavi äärde kolme tee ristile jõudes vaatasin igaks juhuks ringi ja kui kusagil kedagi näha polnud , kukutasin ennast sillalt lumme . 
1362	NA	 Püherdasin natuke hanges ning hakkasin siis ägedalt silla alla käiku kaapima . 
1362	NA	 Lumi tuiskas üle pea ja kõrvetas kindapärade ning palitukäiste vahelt sisse tungides käerandmeid . 
1362	NA	 Kaapisin seni , kuni vajusin käpuli auku - sillaalusesse koopasse . 
1362	NA	 Seda ma just ootasin , kuid ehmatasin ikkagi . 
1363	NA	 Silla all ei olnud lumekübetki , seal läikis tume kraavijää . 
1363	NA	 Ruumi oli seal just nii palju , et mina võisin jääd mööda käpakile käia . 
1363	NA	 Päevavalgus jõudis koopasse läbi minu kraabitud augu , kuid seda kumas tuhmide triipudena laestki , korpas kuuselattide vahelt . 
1363	NA	 Üldiselt aga valitses siin hall hämarik . 
1363	NA	 Ajasin sissepääsu ettevaatlikult lund täis ja olin nüüd elusalt silla alla maetud , maa pealt kadunud . 
1364	NA	 Heitsin selili maha ja vaatasin silda altpoolt . 
1364	NA	 Kõik latid paistsid olevat ühejämedused , neid kandsid kaks tala , praod olid lund täis . 
1364	NA	 Kuulda ei olnud ühtegi häält peale nende tasaste sahinate ja krõbinate , mida ma ise liigutades tegin . 
1364	NA	 Tundsin , kuidas jää külmus aegamööda isegi läbi paksu mütsi pealuuni tungis . 
1364	NA	" Heitsin käed laiali , sirutasin jalad pikalt välja ja nõudsin endalt mõttes ägedalt : "" Noh , kas saab juba ! "" "
1364	NA	 See iseäralik jõupingutus , mis nüüd kohe järgnema pidi , meelitas peitu pugema ja varju otsima ; see maitses mulle nagu salaja söödud hambapasta ja seda nagu hambapastatki pidi ikka jälle uuesti ahmima . 
1364	NA	 Pingutus ise seisis selles , et ennast segiaetud klotsidest õieti kokku panna , nii et pilt välja tuleks . 
1365	NA	 Silmaterade tagune hauavaikus ja pimedus ärkas , hakkas kohisema , tundus , nagu oleksid seal nikkelkapslitega kellad läikides ja välkudes käima hakanud . 
1365	NA	 Silmad olid siin ainult tüliks . 
1365	NA	 Need võisid väga kergesti jääda pidama mõnele nähtaval olevale asjale - oma vildininadele või laest rippuvatele kuusekooreribadele , siis oleksid suure vaevaga kokku pandud klotsid kohe laiali läinud . 
1365	NA	 Seda ma juba teadsin ja sellepärast ka silmad kinni pigistasin . 
1365	NA	 Nüüd tuli ennast hästi kokku võttes mõtelda mõne inimese nime peale ja siis võttis see nimi minu kukla ja otsaesise vahelises palavas ja mustas ruumis omale kuju . 
1365	NA	" Ütlesin mõttes "" Anton "" ja nägingi kohe võhivõõrast Antonit selga vastu majanurka toetamas , kaval nägu ees ja hall klatstükiga pluus seljas . "
1365	NA	" Järgmisena tuli meelde nimi "" Tiiu "" . "
1365	NA	 Tiiu seisis vaga näoga keset tuba , traksidega põll ees ja käed ripakile . 
1365	NA	 Lokkis peaga Linda läks üle jää , pani jalga jala ette ja kilkas , Anne istus kõrgel toolil , mossis nägu ees , punane kleit seljas , mustad sukad jalas ja kõigutas jalgu , Ants naeris põrinal , temast ma muud teada ei saanudki , Miina oli hall ja tõsine , lusika moodi . 
1366	NA	 Sellest mängust ei rääkinud ma kellelegi . 
1366	NA	 Jälgisin teisi ja murdsin pead selle üle , mis võiks olla n e n d e saladus , millest n e m a d kunagi ei räägi . 
1367	NA	 Selles sillaaluses koopas , jää ja lume kalki riiki oma hingeõhuga soojendades tundsin tumedat hirmu , loomalikku ja ähmast kartust kuidagi k a o t s i m i n n a. 
1367	NA	 Keerasin ennast kõhuli , toetasin lõua vastu jääd ja jäin üksisilmi vahtima sõmerat lund oma näo ees . 
1367	NA	 Tahtsin tungivalt teada , kas lumi , jää ja kõik muu , mis mind ümbritseb , ka siis mind samamoodi huvitab , kui ma suur olen . 
1368	NA	 See hirmuga segatud uudishimuhoog oma tuleviku vastu , väga ebamäärane , kuid ängistav ja vaistlik kartus murdeeas kaotsi minna , keskpäraseks inimeseks murduda , oma haldjariigist ja marssalikepikesest terveks eluks ilma jääda sähvatab ehk igast lapsest korra läbi ; seda sähvatust summutatakse eneses kisa ja kära , jonni ja kannidega . 
1369	NA	 Näen praegugi seda halli hangunud talvepäeva . 
1369	NA	 Aastate tagant paistab see olevat kokku tõmbunud ja tihenenud ning meenutab härmatanud magnetrauda . 
1369	NA	 Ma tean , et see kraav , kus ma lebasin , on veel praegugi olemas , kuid ümberkaudsete heinamaade asemel on seal nüüd võsa . 
1369	NA	 Juuli on surnud , Liisu on surnud , Kott-Eevald on surnud , vanaema on surnud , Lehik on tapamajja viidud , Punik on tapamajja viidud , Tähik läks ädala peal lõhki , Tuksi murdis hunt , Tommi pandi magama . 
1370	NA	 Ometi saabub tühermaadele ja võsadessegi suvi . 
1370	NA	 Pilved rändavad ja päike paistab , ajapilti pööratakse ning igal elaval tuleb selles tahes-tahtmata midagi muuta , halvema või parema poole . 
1370	NA	 Lennuk möiratab linna kohal ohtlikus tänapäevataevas , kuiv keskkütteõhk kipitab ninas , lumi sulab katustel ja kevadväsimuse sinilill tõuseb jälle keltsa alt . 
1371	NA	" Minu küünarnuki all on kõva ja kindel lauapind , seinal parema õla kõrgusel ripub General-Karte von Livland , valkjaskollane ja vana , alumises ääres märkus : "" Dozvoleno tsenzuroju Riga 1889. "" Sellelt kaardilt võib ka praegu leida jõe ja luha , milledest ma siin räägin , kuid nende nimed on seal saksakeelsed . "
1371	NA	 Seal seisab Neu-Tennasilm ja Alt-Tennasilm ning poolviltu paremal Spiegelfabrik Catharina . 
1371	NA	 Mis vabrik ? 
1371	NA	 See on maa , mida mina iialgi oma silmaga näinud ei ole . 
1371	NA	 Tean sellest midagi ainult kuulujuttude ja raamatute põhjal , samuti kui teistest taevakehadestki . 
1371	NA	 Elan maal , mida mul ka 2083. aastal ei ole võimalik näha . 
1371	NA	 Jääb loota , et see on siiski üks ja seesama maa . 
1372	NA	 Lebasin vanale kaardile märgitud jõe läheduses , lumekoopas . 
1372	NA	 Seesama maakaart ise vedeles kokkumurtult tagatoas lauasahtlis . 
1372	NA	 Olin sellele juba kallale pääsenud ja sinna vildakate kriipsudega oma nimes esinevaid tähti kritseldanud . 
1372	NA	 Tundsin läbi palitu jää külmust , olin tardunud ja tõsine . 
1372	NA	 Kõik , mida ma tundsin , oli ebamäärane , sõnades väljendamatu ja ometi tähtis . 
1373	NA	 Korraga tuli mulle meelde , et on vana-aasta õhtu ja et ma olen juba väga kaua kodunt ära olnud . 
1373	NA	 Äkki on isa vahepeal koju tulnud , võib-olla on isegi kuuseehted juba karbist välja võetud ja liha ahju pandud , aga mind ei olegi ! 
1373	NA	 Tõusin silmapilk üles , kaapisin lume kiiruga laiali ja kargasin koopast välja . 
1373	NA	 Nägin üle välja lähenemas suurt punast hobust ja rege , milles istus kuldhammastega kaltsukaupmees , poti-setu , Närumees , minu kõige suurem vaenlane ja minu arust üleüldse väga kardetav isik . 
1373	NA	 Närumehe hobune puristas , raputas musta turris lakka ja tema kapjade alt lendasid õhku laiad hallid lumekamakad . 
1374	NA	" Kihutasin suure ajuga kodu poole , jooksin õudusega väravast sisse , lõin uksed pärani lahti ja kisendasin kurgu põhjast : "" Närumiis tuleb ! "
1374	NA	" Närumiis tuleb ! "" "
1375	NA	 Vanaema pani leibu ahju , ema triikis tagatoas pesu . 
1375	NA	 Toas oli tunda sütevingu ja külma käest toodud pesu värsket lõhna . 
1375	NA	 See rahustas mind natuke . 
1375	NA	 Kiskusin palitut seljast ja otsisin silmadega kohta , kuhu peitu minna ning samal ajal ka näha , mis eestoas tehakse . 
1376	NA	 Tommi hakkas väljas haukuma ja juba põrutaski Närumees trepi peal jalgade küljest lund ära . 
1376	NA	 Litsusin ennast kähku tagatoas ahju ja ukse vahele nurka ja piilusin uksehingede vahelt jubedusega ettetuppa . 
1376	NA	" Närumees lõi lävel mütsi kuklasse ja räuskas : "" Perenaesed , tooge nüid närud välla ! "
1376	NA	" Kaussa om miul igate muudu - suura kaussa om , veiksi kaussa om , kruuskasi om , tarelkasi om ! "" "
1377	NA	" Vanaema pühkis toolipõhja üle ning lausus pahakspanevalt : "" Kassa näe , Juks kohe peris vana-aasta õhta äri aamas ! "
1377	NA	" Lase ma lükkan levad ahju , siss näeb , mes saab ! "" "
1378	NA	 Närumees lõi kasukahõlmad laiali , istus pakutud toolile ja viskas ühe jala üle teise . 
1378	NA	 Tema lai ilvesenägu punetas , ta luuras pilguga tuba , toksis piitsaotsaga põrandat ja muigutas suud . 
1378	NA	 Vanaema toimetas endiselt ahju juures . 
1378	NA	 Ema aga ei teinud külainimesest väljagi , vaid triikis tagatoas edasi , nagu ei olekski teda üldse kodus . 
1379	NA	 Närumees lasi suul käia . 
1379	NA	" Ta ähvardas : "" Nüid võetasse lehmapidajate vasta õte karmid abinõud tarvitusele ja õõnapuiele pannasse uuest aastast õõnapuu maks pääle . "
1379	NA	" Kis tahab omale õunu persse aada , piab rahvi maksma . "" "
1379	NA	" Ta ei jätnud uhkustamata : "" A' mes miul viga - lehmale antsin nuga , õõnapuud raitsin maha , mia olen nüid puhas poiss ! "" "
1380	NA	" Vanaema imestas : "" Mes kiik ära ei kuule ! "
1380	NA	 Kissi täia aruga inime akkab õõnapuud maha raidma ! 
1380	NA	" Niipaelu ikki neid rahakopikid on , et tema ingekse iist maksa saab . "" "
1381	NA	" Närumees põlastas : "" Mes kurradi ingekse ! "
1381	NA	 Õõnapuiega tii mes sa isi tahad , a' lehmal tõmma küll kõri maha , tii rahass , mes rahass teha annab ja mini ära linna . 
1381	NA	 Vot mina lüün omale nendesamade närudega linna maja püsti ja maa poole sülgan . 
1381	NA	" Oma veiksepoisi õpetan ka viil maa poole sülgama ! "" "
1382	NA	" Ta tõusis püsti , käis mööda seinaääri , mudis näpu vahel kõiki riideid , mis nagis rippusid ja kirus : "" Maa maa mes kuradi maa ! "
1382	NA	" Nüid , kas tääd , om elu teene ! "" "
1383	NA	" Vanaema lausus nagu lepituseks : "" Noh , sina oled va käind ja näind miis , eks sina tääd seda nüidse aa asja . "
1383	NA	" Mes mina , rumal vanainime , siin ikki mõistan arvata . "" "
1383	NA	" Siiski ei saanud ta kiusatusele vastu panna ja parastas minu heameeleks : "" Vaata aga , et uhkus upakile ei aa ! "" "
1384	NA	 Ta pesi laua puhtaks , võttis jahumati kaenlasse ja läks kas kööki või koguni aita . 
1384	NA	 Nüüd jäi Närumees üksinda , kuid ta ei osanud aimatagi , et minu silmad teda jälgivad . 
1384	NA	 Ta seisis ikka veel seina ääres nagi all . 
1384	NA	 Seal rippusid onu uued kalifeepüksid , kaks kuube ja vanaema villane körtsik . 
1385	NA	 Närumees pidas nagu millegi üle aru , mudis kalifeesid ja silitas kuube . 
1385	NA	 Järsku ta nõksatas , tõmbus kühmu ja vanaema körtsik kadus tema kasukapõue nii kiiresti , et ma ei saanud arugi , kas ta käed üldse liikusid või lipsas körtsik ise talle põue . 
1385	NA	" Hiilisin kikivarvul triikiva ema juurde ja sisistasin talle vihaselt kõrva sisse : "" Närumiis võttis vanaema uue körtsiku ära ja pandis omale põue ! "" "
1386	NA	 Ema ehmatas , jättis triikimise katki ja läks mossi . 
1386	NA	 Ta jäi korraks mõttesse , silus siis peegli ees pead , tegi naerul näo ja astus järsku taganttoast välja . 
1386	NA	 Mina jäin ukse peale kõõluma . 
1386	NA	" Närumees ei löönudki meid kartma , nagu ma innukalt lootsin , vaid lõmpsis ema nähes vilunult : "" Oi-oi-oi ! "
1386	NA	 Noorik ka kodu ! 
1386	NA	" Nüid teema küll noorikule pai ära ! "" "
1387	NA	 Ta püüdis peoga üle ema pea tõmmata ja naeris laia suuga , nii et plekkhambad kuldhammaste tagant paistsid . 
1388	NA	" Minu imestuseks ja pahameeleks hakkas ema Närumehega lahkesti juttu ajama , itsitas kõigi tema naljade peale ning küsis tungivalt : "" Juks , kas sul ometi pala põle ? "" ja sundis : "" Võta kasuk sellast ära , me toome närud ikki sisse , ega me vällas külma käe siss kauplema ei akka ! "" "
1389	NA	" Mitu korda hõikas ta kööki : "" Ema , mes sa sääl koperdad ? "
1389	NA	" Tule seie ! "" , tõusis lõpuks püsti ja läks ise vanaemale järele . "
1390	NA	 Pärast ema äraminekut tekkis tuppa vaikus . 
1390	NA	 Nagist põrnitsesid meid pinevalt ja külmalt onu kalifeepükste tinakarva nööbid . 
1390	NA	 Tagatoas ajas triikraud sütevingu ning lae all hõljus sinine vine . 
1390	NA	 Taganesin sammhaaval tahatuppa . 
1390	NA	 Närumees mängitas piitsa käes ja nohises . 
1390	NA	 Tõmbasin pea õlgade vahele ega julgenud tema poole vaadatagi . 
1390	NA	" Lõpuks ei pidanud ma enam vastu ja kisendasin : "" Ema ! "
1390	NA	 Ema ! 
1390	NA	 Ema ! 
1390	NA	 Ema ! 
1390	NA	" Ema ! "" , kuid juba ilmusidki ema ja vanaema tuppa . "
1390	NA	 Ilma minu poole vaatamata ja minu hädakisast välja tegemata läksid nad Närumehe juurde . 
1390	NA	 Enne kui Närumees paha aimatagi jõudis , olid ta kasukahõlmad eest lahti tõmmatud . 
1390	NA	 Kasuka kaenlaaugust tolknes välja vanaema körtsik . 
1391	NA	 Närumehe nägu läikis , ta kiskus kasukahõlmad vaheliti ja kõpsutas jalga vastu maad , nagu poleks midagi olnudki . 
1391	NA	" Vanaema ninasõõrmed läksid puhevile ja nägu lapiliseks , ta hingas kähinal , kahmas ahjuluua kätte , astus ukse peale ette ja käratas : "" Malka ! "" "
1392	NA	" Närumees imestas : "" Tohhoo kurrat , mes nali sii siss om ! "" ja paistis , et ta läheb kohe vanaemale kallale . "
1393	NA	" Kargasin vanaema juurde , litsusin selja vastu ust ja tönnisin : "" Vanaema , võta körtsik ära ! "
1393	NA	" Vanaema , võta körtsik ära ! "" "
1394	NA	" Vanaema astus julgelt Närumehe nina alla , vaatas talle otse näkku ja käsutas : "" Pane tagasi ! "" "
1395	NA	 Närumees ainult mühatas . 
1395	NA	 Korraga oli tal aga ometi körtsik näpu vahel . 
1395	NA	 Ka seekord ei olnud aru saada , kunas ta käed liikusid . 
1395	NA	" Ta viskas körtsiku vilet ajades nagisse ja põlastas : "" Saa neist naestest sotti ! "
1395	NA	 Vot võtsin määrasin igavuse pärast riide sorti , ei saand käest ära pannagi , ku' te tahte juba vargass teta . 
1395	NA	" Ena mul asja ! "" "
1395	NA	" Seda seletust andes sai ta julgust juurde ja räuskas endiselt : "" No julgemini , julgemini , naesed ! "
1395	NA	 Tooge närud välla ! 
1395	NA	" Kaussa om , tarelkasi om ! "" "
1395	NA	" Ta sosistas saladuslikult : "" Võide kaussa võtta , a' võib villanormi kustutuse kah ärä teta . "
1395	NA	 Teile ma tulen vasta , mul viil üts viimane plankett om . 
1395	NA	" Antke punt närusi ja teeme ära ! "" "
1396	NA	" Vanaema kurtis : "" Ma mette änam ei taha , et sii inime mo silma all on , aga tal põle niipailu arusaamest kah , et ta ärä lähass ! "" "
1397	NA	 Emale tükkis naer peale , ta tegi nagu vaataks aknast välja , tõmbas kardinaserva näo ette ja ta selg vappus tagasihoitud naerust . 
1397	NA	 Enam ma Närumeest ei kartnud . 
1397	NA	 Ma koguni tegin tema ümber ühe ringi ja takseerisin teda igast kandist . 
1397	NA	 Panin tähele , et ta käed olid tublisti lühemad kui kasukakäised . 
1397	NA	 Tõmbasin oma käed ka käistesse , nii et sõrmeotsad vaevalt välja jäid , läksin müksasin ema ; näitasin talle Närumeest ja siis oma käistesse kistud käsi . 
1397	NA	 Ema ei saanud enam vastu panna , ta kukkus heledasti lõkerdama . 
1398	NA	 Närumees jäi poole sõna pealt vait ja kobis vihaselt uksest välja . 
1398	NA	 Vaatasin aknast , kuidas ta sassi läinud ohjad puntrast lahti harutas . 
1398	NA	 Lõpuks kargas ta püsti rekke , lõi mütsi silmile , sülitas ja sõitis minema . 
1399	NA	 Vanaema viha ei olnud ikka veel üle läinud . 
1399	NA	" Ta tegi : "" Ptüh ! "
1399	NA	 Ptüh ! 
1399	NA	 Sa roojane luum ! 
1399	NA	 Ta tuleb ja süüb viil vana-aasta õhta silmad pääst ära ! 
1399	NA	" Ja Teste naesed laalavad , "" - ta tegi järsku peenikese magusa hääle ja osatas - "" otsime ikki Juksile närusi ! "
1399	NA	" Juksile piab võid andma , siss saab Juksi käest villanormi tõendi ! "" "
1399	NA	" Ta käratas : "" Või koerale viil võid vaja ! "" "
1400	NA	" Ema naeris : "" Aga kas põlnd nallakas , kudas kasuk iist lahti karas ja körtsikusaba paistis ! "" "
1401	NA	" Vanaema päris uudishimulikult : "" No kudaviisi sii siss vällä tulli , et ta mo körtsiku põue aas ? "" "
1402	NA	" Ema uhkustas : "" Laps nägi ärä ! "" "
1403	NA	 Asusin ise asja juurde ja püüdsin teistele selgeks teha , kuidas kõik oli olnud . 
1403	NA	" Käskisin : "" Istke ometi maha , mudu ma ei saa teile alt üles rääki ! "" "
1403	NA	" Seisin keset tuba ja taastasin mõttes kõike , mida ma olin näinud : "" Nigu Närumiis üksi tuppa jäi , nii tulli talle irmus nägu päha ! "" "
1403	NA	 Siinkohal tuletasin meelde kõiki hirmsate nägude pilte , mida ma raamatutes näinud olin ja võrdlesin neid mõttes Närumehe näoga . 
1403	NA	" Sosistasin tungivalt : "" Iina keisre nägu ! "" ja jätkasin seletust : "" Ta vaadas püksa kah , aga neid ikki es julge võtta . "
1403	NA	" Siss toppis vanaema körtsiku põue ja isi aas ammad irevile . "" "
1403	NA	 Kasutasin ruttu juhust ja näitasin pikalt ning põhjalikult , kuidas Närumees hambad irevile ajas . 
1404	NA	" Korraga aga läksin üle keha kuumaks ja kaebasin : "" Ja kuue taskust võttis kiik raha ka ära ! "" "
