par_nr	head	sentence
557	NA	 Kloostrivendade dispuudi ebaõnnestumises ei olnud midagi erilist , see kordus nädalast nädalasse . 
557	NA	 Mitte kunagi ei vaevunud vend Ibune mõtisklema samades kategooriates nagu ootas temalt vend Übene , kui ta sattus dispuudis Miragaeliga raskustesse . 
557	NA	 Kuid keegi selle üle ka ei imestanud – oli ju tema saatus hoopis teistsugune . 
557	NA	 Ibune oli endine timukas . 
557	NA	 Raiunud püha inkvisitsiooni korraldusel päid , oli ühel päeval võetud järsku töö tal käest . 
557	NA	 Ametliku versiooni põhjal , mida ülemad kõigile ka püüdlikult korrutasid , saadeti ta Iisakusse täiendavaid vilumusi omandama , ent vaevalt uskus ükski kuulaja või rääkija , et neis sõnades oleks teragi tõtt , sest koht , kuhu ta küüdivankriga veeti , asus seal , kus ei olnud ainsatki tapalava , vastupidi , Iisaku klooster nägi välja niisugune , et isegi mõrtsukas oleks pidanud ärkama siin meeleparandusele , tegemata enam sääselegi liiga . 
557	NA	 Juhtumisi saabus ta hoovile teisest väravast samal ajal Übesega , kes tuli okslik rännukepp käes teisest väravast . 
558	NA	 Majja astusid nad kõrvuti ja tunnistati vendadeks . 
558	NA	 Nende ees oli käinud Tema ingel , juhatanud teed ja palunud sisselaskmist ning papp rõõmustas neid nähes . 
559	NA	 “ Laske lapsed minu juurde tulla , ” pomises Übene vaikselt , lootuses , et keegi ei kuule , “ lapsed pääsevad esimestena taevariiki … ” 
560	NA	 Kunagi , kui Übene rändas maailma otsa otsima , seljas kerge õhuke pamp , milles ainult paar hädavajalikku rõivaeset , sest ta uskus tõsimeeli , et leiab niisuguse maa , kus lõvi ja lammas magavad koos ning alati paistab päike või on vähemalt piisavalt soe , et lamaskleda külili puu all , rohukõrs suus ja veeta järelejäänud päevad muretult tukkudes , peas kas üksik mõte või lausa ainult puhas kirgastus , siis ühel hetkel taipas ta , et niisugust kohta ei ole või vähemalt temale ei ole antud seda leida , kusagil tuleb alati ette piir – ning ta heitis oma pambu sellesse piiriäärsesse kloostrisse ega pidanud kahetsema . 
561	NA	 Saunas oli põhjalikult küüritud . 
561	NA	 Hingemattev rõskus sammus neile vastu , kui ülempreester ja isa Isidor ilmusid leiliruumi , peades mõdu mõnusalt surisemas nagu mesilassülem , aga ometi oli see hea soe pehme rõskus , mida saunalised ihaldasid . 
561	NA	 Isegi vettinud lavapingid olid kuidagi vähem vettinud . 
561	NA	 Keris kuumas . 
561	NA	 Särisedes lendas kividele tuline vesi . 
562	NA	 Miragaeli nägu punetas pingutusest nagu peet , ent suu ja silmad naeratasid säravalt ja õndsalt nagu oleks tegemist valvuriga paradiisiväraval . 
562	NA	 Tal oli hämmastav kannatamise võime . 
562	NA	 Ta võis ilmselt ka keeduvees ujuda . 
563	NA	 Käsi küünlaga valgustas Huldeni nägu . 
563	NA	 Seal oli tarretunud hirm . 
563	NA	 Nägu oli liikumatu , silmad ei paistnud midagi nägevat . 
563	NA	 Higi nirises laubalt . 
563	NA	 Või olid need pisarad silmist , täpselt ei olnud võimalik eristada . 
564	NA	 Isa vaatas ülempreestrile otsa ja see siis läks . 
565	NA	 “ Tubli , isa Aabram ! ” kiitis Miragael Fabrika familiaarselt . 
565	NA	 Ta oli märganud , kuidas ülempreestrile meeldib eriliselt , kui teda kõnetatakse aupaklikult isana , sest omast kohast olid nad kõik tema pojad siin kloostris . 
565	NA	 Ning kui lisandus veel ka vihtlemine , siis saabus täiuslik idüll lavale , õhku paiskus vägev meeleparanduse jõud , hetk pälvis võimsa pühitsetuse . “ Vaata , isa , taevasse , ” kõneles Miragael pappi viheldes , “ vaata , kuidas meie klooster on tundlatega rippumas otse taevasse ! 
565	NA	 Kuidas ta on ! 
565	NA	 Ning mida me näeme ? 
565	NA	 Maapealne sirge , mis võiks muidu viia lõpmatusse , on murtud ja nurkadest üles rebitud , taevased väed on riputanud meie sarikad teisele tasapinnale , kolmnurga tipp kisub taevasse ! 
565	NA	 Kolmnurga tipp on Tema , isa , vaata , tipp on täius ! ” 
566	NA	 Miragael kõneles väga innukalt ning tema vihahoopides väreles läbi õhu saja-aastase elu saladus , mitte vähemat . 
566	NA	 See oligi sauna sisim mõte . 
566	NA	 Vana Aabram ei kavatsenud mingil tingimusel elada vähem kui sada kakskümmend aastat selles ilmas . 
567	NA	 “ Vaata , isa , see täius hoiab meid pihustumast lõputult laiali , selles koonuses on kogu maailma saladus . 
567	NA	 Kui seda kolmandat juures ei ole , siis ei ole kahel ülejäänulgi mõtet . ” 
568	NA	 See oli mingi dispuudi jätk , millest papp ei saanud eelnevaid osi kuulmata aru , kuid ta oli sellegipoolest rõõmus ja rahul , et õpetussõnad ei olnud lennanud tuulde nagu sinepiivad , vaid olid langenud viljakasse mulda . 
568	NA	 Kõigest oli näha , et tema puupäine jünger on hakanud mõtlema , ning mida enamat veel tarvis ! 
568	NA	 Vana tõde , et sauna alastus ja Tema lähedalolu teevad inimestega imet . 
568	NA	 Kui saunalaval suudeti lähendada üksteisele isegi vaenlased , siis kuidas pidid ennast ülal pidama veel need , kes juba varem heas läbisaamises – ta haaras meeleliigutusega jüngri õlgadest ning rippus tal kaelas , kuulates , kuidas Miragael räägib ja räägib , nagu oleks tal kiire või suu ja keel alles äsja avastatud . 
569	NA	 “ Ta süütab hinge põhjas iha kõrguste järele ! 
569	NA	 Kuid , isa , vaata , samuti on teada ka see , et taevased kõrgused asuvad lähedal päikesele . 
569	NA	 Kui nendele liigselt ligi pääseda , siis päike , mis muidu soojendab ja elu annab , asub kõrvetama , sulatama , põletama , seega see , millel on olemas ainult hea , on määratud hukkuma põrgupiinades … ” 
570	NA	 Nad lausa kaisutasid omavahel , vandudes igavest vendlust ning vanale Aabramile meenus miskipärast tema ise , kui ta oli alles noor , alles oma tee alguses , mida ta isegi ei näinud ega osanud ette kujutada . 
570	NA	 Aga ta sammus seda . 
570	NA	 Olgugi ahtad ja rasked need esimesed sammud , viivad nad edasi järgmisteni , algab tants , karglemine , treppidest üles , treppidest alla . 
571	NA	 Missugune noorus ! 
571	NA	 Unistustes oli ta Metuusala . 
571	NA	 Eriti sügavates unistustes , mida ta häbenes isegi Tema ees , oli ta surematu , häbenedes neid unistusi ka enese ees , punastades kuumas aurus . 
572	NA	 “ Hea variseb põrmu ! 
572	NA	 Isa ! 
572	NA	 Ilmselt peab tabama samasugune paradoks ka seda , kes üritab saavutada täiuslikku kurjust ja kaevab end põrgu põhja … Ma parem ei mõtleks selles suunas edasi , ta leiab end sarikalt ; see ei veetle ega huvita mind , isa … ” 
573	NA	 “ Milleks see jama ? ” Isa lausa sisistas need sõnad . 
574	NA	 Tekkis hetk tardumust , mil Miragaeli käsi peatus . 
575	NA	 Ehkki ülempreestri meelest oli kõik hea ja õige , mis kasvas maa peal , ning praegusel hetkel nägi ta kasvamas poeg Miragaeli mõistust Temale õnnistuseks , sai ta muidugi aru ka isa tunnetest . 
576	NA	 “ Milleks siis nii järsud küsimused ? 
576	NA	 Milleks tarvis ? ” küsis ta siiski . 
577	NA	 “ Ka meil muud midagi enam teha ei ole , vana Aabram ? ” 
578	NA	 Isa Isidori kärsitus oli tingitud tema õnnetust olukorrast , tal ei olnud vihta . 
579	NA	 Teine viht , mida ta oleks saanud kasutada , oli vahepeal Miragaeli hoopidest lagunenud ning nagu sellest veel vähe , ei mahtunud isa Isidor kuidagi ka lavale , sest selle oli haaranud täielikult enese alla kõhutav ülempreester . 
579	NA	 Ülejäänud ruumi täitis jüngri kloppiv käsi . 
580	NA	 Ta soojendas end kössitades kerise kõrval ning ootas järge . 
580	NA	 Vana Aabram oli tahtmatult sunnitud neid omavahel võrdlema . 
580	NA	 Ta paistis enesele korraga väga tähtsa ja pidulikuna ning otsustas , et homme kiidab ta müsteeriumi ajal tingimata eraldi isa Isidori . 
581	 12 . 	 12 . 
582	NA	 Ta nägi küünla läheduses liikuvaid varjusid . 
582	NA	 Ümbritsevad ollused , pimedamad kui pimedus , vaiksemad kui vaikus taganesid oma urgastesse . 
582	NA	 Kostis kolinaid , nad tõmbasid kirstukaaned endale peale . 
582	NA	 Ta asus uuesti ulguma , seda ise kuulmata ja märkamata . 
583	NA	 Uinumise võnge äratas teises kohas omakorda kellegi . 
583	NA	 Sofophil tõstis pea imestades ema sülest ning avastas , et nad viibivad oma toas , oma lavatsil , tekikaane all , kõik on soe ja turvaline , kuldne kuu vaatab heatahtlikult läbi aknapilu , kallates tuppa jahedat valgust . 
584	NA	 Olles alles unenäo mõju all , lootis ta edasi tukkuda ning sulges silmad . 
584	NA	 Unenägu tundus palju eredam ja kaunim kui see , mida ta nägi ümberringi . 
584	NA	 Ta oli taas linnapea . 
584	NA	 Ta võttis vastu paraadi , temast sõitis mööda lumivalge hobukaless . 
584	NA	 Ent äkitselt hakati tema ärkamist märgates häälutama hällilaulu . 
584	NA	 Vanaeidel polnud hambaid , hääl tuli susinal , Sofophil palus tal vaikida ning taipas , et pea ei olnud tal tukkunud mitte süles , vaid oli litsutud vanaeide pehmete karedate rindade vahele . 
585	NA	 Ta pööras pea ohates seina poole ja lootis , et suudab siiski kuidagi unenägu pikendada . 
585	NA	 Enamvähem samal hetkel niuksatas isa Isidor läbi une . 
585	NA	 Ta oli purenud hammastega vintsket praetud kooti , millel oli millegipärast kloostri kokapoisi küürus välimus , ning heitnud selle põlglikult koerte ette ; labane uni . 
585	NA	 Saunas oli talle kõhtu arvatavasti sugenenud hunt , imestas ta unes , ühtaegu imestades kohe ka oma imestuse labasuse üle , see ulus . 
586	NA	 Linnapea võttis vastu välismaa saadikuid , kes olid ninajuureni mässitud karakulli ja nahkadesse , kes liikusid lossi ees tänaval siidist sallide kahinal ja sõrmuste , prosside , kaelakeede kuld ning rubiinid kilisemas iga sammu juures , kuid järsku lendas talle autodafee küljest tala vastu pead ja pärast seda ei olnud ta enam suuteline täitma meeri kohuseid . 
587	NA	 “ Järgmine … Hoolitse kü-kü-külalise … ” kähistas ülepreester Miragaelile ja tõukas veidi kahetsedes tema käe vihaga kõrvale . 
587	NA	 Ta püüdis seejuures lohutada end mõttega , et tegelikult ei ole liiga palju head hea . 
587	NA	 Ent välja kukkus see kokutades , justnagu paroodia , isa muidugi arvas , et ta tegi seda meelega . 
587	NA	 Vanal Aabramil hakkas saunas külm , ta lõdises ja torge tuli taas ta südamesse . 
587	NA	 See – paljukannatanu – jättis löögi vahele . 
588	NA	 Ikka veel ei olnud selge , mis saab homsest müsteeriumist , see tuli tal praegu täiesti valel hetkel meelde . 
589	NA	 Üllatuslikult keeldus isa Isidor kategooriliselt jünger Miragaeli teenetest ja käskis tal kasida saunast kiiremini kui sinine suits . 
590	NA	 “ Variser ! ” hüüdis isa talle koguni sajatades järele , kui vana Aabram kuulis õigesti . 
591	NA	 Vanal Aabramil oli kahju . 
591	NA	 Ta oli just märganud mõtte paisumist inimeses . 
591	NA	 Kuid isa jäi kõigutamatuks ning ulatas viha ülempreestrile , et see teda vihtleks . 
592	NA	 Mitte iial ei praalinud vana Aabram ega rääkinud kellelegi , kuidas ta oli ajast aega seda paika hoolikalt kastnud soolaga ja löönud ümber esemete tantsu , õnnistavad maarohud peos . 
592	NA	 Mitte kunagi niisama igaks juhuks , vaid alati selge tagamõttega . 
592	NA	 Kindlasti mitte kärsitult ega pealetükkivalt , vaid harva . 
592	NA	 Ainult saunaõhtutel , ainult niithaaval lugupidamist enese ja kloostri vastu pärmitades , et mäe vaimud ei tüdineks . 
593	NA	 Saun oli andnud vanale Aabramile tagasi tema reipuse ning ta oli korraga täiesti kindel , et müsteerium toimub ja see toimub tema juhtimise all , vaimud varjasid teda oma kaitsvate tiibade all ega lasknud sündida millelgi kurjal . 
593	NA	 Ta isegi imestas , et oli korraks selles justkui kahelnud , vankuma löönud . 
594	NA	 Tal oli muidugi täielik õigustus kahtlemiseks , nad olid tujukad vaimud – kunagi kaitsnud vastasleeri . 
594	NA	 Kõik ju teadsid , kuidas esimesed asukad , kes Iisaku kloostrit ehitasid , olid vaevalt jõudnud püstitada sarikad , kui surid mustadesse laikudesse , mis ilmusid äkitselt ihule . 
594	NA	 Isegi jõledaid kuuldusi tekkis . 
594	NA	 Kohalikud tantsisid kahjurõõmsalt üle koolnute ja kuulutasid , et nad näinud , kuidas linnast olla tulnud tume pilv , millel See ise ratsutanud kohale jälgima ehitajate kätetööd . 
594	NA	 Ning seda nähes kogunenud maavaimud orust ja mäe pealt , kes kihutanud Selle häbiga tagasi linna . 
595	NA	 Ent saabusid linnast järgmised puusepad ja järgmised müürsepad , ususõnad suus , ning kui nendestki jäid paigale vaid kondid ja mädanenud liha , siis järgmised , kuni vallutasid Iisaku ning ilmsiks tuli hoopis vastupidine : tegelikult olid kohalikud ise need , kes ohverdasid oma palved Sellele . 
596	NA	 Just seal kohas , kuhu püstitati klooster , olid olnud nende mets , nende tammepuud , seal nad palvetasid . 
596	NA	 Just See külvaski palveid kuulda võttes , võibolla isegi sõnu ette sosistades seppade ihudele mustad laigud ! 
597	NA	 Nemad aga seda ei märganud . 
598	NA	 See paradoks pani vana Aabramit alati imestama , kui ta oli veel noor : keegi süüdistas kedagi Selle kummardamises , ent tegelikult asus hoopis ise Selle küüsis . 
599	NA	 Talle tundus neid juhtumeid kohates iga kord , nagu oleks maailm vajunud kummuli . 
600	NA	 Nüüd teadis vana Aabram muidugi ammu , et Sellel leidub igasuguseid nõiaviirukeid , mis panevad nägema maailma vastupidi tegelikule ning nad võisid uimastena tõesti näha nii nagu nägid . 
601	NA	 Nähtud unenägu kumas Sofophilile kui ohtu ja etteheidet täis märk , väga selge oli see unenägu . 
601	NA	 Ihu orjas ta kloostris , mitte hinge ! 
601	NA	 Sofophil teadis , et kui see oli Tema plaan , läbikatsetamine , siis oli see plaan täiel määral oma sünges ilus õnnestunud , Sofophil ei olnud pidanud vastu – ning talle on ette nähtud igavene põrgupiin ja seda täieliku õigusega . 
602	NA	 Liiga pikalt oli ta jäänud vaatama oma linnapeaks olemise päevi , liiga pikalt ! 
603	NA	 Jutt tumedatest laikudest vaibus ajapikku , kuid päriselt ei lakanud kunagi . 
603	NA	 Ikka piidles mõni silmaservast vargsi kloostrielanike nahka . 
603	NA	 Häda , kui kellelgi leidus mõni sünnimärk . 
603	NA	 Kellel neid ei leiduks . 
603	NA	 Siinsamas laval istus Miragael , kelle avalast pilgust , ümarast näost , lotist lõua all , kõigest õhkus sügavat soojust , pehmust , andestust kogu maailmale ja seal leiduvale kurjusele , tal oli kaenlaaluse karvade vahel väike polüübike , mis keerdus nagu hobuseraud . 
603	NA	 Niisugused märgid toovad õnne , nende kandjad on Tema poolt eriliselt ära valitud – ning kas mitte just Miragael ei olnud nende saladus – , ent kindlasti pidi ta taluma sõgedate omavoli . 
603	NA	 Alles siis kui küla hävis leekides – saunast alguse saanud puhastustules – alles pärast küla õnnetut lõppu lakkas see jutt . 
603	NA	 Vana Aabram tundis end diplomaadina , koha äravõitjana Temale . 
603	NA	 Vaimud olid temaga rahul , leplikud . 
604	NA	 Ilmselt ei olnud keldris enam usku Huldeni rahunemisse ; kalade vahelt ujus nähtavale veidi teistsugune olend , suurem , ilmselt nende ülemus , kellele nad kuuletusid ja teed andsid . 
604	NA	 See oli kuidagi tuttav lõust . 
604	NA	 Musta nokkmütsiga ja musta nahkpintsakuga , kannelgi oli tal käes nagu inimesel . 
605	NA	 “ Otsime , mis ? ” küsis lõust ootamatult sõbralikult silma pilgutades . 
606	NA	 Niisuguseks familiaarsuseks ei olnud Jakob Hulden valmistunud ning selle asemel , et korralik mask näole ette tõmmata , ta noogutas juhmilt . 
607	NA	 Hulden tundis olendis ära ennistise lõunalaualise lautomängija , kelle kohta öeldi tutvustuse asemel seda , et ta saabub alati päev varem müsteeriumile . 
607	NA	 Lautomängija ei olnud lauas sõnagi rääkinud , kuid positsioon pidi tal olema kloostri hierarhias kõrge : istepaiga alusel oli ta sisuliselt teine isik otse ülempreestri paremal käel . 
608	NA	 “ Teame , teame , ” kommenteeris ta Huldeni noogutust , laskus põlvele ning vilistas . 
608	NA	 Vile oli nõrk ja ebaühtlane , ent nähtavasti sisaldus selles mingi käsklus , sest klaasjad olendid kogunesid tema selja taha kobarasse ning järgmise vile peale tegid maani kummarduse Jakob Huldenile . 
609	NA	 “ Milleks mulle see au … ” kuulis Hulden end lalisevat . 
609	NA	 Ta jõudis karta sellegi ära , et nahkkuuega võõra käsi on külm . 
609	NA	 Aeg voolas siin ilmselt teisiti kui mujal . 
609	NA	 Seejärel puutusid nende käed kokku . 
610	NA	 Paradoks paradoksiks , kuid see tähendas , et siinsed maavaimud olid kunagi asunud Selle poolel . 
610	NA	 Seega olid nad kavalad ja ohtlikud ning nende vastu ei olnud tark astuda mõõgaga . 
610	NA	 Sest kes mõõga haarab , mõtles vana Aabram raamatu sõnadega , see ka mõõga läbi langeb ; kas ta vähe nägi , kuidas eided vedasid oma taadid tema jutlustelt ära , kui ta käis neid hurjutamas kasinusele ja lihtsusele , muhklik kadakakepp ähvardavalt käes . 
610	NA	 Ta otsustas vaimud enese poole võita . 
610	NA	 Ta teadis , et vaimude tuunusjooneks ei ole niivõrd põhimõtted kui edevus ja praktiline meel . 
610	NA	 Esimese omaduse suhtes aitas meelehea toomine . 
610	NA	 Küpsetades meekooke , puistas vana Aabram ikka koogipuru ka mäge kaunistavate kaharate tammede juurtele . 
610	NA	 Külvas soola , pritsis mürri . 
610	NA	 Teine omadus aga andis vaimudele teada objektiivse tõe , et kui ka vana Aabrami jälge ei märka praegu mitte keegi – ei olnud enam külas neidki , keda muhkliku kepiga taga ajada nagu varemalt – , siis jälg on alles ja kunagi astub seda mööda hiiglase jalg , vajutades teised talla alla nagu kapsaraud , nii nagu varjas Iisakus muud usud ja õpetused vana Aabrami mõte kirikust ja kogudusest ja kloostrist . 
610	NA	 Vana Aabram oli see , kelle poole tasub hoida . 
610	NA	 Oli ülimalt tõenäoline , et vaimud vaatasid ja nägid . 
611	NA	 See oli keeruline töö , vana Aabrami nahk lõhenes sellest laiguline , kestendav , sinna tekkisid ehitades ühel päeval soomused . 
611	NA	 Öeldi , et see on piiri haigus . 
611	NA	 See oli ka põhjus , miks ta ei tahtnud enam tagasi . 
611	NA	 Võibolla oleks ta hukatud . 
611	NA	 Ta nahk nägi välja nagu röövikutest haigestunud põõsas : . 
612	NA	 Papile tekkisid 
613	NA	 Sellest ajast peale ta enamasti vaikis . 
614	NA	 Maavaimud tunnetasid vana Aabrami ülekaalu ja teenisid teda nagu koerad . 
615	NA	 Ent käsi oli soe ja sõbralik . 
615	NA	 Nad panid peod vastamisi . 
615	NA	 Lautomängija naeratas sõbralikult . 
616	NA	 “ Au , ” krimpsutas ta Huldeni kätt surudes oma suunurki . “ Auuuuuuuuuuu ! ” 
617	NA	 See oli ilmselt taas mingisugune märguanne , sest nagu muinasjutus paiskus selle peale lautomängija kuue tagant või koguni hõlmast tema ette hauaristide mets . 
617	NA	 Kuid Hulden ei kartnud , lautomängija käsi oli tal peos . 
617	NA	 Ta märkas , kuidas igast ristist hoidis kinni mõni klaasjas tantslev vaim . 
618	NA	 Ristide kahinal pudenesid vaimud laiali . 
618	NA	 Sakiline vonklev sõjavägi . 
618	NA	 Lautomängija mängis põlvelt kannelt neile taktiks kaasa . 
619	NA	 See muidugi ei olnudki kannel , vaid lauto , Huldeni taipamine töötas praegu kuidagi aeglaselt . 
619	NA	 Ka vaimude ringtants oli aeglane . 
619	NA	 Ta vaatas ennast kõrvalt ja temagi paistis pealtnäha aeglane ja pooleldi tardunud . 
620	NA	 “ Fortepian , Juubali poeg , ” tutvustas lautomängija ennast , “ armeenlane , Ararati mäelt , vanast põllumeeste soost . ” Alles nüüd vabanesid nende käed teineteisest , aeg peaaegu üldse ei liikunud . 
621	NA	 Kas tuli see muusikast , ent mõned klaasjad vaimud hakkasid vähehaaval omandama piirjooni . 
621	NA	 Mida kauem Jakob Hulden vaatas , seda enam hakkas talle tunduma , et jooned muutusid ajapikku teravamaks ja selgemaks ning hakkasid omandama jumet , varjudest olid ilmutumas otse tema silmade all lapsed , poisid , talle meenus poiste hõljuv rännak jõe äärde ja see näis olevat sama ; kuid oli ka tüdrukuid . 
622	NA	 Liiga pikalt oli ta jäänud vaatama oma linnapeaks olemise päevi , liiga pikalt ! 
623	NA	 Tollal olid lauad alati lookas , piimapõrsastega kelnerid jooksid tema ees ja järel , rahvas kummardas maani tema raske jalaastumise ees , mille ta oli aastatega selgeks õppinud , ja kõik austasid teda . 
623	NA	 Tuleneelajad tervitasid teda suust purskuvate valguselontidega nagu lohed raehoone ees . 
623	NA	 Põlvpükstes poisikesed tilistasid imekauneid hümne , kellukesed käes , kuni ta astus trepist üles ja viimasel astmel pöördus rahva poole . 
623	NA	 Vahuveini joad ja raketid purskusid tema sammudest taeva suunas , õhk oli hele , värviline ja märg , kui ta astus . 
623	NA	 Autodafee oli kõrge , paljakskooritud süüalune lamas laual selle ees ja siples jalgadega nagu putukas . 
624	NA	 See kõik tuli meelde . 
624	NA	 Ka viimane mõte , mis oli Sofophilil enne meelemärkuse kaotamist – arutlus sellest , kas läheb süüalune taevasse või põrgusse . 
625	NA	 Kohtupidamise järgi pidi ta minema muidugi kolisedes põrgusse , maa pidi ta neelama , talle ei olnud enam alles jäetud isegi nime – aga samas , kas pole Tema teed äraarvamatud ? 
625	NA	 Kohtu poolt langetatav karistus võis olla vajalik inimeste seas korra pidamiseks , sellega hoiatas kohus järgmisi võimalikke üleastujaid , kuid oletame nüüd , et ülekohut tehti inimestele selle sihiga , et nende silmad avaneksid , et nende hingedesse tuleks raputus ja arusaamine . 
625	NA	 Isegi juba päris esimesele ülekohtule , paradiisiaiast minemapeletamisele järgnes pöörane raputus , südantlõhestav hüüdmine Tema poole , oma patu mõistmine – aga kui nii , kui taevani kisendava ebaõigluse eesmärk on saavutada senisest suurem Tema poole hüüdmine , siis on kurjategija vastupidiselt kohtu eeldusele hoopis heateo tööriist . 
625	NA	 Ka kõige karjuvama ülekohtu nuhtlemine võis olla väär ! 
626	NA	 Sofophil vaikis ikka veel . 
626	NA	 Rahvas vaikis , oodates tema märguannet süüdata takukoonlad . 
627	NA	 Sellal kui kohus langetab Tema nimel oma otsuse , siis samal ajal Tema enese kohtumõistmine tunnistab selle vääraks , sest seda on otsustanud inimesed oma parima sisima äratundmise järgi , iseeneste nimel , oma patu ja ekslikkuse nimel , kuid mitte Tema nimel , lausa teadlikult mitte Tema nimel , sest inimesed , need putukad sibamas väljal teavad , et Temal ei ole nime ja Tema nimi ei ole suhuvõtmiseks , kohus on langetanud oma otsuse Tema tahtmist vaid kilbina ära kasutades . 
627	NA	 Pealegi , kas saab keegi , kas on kellelgi julgust teha maa peal otsustusi Tema eest ? 
627	NA	 Kes teadis Tema tahtmist ? 
627	NA	 Kes teadis , see visaku esimene kivi ! 
628	NA	 Aga kepp , trianglit helisema panev sau ? 
628	NA	 Kus oli see – neljas ? 
629	NA	 Põlemise suits lendas ülespoole . 
629	NA	 Ta lamas tala all maas ja vaatas mitte midagi nägevate silmadega üles ja sai endale Tema , keda ta seni oli südames salanud ja kiitnud suus ; nüüdsest kiitis ta suu teisi , keda ta teenis , ja süda kummardas Tema , ainult Tema poole . 
630	 13 . 	 13 . 
631	NA	 Miragaeli vaikimise põhjal võisid kaksikvennad oletada , et ta ei olnud avaldanud saunalaval oma etteastega piisavalt muljet . 
631	NA	 Kuid see ei olnud nende asi ega huvitanud neid . 
631	NA	 Siin olid kõigil omad toimingud . 
631	NA	 Oli näha , et Miragael saabus leiliruumist higisena ja loputamata . 
632	NA	 Nad olid teda oodanud ja läksid nüüd hanereas vaikides kloostrisse , justkui protsessioon , mis suundumas kesköisele missale . 
632	NA	 Jah , kunagi oli Iisakus missade aeg . 
632	NA	 Kirik oli rahvast tulvil ja palvetati , hardad nuuksed , andekspalumised , vaimustunud pomin Tema suunas isegi südaöösiti ning Tema , suur kõikemahutav Tema kuulas nad ära . 
633	NA	 Kuni arvatavasti tüdines kaeblemisest ja tühiasjade ülestunnistamisest – sest Ta nägi ju igale poole ja südametesse ! – ning tegi sellele lõpu . 
633	NA	 Missad lakkasid , ka päevased . 
633	NA	 Elu muutus vaikseks , rahulikuks , mõtlikuks . 
634	NA	 Fortepian – Hulden raputas pead , niisugust nime ei olnud ta varem kuulnud , vaevalt usutav , et sellist saaks olemas olla . 
635	NA	 “ Kunstnikunimi , ristil on teine nimi … Siin on ainult pärisnimed , nagu Hulden . ” 
636	NA	 Seejärel tõmbas lautomängija mütsinoka silmile , otsekui kardaks oma nime pärast , ning sosistas , nii nagu tema muusika oli meloodiline , oli ka tema hääl rahustav ja uimastav : 
637	NA	 “ Tüdrukud nimelt ei asu pühitsetud mullas , kus poisid , ja on seega määratud igavesele hukatusele . ” 
638	NA	 Samal ajal olid kuked vaikinud maakeral , valitses öö . 
638	NA	 Nüpeldanud pehmeks isa Isidori selja , sai vastutasuks nüpeldatud ka ülempreester . 
638	NA	 Ruigas mõne aja mõnust , seejärel aga tuli tagasi vana teema juurde . 
639	NA	 “ Äkki sa , isa , ikka veidi paotad katet saladuselt – homne müsteerium … ” 
640	NA	 “ Müsteerium , hüsteerium , ” mühatas isa , see oli kõik , sellest ei olnud võimalik midagi välja lugeda . 
641	NA	 Tõepoolest , Hulden märkas nüüd , et riste kannavad – vastupidi arvatule , sest ristid olid rasked ja rauast – üksnes tüdrukud , sellal kui poisid , kes neid embasid , olid ristideta . 
641	NA	 Et ristidel leiduvad ainult naisenimed . 
642	NA	 Need naised olid märkinud maha väga erineva pikkusega elu , mõnikord oli kutsutud taevasse ebaõiglaselt noorena , rohkesti oli ka vanamutte . 
642	NA	 Kusjuures praegu – kui nad tõepoolest asusid tema ees – ei olnud neil omavahel mitte mingit vahet , kõik olid omandanud ühtlaselt tütarlapselikud kontuurid . 
