par_nr	head	sentence
379	NA	 Ema tuli mulle appi ja tõstis raadio laua peale . 
379	NA	" Isa seletas : "" Akud on sellakotis . "
379	NA	 Te ehk arvate , et sii on võrguraadiu , aga sii põle võrguraadiu , sii on akuraadiu . 
379	NA	" Maal ju elektert põle ! "" ja tema hääles kõmises kaastunne meie vastu , üksindus , kavalus ja himu maailma natuke alt tõmmata . "
379	NA	" Isa ei teadnud ise , mis ta hääles kostis , ta pilgutas silmi ja naeris lühidalt : "" Jah-ah-ah ! "" "
379	NA	 Temagi suust paistis üks kuldkrooniga hammas , ega ta siis ilmaasjata hambaarsti vennapoeg ei olnud . 
380	NA	" Vanaema tuli uuesti ukse peale ja kutsus : "" Tulge nüid süüma ! "" "
380	NA	" Isa vastas ruttu : "" Tänan väga , mu kõht on täis ! "" , see oli tema võlusõna teiste inimeste tehtud toidu vastu , mille sees võib olla koerakarvu , laiussimune ja silmapisaraid , kui söögitegijal on suur mure . "
380	NA	" Isa põlgas ihust ja hingest sealiha , kanamune , jõe- ja järvekalu , rõõska piima ja koduvõid , sest sealiha ja kanamunad teevad kurjaks ( "" Vaata , kui kuri on Lillemäe Oskar , kis ainult sialiha süübki ! "" ) , jõe- ja järvekaladel on laiuss kõhus , rõõsa piima sisse tilgub lehmasabast virtsa ja koduvõid patsutab perenaine käte vahel , omal juuksekarvad rätiku alt ripnemas . "
381	NA	 Leiva peale oli isa kindel , sest leib on ahjus kuumuse käes küpsenud ja tema käperdatud koorukese võib noaga ära lõigata . 
381	NA	 Suhkur on aga juba loomu poolest puhas , vaata kui valge ta on , ja seisab kotis ! 
381	NA	 Ka sprotte , heeringaid ja soolaräimi võis ta usaldada . 
382	NA	 Ema pani ikkagi taldriku peale kuumi kartuleid ja soolaräimi ning viis tahatuppa isale . 
382	NA	" Isa kurtis : "" Ai-ai , kuum kartul põletab suu ära ! "
382	NA	" Küll ma pärast süün . "" "
383	NA	 Ta võttis kotist juhtmeid ja traate ning urgitses raadios . 
383	NA	 Ma ei raatsinud isa kuidagi silmist lasta , tahtsin näha , mida ta mu raadioga teeb , kuid läksin ikkagi söögilaua äärde ja sõin kiiruga ning kugistades kartuleid , kastet ning praetud sealiha , kuigi liha juures ma tegin isa meeleheaks näo , et ma seda üldse ei taha . 
383	NA	 Tegelikult tahtsin , ja kuidas veel . 
383	NA	" Püüdsin endast üle olla ja ütlesin kurvalt , peaaegu pisarsilmi : "" Liha põle vist peris küpse . "
383	NA	" Ma rohkem ei taha . "" "
383	NA	 Kuidas ma sain liha süüa , kui isa kodus oli ! 
383	NA	 Ta võis tulla iga minut ukse peale ja minus pettuda . 
384	NA	 Akna taga kuuvalgel kahisesid oksad ja ladvad , metsad hingasid , veed aurasid , põld kolletas . 
385	NA	 Vanaema kooris palavaid kartuleid , selg kühmus . 
385	NA	 Vahetevahel kopsas noapea vastu lauda , hall kartulikoorehunnik kössitas lauanurgal . 
385	NA	 Otse toapõranda all asus sügav pime muld , puud nagisesid ümber maja , laiad heinakuhjad seisid kinkudel , õhuvoolud kandsid külmi kurbi linnuhääli . 
385	NA	 Kaevupõhjas läigatasid õudselt kaks pruunist klaasist mängukarusilma , mis ma olin vana karu kulunud silmnäost välja kiskunud ning kaevu visanud . 
386	NA	 Onu lähenes mööda metsaradu kodule , tühi leivakott kaenlas ja selg tööst kange , teerja ääres kahisesid laiad sõnajalalehed . 
386	NA	 Kes nii hilja koju tuleb , see saab külmi vindunud kartuleid ja hangunud sousti . 
387	NA	 Salarajad väänlesid mööda kuusikuid ja kaasikuid , vahetevahel ristusid nad ristiinimeste käiguteedega . 
387	NA	 Võpsikus liikusid hallid kuueseljad , püssirauad läikisid ja naksusid , higi tõusis otsaette . 
387	NA	 Koolimaja ukse peale tekkis igal ööl uus paberitükk ähvardusega : 
388	NA	 Saa vabaks , Eesti meri , 
389	NA	 saa vabaks , Eesti pind ! 
390	NA	 Neid jutte kuulsin ma leiba pudistades , mööda taldrikut kartuleid veeretades , tühja niidirulli põrandale sõitma pannes , tikutoosidest maju ehitades , laua all istudes ja suurt jott-tähte tehes . 
390	NA	 Vaatasin selgete külmade silmadega ainult korraks üles ja kohe läks mu suur jott viltu või varises valmisehitatud maja kokku . 
391	NA	 Kuulsin söögilaua äärde , kuidas isa tagatoas kõndis ja kolistas ning tundsin head meelt . 
391	NA	 Hea meel tegi silmad ergaks ja jalad kergeks , mulle paistis , et ma olen mitu aastat ja mitu kuud ühtejärge ärkvel olnud , kõigi riikide pealinnad läbi käinud ning nüüd koju vana kase alla tagasi jõudnud . 
392	NA	" Ema läks kööki jalgu pesema , vanaema lükkas sööginõud laua otsa peale kokku ning laotas nende peale ajalehe "" Rahva Hääl "" . "
392	NA	" Tommi hakkas järsku haukuma , isa vaatas tagatoast välja ja tegi : "" Kuss ! "
392	NA	 Kuss ! 
392	NA	" Üks käib ümmer maja ! "" "
392	NA	 Kuulsime raskeid ühtlasi samme akna alt läbi minemas . 
392	NA	 Siis oli kõik jälle vaikne . 
393	NA	 Läksin tahatuppa isa juurde ja vaatasin , kuidas ta raadio sisse traadiotsi pistis , traadid looklesid laua alla akude juurde . 
394	NA	 Vanaema võttis lauluraamatu ja istus ettetuppa laua äärde , tema rätikunurgad olid jälle sõlmest lahti läinud . 
394	NA	 Ta luges : 
395	NA	 Patt on meid rikkund kurjaste 
396	NA	 ja kurat vaevab raskeste . 
397	NA	" Korraga hakkas raadio ragisema ja tubades kõmises nähtamatu mehe pühalik mahe hääl : "" Eesti rahvas on asunud täie hoo ja kustumatu innuga tööle uue stalinliku viisaastaku plaani teostamiseks , et oma majandus- ja kultuurielu viia seniolematule kõrgusele . "
397	NA	" Ta on kindlalt veendunud , et ta bolševike partei ja nõukogude rahvaste suure juhi seltsimees Stalini juhtimisel suudab ennastsalgava tööga lähema aja jooksul muuta oma sünnimaa kõrgelt arenenud majanduse ja kultuurieluga sotsialistlikuks riigiks . "" "
398	NA	 Isa silmad särasid , vanaema pani lauluraamatu kinni ja pühkis suunurki , pestud jalgadega ema tuli tuppa , Tommi liputas saba ja jooksis vöörusesse onule vastu . 
398	NA	 Kõik kuulasid raadiot kohmetult püsti seistes . 
399	NA	" Lõpuks lausus isa : "" Kreissaag ja raadiu on elus kaks kõige tähtsamat asja . "
399	NA	" Ilma nendeta ei läha elu edesi , "" andis onule kätt ja ütles : "" Tere jõudu ! "" "
399	NA	 Ta läks , pani kõrva raadio juurde ja kuulatas . 
399	NA	" Tegi siis imeliku näo , minu poole vaatas , aga onule ütles : "" Ei tää , kis sääl kastis ometi räägib ? "
399	NA	" Kas mõni veike härjapõlvlane või ? "" "
400	NA	" Onu tegi niisama imeliku näo ja köhatas : "" No arvata võib jah ! "" "
401	NA	" Isa arutas : "" Ei , ma ei taha usku , et ta kastis on . "
401	NA	" Ta on ehk vällas toaseina taga , isi räägib torusse , aga ääl tuleb raati müüda tuppa . "" "
402	NA	" Onu jäi nõusse : "" No seda võib ju järgi vaadata . "
402	NA	" Võta aga üks vemmal kätte ja lase ring ümmer maja ära ! "" "
403	NA	" Ema turtsatas , aga vanaema vihastas : "" No mes piass vigurdama ! "
403	NA	" Laps ära väsind isigi . "" "
404	NA	 Seisin otse riidenagi all ja tundsin villase kampsuni lõhna . 
404	NA	 Väljas tümisesid isa sammud , virutati kaikaga vastu seina , ähiti ja vannuti võõra häälega . 
404	NA	 Mu kulmud läksid kortsu , ma ei uskunud , et võõras mees toa taga torusse räägib , aga õudne oli ometi . 
404	NA	 Kes see siis vandus , kui seal kedagi ei olnud ? 
405	NA	 Lootsin palavalt , et lõpuks pannakse toolid nagu kord ja kohus raadio ette ritta , me istume kõik kõrvuti ja kuulame . 
405	NA	 Meie ei usu , et raadio sees pesitseb härjapõlvlane , ja mõistame isa teguviisi hukka . 
405	NA	" Kuskil kirjutati vihast artiklit ajalehe "" Sirp ja Vasar "" jaoks , toimetati "" Loomingut "" , õmmeldi rätsepakostüüme , riputati üles ilututtidega plüüškardinaid , õhuakendest kostis klaverimängu , koduabiline asetas lauale ploomikompoti vahukoorega , ümber laste punni kõhtude seoti rahvuslikke vöösid , mõne isa sõitis koguni Moskvasse komandeeringusse ja tõi sealt õudselt suuri pakatanud ananasse , mis lõhnasid nagu maasikad ja ajasid öösel pissile . "
405	NA	 Aukulangenud põskedega inimesed võltsisid käte värinal ankeete ja nende peopesad higistasid . 
406	NA	 Mina aga pidin seisma nagis rippuva vana kampsuni all tagatoa ukse kõrval ja kuulama , kuidas minu isa väljas tühist nalja teeb . 
406	NA	 Ja jäävadki mul suhkrusabad ning sõjasandid nägemata , ei saa ma põlvikuid jalga ega patse kõrvade taha kringlisse . 
406	NA	 Raadiost kostis omasoodu : 
407	NA	 Aga kes teist esmakordselt hoiab 
408	NA	 komsomoli liikmekaarti käes , 
409	NA	 teadku - lahinglipp ta kohal loidab , 
410	NA	 ta on sõdur Noores Kaardiväes . 
411	NA	 Igatsesin palavalt siit ära , laia ja peibutavasse maailma . 
411	NA	 Seal pidi kõik olema teisiti kui kodus . 
411	NA	 Seal ei tohtinud olla lihtlabaseid laudu , sänge , nagisid ning kampsuneid . 
411	NA	 Mulle tundus , et laias maailmas liiguvad inimesed kas sõjaväevormis või siis pikkades väärikates rüüdes . 
411	NA	 Kes kannab seal tolknevate trippidega pihikut või koitanud kraega palitut ! 
412	NA	 Uskusin ka , et kõikide nende maailmainimeste südametes põleb tahe hävitada võimalikult rutem mustad jõud ja ebameeldivad ning salajas hoitud nähtused , mille märkideks olid minu jaoks pimedad kapitagused , surnuhauad , heinakuhjadest leitud püssid , mõnede siia-sinna vilavad silmad ja tangis hambad . 
413	NA	 Tänaseks olen näinud juba nii palju laudu , sänge , nagisid ja kampsuneid , et nende täielik puudumine mõnes maailma osas tunduks isegi imelik ja väheusutav . 
413	NA	 Ma ei usu , et kusagil võiks olla kõik teisiti , kui on kodus ; surnuhaudu ning pimedaid nurki olen näinud siiamaani kõikjal , kus inimesed elavad . 
413	NA	 Kaugeltki mitte kõigi inimeste südametes ei põle tahe hävitada musti jõude , seal on enamasti üks ja ainus soov - saada rohkem kallist elektroonikat , imeautosid , lusti ja lõbu . 
413	NA	 Panna silmad ähvardava pimeduse ees kinni ja luua omale kunstlik valguseillusioon . 
414	NA	 Seda , kuidas asjad on , võin lugeda nii romaanidest kui statistikakogumikest , kuulda nii televiisorist kui raadiost . 
414	NA	 Selles veendumiseks võin ka meenutada võõrastes suurlinnades oma silmaga nähtut . 
415	NA	 Ometi hakkan ma sellele vastu . 
415	NA	 Minu jonnakas lapseusk püsib . 
415	NA	 Olen tänagi kindel , et kellegi südames põleb tulevikulootus , et maailma troostituid hooneterägastikke , baare , tantsupõrandaid ja veretöid lunastavad luuletajate närvid ning mõtlejate ajurakud . 
415	NA	 Kuni neid on , usun ma , et maailm püsib . 
415	NA	 Ehk teisisõnu : 
416	NA	 On seda teed , kus käivad tuletoojad , 
417	NA	 maatasa teha tahtnud igat pidi 
418	NA	 kõik sööjad-joojad , Piinajad ja Poojad . 
419	NA	 Ei ole saanud . 
419	NA	 Tee on teisipidi . 
419	NA	 * 
420	NA	 * 
420	NA	 Juhan Viiding 
420	NA	 
421	NA	 Seda kinnitades puhus tuul vastu majanurki ning vanad kuused oigasid ja nagisesid väljas . 
421	NA	 Isa vilgutas akna taga taskulampi . 
421	NA	 Vanaema tuli ja pani oma rasked käed mulle õlgadele , mu kukal ulatus tema jaki alumise ääreni . 
421	NA	 Mulle ei meeldinud , et isal taskulamp käes oli . 
421	NA	 See muutis toa nii ärevaks , nagu trambiks õues sõdur . 
422	NA	 Läksin raadio juurde ja katsusin näpuotsaga pruuni pinguletõmmatud riiet , mis varjas enda taga juhtmeid ning klemme . 
422	NA	 Nuppe ma ei keeranud , ohkasin sügavasti ja panin pea raadio ette lauale . 
422	NA	 Nüüd tulid kõik uudised ja kõik laulud läbi minu meelekohtade . 
422	NA	 Ma tundsin , kuidas nad laua minu põse all värisema panid . 
423	NA	 PÄIKE PAISTIS SINISEST TAEVAST , nagu poleks kunagi olnudki ei õhtulagendikke ega kolme purukskistud kõriga kana köögis raiepaku kõrval . 
424	NA	 Käisin tiiru ümber maja ja sain aru , et on soe ilm . 
425	NA	 Vahetevahel jäin seisma ja silmitsesin suure huviga oma põlle . 
425	NA	 Sellel seisis väike nett tasku keset kõhtu ja kogu põlle kattis lugu paksust lapsest ning hanedest . 
425	NA	 Lugu hakkas pihta alt äärest ja oli alati nagu uus , sest see põll võeti nii harva kapist välja . 
425	NA	 Ta seisis kokkupandult riiulil padjapüüride all , talle olid sisse jäänud teravad kokkupanekujooned nagu viigid . 
426	NA	 Talutütre Aino , kes seda põlle omal ajal kandnud oli , viis sõda kodumaalt minema , võib-olla Saksamaale , mille pealinn on Berliin , aga võib-olla ka hoopis Inglismaale , mille pealinn on London . 
426	NA	 Võib-olla mõtles vana Aino võõrsil pisarsilmi oma põlle peale . 
427	NA	 Tõmbasin põlle sirgu ja näe ! jälle ajas tugev punase nokaga hani kaela õieli ning nokkis mahlast mürkrohelist rohtu , mille sees kasvasid kollased ja sinised lilled . 
427	NA	 Paks laps seisis , tagumik urvis ja põsed punnis , ta püüdis peoga hane pead patsutada , ega pannud tähelegi , et tagantpoolt tuli teine veel suurem hani , kael vastu maad surutud . 
427	NA	" Selle suure hane noka vahelt tungis välja kolm š-tähte , hani sisistas : "" š-š-š ! "" "
428	NA	 Järgmisel pildil haaras ta juba nokaga paksu lapse püksitagumikust kinni . 
428	NA	 Lapse pitsiliste säärtega püksid kärisesid tagant lõhki , ruudulise kleidi saba jäi töllakile , hani sikutas ja laps röökis . 
428	NA	 Lapse põsed punetasid , ta hõõrus kahe jämeda rusikaga silmi . 
428	NA	 Kurjale hanele hiilis aga omakorda ligi poisike , vits peos , sest mine isahane tea . 
428	NA	 Endisaegne tuul lehvitas poisikese triibulist madrusekraed , tema nina katsid tihedad tedretähed . 
428	NA	 Ta äigas vitsaga hanele üle turja . 
428	NA	 See toimus juba päris üleval põlle ääres värvli lähedal , kus riie natuke volti hoidis . 
428	NA	 Poisike võttis paksul lapsel isalikult käest kinni ja nad läksid ühele poole , häbistatud haned aga teisele poole . 
428	NA	 Siin-seal seisid kikkis rohututid kirjude lilledega . 
428	NA	 Laste peade ümber lendasid võimsad liblikad . 
428	NA	 Tasku kohalt värvli vahelt paistis suurte mustade silmade ja naerul suuga päike , pikad kiired ümber näo . 
428	NA	 Ehk tahtis see päike mind ära moondada , ka üheks põllepildiks muuta . 
428	NA	 Kas niisuguseid lugusid siis raamatutes vähe juhtunud oli ! 
429	NA	 Kortsutasin kulmu ja katsin päikese näo peoga kinni . 
429	NA	 Isa pidi mind nüüd kohe selle põllega pildistama , sinine paelgi seoti mulle pähe pildistamise jaoks , sest see oli minu tahtmine . 
429	NA	 Selga aeti mulle lühikeseks jäänud valge kleit , mida katsid üksikud hõredad ja plassid kannikesekimbud . 
429	NA	 Ma põlgasin seda kleiti , sest see oli nii haledast riidest tehtud , kuigi riide nimi oli batist , ja see oli samuti Saksa- või Inglismaale läinud Aino seljast pärit . 
430	NA	" Vanaema tuli õue , vaatas mind eest ja tagant ning kiitis : "" No küll sina oled nüid tore ! "
430	NA	 Ää mette käega katsugi . 
430	NA	 Aga isi nõnda kurja näoga kui üks pull . 
430	NA	 Kas sa ei tää , et pildi pääle minnasse ikki naarul näoga . 
430	NA	" Ot-ot , ma tuun sulle lilla kah . "" "
430	NA	 Ja vanaema läks kahinal marjapõõsaste vahelt läbi , murdis kolm kopsakat jorjeniõit ning sättis need mulle kätte , et kimp tuleks ilus ümmargune ja kõik õied paistaksid . 
431	NA	" Mulle tundus , et terve mu kere , ja eriti piltidega põll , kaob lillekimbu taha ära ja ma tõstsin hädakisa : "" Vanaema , võta lilled ära ! "
431	NA	" Vanaema , võta lilled ära ! "" "
432	NA	 Trepi peale ilmus isa , päevapildiaparaadi jalg käes , nahkjope soojast ilmast hoolimata seljas . 
432	NA	" Vanaema käes ümmargust kirjut jorjenikimpu nähes pakkus ta : "" No teeme vanaemast ka pilti ! "" "
432	NA	" Isa küsis vanaema käest : "" Kudamuudu sa pildi pääle tahad tulla ? "
432	NA	" Kas tahad mõne ilusama asja ka kätte võtta ? "" "
433	NA	" Vanaema torises : "" Ei tää , mes iluasju sel vanamooril änam tarvis on ! "
433	NA	" Mul jo süle lilla täis , kas sii põle siss ilus ? "" "
434	NA	" Isa ajas oma : "" Oina Aadu kõige ilusam asi olli põrsastega emmis , Aadu laskis ennast siaaias emmise kõrval üles võtta , teise kainla all teine põrsas . "
434	NA	 Savikoti Vaike tahtis jälle kangesti õmblusemasina pilti . 
434	NA	 Pandis käe vända pääle ja tegi nigu õmless , isi tegi suu ästi veiksess ja aas silmad päha punni . 
434	NA	" Ei tää , miks ta isi nii irmsa näo tegi ? "" "
435	NA	" Vanaema lausus : "" No ku kõigil on sihandsed tahtmesed , siss mina tahass , et sa mind selle loksipiindra juures lapsega üles võtass . "
435	NA	" Niid on viil minu ema istutatud loksid . "" "
436	NA	" Ma ei kannatanud enam oodata ja nõudsin : "" Ma tahass jalgrattapumba kätte võtta ! "" "
437	NA	" Isa imestas : "" Vaata , kui ää mõte ! "
437	NA	 Kis pärast pilti vaatab , arvab , et sul on toanurga taga ehk jalgratas isi kah varjus . 
437	NA	 Nüidse aja inimese lillekimp ongi jalgrattapump ja mutrevõti . 
437	NA	" Kas sa mutrevõtit ei taha ka kätte võtta ? "" "
438	NA	 Mutrivõtit ma ei tahtnud , sest ma ei mäletanud hästi , missugune ta oli . 
438	NA	 Tõon toast kapi alt rattapumba , astusin vanaema kõrvale floksipeenra äärde ja hoidsin kätt pumbaga nii , et põll kindlasti paistaks , sirutasin pumba ette ja sihtisin sellega isa poole . 
438	NA	 Teisest käest hoidis mul kinni vanaema , nagu läheksime me kuhugi . 
438	NA	 Kaugesse tulevikku , karpi minevikupiltide hulka . 
439	NA	 Piltide hulka , mis jõhkralt ja lühidalt kinnitavad , et see päev , need inimesed ja nende mõtted ning näod on ühe hetke niisugused olnud ja siis kas surma või elu läbi täiesti teiseks muutunud . 
439	NA	 Pildid kinnitavad , et see soe sügissuve pärastlõuna tõuseb igal aastal uuesti surnuist üles . 
439	NA	 Valged säravate äärtega pilverongid lähevad üle taeva . 
439	NA	 Tillivartest , mustsõstralehtedest ja floksipuhmastest tõuseb sõnulseletamatut sügiseärevust , rohutirtsud siristavad veel - ja juba on see hetk möödas , varjud on nihkunud , tuul pööranud ning näod vanemad . 
440	NA	 Järgmine pilt pidi tehtama minust üksinda . 
440	NA	 Seal peal tahtsin ma olla hanega , ja nii , et hanepea jääks põlletaskuga kohakuti , siis silitaks paks laps põlle peal justkui meie hane pead . 
440	NA	" Vanaema püüdis küll vastu ajada : "" Kissi seda ani kinni oiab ! "
440	NA	" Akka nüid rajakaga mässama ! "" , aga minu tahtmine jäi peale . "
440	NA	 Rammus valge hani tõsteti kõripidi üle aia ja pandi minu ette maha . 
440	NA	 Hani ajas pea püsti , rinna ette ja kaagatas solvunult . 
440	NA	 Pilt sai enne valmis , kui hani ära minna taipas . 
441	NA	" Isale hanega pilt ei meeldinud , ta soovitas : "" Vat nüid lähme teeme ilusa pildi , kus laps seisab pooliti sirelipõõsas ja otsib sireliõnne . "" "
442	NA	" Röökisin : "" Põle ju õisa ! "" "
443	NA	" Vanaema mühatas : "" Kus aru pääs - kartulivõtmese aeg nüid mõnda õit või õnne . "" "
444	NA	" Isa jäi kindlaks : "" Ega pildivaataja ei tää , et põle ! "
444	NA	 Pildivaataja on ju nigu sii tüdrik , kis kassinahast muhvi ostis . 
444	NA	 Kaupmiis mudku aga käis pääle , et ostke , preili , katusetiigre nahka . 
444	NA	 Tüdrik karas rõõmu pärast lakke ja tagus käsa kokku , et tema sai nii ilusa tiigrenahast muhvi , mis kellegil teisel tüdrikul põle . 
444	NA	" Vat sedaviisi usub pildivaataja pilti kah . "" "
445	NA	 Läksime toa taha sirelipõõsa juurde . 
445	NA	 Isa painutas ja sättis hõredaid oksi , et need ümber minu ilusasti kohevil oleksid . 
445	NA	 Pidin vaatama lehtede vahele , nagu näeksin ma seal suurt seitsme lehega õnne . 
445	NA	" "" Kis nii suurt õnne näeb , selle suu läheb kõrvuni ! "" , õpetas isa . "
445	NA	" "" Pää tuleb sedaviisi viltu lasta ja kulmu alt vaadata , aga naeratus piab näha olema . "
445	NA	" Kis ültse naarda ei mõista ja ilma naaratuseta õnne vasta võtab , sii on kui üks ürgaja inime . "" "
446	NA	 Ma ei näinud muud kui musta mulda põõsa all ja kirjusid kanasulgi mulla peal , päike paistis silma , kui pead tõstsin , pidin vahetevahel silmi hõõruma . 
446	NA	" Isa tõmbas mu põõsast välja ja käratas pahuralt : "" Sinust ei saagi pilti . "
446	NA	" Sul on lontruse ais juures ! "" "
447	NA	 Ta ei vaadanudki enam minu poole , vaid läks õue ja hõikas ema . 
447	NA	 Ema kammis toas pead ja silus silmakulme , nägin teda läbi akna . 
447	NA	 Kui ta välja tuli , oli tal valge klaasnööpidega pluus ning surnud tädi sinine seelik seljas , aga jalad paljad . 
447	NA	 Kingi ta ei saanudki jalga panna , sest linnas käies hõõrusid kingad talle suured vesivillid kandadesse , üks vill läks isegi katki , selle asemele jäi verine liha , mida tohterdati teelehtede ja rivanoolilappidega . 
447	NA	 Selleks , et pildi peal tema paljaid rakkus jalgu näha ei oleks , astus ta lillepuhma taha . 
447	NA	" Sireliõnne ei tahtnud temagi otsida , vaid ajas naerdes vastu : "" Ah , mes ma ikki vigurdan ! "
447	NA	" Pluuse jääb ka okste varju ja "" "
448	NA	" Isa jäi nukraks , aga soovitas siis uue lootusega : "" Aga võta iiskann kätte ja kasta kapsid ! "
448	NA	 Vat siss tuleb ilus pilt ! 
448	NA	 Iiskannust veejoad joosevad ja pluusenööbid sätendavad ja ümmerringi on suured kapsapääd . 
448	NA	" Pildivaataja lüüb käsa kokku ja karjub : "" Püha jumal , kui suured kapsad Hilda on kasvatand ! "" "
449	NA	 Ta tõi emale vett täis kastekannu , ema tammus kapsaste vahel ja otsis kõige ilusamat kohta . 
449	NA	 Ta tahtis , et selja taha jääks hernepeenar ja kaunad ka paistaksid , aga kurgipeenart tahtis ta samuti tulevikku kaasa võtta . 
449	NA	 Isa otsis peenrast suure kurgi ja pani selle ema lähedale kapsalehtede vahele , nagu kasvaks see kurk kapsa küljes . 
449	NA	 Nagu oleks isa Mitšurin , Lõssenko või Jaan Raeda ja aretaks pirnõunu , kirsspihlakaid ning kurk-kapsaid . 
450	NA	 Ema kastis püüdlikult kapsaid , nägu naerul . 
450	NA	 Tema verist jalga varjasid laiad läikivate veetilkadega kaetud kapsalehed . 
450	NA	 Üle ema pruuni päevitunud näo ja valge pluusi voolas kuum sügissuvine päikesevalgus . 
450	NA	 Ta seisis sirge seljaga , raske kastekann käes ja ta käsivarrelihased võbisesid . 
450	NA	 See kestis väga kaua ja ikka suutis ema veel hambaid näidata , säravat naeratust näol hoida . 
450	NA	 Ta teadis , et pildi peal peab naeratama nii , et poleks aimatagi nõgeseid aia ääres ega ka verele hõõrutud paljaid jalgu . 
451	NA	 Ema naeratus tegi mulle viha , see kinnitas ning kuulutas : kes vastu ei pea ja välja ei kannata , see tuleviku pildialbumisse ei pääse . 
451	NA	 Ei pääse veel ehitamata majadesse , ilmasündimata inimeste arvustavate pilkude alla , ei ole võimalust ei kustuda ega hiilata . 
452	NA	 Lõin hambad kättemaksuhimuliselt kõvasse valgesse kapsapeasse . 
452	NA	 Kapsas krudises ja pani vastu . 
452	NA	 Vaatasin oma hambajälgedega ära narritud kapsapead ning mu meel läks paremaks , pahurus oli välja valatud . 
453	NA	" Isa pani aparaadijala kokku , ema viis kastekannu ära ning ütles mulle : "" Isa tahab sind mooturrattaga sõitma viia . "
453	NA	" Kassa tahad minna ? "" "
454	NA	" Mu käed hakkasid ärevusest higistama , ma kinnitasin innukalt : "" Tahass küll ! "" , sealjuures oli mu selja taga äranäritud kapsapea ja hinges kartus kõverate torude ees , mis asusid mootorratta külgedel ja kust tuli sõidu ajal sinist suitsu . "
455	NA	 Tiirlesin õhinaga ümber isa ja ootasin , kunas me minema hakkame . 
455	NA	 Isa kadus tuppa , ja oli toas , ja jäigi tuppa . 
455	NA	" Ma ei jõudnud enam oodata ja nõudsin : "" Ema , mes isa toas tiib ? "" "
456	NA	" Ema lausus ükskõikselt : "" Kust mina seda tään . "
456	NA	" Mini isi ja vaata ! "" "
457	NA	 Poetasin ennast vaikselt tahatuppa ja nägin isa peegli ees seismas , habemenuga käes . 
457	NA	 Lauanurgal asus topsik seebivahu ja jämeda pintsliga . 
457	NA	" Uurisin : "" Kunas me ometi minema akkame ? "" "
458	NA	" Isa noomis peeglisse kõõritades võõra ninahäälega : "" Kissi sedaviisi saab reisu pääle minna , kui ültse kannatust põle ! "" "
459	NA	 Läksin löödult toa taha liivahunnikusse , kus asus nõiakoobas , mille ma hiljuti oma rohelise plekk-kühvliga niiske liiva sisse olin kaevanud . 
459	NA	 Koobas asus keset mägesid , sinna viis ainult kitsas ja väga ohtlik rada . 
459	NA	 Mõnikord ilmus nõid koopast välja - see oli eriti õudne , kui ta koopasuust paistma hakkas . 
459	NA	 Ta võis igaühe sitasitikaks nõiduda , ehkki ta ise oli ainult üks mustast kummist rohupudeli kork . 
459	NA	 Nüüd tõmbasin ma ta jõhkralt koopast välja ja viskasin kukerpalli rohu sisse . 
459	NA	 Võtsin nõia ametist maha , lasin erru . 
459	NA	" Vandusin : "" Sa kuradi kampsun ! "" ning purustasin ära ka mäed , orud ja lookleva teeraja . "
460	NA	 Õunapuude all õitses kummel , tagatoa aken läikis kingalillepuhma taga . 
460	NA	 Aknast paistis raadio tagumine külg . 
460	NA	 Isa ma ei näinud . 
460	NA	 Kuulatasin . 
460	NA	 Isa rääkis juba õues vanaemaga rabarberitest ja rõhutas eriti punase lihaga maasikarabarberi tähtsust . 
461	NA	 Sööstsin majanurga tagant välja , mul kästi sandaletid jalga panna , pandlad ei läinud kinni , ma jälgisin kogu aeg isa , et ta viimati ilma minuta ära ei läheks , ja siis me hakkasime minema . 
462	NA	" Kopli mulgu juures ma seisatasin ja kuulutasin : "" Isa , kas tääd , et eila murdis tõhk siin kohas Varesepää , Vana-Pruuni ja Sõbra ära ? "" "
463	NA	" "" Kis niid ollid ? "" küsis isa kohkunult . "
464	NA	" Ma laususin tasakesi : "" Mede kanad "" ja mulle tuli meelde , et isa ei hooli suurt ei kanamunadest ega kanadest endist . "
464	NA	 Ta ei teadnud ka muinasjuttu mustast kanast , kes oli haldjas kana kujul ning kinkis vanaaegsele poisile sinepiiva . 
464	NA	 Hakkasin seda jutustama , mu hääl muutus valjuks , silmad särasid , ma püüdsin isaga ühte jalga astuda ja tema kõrval käia , et ma talle näkku saaksin vaadata ja näha , mis mulje see muinasjutt isale ka jätab . 
465	NA	" Vahetevahel tegi isa : "" Mh-mh ! "
465	NA	" Mh-mh ! "" "
