par_nr	head	sentence
807	NA	 Aime ei ütelnud midagi . 
807	NA	 Kui ma sängi alt välja tulin , ei olnudki teda enam toas . 
807	NA	 Tuks tormas , aluskleidi saba kaelas , minust mööda . 
807	NA	 Aluskleit niitis tal ajuti esimesed jalad alt ära , aga sellest hoolimata sai ta ruttu edasi . 
807	NA	" Mõtlesin meeleheitega : "" Ja viibki , saadanas , minu alusleidi ära ! "" "
807	NA	 Toauks selja taga seisis pärani , Tommi hiilis minust mööda nagu vari , kukk kössitas katusel , üksikud laudast välja jäänud kanad hoiatasid mind nähes üksteist . 
807	NA	 Tekitasin hirmu ja hakkasin ise ka järsku kartma . 
807	NA	 Ma ei julgenud tuppa minna ega julgenud ka väljas olla . 
807	NA	 Kukal läks külmaks ja küljed hakkasid sügelema , pistsin ähkides jooksma . 
807	NA	 Maa müdises , uksed jäid pärani lahti , tormasin õuest välja , vankriteele , metsapuude vahele . 
807	NA	 Sees hakkas pistma , aga jooksin nii ruttu kui ma jõudsin . 
807	NA	 Eespool kadus tee paksu kuusikusse nagu koopasuhu . 
807	NA	 Aime seisis lageda peal ja nuttis . 
807	NA	 Mind nähes jäi ta vait , vaatas kõõrdi ja löristas nina . 
807	NA	" Pilkasin : "" Mespärast sa kodu es läha ? "
807	NA	" Sa tahtsid ju kodu minna ! "" "
808	NA	" Aime ütles tasakesi : "" Ma es julge säält kuusikust läbi minna . "" "
809	NA	 Kogu mu ennistine hirm oli niisama järsku kadunud , kui ta tekkis . 
809	NA	" Itsitasin : "" Mes sa oled siss sihande uimane ! "" ja lohutasin : "" No sitta kah , ma tulen ühes . "
809	NA	" Mina küll seda kuusikud ei karda . "" "
810	NA	 Võtsin maast roika , keerutasin ümber pea ja läksin pikkade sammudega kuusiku poole . 
810	NA	 Tee ääres leinakase all kasvasid karvaste servadega seened , need levitasid külma kibedat lõhna . 
810	NA	 Surusin salahirmu maha , taevas veel punetas ja väljas oli valgem kui toas . 
811	NA	" Küsisin : "" Kus Tuks on ? "" "
812	NA	" Aime vastas kahjurõõmsalt : "" Tuks läks ära kodu , sinu alusleit olli sellas . "" "
813	NA	 Jäin murtult vait ja peksin roikaga sõnajalalehti . 
813	NA	 Luurasin ümbrust . 
813	NA	 Mõnede kuuskede okste küljes narmendas hall sammal , teistel kuuskedel rippusid oksad maani , okste alt paistis paks pimedus . 
814	NA	 Püüdsin tasa olla ja vahtisin kogu aeg ringi . 
814	NA	" Aime sosistas : "" Mes sa näed ? "" ja "" Ega sa kedagist es näe ? "" "
815	NA	 Kartsin , et kuulen kohe kas vihmakassi vilet või näen kuuseokste all surnut . 
815	NA	 Vihmakassi vilega võis üks mees teisele mehele märku anda , et ta mind näeb , et mina olen ka metsa tulnud . 
816	NA	 Surnu võis olla kaduma läinud vallavolinik või meiereist koju tulemata jäänud Orri-Ants . 
816	NA	 Kuhugi pidid nad ju peidetud olema . 
816	NA	 Kunagi pidid nad ju välja tulema . 
816	NA	 Siiamaani olid kõik välja tulnud ! 
817	NA	 Minu arust paistis Orri-Antsu habemik nägu videvikus igast pajupõõsast , kõigist haohunnikutest , eriti kui selle peale mõtlema hakata . 
817	NA	 Niisugustest kahtlastest kohtadest mööda minnes läks selg alati märjaks . 
818	NA	 Enda julgustuseks võisin sosistada salmikest : 
819	NA	 Päike naerateleb . 
820	NA	 Aed on õitest ere . 
821	NA	 Õnnelikult elab 
822	NA	 meie lastepere . 
823	NA	 Siin kuusikus tuli see salm mulle kohe meelde ja ei läinudki enam meelest ära . 
823	NA	" Kordasin mõttes rõõmsalt : "" Päike naerateleb "" ja piilusin hirmuga kolletanud sõnajalalehti , mis mustade kuuskede vahelt helendasid . "
823	NA	 Kaugemalt vaadates paistsid nad nagu maha visatud valged kompsud , viljakotid või kõhuli olevate inimeste näod , kui aga lähemale jõudsime , polnud seal enam midagi . 
824	NA	 Äkki inises kuskil siinsamas lähedal lehm . 
824	NA	 Jäime seisma ja võtsime teineteisel käest kinni . 
824	NA	 Lehm inises jälle . 
824	NA	 Seejärel ta ammus . 
824	NA	 See lehm oli ammunud kogu aeg , kui me liha sõime ja kui me kanu hirmutasime . 
824	NA	 Metsas aga oli lehmast seltsi , tekkis tunne , et polegi midagi karta , kodu on siinsamas lähedal , igal pool lüpstakse õhtust lüpsi , vanaema on ehk ka selle aja peale juba kodus ja lüpsab lehma . 
825	NA	 Aime nohises ja väänas valusasti minu pöialt . 
825	NA	 Käsutasin . 
825	NA	" "" Lähme vaatame , kelle lehm sii on ! "
825	NA	" Viimati on kuskile kinni jäänud . "" "
826	NA	 Kettipidi rägastikku kinnijäänud lehmadest oli ühtepuhku juttu . 
826	NA	 Teadsin , et ketiga lehma ei tohi omapead metsa lasta , poob ennast põõsasse ära nagu üks vanaaegne Tähik poos . 
827	NA	 Teelt kõrvale poolhämarasse morni kuusikusse minnes tundsin ennast lehma elupäästjana , vaenlase tagalas sumpava väikese partisanina , hea lapsena . 
828	NA	 Aime hingas mulle kuklasse , ta ei jäänud poolt sammugi maha . 
828	NA	 Me hoidsime veel ikka teineteise käest kinni . 
828	NA	" Komistasin kogu aeg puunottide ja põldmarjaväätide peale , lehed ja oksad lõid ühtelugu näkku , oleks tahtnud vaarikavartesse ja kuuseokstesse kinni jäädes kere kangeks ja käed püsti ajada ning lõugama pista , aga polnud kellegi peale loota , lõuga kaua tahad , keegi ei kärata : "" No mes sa , pimeluum , tükid sihandsesse kohta , kost sa isi välla ei saa ! "" "
829	NA	 Lükkasin vihaselt raskeid oksi kahele poole ja vedasin Aimet kättpidi järel . 
829	NA	 Lehm tundis meie lähedalolekut ja hakkas möirgama , nagu oleks piiblilooraamat metsa lahti jäetud ja sealt tungiks välja pime pasunahääl . 
830	NA	 Jäime seisma ja sügasime jalasääri . 
830	NA	 Ma ei olnud enam päris kindel , kas ma saangi üldse ketti lahti , kui see on kinni jäänud . 
830	NA	 Võib-olla polegi lehm , on pull ja tuleb kallale ! 
831	NA	 Nihkusime natuke edasi , ainult mõne sammu ja näe , okste vahelt paistis mustjaspunane maokas lehmakere , kett kõlises , kostis puhinat ja krõmpsutamist . 
831	NA	 Kindlasti oli see kinnijäänud lehm ! 
831	NA	 Kas see Pajusi Kirsi ei olnud ? 
831	NA	 Mul polnud üldse enam tahtmist Pajusi Kirsit ära päästma minna , see otsis pulli ja kui inimest nägi , kargas kohe selga . 
832	NA	 Korraga käis mul peast õudne mõte läbi , mõtlesin põlvist nõksatades , et see ongi nüüd see kolhoosilehm , seesama , kes ühest suurest kuusikust leiti , suu vahul ja saba püsti . 
832	NA	 See ju võiski seesama suur kuusik olla ! 
832	NA	 Kolhoosilehma saba oli naelutatud puutüve külge , puukoort mööda jooksis alla hüübinud veri . 
832	NA	" Lehma sarvede vahele seotud katuselaastult ähvardasid suured trükitähed : "" See saatus ootab sõpra-seltsimeest ! "" "
833	NA	 Lehma kõrvad liikusid mu kujutluses , ülemine mokk kerkis tontlikult üles ja laiad kollased hambad paistsid . 
834	NA	 Sellest lehmast räägiti palju ja painavalt ning jäädi kohe poolelt sõnalt vait , kui ma ennast söögilaua all liigutasin . 
835	NA	 Pistsin kõõksatades jooksu , kukkusin kohe kõhuli , kargasin uuesti püsti , vedasin vastupunnivat Aimet jälle kättpidi järel ja tundsin seljanahaga , et nüüd see lehm meile küll järele jõuab , koos katuselaastuga sarvis , koos juurtega väljakistud jämeda verise puutüvega , saba püsti ja hõredad hambad paljad . 
835	NA	 Ägasin tasakesi . 
836	NA	" Aime lõi mind tötsti ! rusikaga : "" Loll , mes sa sikutad minust ! "
836	NA	" Mes sa tõid minust siia metsa ! "" "
837	NA	 Raputasin teda kõvasti ja vihaga rinnust , võtsin tal vägisi käerandmest kinni ja tundsin teise abitut veresoont oma pöidla all tuksumas . 
838	NA	 Maailm oli täiesti vait , kõik inimesed kadunud . 
838	NA	 Nüüd elasid inimeste elu loomad ja linnud . 
838	NA	 Koerad lõid tantsu , kanad tõid kuuldavale omakeelseid hoiatusi ja manitsusi , lehmad olid segatud poliitikasse . 
839	NA	 Vihmast ja tuultest räsitud metsa julm ajaloolõhn lõi hinge kinni . 
839	NA	 Tarn kahises mätastel ja see kahin läks nagu laine üle niitmata jäänud metsaheinamaade . 
839	NA	 Lepad lasid lehti maha , need krõbisesid jalge all kõvasti ja äraandlikult . 
840	NA	 Jooks pööras kõik segi , kohad muutusid võõraks ning vahemaad teiseks . 
840	NA	 Meie laut ilmus nähtavale varem , kui ma ootasin . 
841	NA	 Lauda kohal kõrgusid pilved nagu punased kaljumäed . 
841	NA	 Ühe pilve serval seisis veeaurust poisike , sonimüts peas , palitu seljas . 
841	NA	 Nii lähedal . 
841	NA	 Nii imelik . 
842	NA	 Mul oli Aime meelest ära läinud , ehmatasin , kui ta mu kõrval aevastas . 
842	NA	 Mäed vajusid laiali , poisike kustus ära . 
842	NA	 Silmitsesin oma jalgu , need olid paksu poriga koos ja kipitasid kangesti . 
842	NA	 Kindlasti olid nad katki . 
842	NA	 Mul hakkas endast hale , tundsin , kuidas nägu läks punaseks ja suu kõveraks . 
842	NA	 Läksin sõna lausumata otsejoones pimedasse tahatuppa ning pressisin ennast nohisedes ja nuutsudes kapi ning seina vahelisse prakku . 
842	NA	 Tundsin , kuidas Aime ka ennast sinna kiilus ja nihkusin eest ära , veel kaugemale , kas või seinast läbi . 
843	NA	 Kapp naksus ja vajutas rinnakorvi kokku , kapi sees aga kahises vanaema surikleit . 
844	NA	 Õuest hakkasid kostma hääled - Paula ja vanaema jõudsid lina kitkumast tagasi . 
844	NA	 Ema häältki oli kuulda . 
844	NA	 Kuuldus , et vanaema ja ema arutavad , mis siin tehtud on , taevane halastus , uksed pärani lahti ja kukk katusel . 
844	NA	 Paula kutsus Aimet nimepidi . 
844	NA	 Katus krobises ja kuketiivad kohisesid . 
844	NA	 Nüüd kukk lendas ja mina ei saanudki näha ! 
844	NA	 Kukkusin suure häälega töinama , mõttes läksid omavahel segi võõras ärapiinatud lehm ja meie kukk , kellele ma ise nii palju hirmu olin teinud . 
844	NA	 Tahtsin mõlemate eest ennast ikka sügavamale kapi vahele pressida . 
844	NA	 Õhust tuli puudu , vahetevahel kõõksatasin ja luksusin , palavad pisarad imbusid kampsuni rinnaesisesse . 
845	NA	 Naised tulid minu lõugamist kuuldes tuppa , latern käes . 
845	NA	 Mõnest pilust tungis isegi kapi taha tuhmi kollast valgust . 
845	NA	" Vanaema uuris asja lähemalt ja kukkus siunama : "" Te äbemata loomad ! "
845	NA	 Niid põle änam undikutsikad , niid on vanad undid isi ! 
845	NA	" On kukke väntsutand , et küll saab , ja isi kapi vahele tüknud ! "" "
846	NA	" Ema hädaldas , nutt kurgus : "" Kis jõuab seda kappi tõsta , oh jumal , jumal küll ! "" "
847	NA	" Paula arvas : "" Põle kedagi , persed pallass ja vitsa . "
847	NA	" Vitsa - kas veri vällas ! "" "
848	NA	 Ähiti ja lükati kappi , aga kapp ei liikunud sugugi . 
848	NA	 Ma jäin isegi nagu veel kõvemini kinni . 
848	NA	" Vanaema käratas : "" Kas põle praegu kurat lahti ! "" ja kangutas kappi , nii et kapijalad ragisesid . "
849	NA	" Ema kurtis : "" Kudagi ei tule . "
849	NA	" Ta on nii raske , et "" "
850	NA	" Vanaema põrutas : "" Mesasja sa vingud ! "
850	NA	" Ega siss lapsa kapi vahele ei saa jätta ! "" "
851	NA	" Palusin meeleheitel : "" Vanaema , vanaema , ära võta mind välla , mina kardan ! "" , aga kapp nihkus ikkagi natukehaaval ja jättis mind lõpuks abitult seisma tolmuste ämblikuvõrkudega kaetud seina äärde . "
851	NA	 Paistis , nagu oleks kapp mind just praegu siia maailma sünnitanud . 
851	NA	 Polnud midagi parata , mu pealaele laskus vanaema raske soe käsi , latern võpatas ja viskas otse näkku pikki palavaid lootusekiiri . 
852	NA	 Need lõikasid mind pimedusest välja , valgustasid mu nägu ja silmaterasid , otsekui oleks kätte jõudnud hetk , mil valgustatakse nägusid sünni ja surma , kahe pimeduse vahel . 
853	NA	 Vesised luhad , kartulimaa ja laut pöördusid aeglaselt ööpoolsesse külge . 
853	NA	 Kõik , mis ümberringi seisis , hingas ja laius , ei olnud midagi muud kui aeg riidekapi ning kruupingi , ema ja vanaema , kartulimaa ja kuusemetsa kujul . 
853	NA	 Kogu maakera , kõik muld , savi , vesi ja liiv oli ainult kuju võtnud aeg . 
853	NA	 See pöörles keset võimsaid jääkülmi õhuvoole ja sätendavat eebenipuupimedust ning kasvatas vilja , kartuleid ning lehmaheina niisama nagu luid , hambaid ja sõrmeküüsigi . 
854	NA	 Aegamööda pööras maakera kõiki minuvanuseid sünnipimedusest välja , olgugi täisvalgusesse veel aastatepikkune tee . 
854	NA	 Veel ei võinud ühegi eelkäija silm selja taha vaadates seletada meie kujusid , sest me alles võtsime kuju . 
854	NA	 Tulevaste aastakümnete luud , hambad ja küüned alles kasvasid . 
855	NA	 LÄKSIME LÄBI RAAGUS LEPIKU , meie hingeaurupilved jäid teeraja kohale okstesse lehvima , nagu oleksime me lippe õlal kandnud . 
856	NA	 Vanaemal oli lehm kettipidi järel ja ka lehma elulipp lehvis puude vahel , mitte eriti palju vanaema omast madalamal , kuid minu omast ikkagi kõrgemal . 
857	NA	 Lehm lasi ennast armulikult talutada , ta astus suursuguselt ning põlastavalt saba kergitades läbi vee ja pori . 
858	NA	 Kaugemal metsas tegi Tommi suuri ringe , vahel ei näinud me teda üldse , mõnikord aga välgatas kuuskede vahelt tema kollane kere . 
858	NA	 Iga suurema ringi järel sörkis ta meie juurde vaatama , kas me äkki sööma pole hakanud või teise suunda pööranud . 
859	NA	 Vanaema peos kõlises paljas külm lehmakett , käed olid tal elu jooksul kibeda külmaga ära harjunud , ainult punetasid . 
859	NA	 Minu käed aga kartsid küll külma . 
859	NA	 Ajasin käsivarred kangelt harali , tõmbasin rusikad palitukäistesse ega liigutanud käies keha , ainult jalad liikusid all . 
859	NA	 Vanaema juhatas mulle mättaid ja kuivemaid kohti , aga ikkagi tuli üle kalossiääre vett , mis imbus kohe minu hallidesse villastesse sukkadesse . 
859	NA	 Jälgisin seda suure huviga . 
859	NA	 Sukad olid justkui suhkur , imesid vett niisama hästi ja ei paistnud ise sealjuures sugugi märjad olevat . 
860	NA	 Vanaema jõudis minust rutemini edasi , tal käis kalossitalla alt takune nöör läbi , mina aga ei läbenud kodus oodata , kuni mulle kalossid jalga seotakse , punnisin vastu ja jäin nüüd iga natukese aja pärast jalgupidi porisse kinni . 
860	NA	" Vahetpidamata kostis minu hädakisa : "" Vanaema , vanaema , uuta ometi mind kah ! "" "
861	NA	 Lepaokste küljes rippusid suured selged veepiisad , mets paistis hõre ja tühi , ainult kuused kohisesid omaette . 
861	NA	 Metsa vahelt jõudsime välja luitunud karjamaale , siin oli jalgealune juba kindel ja võis näha kaugele ümberringi . 
861	NA	 Eemal , punakate pajupõõsaste taga ulatusid taevarannani jõeluha laiad süsimustad veeväljad . 
862	NA	 Vanaema tõusis aeglaselt nende mustade vete ja raske tuhakarva taeva ees nõlvakut mööda üles , lehm truult järel . 
862	NA	 Kingulael jäi ta seisma , tegi ketilõksu lehmapäitsete küljest lahti ja patsutas lehma kaela . 
863	NA	 Lehm vaatas huviga , kuidas ma nõlvakut mööda üles rühin , paistis , nagu oleksid tal prillid ninal , sest tema hõõruvatele kettpäitsetele oli ninaluu kohale paks potisinine polster õmmeldud . 
863	NA	 Ta seisis , kõrvad laiali , ja tema silmadest paistsid vastu kalgid veeväljad , tumehall taevas ja mina ise , punased põsed punnis , kalasabamustriline lendurimüts peas . 
863	NA	 See kõik oli nagu lillaka kile või varjuga kaetud ja kadus kohe ära , kui lehm korra pead liigutas . 
863	NA	 Siis hakkas ta himukalt ning osavõtmatult ädalat sööma , tema kondine selgroog saagis aeglaselt silmapiiri . 
864	NA	 Pidasin lehma suure põnevusega silmas ega tundnud sellejuures enam külmagi . 
865	NA	 Nüüd kattis lehma jäme nina juba Teiste suured kuused kinni , nüüd neelas ta nad alla ja näe nüüd sõi ta ära Teiste elumaja ühes poleeritud kapi , õmblusmasina ja klaasist seaga . 
865	NA	 Lehma nina ees paistsid pikad laudakatusedki lühikesed ning tühised , rääkimata siis veel kaugetest heinaküünidest . 
865	NA	 Puhisedes jõi ta jõe koos luhtadega veest tühjaks ja sõi kohe peale nuiataoliste tüvedega pajud linaleoaugu tagant . 
866	NA	 Nägin ainult seda , mida ma näha tahtsin . 
866	NA	 Vaatasin ainult ettepoole , lehma nina ette , mitte taha , kus kõik allaneelatud puud , veed ja hooned endiselt omal kohal seisid . 
867	NA	 Ootasin põnevusega , kas ei tule eemal silmapiiril nähtavale salakaval kollane Teiste Sips , minu vaenlane . 
867	NA	 Kui ta nüüd tuleks , laseksin ma meie lehmal ta alla neelata . 
868	NA	 Või kui nüüd Liisu metsa vahelt välja ilmuks , mis siis saaks ? 
868	NA	 Kas ma päästaksin Liisu viimasel silmapilgul ära , või ei päästaks ? 
869	NA	 Vahtisin põlevate silmadega pikka porist teed kaugemal lehma lõuapärade ja pehme rinnaloti taga ning kartsin , et viimati ilmubki metsa vahelt Liisu , triibuline põll ees , nahkvest seljas ja kadakane kepp peos . 
869	NA	 Otsustasin Liisu ära päästa ja rõõmustasin ise kangesti oma headuse üle . 
870	NA	" Läksin vanaema juurde , jäin otse tema ette seisma , vaatasin alt üles ning kuulutasin nõudlikult : "" Mina olen ää ! "" "
871	NA	" Panin isegi pea ette valmis , et vanaema seda silitada saaks , aga ta ei silitanud , vaid parastas : "" Nuujah , kis koera saba kergitab , kui mette koer isi ! "" ning käratas : "" Mes asi sii on ! "
871	NA	" Kas sa paned kindad kätte ! "" "
872	NA	 Hallid punaste pöialdega labakindad tolknesid keerdus nööri otsas minu käisesuudest välja . 
872	NA	 Neid oli küll hea niisama lehvitada , aga kui nad kätte tõmmata , siis hakkasid nöörid palitu all tirima ja soonisid kaela , just nagu oleks mind poodud . 
872	NA	 Nüüd kiskus vanaema ise need kindad mulle kätte , aga selle ajaga läks lehm juba kaugele metsa äärde . 
873	NA	 Jooksin talle küll järele , aga nüüd seisid tema selja taga ühtlased valkjashallid puutüved . 
873	NA	 Ta polnud enam kõikvõimas saatusekäsilane , vaid ainult lehm metsa ääres ja mul ei olnud enam huvi teda jälgida . 
874	NA	 Olin vanaema peale pahane ja lasin ennast enne mitu korda hõigata , kui ma tema juurde tagasi läksin . 
874	NA	" Küsisin pahuralt : "" Vanaema , mespärast me karjas piame olema ? "
874	NA	" Mespärast me Lehikud ketti ei pane ja isi ära kodu ei läha ? "" "
875	NA	" Vanaema vaatas vilksti ringi ja seletas tasase häälega : "" Piab jo salaja süütma , et mõni viimati ei näe ja päälekaibust ei tii . "
875	NA	" Kui isi lehma juures oled , siss on , nigu kogemata oless lahti saand ja koloosi vällale tulnd ja meie oleme teda kodu viimas . "" "
876	NA	" Jonnisin : "" Mes me siss söödame teda koloosi välla pääl ! "" "
877	NA	" Vanaema sosistas haledalt , mitte nagu minule , vaid nagu emale või Teiste Leidale : "" Põle jo piaaegu sugugi einu . "
877	NA	 Niipailukest kui ta enne lumemahatulekut vällast einajätku saab , niipailu on . 
877	NA	" Mede oma karjamaa on jo nüid üks pallas lehmasitt ja pori , mesasja ta , vaene luum , säält ka saab . "" "
878	NA	 Vanaema silmad läksid märjaks , ta astus töntsi sammuga metsa äärde tuulevarju , pani prillid ette , võttis korvist peaaegu valmis halli suka ja hakkas minu suureks meelehärmiks kangete näppudega kuduma . 
879	NA	 Lehm sõi üksluiselt krõmpsutades märga , kohati külmavõetud rohtu , kaugemal väljade kohal kraaksusid varesed , puuoksad ei liikunud ega kohisenud . 
879	NA	 Läksin , selg ees , tagurpidi kaugemale ja vaatasin kogu aeg üksisilmi vanaema poole . 
879	NA	 Vanaema hall suurrätik ja pikk villane körtsik ei sulanud niisama hallide haava- ja lepatüvedega sugugi kokku , mina nägin ikkagi , et see ei ole metsapuu , vaid inimese kuju . 
879	NA	 Kõige rohkem meenutaski ta metsaäärde püsti pandud kuju . 
879	NA	 Isegi körtsik hoidis kangelt volti nagu kujul . 
879	NA	 Surrätik , körtsik , porised kalossid ja tõsine nägu olid otsekui kivist välja raiutud , või mis veel tõenäolisem , vanaema polnud mitte kivist raiutud , vaid kiviks muutunud . 
880	NA	 Seisin ihuüksi kumeral väljapealsel , mustad veed loksusid all laial luhal , tuhakarva taevast hakkas pudenema mitte tuhka , vaid lund ja minu süda tagus kõvasti vastu vateeritud palitu täpilise sitsiriidega paigatud voodrit . 
881	NA	" Kujutasin ette , kuidas ma lähen koju ja ütlen emale , et vanaema on kiviks muutunud , ja ema ei usu , ja siis ma hakkan nutma , ja siis lähevad kõik vanaema vaatama , mõmisevad , raputavad päid ja arvavad : "" Nuujah-noh , no mes sa siin änam teha mõistad , "" aga m i n a nõuan teiste selja tagant : "" Tooge talle ometi eluvett ! "" "
881	NA	 Siis loetakse kapiukse varjus raha , pannakse uued palitud selga , võetakse keedetud mune ühes ja minnakse merede ja mägede taha eluvett otsima . 
881	NA	 Võib-olla minnakse jala , aga kui buss käib , siis bussiga . 
881	NA	 Kui veega tagasi tullakse , ärkab vanaema kohe ellu ja annab mulle nii palju mett süüa , kui ma ise tahan . 
882	NA	 Kõike seda ma sosistasin omale nina alla , muidu tasemini , aga neid kohti , kus keegi midagi ütles , valjemini . 
882	NA	 Kui ma aga oma mõtete ja sosinaga mee juurde jõudsin , tuli sülg suhu ja pea läks seest tühjaks . 
883	NA	" Jooksin , kindanöörid nürilt kaelasooni lõikamas , vanaema juurde ja pärisin õhinal : "" Vanaema , kas sul kodus purgis mett on viil ? "" "
884	NA	" Vanaema raputas pooliku suka pealt lumepuru maha , vaatas mind prillide alt ja lausus moka otsast : "" No natuke ikki on . "
884	NA	" Rohu jaoss . "" "
885	NA	" Vuristasin : "" Kui ma nüid ästi ää laps olen , kas sa siss annad mulle mett süia ? "" "
886	NA	" Vanaema torises : "" Siss põle sul pühade aeg kedagi suhu pista , kui sa ta nüid juba ära süüd ! "" "
887	NA	 Mulle tuli järsku meelde , et olin enne karjatulekut vanaema korvi oma käega kaks raamatut pannud . 
887	NA	" Kükitasin maha , tõstsin korvikaane üles ja tõmbasin lõngakerade alt välja õhema raamatu , mille pealkiri oli "" Pilliroo saar "" . "
888	NA	" Vanaema vaatas mind murelikult , pani suka koos varrastega korvi ja ohkas : "" Ega põle kedagi teha , ega nüid änam rahu ei saa . "" "
889	NA	" Näugusin magusalt : "" Vanaema , loe sina ennem mulle s e d a raamatud , siss mina loen isi sulle pärast t e i s t raamatud . "" "
890	NA	 Vanaema võttis ilma sõnagi lausumata õhukese ja siin põldude ning metsa taustal väga valge raamatu oma kätte ja tõmbas suurrätiku nurga talle lumekaitseks tuulepoolsesse külge ette . 
891	NA	 Lehm oli jälle lähemale tulnud ja sõi siinsamas , ta puhus ninasõõrmetest sooja valget auru ega teinud meist üldse välja . 
891	NA	 Tommi istus vanaema kalossininade peal ja pani iga meie liigutust tähele . 
891	NA	 Ta ootas ikka veel , kunas me sööma või minema hakkame . 
892	NA	" Vanaema tõstis raamatu kahe käega rinna kohale , pööras selja lageda luha ja madalate lumepilvede poole ning luges vana järje pealt vaevaliselt ühetoonilise ähvardava häälega edasi : "" Küll ollid neil kaa praegu ilusad näod . pääkesed eledate juuste ja mustade silmadega kuid kehad ollid neil soomustega kaetud ja jalgade asemel inetud kala sabad "" "
893	NA	 Kuulasin kannatlikult , olin nagu mustjassinine kivi keset välja . 
893	NA	 Ma ei mõtelnud mitte midagi , kuulasin ainult imelikke sõnu , mis tulid takerdudes vanaema suust . 
893	NA	 Tundsin , kuidas mu silmad lähevad teravaks ja ninaots külmaks . 
894	NA	" Järsku lausus vanaema oma hariliku häälega : "" Päätükk "" Näkkide kättemaks "" . "" "
895	NA	" Ma nagu ärkasin üles , mul hakkas äkki igav ja ma käsutasin : "" Ära nüid rohkem änam loe ! "
895	NA	" Nüid vaatame pilta ! "" "
896	NA	 Olin seda raamatut põhjalikult uurinud ning teadsin tegelikult kõiki pilte peast , aga kasutasin ikkagi juhust , et vanaemale näidata , missugune pilt mulle kõige rohkem meeldib . 
896	NA	" Kõige rohkem meeldis mulle pilt , mille allkiri oli : "" Laste valged käsivarred sirutusid lainetest välja ja tõmbasid Hella põhja . "" "
897	NA	" Vanaema mõistis selle pildi hukka : "" Sii pilt põle küll kedagi asi , sii on üks irmus pilt ! "
897	NA	" No mes siin ilust on ? "" "
898	NA	" Purskasin : "" Sii just ongi ilus , et irmus on "" Jäin mõttesse ja selgitasin : "" Sii on ilus , et keresid põle , pallad käed . "
898	NA	" Ja et must vesi laenetab ümmer suure kivi . "" "
899	NA	 Jätsin ütlemata , et selle pildi mõjul kartsin igast veekogust ilusaid valgeid käsivarsi tõusvat ja pidasin alati teraselt teekraave silmas . 
900	NA	" Vanaemale endale meeldis kõige rohkem pilt allkirjaga : "" Nad vaatasid teineteisele silma ja olid õnnelikumad kui kunagi enne . "" "
900	NA	 See oli ainuke värviline pilt terves raamatus ja kujutas rohelises riides noormeest põlvili pika roosa kleidiga tüdruku ees . 
900	NA	 Nende selja taga õitses saksa roosipuu , silmapiirimägede ja -orgudeni ulatus kollaseid , punaseid ja siniseid lilli täis mürkroheline muru . 
901	NA	 See oleks võinud minu arustki raamatu kõige ilusam pilt olla , kui tüdruk ei oleks istunud kanderaami ääre peal . 
901	NA	 See rikkus pildi ära ja ei meeldinud mulle põrmugi . 
901	NA	 Murdsin pead selle üle , miks on säng metsa viidud . 
901	NA	" Sõna "" kanderaam "" jutu sees ei öelnud mulle midagi ega lahendanud pildi mõistatust . "
901	NA	 Olin valgesse peapatja tüdruku kõrval keemilise pliiatsi abil mitu vintpüssikuuli lasknud tungida ja tüdruku kahara kleidisaba alla pliiatsit enne suus niisutades kaks jämedat sinist L-tähe kujulist jalga joonistanud . 
901	NA	 Nõnda maksin ma kätte asja eest , millest ma aru ei saanud . 
902	NA	" Ütlesin lõpuks rahulolevalt : "" Nüid on pildid ära vaadatud . "
902	NA	" Nüid ma loen isi sulle ette . "" "
903	NA	" Kahmasin vanaema käest "" Pilliroo saare "" ja pistsin korvi tagasi , korvipõhjast tõmbasin aga võidukalt välja raamatu "" Emakeele lugemik IV klassile "" , millega suur Teiste-Maire enam midagi ei teinud ja mis nüüd minu oma oli . "
904	NA	" Lõin raamatu uhkusega lahti ja püüdsin endast mõtelda , nagu pidid mõtlema nähtamatud andunud pealtvaatajad , kes mu elu ja tegevust minu arust kogu aeg jälgisid : "" Näe , kui veike isi , aga kui tähtsad raamatud juba loeb ! "" "
904	NA	 Nendesamade nähtamatute pealtvaatajate jaoks lõin mõnikord laua peale lahti dr. phil . nat . 
