par_nr	head	sentence
568	NA	 Õrnalt puudutas mees huultega esmalt naise kulme , siis silmalauge , nina ja jõudis tulise , pragunenud huultega suuni . 
568	NA	 Marit väänles sitkena ta käte vahel . 
569	NA	 Kes teab , kui palju öid , mõtles Ivo , on Marit kuulanud selles voodis lebades küla hääli , huikeid , pillimängu ja teel mööduvate paarikeste kudrutamist . 
570	NA	 Mõni aeg hiljem tulid seina taga kerged sammud ja nad nägid , kuidas eeskambrist tuulekotta viiva ukse link alla vajus . 
570	NA	 Hinge tagasi hoides ootasid nad , millal sammud lahkuvad , Mariti sõrm Ivo huultele surutud . 
571	NA	" "" Sind on paljastatud ! "" sosistas Ivo . "
572	NA	" "" Meid ! "" "
572	NA	 Marit tiris teda kõrvust . 
572	NA	" "" Kuuled , meid on paljastatud ! "" "
573	NA	 Kui nad suurde majja läksid , võeti neid väga lihtsalt ja vaikselt vastu . 
573	NA	 Toidulaud oli kaetud . 
573	NA	 Neid oli oodatud . 
573	NA	 Tagakambrist tuli pikk ja laiaõlgne , täiesti lumivalge peaga vanamees , ulatas vaikides suure , kareda käe ja surus inseneri sõrmi , nii et need ragisesid . 
573	NA	 Tüse , lüheldane õemees viskas nalja , õepoeg vaikis , vahtis aknasse . 
573	NA	 Kui Ivo oli istunud , tuli väike Triin , nõjatus mehe põlve vastu . 
573	NA	" "" Sülle ! "" "
574	NA	 Selle laua taga oli hea ja lihtne olla . 
574	NA	 Ivo õlad vabanesid pingest , nii et teda viimasel ajal aina vaevanud kuklavalu järele andis . 
575	NA	 Ta oli siiasõidu mõttele pisut vastu punninud , oli öelnud , et Maritil endalgi on ehk lihtsam , kui nad enneaegu sugulaste ette ei ilmu . 
575	NA	 Mitte midagi kindlat polnud veel nende vahel . 
575	NA	 Lõpuks aga leidis ka tema , et poisikese mängimisel pole mõtet . 
575	NA	 Mõlemad täiskasvanud inimesed . 
575	NA	 Millal siis veel , kui mitte neis aastates ? 
575	NA	 Ja küllap oli Maritil teda näidata vaja . 
576	NA	 Pärastlõunal mindi aiatagusele põllulapile ristikut kärbisesse panema . 
576	NA	" "" Eks näe , kuidas linnamees ka harki pihus hoiab ! "" ütles Mihkel , kui kuulda sai , et Ivo kaasa tuleb . "
576	NA	 Päris tundmatu see töö insenerile polnud . 
576	NA	 Tudengiaastate sügisesed kolhoosiskäigud olid mingi mälestuse jätnud . 
576	NA	 Kuid peagi sai selgeks , et temast pole vastast isegi Maritile . 
576	NA	 Nad kõik olid hanguvarre najal üles kasvanud . 
576	NA	 Vaalutõmmatud pikavarreline ristik oli keerdunud sellisteks köiteks , et jõukohase tüki harutamine tihtipeale aega võttis . 
576	NA	 Lisaks avastas mees , et sellel tööl - laduda heinakahlakaid kärbisepuudele - on mingid temale täiesti tundmatud reeglid . 
576	NA	 Igatahes oli tal poole tunni pärast juba paras tüdimus kallal ja rakud pihus . 
576	NA	 Siis läks veel Marit põllult ära . 
576	NA	 Ivo mõtles juba , kas mitte hangu lihtsalt maasse lüüa ja järele kõndida , kui naine tagasi tuli . 
576	NA	 On tal bensiini veel paarikümne kilomeetri tarvis ? 
576	NA	 Täna on ema surmapäev . 
576	NA	 Isa tahaks surnuaiale minna , Mihkli autol on aga kardaan alt ära . 
576	NA	 Kergendustundega jättis ta pererahva heinu kokku panema ja lonkis taluõuele . 
577	NA	 * * * 
578	NA	" "" Siis hakkasin jooma . "
578	NA	 Ma jõin , nii et maa oli must . 
578	NA	 Kurram , ma lükkasin roppu kanti tööd teha . 
578	NA	 Kevadel hakkasin künniga pihta , ikka neliteist tundi ja rohkem järjest . 
578	NA	 Siis tuli kultiveerimine , äästamine , külvamine , siis tuli hein , siis tuli kombain , nii kaua kui sügiskünnini välja . 
578	NA	 Siis läksin talveks metsa ja panin seal traktori peal nii kaua , kui kevadel teed ära lagunesid . 
578	NA	 Ja kõik selle raha lasin sirgelt kõriaugust alla . 
578	NA	 Plikad said nii palju , kui küsida oskasid . 
578	NA	 Mõlemad said koolis käia nii palju , kui isu oli . 
578	NA	 Aivi rohkem ei tahtnudki , käis siin oma klassid ära ja pärast Jäneda Tema oli kohe algusest saati maatüdruk , temast tuli perenaine . 
578	NA	 Aga Marit hakkas plikast peast Virve küljes rippuma . 
578	NA	 Üks vanatüdruk kasvatas teise . 
578	NA	 Enam ei kõlband miski asi . 
578	NA	 Kodu oli must ja mehed olid ropud ja keski ei oskand miskit rääkida , mis preilnale kõlband oleks . 
578	NA	 Tahtis ja sai nii palju kooli , kui jaksas . 
578	NA	 Raha oli küll , kurask ! 
578	NA	 Kolhoos maksis silmad kinni . 
578	NA	 Nefti oli küll , joo või ise . 
578	NA	 Kõik aiamaad tõmbasin üle ja mis kõik . 
578	NA	 Ja kõik sirgelt kõrisse . 
578	NA	 Kuram , ma olin viiskümmend üks aastat vana , mis ma näinud olin ! 
578	NA	 Põllutöökoolist tulin , mõtlesin ka , et teen kodutalus korra järgi kõik ja puha , kuram , sundaeg oli poole peal , kui võtsid , tõprad , riigi ära . 
579	NA	 Petserist laagrist viidi Tartu tagasi , ütlesid , et nüüd olete punaarmeelased , kuram . 
579	NA	 Ei enam lastud koju puhkusele ega miskit . 
579	NA	 Sain just kroonust kodu , kui jälle tagasi — sõda lahti . 
579	NA	 Petseri taga mina panin kohe üle . 
579	NA	 Kurask , Venemaale ! 
579	NA	 Mis ma sinna ära olen kaotand ? 
579	NA	 Sain aga just aasta kodu olla , vähe vist üle , kui oli näha , et Aadu hakkab vatti saama . 
579	NA	 No , kuram , ei taha neid küüditajaid siia tagasi ! 
579	NA	 Mina läksin Rebase poistega koos . 
579	NA	 Ah sa saadan , Neuhammer oli ikka kool küll ! 
579	NA	 Kah justkui väljaõpetatud soldat ja kahte kroonut teenind ! 
579	NA	 Kui frondile minek oli , läksid naeruga . 
579	NA	 Saab kuradist minema ! 
579	NA	 Takka hullem - visati meid Koršuni alla . 
579	NA	 Ei enam old öössel ega päeval vahet , mudku madista . 
579	NA	 Terve selle pasa käisin otsast otsani läbi . 
579	NA	 Tšehhimaal tahtsid hinge välja võtta . 
579	NA	 Ei , siis tuli üks vene major peale , ähvardas need pätid maha lassa . 
579	NA	 See oli meie pääsmine ! 
579	NA	 Hulga mehi , raisad , tapsid rahu ajal ära , tõpranäod ! 
579	NA	 Kui kuuekümne kaheksandal Vasja neile säru tegi , ma ütlesin - kuda on , ah ? 
579	NA	 Saite nüüd , kuradi punasesidememehed ! 
580	NA	 Minule väänati kümme pluss viis , viiskümmend kaheksa lõige kaks . 
580	NA	 Mitte üks päev mina võlga ei jäänd ! 
580	NA	 Neljakümne viiendal läksin istuma ja viiekümne viiendal tulin välja . 
580	NA	 Kuuekümnendal sai asumise aeg täis ja varastasime ennast Laine ja lapsega sealt tulema . 
580	NA	 Laine vanad ei tuld , et müüvad enne majapidamise maha ja siis tulevad . 
580	NA	 Siiamaale tulevad ! 
580	NA	 Ei lastudki enam , lubati , et Petseri rajooni , aga Eestisse ei saa . 
580	NA	 Vanad ja ausad inimesed , eks sealt oleks ennast ikka siia nihverdand , aga jäid , ja nüüd pole surnuaia kohta kah alles . 
580	NA	 Kõik maatasa . 
580	NA	 Üks sealt tulija ütles . 
580	NA	 Maa pealt kadunud , küla ja kool ja surnuaed ja Eh , elajavägi ! 
581	NA	 Ma olin siis nelikümmend aastat vana ja mis ma näind olin , kui sõda ja nälga ja kaevandusi ja sõimu . 
581	NA	 Sain siia , kurask , miski rändrahvas majas sees . 
581	NA	 Kuuekümne neljandal aastal , kurask , ma ostsin selle taluvärgi kolhoosi käest tagasi . 
581	NA	 Raha oli küll , kui tööd viitsisid lükata . 
581	NA	 Saime mõne aasta elatud , siis oli Lainel vähk ja läks . 
581	NA	 Ja siis mina hakkasin jooma ja jõin kohe nii , et maailm oli must . 
581	NA	 Üks joodikute mörin oli ilmast ilma köögis ja plikad olid vihased ja nutul ja käisid Virve juures varjul , kui liiga ropuks läks . 
581	NA	 Eks ma olnd ikka loll küll ! 
581	NA	 Siis oli Virvel kah vähk külges ja põdes ja läks kah . 
581	NA	 Ja siis mulle nagu pandi aru pähe . 
581	NA	 Mees , mis sa lakud nagu siga ! 
581	NA	 Nüüd mina olen juba seitsekümmend kolm aastat vana ja mõtle , mina olen kolm aastat sõdind ja kümme aastat maa all olnd ja üle kolmekümne aasta traktori peal olnd ja viisteist aastat hirmsal moel viina võttand ja minul ei ole veel suurt häda ühtigi . 
581	NA	 Ja plikad kasvasid kah lõpuks inimesteks ja nüüd mul on rõõm vaadata , kuidas Mihkel kohta peab . 
581	NA	 Kitsas on küll . 
581	NA	 Nii kitsas ei olnud meil Vološinos kah , kui raha peale mõtelda . 
581	NA	 Aga see on oma värk , kõik see töö , mis teed . 
581	NA	 See jääb omale . 
581	NA	 Ja mina mõtlen , et oleks kõik need viiskümmend aastat saand sedasi omale teha , meie oleksime kõik hoopis teised inimesed olnd ja elu oleks teine olnd . 
581	NA	" Aga mina olen ikkagi õnnelik inimene , et ma kõik selle ära olen näind ja veel seda uut asja kah mulle näha anti . "" "
582	NA	 Ivo ja vana Möller istusid surnuaiamüüril päikese käes ja vanamees rääkis . 
582	NA	 Tagasisõiduga polnud kummalgi kiiret . 
582	NA	 Surnuaed asus lausa mere kaldal . 
582	NA	 Otse tagamüüri äärest algas järsk kaldanõlv ja selle all oli vaikne laht . 
582	NA	 Eespool oli uus , nukutoana korras sadam . 
582	NA	 Meri oli õhtupäikeses tüüne ja tasa laineid veeretav . 
582	NA	 Paar valget pilve libises taevas . 
582	NA	 Uimaseid , enesega rahulolevaid kajakaid seisis kaldakividel . 
582	NA	 Ükski ei lennanud , ei kisendanud , ei otsinud süüa . 
583	NA	 Ennist , kui vanamees vaikiva siiasõidu järel autost maha tuli , laskis Ivo tal üksi surnuaeda minna ja jalutas randa . 
583	NA	 Sadamast läände jäi piirivalvurite kunagine vaatlustorn . 
584	NA	 Ta jalutas selleni , leidis sealt lagastatud ja mahajäetud paiga , nagu neid nüüd kogu Eestimaa täis on . 
584	NA	 Puruks pekstud sisustusega kiviosmik , betoonist kuulipildujapesa , üles rebitud kaableid , lipendavaid pabereid ... 
585	NA	 Mariti isa meenutusi kuulates mõtles Ivo Lepala äkki , et ta on elanud oma elu , aimamata selle mehe olemasolu . 
585	NA	 Tema lugu oli üks neist arvutuitest lugudest , mis lõpuks moodustavadki põlvkonna kogemuse . 
585	NA	 Mariti kaudu sai see nüüd mingil viisil ka tema osaks , kas ta tahtis või ei . 
585	NA	 Esimest korda selle aja jooksul taipas mees , et naine seob teda hoopis uue maailmaga . 
585	NA	 Ta polnud üldse kindel , kas ta neljakümne kahe aastasena tahab veel saada kellekski teiseks , kui ta juba on . 
586	NA	 * * * 
587	NA	" "" Lõo , lõõrita sa ! "" lõõritas Marit . "
587	NA	 Ta värvis jälle lõngu , seekord päikesepunast . 
587	NA	 Näis , et ta oli kätte saanud selle vahepealse tooni ruuge ja purpuri vahel , hommikupäikese tooni , kui udu hajub ja silmapiirilt kerkiv tuline kuul just sooja hakkab andma . 
587	NA	 Jumal teab mis ajast polnud ta laulnud . 
587	NA	 Tal oli musikaalsust ja üksjagu häältki . 
587	NA	 Kooli segakooris oli ta koguni solistina esinenud . 
587	NA	 Aga koos emakeelse laulu kadumisega estraadilt ja eetrist , kuigi vist muudel põhjustel , oli õpetajannale aja jooksul tunduma hakanud , et oma korteris vanu viise valju häälega laulda pole just päris sobiv . 
587	NA	 See kostis paratamatult nii allkorruse korterisse kui hoovigi . 
587	NA	 Kuid täna ei hoolinud ta sellest . 
587	NA	" "" Vanu laule hea on laulda , kui kõik sõbrad lõkke äärde jälle kokku tulnud on "" Teda ajas naerma . "
587	NA	 Kuidas ta küll vallavanema puu otsast alla põrutas ! 
587	NA	 Madis oli ta klassivend . 
587	NA	 Peaaegu naaber . 
587	NA	 Omal ajal haudus ta Mariti suhtes julgemaidki plaane . 
587	NA	 Igatahes oli see kõik kusagil väga kauges minevikus . 
587	NA	 Viimastel aastatel piirdus kõik mehepoolse lõõbiga . 
587	NA	 Juba ukselt - kallis Mari ! 
587	NA	 Aina oli ta saanud väljapeetult viisaka , täiesti distsiplineeriva vastuvõtu . 
587	NA	 Ta oli harjunud sellega , et lõugadele voli andes ei riski ta millegagi . 
588	NA	 Nad sõid parajasti õhtust , istusid päevast väsinuna teetasside taga , lasksid punasel videvikupäikesel järjest kaugemale köögi nurka ulatuda . 
588	NA	 Nii oli selle pere viis alati olnud . 
589	NA	 Madis Kallaus tuli nagu ikka , hooga koputanud ja kohe ukse avanud , astus ta üle läve . 
589	NA	 Marit kallis ! 
589	NA	 Kui palju aastaid ! 
590	NA	 Marit , kes pliidi juures parajasti teetasse täitis , pani kannu käest ja see hakkas tulisel pliidiraual laulma . 
590	NA	 Kuid selle asemel , et viisakalt küsida , mis külalise siia toob , selle asemel , et istet pakkuda ja kapist teetassi võtta - olgu naabrimees lahke , laual on värske maasikamoos Selle asemel lõi Marit hetkeinspiratsiooni ajel käed laiali ja langes mehele kaela . 
591	NA	" "" Madis , mu kallis vallavanem ! "" "
592	NA	 Mihkli lusikas kukkus kolksatades taldrikule . 
592	NA	 Nüüd pidi küll igale hingelisele , Bella kaasa arvatud , selge olema , et Maritiga on toimunud pöördelised muutused . 
593	NA	 Marit mõistis isegi , kuidas ta kunagise peokaaslase ära oli ehmatanud . 
593	NA	 Seda ohtu , et võõras naine talle teiste nähes kaela kukub , ei olnud tal siin peres küll olnud . 
593	NA	 Kuid veel midagi sai Maritile selgeks ja tegi ta salaõnnelikuks . 
593	NA	 Silmanurgast oli ta näinud Ivo ilmet . 
593	NA	 Tema pärast polnud seni küll ükski mees armukadedust tundma pidanud ! 
594	NA	 Edasi , kogu selle aja , mis Madis neil viibis , tundis Marit seda kiivast hingust , mis Ivo poolt lähtus . 
594	NA	 See hellitatud mees , see tõmmu paharet , kes on harjunud , et tüdrukud nagu küpsed õunad ... 
595	NA	 Madisel oli tegelikult asjalik jutt . 
595	NA	 Ta tuli nõu küsima . 
595	NA	 Külla on kooli vaja . 
595	NA	 Maja on ju olemas , vajab ainult kohendamist . 
595	NA	 Ja enne on vaja need vanad inimesed sealt kuhugi mujale varju alla saada . 
595	NA	 Mõeldud juba on , kolhoosiosakonna kontor seisab nagunii tühjalt Aga mida Marit , kogenud õpetaja , arvab , kas sellest majast tänapäeva koolile väheks ei jää - võimlat näiteks ei ole . 
595	NA	 Ja üldse , mis sellest saab ? 
595	NA	 Omal ajal pandi väikesed koolid just majandusele viidates kinni . 
595	NA	 Mida see maksab ? 
595	NA	 Kui palju maksab riik ? 
596	NA	 See polnud jutule tuleku põhjus , mõistis Marit . 
596	NA	 Madis tiirutas ümber peaküsimuse , tihkamata lagedale tulla , enne kui Mihkel selle välja portsatas - Mari tuleb ja paneb selle poe teil käima ! 
596	NA	 Vaikus , mis sellele järgnes , oli piisavalt kõnekas . 
597	NA	 Ja nüüd ta aina sellele mõtleski . 
597	NA	 Alustama peaks esimesest klassist ja kooli sealt kasvada laskma . 
597	NA	 Tema ei ole algklasside õpetaja , kuigi ta sellega toime tuleks ja meelsamini päris väikestega tegelekski . 
597	NA	 Et poleks vaja valmis arusaamu murda . 
597	NA	 Maritile sai aina selgemaks , kui tüdinud on ta linnast ja kuivikurollist , millesse ta siin sattunud on . 
597	NA	 Aga just praegu ei osanud ta mingeid tulevikuplaane teha . 
597	NA	 Kõik oli veel liiga lahtine . 
598	NA	" "" Kui kallist kodust läksin ma ära kaugele , "" laulis ta ja vakatas . "
598	NA	 Ta oli trepil kuivalt klõpsuvaid kontsi kuulnud . 
598	NA	 See tulija ei saanud olla keegi muu kui Hilda . 
599	NA	 Marit oli kuulnud , mida neist räägiti , kuigi ta seda kunagi päris tõsiselt ei olnud võtnud . 
599	NA	 Pidi küll haige inimene olema , kes seda laimu uskus . 
599	NA	 Kuid nüüdsed stseenid panid teda kahtlema , kas Hilda siiski kõike kuidagi teisiti polnud mõelnud . 
599	NA	 Mis neid siis sidus ? 
599	NA	 Hingepuistamised . 
599	NA	 Hilda püüd teda lohutada ja hoida , pisut peasilitamist ja põske põse vastu surumist , ümbert kinni võtmist . 
599	NA	 Nad olid mõlemad üksikud naised ja tundsid end nii vähem üksikuna . 
599	NA	 Miks Hilda nii aktiivselt armukade oli ? 
600	NA	 Täna oli ta leebelt eleegiline . 
600	NA	 Teadatahtjal oli siin linnas kõik alati teada . 
600	NA	 Milleks oleks Marit pidanud seda veel üle rääkima ? 
600	NA	 Ta oli lihtsalt liiga õnnelik , et teise kurbust jagada . 
601	NA	" "" Näita siis vähemalt teda mulle ! "" nõudis sõbranna , endal peaaegu vesi ahjus . "
602	NA	" "" Miks ei , "" arvas Marit , ise kiiresti mõeldes , et siia , nende pessa ta Hildat kolmandaks küll ei taha . "
602	NA	 Ta leppis kokku , et püüab Ivo seitsmeks õhtul baari meelitada , tulgu Hildagi sinna . 
603	NA	" "" Iga kord , kui tood mul roose "" ümises ta tasa , kuni nägi Hilda selga majade vahele kadumas ja lasi siis täiel häälel : "" Tahan öelda sulle ma : sama kaunid kui need roosid , oled nõnda kallis sa ! "" "
604	NA	 * * * 
605	NA	 Kaks jäätisetopsi näpus , astus Ivo kaupluse klaasuksest varikatuse ala . 
605	NA	 Ta jäi trepile hetkeks seisma . 
605	NA	 Näis , nagu oleks ta millegi otsa komistanud . 
605	NA	 Marit istus endiselt välikohviku valge laua juures . 
605	NA	 Kuid naise kõrval oli end sisse seadnud uhke tõupuhas afgaani hurt . 
605	NA	 See leekivakarvaline olevus vaatas äraoleval pilgul kaugusse . 
605	NA	 Ja teisel pool lauda istus tõsine , püstipäine , iseteadlikult rahulike silmadega , nudiks pügatud blond tüdruk . 
606	NA	 Kairi pilku jälgides pöördus Marit üle õla vaatama , silmas Ivot ja ta rahulikku ilmet jumestas rõõm . 
606	NA	 Sa siis naistest aru ! 
607	NA	 Ivo teretas ja istus , ulatas ühe jäätisekoonuse Maritile ja teise , väikesest kõhklusest jagu saades , Kairile . 
608	NA	 Muidugi polnud Marit ju lunastanud litsentsi tema valdamiseks ... 
609	NA	 Kuid naised vestlesid rahulikult ja lihtsalt nagu vanad südamesõbrannad . 
609	NA	 Kairi mõistis , et Ivo oli toonud jäätise endale ja ta käsi peatus viivuks . 
609	NA	 Kuid ta taipas kohe mängu olemuse , ja võttis pakutu vastu , vajutas oma väikesevõitu , kuid ühtlased hambad šokolaadiglasuuri , kahvatusinistes silmades lühike tänulikkusehelk . 
610	NA	" "" Ma ei salli küünilisi naisi ! "" oli vist üks viimaseid asju , mida Ivo oli talle öelnud . "
610	NA	 Ja Kairi oli voodist tõusnud , ajanud valge kleidi paljale kehale . 
610	NA	" "" Ega ole suurt asja sallidagi ! "" "
610	NA	 Ta lihtsalt tõusis , riietus ja läks , jättes mehe hinge esialgu veel valutu , puhta , külma ja kiire lõike . 
611	NA	 Ivo jälgis naisi kõrvalt . 
611	NA	 Tüdruk meeldis talle rohkem , kui mees tahtis endale tunnistada . 
611	NA	 Iseteadlik , tasakaalukas , halastamatu enda ja kogu maailma vastu , ent mitte küüniline , mitte alaväärsusest kaitsevalmis . 
611	NA	 Ta teadis enda väärtust ja Ivo ei kahelnud , et elus saab Kairi kõik , mida igatseb . 
612	NA	 Hoopis suurem mõistatus oli talle praegu Marit . 
612	NA	 Kui palju oli huvis , millega ta Kairi edasiõppimisplaani kuulas Ivo praadimist mehe enda südametunnistusel , kui palju võitja kättemaksurõõmu tüdruku ees , kui palju lihtsalt vabanenud isiksuse rahulikku iseolemist ? 
613	NA	 Kiire kõrvalpilk , käeviibe . 
613	NA	 Ivo jälgis Kairi žesti ja nägi teisel pool tänavat Peepu . 
613	NA	 Tüdruk hammustas viimase suutäie , libistas keelega üle suunurkade , tänas ja tõusis lauast . 
613	NA	 Koos oma tõupuhta köiepuntraga moodustas ta vaatamisväärsuse , mis oleks au teinud mis tahes ajakirja kaanele . 
614	NA	" "" Nüüd jäid ilma jäätiseta , "" ütles Marit . "
614	NA	 Ivo ei olnud arvanud , et naisel nii head närvid on . 
614	NA	" "" Pole viga , lähme , ma teen sulle baaris jäätise välja ! "" "
614	NA	" Ta vaatas meest uurivalt ja imestas : "" On midagi viltu ? "" "
614	NA	 Ivo raputas vaid pead , kuid ta oli tõepoolest natuke mõttes . 
614	NA	 Üks telefonikõne , just enne tööpäeva lõppu , nii et päris värske alles Esialgu ei tihanud ta sellest Maritile rääkida . 
614	NA	 Maalkäigust saadik kiusas teda niigi isesugune süütunne . 
614	NA	 Kuidas seda nüüd täpselt väljendada ? 
614	NA	 Marit , noh , mitte ainult et meeldis talle See oli midagi enamat . 
614	NA	 Nagu oleks filmi peategelane astunud valgelt seinalt alla , muutunud ruumiliseks , saanud kombatavaks , omandanud lõhna . 
614	NA	 See ei olnud enam mingi tühine seiklus . 
614	NA	 Nad olid lähedaseks saanud . 
614	NA	 Ja seejuures mõistis mees lausa valusteravalt , milline vahe oli tema ja Mariti tunnetes . 
614	NA	 Temale oli see kõik ikkagi üks järjekordne lugu , ammukogetu kordamine ei tea mitmendas variandis . 
614	NA	 Ning enesesäästmise vaist käskis olla jahe ja sõltumatu . 
614	NA	 Sest ta teadis valust juba kõike . 
614	NA	 Ta ei tahtnud seda veel kord järele proovida . 
615	NA	 Aga Maritile oli see tõeline , ainus , suur , kogu maailma täitev . 
615	NA	 See oli lend langevarjuta . 
615	NA	 Iga selline üksikepisood , kas või see äsjane kohtumine tänavakohvikus Millised mõõtmed omandab see Mariti teadvuses ? 
615	NA	 Sellele mõeldes tuli lausa hirm peale ! 
616	NA	 * * * 
617	NA	 Marit nägi seda stseeni nagu aegluubis . 
617	NA	 Ivo pöördub baaripukil tema poole , kohvitass suu juurde tõstetud , naeratus üksnes silmades , on midagi ütlemas . 
617	NA	 Ja sel hetkel märkab Marit uksele ilmunud naisesiluetti . 
617	NA	 Esialgu on see veel prillide vaateväljast kõrval , udune , laialivalguv , kuid ta tunneb millegi väga iseloomuliku järgi Hilda ära . 
617	NA	 Ta jõuab pilgu sinna suunata , näeb Hildat tardunult seisvat , tegemas dramaatilist pausi , mida isegi Marlene Dietrich poleks mõjuvamalt esitada suutnud . 
617	NA	 Selle hetke jooksul muutub ta ilme tavalisest kalbest äraolevast nukrusest peaaegu traagiliseks . 
617	NA	 Ja nüüd tuleks küll leida mingi eriti lennukas väljend selle kohta , kuidas Hilda Saaliste nende poole liikuma hakkab . 
617	NA	 See pole sööst ega tormamine . 
617	NA	 Tunnete rajust kantud , ülakeha endiselt püsti , selg sirge , kuid jalad tulemas tükk maad tagapool järele ja käed avatud nagu langetatud tiivad . 
617	NA	 Ivo asetab kohvitassi tagasikätt letile ja keerab viimasel hetkel enne tabamust end veerandpöörde võrra Mariti poole , nii et Hilda ei satu talle mitte põlvede vahele , vaid vastu puusa . 
617	NA	 Siis on sõbranna käed ümber Ivo vöökoha ja mees asetab oma peo ettevaatlikult tema pealaele . 
618	NA	 Kõrvalt vaadates taipab Marit hämmastudes - Ivolgi on kohtumisest hea meel , kuigi ta Hilda tormilist vaimustust ei jaga . 
619	NA	 Nad kolisid lauda , sest kolmekesi reas ei tule baarileti taga jutust midagi välja . 
619	NA	 Kuid peagi mõistis Marit , et sama hästi oleks ta võinud ka lahkuda või üldse olemata olla . 
619	NA	 Neil kahel oli lühikese ajaga teineteisele nii palju öelda , pärida elu üle , meenutada tuttavaid . 
619	NA	 Kui nad baarist tunni aja pärast lahkusid , viimase ehapuna paistel linnas kõndisid , avastas Marit , et nüüd on Ivo jälle tagasi , on tema jagu , otsib oma väga ettevaatlikul viisil võimalust Hildat maha raputada . 
619	NA	 Lõpuks , tema koduukse ees , tõrjusid nad ühel meelel mõtte koos üles minna . 
619	NA	 Jäägu järgmiseks korraks ! 
620	NA	" "" Ta oli selline süütu lits , "" ütles mees viivitamisi . "
620	NA	 Pärinud Mariti mossisoleku põhjust , seletas Ivo nüüd vastu tahtmist neid ammuseid aegu , kui ta Hildaga tuttav oli olnud . 
621	NA	" "" Kolas igal pool kaasas , kas teda taheti või ei . "
621	NA	 Rallidel on ikka neid nümfe , ja millegipärast on kõik blondiinid . 
621	NA	 Tema käis vist küll igaühega voodis ära , kuid oskas ometi lõpuks süütuna mehele minna . 
621	NA	" Ma mäletan , kuidas ta sajanda mehe suudluse juubelit pidas . "" "
622	NA	" "" Hilda ? "" "
623	NA	" "" Paistab , et sa ei tunne oma sõbrannat just kõige paremini . "
623	NA	" Kes ta ka praegu poleks , omal ajal oli ta pesuehtne seksuaalhüsteerik . "" "
623	NA	 Naise osa on kord juba selline vastuoluline . 
623	NA	 Kui kasvatus ja arusaamad hirmus rangelt keelavad ja loodus liiga taga kütab , kujunebki selline ebamugav nähtus - aina süüdistab igaühte , et talle aetakse ebasündsal viisil ligi . 
623	NA	 Sa ei jõua veel talle otsagi vaadata , kui sulle öeldakse - mis sa endast õige arvad ! 
623	NA	 Aina provotseerib ise ja siis karjub appi või nutab käes ja lubab sind vägistamiskatse eest kohtusse kaevata . 
624	NA	 Marit tahtis teada - Ivo ju ütles , et käis igaühega voodis ära . 
624	NA	 Kas ka temaga ? 
624	NA	" Mees neelas midagi alla , enne kui lausus : "" Jah , korra . "" "
625	NA	" "" Kuidas see oli ? "" "
626	NA	 Ivo muigas mõrult . 
626	NA	" "" Teadsin ta tempe ja hoidsin kõrvale . "
626	NA	 Aga kusagil Lõuna-Eestis , mingi kooli ühikas , kus just , ei mäleta enam . 
626	NA	 Meil oli kuus tundi puhkust . 
626	NA	 Sain just püksid jalast maha - olin juhtumisi üksi tuppa sattunud , kui vajus suure halamisega uksest sisse , et meie rallimeeskonna boss , Ostjala Valdek teeb talle liiga , ajab teda taga , tahab ei tea mida temaga teha . 
626	NA	 Ütlesin talle , et olen liiga väsinud ja tegelikult olin ka muidugi , mingi tuhat kakssada kilomeetrit oli seljataga ja teine päev oli ees . 
626	NA	 Ütlesin , et ei viitsi Valdekut otsima minna . 
626	NA	 Kutsugu ta siia , ma löön tal kaks hammast välja ehk saab pikema jututa aru . 
626	NA	 Nojah , sa ei taipa praegu , Valdek oli selline hallide hangunud silmadega härg , sada nelikümmend kilo puhast pulliliha . 
626	NA	 Sama hästi oleks võinud püüda tankile vastu soomust virutada . 
626	NA	 Aga teine asi ka ! 
626	NA	 Laks pihuga pepu pihta oli suurim tähelepanu , mida Valdek ühele daamile võis osutada . 
626	NA	 Ma oleks tahtnud näha , mismoodi ta Hildat piki ühiselamu koridori taga ajab ! 
626	NA	 Teda härjast kiiremini liikuma saada oli ilmvõimatu . 
627	NA	 Hilda siis ütleski , et ei julge toast välja minna ja kas ta võib minu juures magada . 
627	NA	 Toas oli kolm tühja voodit . 
627	NA	 Ronisin teki alla ja ütlesin , et olgu lahke . 
627	NA	 Nojah , daam otsustaski lahke olla ja ronis kaissu . 
627	NA	 Teadsin ta tempe - alailma oli mõni sell ta pärast näost roheline ja käis tollhaaval . 
627	NA	 Ütlesin talle head ööd ja jäin kohe magama . 
627	NA	 Öösel lubasin ta toast välja visata , kui ta mul magada ei lase . 
627	NA	 Hommikul , veerand tundi enne äratust teesklesin , et olen temast hirmsasti ära võlutud - ja eks ta oli ju ka pagana kena plika — ja küsisin , mis ta minust nüüd arvab , et ma selline unimüts olin ja öö sirgelt maha magasin . 
627	NA	 Ja siis mul plahvatas ! 
