par_nr	head	sentence
1	 Continental 	 Continental 
2	NA	 Kellelt : Inger Pindmaa < Inger. Pindmaa@mail.ee > 
3	NA	 Kellele : < ilmar@eskl.ee > 
4	NA	 Teema : No tere siis 
5	NA	 Kuupäev : 25.07.2000 11 : 12 
6	NA	 Suurus : 1 
7	NA	 Tervitus maailma äärelt ! 
8	NA	 Eks maailma äär ole ikka seal , kus meri vastu tuleb . 
8	NA	 Meie baas asub poole kilomeetri kaugusel suurest veest . 
8	NA	 Saab täiesti elada . 
8	NA	 Isegi elekter on majas ja laka eesotsas on madratsijagu värskeid heinu , nagu Samuel ütleb . 
8	NA	 Tema magab lakas . 
8	NA	 Seal all on üks suur ruum , mis on kergete vaheseintega kolmeks tehtud . 
8	NA	 Keskel on köök , kust saab otse lakka . 
8	NA	 Pererahvas elab ühel pool kööki ja mina teisel pool . 
8	NA	 Loodan , et siin keegi salapärasel kombel surma ei saa , nii et ruumide täpsemat kirjeldust pole vaja . 
8	NA	 Minu toas on siiski hulk nimetamisväärseid asju – vana harmoonium , mille nad lasevad korda teha ja mida ma loodan salamahti natuke proovida , ja üks roositud tekk vanal puuvoodil . 
8	NA	 Magamiskoti sees on värsked heinad või õled , vist ikka õled . 
8	NA	 Ja vanad põrandariided on maas . 
8	NA	 Mu toas on ka üks petrooleumilamp , petrooleum sees . 
8	NA	 Ma ei ole seda veel põlema pannud . 
8	NA	 Mulle meeldib , et vanad asjad leiavad kasutust . 
8	NA	 Aga minu poolel asub ka progressi avangard Karli vana arvuti näol , internetiühendusega , nagu Sa mu kirja järgi arvata võidki . 
8	NA	 Voodi asub minusuguse külmavarese õnneks soemüüri taga , muidu oleks liiga rõske . 
8	NA	 Pliiti köetakse , alguses ajas natuke suitsu sisse , ja soemüür on leige . 
8	NA	 Arvasin , et krabisev magamiskott ei lase mul magada , aga esimese öö magasin küll suurepäraselt . 
8	NA	 Kõik olid juba üleval , kui mina ärkasin . 
8	NA	 Jõudsin vaevalt kohvi juua ja merele tere ütlemas käia , kui Karinil oli juba söök valmis , kartul ja pekikaste ja kaasavõetud tomateist ning kurkidest tehtud salat . 
8	NA	 Muuseas , Karin on toekas nagu taluperenaine muistegi . 
8	NA	 Siin aias kasvab sibulaid , tilli ja lilli ka , nii et kui kaasavõetud kraam otsa saab , on proviandile ( kartul ja soolaliha ) midagi kõrvale võtta . 
8	NA	 Päeval olevat parem tuld mitte teha , ikka sisseajamise pärast . 
9	NA	 Peale sööki tegime koosoleku , kus Karl meile eesmärgid püstitas ja nende saavutamise vahendeist rääkis . 
9	NA	 Niisiis meie Samueliga kirjutame kumbki ühe miniromaani ehk romaanikese ja sobitame need pärast omavahel kokku , nii et Karl ei tea , kes missuguse osa kirjutas . 
9	NA	 Mil moel me oma erinevad osad kokku klapitame , olevat meie asi . 
9	NA	 Karl väljendas arvamust , et kuigi Samuel pole varem kirjatöös kätt proovinud ja minu artikleid pole Karl ka enam ammuilma lugenud , määrab ta eksimatult ära , kes mida on kirjutanud . 
9	NA	 Karl on minu meelest alati natuke meesšovinist olnud . 
9	NA	 Küllap pidas ta meie erinevate ametite ja iseloomu kõrval silmas ka seda , et mina olen naine ja Samuel mees ning oma väikeste skandaalidega üpris isase inimese kuulsuse võitnud . 
9	NA	 Mulle teeb see kõik pisut nalja ja on omamoodi põnevgi . 
9	NA	 Kardan ainult , et Samuel kukub jooma ja meie kirjanduslikust eksperimendist ei tule midagi välja . 
9	NA	 Aga esialgu on kõik korras ja Samueli silmad ja nina vaatavad ebamäärases vanuses habeme seest üpriski reipalt . 
9	NA	 Kaalul on kolmeliitrine pudel prantsuse veini . 
9	NA	 Võtsime kokku ka oma sõjanõukogu . 
9	NA	 Samuel pakkus välja , et tema peategelane on pisut laiast ilmast eemale tõmbunud nagu meiegi , põhjuseks näiteks mehe truudusetus . 
9	NA	 Samuel võttis siis “ naispeaosa ” enda täita . 
9	NA	 Mina võin seetõttu kirjutada suvalise stoori , ainult et peategelane olgu mees . 
9	NA	 Otsustasin veel , et mu tegelase keelekasutus on steriilne . 
9	NA	 See tuleks mulle kasuks ja aitaks mul vabaneda nii-räägivad-kõik-stambist . 
9	NA	 Pärast paneme need asjad sel moel kokku , et Samueli tegelane tõlgib minu raamatut . 
10	NA	 Esialgu läksin mere äärde päevitama ja Samuel läks Karliga kalale . 
10	NA	 Kuhu Karin läks , ma ei tea , igal juhul ta minu seltskonda ei igatsenud , mille üle ma põrmugi ei kurvasta , sest pärast Sulle kirjutamist kavatsen oma romaani peale mõelda ja igasuguseid naistejutte vältida . 
11	NA	 Jaluta Nutsuga kaks korda päevas . 
11	NA	 Ja minu lillekest kasta kaks korda nädalas . 
11	NA	 Ära vastupidi tee . 
12	NA	 Tšauki ! 
12	NA	 I. 
13	NA	 Kellelt : Inger Pindmaa < Inger. Pindmaa@mail.ee > 
14	NA	 Kellele : < ilmar@eskl.ee > 
15	NA	 Teema : niuhti 
16	NA	 Kuupäev : 30.07.2000 15 : 07 
17	NA	 Suurus : 1 
18	NA	 Hei-hei ! 
19	NA	 Tervitusi suvitajailt . 
19	NA	 Nädal läinud nagu niuhti . 
19	NA	 Ilm on tore . 
19	NA	 Täna pidas Karl meiega teise koosoleku . 
19	NA	 Rääkis ohtudest , mis algajaid kirjutajaid varitsevad – soov oma põhimõtteid tegelaste suu läbi deklareerida , halb dialoog , ebausutavad tegelased , kusjuures häda ja viletsus seisneb sageli selles , et näiteks kolmekümne aastase naise ( nagu mina paari aasta pärast ) ja neljakümne aastase mehe ( umbes Samuel ) mõtteid , mälestusi ja tundeid omistatakse vastassoost teismelisele , läbiva joone puudumine ( alguses oleks nagu hirmus paljust kirjutada , aga pärast selgub , et see kõik on tüütu möga ) jne. 
19	NA	 Ma rohkem ei viitsi . 
19	NA	 Karl pole ise ühtegi romaani kirjutanud ja minu tagasihoidliku märkuse peale nähvas midagi omletist ja munemisest . 
19	NA	 Aga üldiselt elame sõbralikult . 
20	NA	 Kui Karin “ romaanikooli ” kuulama tuli , kukkus Karl edvistama ja Samueli nöökima . 
20	NA	 Karinit lähemalt vaadates hakkas mind vaevama mõte , et olen teda kuskil varem näinud . 
20	NA	 Rääkisin sellest pärast Samuelile . 
20	NA	 Too punastas natuke ( ohoo ? ! ) ja ütles , et on Karinit maalinud ( “ Kevad mägedes ” voonakeste ja lopsaka suuresilmse Primaveraga ) . 
20	NA	 Ära , palun , mind vanaks salakavalaks nõiaks pea , aga kohe põnevam on , kui mingit mängu saab jälgida . 
20	NA	 Mu meestegelane jälgib ka mängu ja on varsti ise võrgus . 
20	NA	 Ehee ! 
20	NA	 Paras talle ! 
21	NA	 Mis Karinisse puutub , siis oleme täiesti rahuldavad suhted sisse seadnud . 
21	NA	 Jututamine pole õnneks ta tugevaim külg . 
21	NA	 Nii võin rahumeeli ise lobiseda , kui tuju tuleb . 
22	NA	 Mu tegelase steriilne keelekasutus on ta mõttemaailma nakatanud . 
22	NA	 Tegelikult on mõttemaailma ja keelekasutuse vahekord minu arvates vastupidine . 
22	NA	 Nojah , aga ma pean tekitama ju tegelikkuse illusiooni . 
23	NA	 Võiksid natuke ringi sõita , kas või meid vaatama tulla . 
23	NA	 Kui tuled , haara nagist mu vana sinine kilekas kaasa . 
23	NA	 Pilved kerkivad . 
23	NA	 Ja too midagi magusat ja puuvilju ! 
24	NA	 Selleks korraks kõik . 
24	NA	 I. 
25	NA	 Kellelt : Inger Pindmaa < Inger. Pindmaa@mail.ee > 
26	NA	 Kellele : < ilmar@eskl.ee > 
27	NA	 Teema : Vaat siis 
28	NA	 Kuupäev : 04.08.2000 22 : 46 
29	NA	 Suurus : 1 
30	NA	 Tere ! 
31	NA	 Pärast Su ärasõitu hakkaski sadama . 
31	NA	 Külmavõitu on ka . 
31	NA	 Peame Samueliga oma korralisi koosolekuid lakas . 
31	NA	 Küsib , mis ma ühel või teisel puhul ütleksin . 
31	NA	 Vahel lobiseme niisama ja siis ta lööb äkki endale plaksti vastu pead , nagu tapaks sääski . 
31	NA	 Neid on siia ka tekkinud , aga pole viga , on hullematki nähtud . 
31	NA	 Kui S. ennast pähe peksab , on ta minult mõne väljendi ära ajanud . 
31	NA	 Minul ei ole temalt küll midagi laenata , sest minu tegelane on intelligentne ja igavavõitu . 
31	NA	 Samuel on siin kõikipidi viisakas – ei joo , ei ropenda , ei tiku mulle ega Karinile ligi . 
31	NA	 Ei vasta üldse oma immitsale . 
31	NA	 Võibolla on seda talle asjata omistatud . 
31	NA	 Ta ei ole minu meelest üldse edev , vähemalt Karliga võrreldes . 
32	NA	 Kirjutamine , so teise inimese kesta pugemine on üks imelik asi . 
32	NA	 Vahel tuleb nagu iseenesest midagi sellist , mida ma kunagi mõelnud ja tundnud ei ole . 
33	NA	 Peaksid ilmad ometi uuesti soojaks minema , saaks vähemalt päevitada ! 
33	NA	 Head aega ! 
33	NA	 Innu . 
34	NA	 Kellelt : Inger Pindmaa < Inger. Pindmaa@mail.ee > 
35	NA	 Kellele : < ilmar@eskl.ee > 
36	NA	 Teema : Re-ro 
37	NA	 Kuupäev : 06.08.2000 08 : 57 
38	NA	 Suurus : 1 
39	NA	 Re-ro ! 
39	NA	 Re-ro ! 
40	NA	 Kui Sa ei tea , mis see on , tuleta vanaema repertuaari , neid naisansambli laule meelde . 
40	NA	 Mingi gruusia laul , punane . 
40	NA	 Igal juhul on see tervitus päikesele . 
40	NA	 Jõin hommikul vara mere ääres kivi otsas kohvi ja vaatasin , kuidas päike tõuseb . 
40	NA	 Samuel liitus ka minuga . 
40	NA	 Nüüd lõdisen soemüüri taga . 
40	NA	 Tema istub köögis . 
40	NA	 Mina pole küll märganud , et ta Kariniga mingit liini ajaks , oli kunagi mis oli . 
40	NA	 Karl peaks igal juhul nende asjade suhtes , mis sellal juhtusid , kui ta kodunt hüppes oli , suuremat tolerantsust ilmutama . 
40	NA	 Kui Karlile ja Karinile edevust jagati , kahmas Karl suurema tüki endale . 
40	NA	 Varem ma mõtlesin salamisi , et Karlil oleks võinud moodsama väljanägemisega naine olla , aga nüüd olen vastupidisel arvamusel – imelik , et temasugune edev , armukade egoist endale nii toreda ja kena naise sai . 
40	NA	 Ehee ! 
40	NA	 Muidugi see kõik pole minu asi ja lõpuks olen ju nende külaline . 
40	NA	 Aga belletristlik tegevus on mulle mõju avaldanud ja ma lihtsalt pean teiste inimeste käitumise tagant nende iseloomujooni peilima . 
40	NA	 Olgu , lõpetan , sööma kutsutakse . 
40	NA	 I. 
41	NA	 Kellelt : Inger Pindmaa < Inger. Pindmaa@mail.ee > 
42	NA	 Kellele : < ilmar@eskl.ee > 
43	NA	 Teema : ai-ai-oi 
44	NA	 Kuupäev : 12.08.2000 10 : 32 
45	NA	 Suurus : 1 
46	NA	 Tere ! 
47	NA	 Eile juhtus meil siin piinlik lugu . 
47	NA	 Karl käis pudeliga ringi ja nuias muudkui Samueli , et tulgu talle seltsiks . 
47	NA	 Väga inetu , kui mõelda , mis seisus S. praegu on . 
47	NA	 Aga Samuelist ei saanud õnneks asja ja K. tõmbas üksinda nina täis ning hakkas mulle üleliigset tähelepanu osutama . 
47	NA	 Kui S. mind lausa oma kehaga kaitses , lõugas Karl , et mida ta endast õige arvab – ega kõik naised tema omad ole ja muud haiget loba . 
47	NA	 Loodan , et Karin ei kuulnud , aga kui kuulis , saab aru , et asi pole minus , vaid Karli vanas ja praegu küll põhjusetus armukadeduses . 
47	NA	 Aga mis ma kaeblen , ise tahtsin teiste inimeste kohta tähelepanekuid teha . 
47	NA	 Minu meelest Samuel teeb ka – minu kohta igatahes . 
48	NA	 Täna paistab õnneks , et asi pole liiga pingeliseks läinud . 
48	NA	 Karl tegi jälle töökoosoleku , poetas justkui muuseas paar vabandavat sõna ja rääkis meile , et tegelikult pole oluline , mida ja millest kirjutada , vaid kuidas kirjutada . 
48	NA	 Kui tekstil on pisut arusaamatuse lumma , mõeldakse filosoofia ise juurde . 
48	NA	 Mõtlevad need , kes mõtlevad , suurem osa loeb ajaviiteks , nii et peab lihtsalt löövust olema . 
48	NA	 Samuel ütles , et tema loeb ka ajaviiteks , et on kõigesööja ja kõigelugeja . 
48	NA	 Üldiselt käib see minu kohta samuti , kuigi praegu tahaksin õudselt puuvilju saada . 
48	NA	 Hakkasin mõtlema , et tõlgitav raamat võiks vabalt esimese veerandiku juures pooleli jääda . 
48	NA	 Rääkisin Samuelile ka . 
48	NA	 Hakkame varsti otsi kokku tõmbama . 
49	NA	 Tunnen , et tahan igasuguste sekelduste juurest kirjutamise juurde . 
49	NA	 Inger . 
50	NA	 Kellelt : Inger Pindmaa < Inger. Pindmaa@mail.ee > 
51	NA	 Kellele : < ilmar@eskl.ee > 
52	NA	 Teema : ohsaa 
53	NA	 Kuupäev : 13.08.2000 19 : 41 
54	NA	 Suurus : 1 
55	NA	 Tohoo pele , 
56	NA	 suutsin Sinu käest ka kirja välja meelitada . 
56	NA	 Ära minu pärast muretse ja sellele väikesele episoodile , mida ma Sulle rohkem nalja pärast kirjeldasin , et midagi ikka kirjutada oleks , mingit erilist tähelepanu pööra . 
57	NA	 Täna on tore päev ! 
57	NA	 Lugesime oma esialgse töö lõppenuks ja andsime teineteisele lugeda . 
57	NA	 Samuel ütles , et talle meeldib minu osa , olevat stiilne ja süvendavat tema arvamist minust . 
57	NA	 Tema arust on ta enda osa puder ja kapsad . 
57	NA	 Ei ole , aga imelik see on . 
57	NA	 Ei kahtlustaks küll , et Samuel on selle kirjutanud . 
57	NA	 Ei teadnudki , et S. oli abielus ja et tal on ligi kahekümnene poeg . 
57	NA	 Meie arutelu käigus tuli jutuks . 
57	NA	 Sattusime nii hoogu , et jäime sööma hiljaks . 
57	NA	 Tunnen töökat väsimust . 
57	NA	 Head ööd ! 
57	NA	 Nutsule pai ! 
58	NA	 Innu . 
59	NA	 Kellelt : Inger Pindmaa < Inger. Pindmaa@mail.ee > 
60	NA	 Kellele : < ilmar@eskl.ee > 
61	NA	 Teema : ah sa mait 
62	NA	 Kuupäev : 15.08.2000 23 : 12 
63	NA	 Suurus : 1 
64	NA	 Tere , Sa igavene vana tukunui , 
65	NA	 kas Sul pole linnas arvuti taga losutamisest veel lamatised tulnud ? 
65	NA	 Nagu Sa minu lopsaka pöördumise järgi võid aimata , olen kergelt vines . 
65	NA	 Loodan , et Sa pole minu äraolekul kuritarvituste teele asunud . 
65	NA	 Muide , kirjutasin “ kuritervituste ” ja õigekeelsusprogramm ei andnud punase lainelisega märku . 
66	NA	 Saime lõpuks hakkama oma suvetöö delikaatseima osaga –esialgse kokkusulatamisega või ehk siiski traageldamisega ? 
66	NA	 Karl käib meie ümber nagu kass ümber palava pudru . 
66	NA	 Tegime väikesed veinid , Karl pingutas natuke üle . 
66	NA	 Samuel vaatab meid kainena pealt nagu armsaid kergemeelseid teismelisi , kuigi Karl soiub , et pole varem karskeid kunstnikke näinud ! 
66	NA	 ( Kirjutasin alguses “ kunstnukke ” . 
66	NA	 Mul on ka vist täna midagi viga . ) 
66	NA	 Saadan Sulle kirja ära ja lähen magama . 
66	NA	 Ole siis mõnus , ära ainult kohvi joo , tee vahel midagi süüa ka . 
67	NA	 Inger . 
68	NA	 Kellelt : Inger Pindmaa < Inger. Pindmaa@mail.ee > 
69	NA	 Kellele : < ilmar@eskl.ee > 
70	NA	 Teema : ole-ole-ole 
71	NA	 Kuupäev : 21.08.2000 18 : 02 
72	NA	 Suurus : 1 
73	NA	 O-le-o-le-ol-e-o-le ! 
74	NA	 Pidu missugune ! 
74	NA	 Pidu minus eneses ! 
74	NA	 Minus vähemasti küll ! 
74	NA	 Kahtlustan , et S. on salamisi sama lapsemeelne kui mina . 
74	NA	 Kohe ma lõbustan Sind ühe dialoogiga , aga enne kirjeldan tegevuspaika . 
74	NA	 Niisiis – sinised dekoratsioonid on üll , meresinised ja taevasinised kirjeldamatu päikese ja vagurate pilvelammastega . 
74	NA	 Tohutu maasikapõõsas või -puhmas või pole aimugi , kuidas seda nimetada , on punaseid marju pilgeni täis ja taamal valendab veel õisi . 
74	NA	 On kiviaed ja kadakad ja lehmad ammuvad kaugel , pla-plaa . 
74	NA	 Muuseas , siin pole punased lehmad nagu Punik kodus maal , vaid musta-valgekirjud . 
74	NA	 Samuel leidis hommikul maasikaid ja kutsus mind ka jaole . 
74	NA	 Aga asi pole maasikates ega lehmades , vaid selles , et Karl luges meie surematu teose läbi ja tal tekkis probleeme , mida oligi vaja tõestada . 
74	NA	 Niisiis – läks lahti ! 
75	NA	 K : Lugesin teie romaanikunsti tippsaavutuse läbi – loodan , et te naljast aru saate ja liiga uhkeks ei lähe , ääh-ääh-ääh – ja pean paraku tunnistama , et mul tekkis tõesti mõningaid küsimusi . 
75	NA	 Samuel , pane käsi südamele ja vannu , et sa kirjutasid ise , mitte ei lasknud mõnel kolmandal isikul valmis treida . 
75	NA	 ( Naeratab võidurõõmsalt , toksib jalaga kivi ja püüab esineda nagu tead küll mis saate juht . ) 
76	NA	 S : Mis kolmandal isikul ? 
77	NA	 K : Mõnel daamil , Sammi , mõnel daamil . 
77	NA	 Sest Inger kirjutas nõndanimetatud Riia-romaani ja selle lapsevalus ( itsitab ) naisterahva ponnistusi ei pannud sina kirja . 
78	NA	 I : Oled kindel , et mina kirjutasin Riia-romaani ? 
79	NA	 K : Raudselt ! 
79	NA	 Sinust võib veel literaat saada . 
79	NA	 Enam-vähem omavanuse mehe , kuigi igava mehe stoori pingutasid välja . 
80	NA	 I : ( Vaatab Samueli poole ja saab jaatava märguande . ) 
80	NA	 Ei pingutanud , kirjutasin lõdvalt , nagu iseenesest . 
80	NA	 Ja Samuel kirjutas tõesti tõlkija-loo . 
81	NA	 K : Sina seda ei kirjutanud , see on siililegi selge . 
81	NA	 Sul ei ole niisugust kogemust . 
81	NA	 Aga et Samuel … ( Tõstab käed üles ja veab suu kõrvuni . ) 
81	NA	 Ausõna , mina annan alla . 
81	NA	 Mu prantsuse vein on teie . 
81	NA	 Pidutsege ! 
82	NA	 S : Mis siis minu osaga valesti on ? 
83	NA	 K : Selline sigri-migri sinu pintslilöökidega võrreldes . 
83	NA	 Noorepõlvepeika , armsasti haisvad pulmapäevakleidid , nagu mõni mammi koristaks kappi … Upud pisiasjadesse , aga lugejal on raske mõista , mille ümber kogu trall käib . 
83	NA	 Tegelikult teil ei ole veel mingit pidu . 
83	NA	 Õnnelik lõpp on kirjutamata . 
83	NA	 Aga kui hästi järele mõelda , siis su viimase aja plätserdised , Sammi , on ka kuidagi lillelised ja … Eks ma võtan teadmiseks , et inimesed muutuvad . 
83	NA	 Nii et siis lõpp . 
84	NA	 S : Saab tehtud . 
85	NA	 I : Võib koguni kaks lõppu kirjutada , üks õnnelikum kui teine . 
85	NA	 Siis saad jälle arvata , kumb on kumb . 
86	NA	 K : Ah , käige kassi saba alla oma õnnelike lõppudega . 
86	NA	 Muuseas , ega kahe lõpu mõte halb ole . “ Prantsuse leitnandi tüdruk ” . 
86	NA	 Isegi kolm võiks olla … 
87	NA	 I : “ Lola jooks ” … Ta võiks viimasel päeval endale vähemalt sametjaki osta … 
88	NA	 K : Lola vä ? 
88	NA	 ( Ilmselt olen Karli vastu õel ! ) 
89	NA	 Muidugi me rääkisime veel , aga rohkem ei viitsi kirjutada . 
89	NA	 Järgmistel päevadel sulatab Samuel meie praeguse lõuendi üheks tervikuks . 
89	NA	 Siis vaatame , kuidas lõpu või lõppudega saab . 
89	NA	 Kui päris valmis on , see on küll väga tinglik otsustus , sest “ romaani ” ümber võiks mõelda lõpmatuseni , saadan Sulle lugeda . 
89	NA	 Riputaks pärast või netis üles . 
89	NA	 Karlil pole sellega midagi peale hakata . 
89	NA	 Tegelikult kogu see värk on üle ootuste eriline kogemus ja ma peaksin Karlile tänulik olema meie ärgitamise ja küllakutsumise eest . 
90	NA	 Kas me Sinuga läheme koos ema juurde ? 
90	NA	 Mõtle selle üle . 
90	NA	 Kui ma linna jõuan , läheb mul paar-kolm päeva aega , ja siis võikski minna . 
91	NA	 I . 
92	NA	 Kellelt : Inger Pindmaa < Inger. Pindmaa@mail.ee > 
93	NA	 Kellele : < ilmar@eskl.ee > 
94	NA	 Teema : Palju-palju ja korraga 
95	NA	 Kuupäev : 23.08.2000 00 : 38 
96	NA	 Suurus : 548 
97	NA	 Ilmar ! 
98	NA	 Su soov pani mu tõeliselt piinlikku olukorda , või ma vähemalt kartsin seda . 
98	NA	 Igal juhul nihelesin ja kokutasin mis hirmus , kui ma sellest lõpuks rääkida julgesin . 
98	NA	 Aga Samuel ainult naeris häbelikult – ei mingit ülbust kirjatsura vastu , nagu ma kuulnud olen – , ja ütles , et mina ju ei määri talle pähe mingit napakat ettekujutust temast ega pane talle suhu oma sõnu . 
98	NA	 Ütlesin , et kutseeetika ei lubaks . 
98	NA	 Kui armas kuulda , ütles tema , et seda iseenesestmõistetavat mõistet keegi tõepoolest veel iseenesestmõistetavaks peab ! 
98	NA	 Tegelikult pole ma ju mingi erand ! 
98	NA	 Kaugel sellest ! 
98	NA	 Seletasin talle , et meie vennas ( ões ) konnas supsab ju samuti nagu teisteski tsunftides mõni tõrvatilk meepotti , aga tegelikult ei tohi nii üldistada , et õpetajad on lollid ja kiusakad , arstid lohakad ja omakasupüüdlikud , ajakirjanikud nahaalsed ja südametud , kunstnikud veidrad ja liiderlikud … Sul on veel noore inimese optimismi , naerab tema . 
98	NA	 Minu meelest sai intervjuu päris kena . 
98	NA	 Vähemalt on see minu elu seni kõige kenam pealkiri , mis tuli iseenesest , ilma punnitamata . 
99	NA	 Mis romaanisse puutub , siis lõpetasime selle kiiresti ära , et ta ülepea ei kasvaks . 
99	NA	 S. kardab küll , et Elli koos Tirtsukese ja Kivilillega tuleb talle kunagi Tallinnas või ei tea kus vastu … Minul on parem . 
99	NA	 Liiga tihti ma Riias ju ei käi . 
99	NA	 Viimati näidati mind Riia loomaaiale Vene ajal ja eelmisel suvel jalutasin korra Riia vanalinnas . 
99	NA	 Tõeliselt ilus õhtu oli , mis kumab minu osast läbi . 
100	NA	 Olgu . 
100	NA	 Saadan Sulle mõlemad asjad ära ja loodan kiitvat arvamust kuulda . 
100	NA	 Hakkame siin otsi kokku tõmbama , et Karl ja Karin saaksid pisut kaksindust nautida . 
100	NA	 Samuel küsis paariks päevaks meilt öömaja . 
100	NA	 Muidugi lubasin . 
100	NA	 Da-da ! 
101	NA	 Sinu armas ja tragi väikeõde Innu . 
102	NA	 Lisatud failid 
103	NA	 att0000. dat ( 1k ) 
104	NA	 Intervjuu. doc ( 82 k ) 
105	NA	 att0001. dat ( 1k ) 
106	NA	 Sametjakk. doc ( 302 k ) 
107	 SAJANDILÕPU SUVI LÄÄNEMAAL 	 SAJANDILÕPU SUVI LÄÄNEMAAL 
108	NA	 I. P. Läänemaad võib leida su viimase aja maalidelt küll silmitsi varsakapjadega maantee ääres , küll maaliallkirjadest – “ Läänemaa kullendav taevas ” , “ Läänemaa I , II , III … ” . 
108	NA	 On su juured Läänemaal ? 
109	NA	 S . 
109	NA	 T. Olen jah Läänemaa mees . 
109	NA	 Mitte mere äärest , vaid sealt Harjumaa piiri vastast . 
109	NA	 Kodu mul seal enam ei ole . 
109	NA	 Kus poisipõlves võis maasikaid leida , seal kasvavad nüüd lepad , kased tikuvad sohu . 
109	NA	 Elu on ka sealkandis soiku jäänud . 
109	NA	 Oma isakodu ma enam enesele ei saa ja teist kohta seal lähedal vist ei taha . 
110	NA	 See kõlab kuidagi pessimistlikult , ometi on su Läänemaa-maalid rõõmsad . 
111	NA	 Mu lapsepõlvemälestused on valdavalt rõõmsad ja ilusad . 
111	NA	 Ega ma olegi pessimist , või kui , siis optimistlik pessimist . 
111	NA	 Aga mul on hea meel , kui mõni lapsepõlves nähtud koht unes ilmub . 
112	NA	 Kas peale isakodu ja lapsepõlve on veel kohti ja aegu , mida armastusega üle vaataksid ? 
113	NA	 On ikka . 
113	NA	 Ometi arvan , et kogusin endasse just enne kooli palju olulist – loodus ja loomad kui üksiku lapse seltsilised . 
113	NA	 Ja vabadus . 
113	NA	 Kunagi elus pole ma vähem teinud , mida peab , kui lapsepõlves . 
113	NA	 Tegin , mida tahtsin . 
113	NA	 Olin uskliku südamega väike metslane . 
114	NA	 Oled sa päriselt usklik ? 
115	NA	 Jah . 
115	NA	 Aga vahepeal vist ei olnud … 
116	NA	 Kas soovid oma pojale , et ta käiks sinu jälgedes ? 
117	NA	 See , et poeg käiks isa jälgedes , on niisugune südant uhkuses paisutav lootus . 
117	NA	 Aga ei . 
117	NA	 Mäletan naabrivanaisa käest kuuldud lugu , kuidas tema vend astus isa järel käies rästiku peale . 
117	NA	 Isal olid saapad jalas , pojal mitte . 
118	NA	 Laste juures on võluv just see , et neis paistavad välja küll mõned vanematelt päritud jooned , aga uues kombinatsioonis . 
118	NA	 Lapsepõlves nad paratamatult olenevad meist , aga ei peaks hiljem mingeid vanemate teostamata unistusi täitma , vaid eneste omi , ja jätma oma jäljed . 
118	NA	 Minu poeg on teistsugune kui mina . 
118	NA	 Just seda ma imetlen . 
119	NA	 Mida arvad naistest ? 
120	NA	 Olen heas ja halvas sõltunud naistest . 
120	NA	 Kõige ustavamad olid ema ja ristiema Elli , isa õde . 
120	NA	 Nüüd on nad surnud ja minagi juba täiskasvanud ehk nagu ütleks üks tuntud kirjamees – kuresaapaist väljas . 
120	NA	 Naiste elu on raskem ja kindlam , arvan ma . 
120	NA	 Neid ei saa nii kergesti rajalt maha võtta . 
120	NA	 Eks erandeid ole ka . 
120	NA	 Viimasel ajal püüan selle teistsugususe varjus avastada inimest üleüldse . 
120	NA	 Nagu nemad meis . 
120	NA	 Või ma ei tea . 
121	NA	 Kas elus on peale naiste sinu jaoks veel saladusi ? 
122	NA	 Jah . 
122	NA	 Kogu elu on oma näilisest avatusest hoolimata saladus . 
123	NA	 Mu pildid väljendavad püüdu midagi enda jaoks selgeks maalida , aga … 
124	NA	 … teiste jaoks on seegi saladus . 
124	NA	 Su “ Sametjakk ” , miks ta hõljub , varsakabjad ehteks rinnas , nii koduselt Läänemaa kohal , nagu kuuluks ta sinna ? 
125	NA	 Kas ma tohiksin maalimist ja kirjutamist võrrelda ? 
125	NA	 Ega ma kirjutamisest palju tea . 
125	NA	 Ja loen ka kõike . 
125	NA	 Mul oli varemalt tunne , et maalimine on päris kunst ja sõnadega kujutamine allub rohkem justkui mingile plaanile , kas või ideoloogiale või hoopis tahtmisele lõbustada . 
125	NA	 Nüüd ma arvan , et sõnadega juhtub samuti kui värvidega . 
125	NA	 Miski hakkab hoopis inimest ennast käsutama . 
125	NA	 Tekib mingi iseeneslik süvastruktuur . 
125	NA	 Siis äkki lööb midagi pinnale . 
125	NA	 Mõtlen selliseid asju , mis mingile plaanile või kavatsusele ei allu . 
125	NA	 Tahetud on midagi muud , aga tuleb teistmoodi . 
125	NA	 Ma püüdsin seletada , miks ma teen viimasel ajal teistsuguseid asju kui enne . 
126	NA	 Kas sa tahaksid teha veel midagi niisugust , mida enne pole teinud ? 
127	NA	 Ikka tahan . 
127	NA	 Hakkasin kevadel iseenda lõbuks tõlkima . 
127	NA	 Veel tahaksin kellegagi kahasse lasteraamatuid teha . 
127	NA	 Teine kirjutab , mina joonistan . 
127	NA	 Ja maalida tahan , muidu tuleb ahtra lehma tunne . 
128	NA	 Kui ma paluksin sul lambakarja maalida , kas maaliksid ? 
129	NA	 Ports lambaid ? 
129	NA	 Aga miks mitte . 
129	NA	 Kui mul vaim peale tuleb , siis maalin . 
129	NA	 Nad oleksid sellised metafoorsed lambad , kel Hea Karjane pilku peal hoiab . 
129	NA	 Aga see on kõigest kavatsus . 
130	NA	 Lambad Läänemaal ? 
131	NA	 Läänemaal . 
132	NA	 Lapsepõlvel paistab su elus tähtis osa olevat . 
132	NA	 Kelleks sa tahtsid saada ? 
133	NA	 Ei tahtnud kellekski . 
133	NA	 Ei kosmonaudiks , korstnapühkijaks ega karjakuks . 
133	NA	 Nohistasin omaette . 
133	NA	 Teisi lapsi läheduses polnud . 
133	NA	 Õppisin varakult lugema , ei mäletagi õieti , kuidas . 
133	NA	 Illustreerisin salamahti mõned raamatud ära ja sain vitsu . 
134	NA	 On su elus olnud aegu , millest eriti rääkida ei tahaks ? 
135	NA	 On . 
135	NA	 Ja kui tahaks , ei mäletakski suurt midagi peale lõputu pohmelli . 
136	NA	 Nüüd küsiksin sult mõned sajandilõpuküsimused . 
136	NA	 Kas ja kuidas on postmodernism sind mõjutanud ? 
137	NA	 See on vaev ja rahulolematus , tahtmine lõhkuda ja kildusid korjata ja vaadata , kas veel midagi välja tuleb . 
137	NA	 See periood sai mul koos pohmelliga läbi . 
